Station,Show,Snippet
BBCNEWS,Breakfast,taken place yet instead remind ice cap melt politician around globe fail cut greenhous ga emiss time stop rise temperatur brexit parti said didnt take part didnt faith
BBCNEWS,Afternoon Live,temperatur globe averag see global warm fault pretti much statist prove
BBCNEWS,BBC News,unit nation say world act much faster avoid danger level global warm hundr famili come forward potenti case
BBCNEWS,HARDtalk,zambia presid recent tweet shot expans rock call stark remind climat chang elisha moyo zimbabwean govern lead climat chang research constantli
BBCNEWS,BBC News,go back kind climat chang debat briefli heard one mari new south wale talk climat chang bring directli relat happen right
BBCNEWS,BBC News,describ fire heard word unpreced unchart territori strongli link climat chang scientist lwa ys climat chang scientist alway said long time
BBCNEWS,Asia Business Report,climat chang donald trump yesterday offici took us pari agreement two member want renew attack climat chang togeth right still everyon look toward chines market
BBCNEWS,BBC News,think thing need rememb climat chang critic period climat chang well see decis make last notjust decad even centuri
BBCNEWS,Worklife,debat climat chang conserv sent michael gove accompani pm father stanley johnson reject debat parti leader much climat chang elect issu come
BBCNEWS,Victoria Derbyshire,help climat chang could need integr polici across govern climat chang top agenda food farm agricultur
BBCNEWS,Outside Source,thousand displac new south wale queensland warn worst yet come bushfir australia common theyr usual big earli fire season fear climat
BBCNEWS,Afternoon Live,bigger part campaign far ever main parti compar pledg ur environ analyst roger harrabin report year massiv environ gener climat
BBCNEWS,BBC News,pair finish remind top stori new report show concentr carbon dioxid main ga behind global warm record level
BBCNEWS,Breakfast,get tax tax aviat fuel need carbon tax let tax aviat fuel way tax fuel let
BBCNEWS,Can Flying Go Green - Panorama,absolut clear burn plane go releas amount greenhous ga emiss current kerosen ye behav exactli like current kerosen greenhous emiss plane life cycl
BBCNEWS,BBC News,fuel cheap dont buy fuel expens problem fuel mean heavier plane heavier plane mean greenhous ga emiss british airway save hundr pound per flight bbc seen dozen
BBCNEWS,BBC News at One,cut cost heavi plane take fuel fli air therefor creat greenhous ga emiss practic appear odd commit british airway airlin cut emiss seem willi walsh chief
BBCNEWS,Worklife,gener problem term eat gener problem term produc eat agricultur big culprit certainli term greenhous ga emiss go chang need chang
BBCNEWS,Breakfast,forefront main parti wa nt forefront main parti want put climat chang centr offer polici address climat chang centr offer address
BBCNEWS,Victoria Derbyshire,one mention climat chang well surpris issu come across flood concret exampl impact climat chang need make invest would dedic
BBCNEWS,BBC News,climat chang effect earli say pinpoint individu event blame climat chang alway difficult abl say
BBCNEWS,BBC Newsroom Live,last night well almost though becam climat chang denier last night correspond bank england remov climat chang refer
BBCNEWS,BBC News,anyth climat chang pin exactli scientist say effect climat chang intensifi bushfir situat right across eastern australia go
BBCNEWS,BBC News,climat chang real tree destroy veget lost issu beyond park boundari subsist farmer also struggl surviv land dri dust climat chang intensifi conflict human wildlif
BBCNEWS,BBC News,individu countri one thing done set new climat chang commiss model uk climat chang committe give us authorit sciencebas target mayb target set
BBCNEWS,BBC News at One,£ billion year carbon emiss amount carbon dioxid releas burn fuel contribut global warm chri morri detail thank
BBCNEWS,Afternoon Live,un say world act much faster avoid danger level global warm lucki coupl west sussex £ million win euromillion
BBCNEWS,Business Briefing,strateg review bank purpos ft report paper say ms lagard believ global warm mission critic prioriti presid trump sign democraci
BBCNEWS,BBC News at 9,climat crisi here environ report laura foster music
BBCNEWS,Outside Source,see mean come moment see notjust zimbabw across southern africa zambia zimbabw mozambiqu four countri suffer drought extrem weather pattern fundament believ effect climat
BBCNEWS,Our World,global warm go like cartag heap white pillar lean sign life would realli like welcom brunt
BBCNEWS,BBC News,welcom bbc news im mike embley top stori new report show concentr carbon dioxid main ga behind global warm record level critic period
BBCNEWS,Electioncast,welcom bbc news im mike embley top stori new report show concentr carbon dioxid main ga behind global warm record level critic period
BBCNEWS,Sport Today,welcom bbc news im mike embley top stori new report show concentr carbon dioxid main ga behind global warm record level critic period
BBCNEWS,BBC News,welcom bbc news im mike embley top stori new report show concentr carbon dioxid main ga behind global warm record level critic period
BBCNEWS,BBC News,question extrem weather event caus global warm anyth peopl go vote gener elect
BBCNEWS,Dateline London,popular climat chang top prioriti public ask urgent prioriti compar countri climat chang top prioriti ask peopl green parti germani
BBCNEWS,BBC News,score even though lib dem criticis tori take climat chang serious sometim hard see effect climat chang happen front especi uk certain place
BBCNEWS,BBC News,said lib dem leader jo swinson score even though lib dem criticis tori take climat chang serious sometim hard see effect climat chang happen front especi uk
BBCNEWS,BBC News,face world climat chang made campaign speech swindon parti promis make newbuild home zero carbon within three year effort curb hous shortag tackl climat chang mr corbyn also dismiss
BBCNEWS,Beyond 100 Days,central bank interest rate realli low labour take risk argu isa basi invest notjust climat chang climat chang also improv britain pour poverti
BBCNEWS,BBC News,us offici talk passport big pharma nh think labour parti also talk climat chang ahead first leader debat suppos climat chang tomorrow ye jeremi
BBCNEWS,BBC News at Ten,face intens heat wave drought flood think thing need rememb climat chang critic period climat chang see decis make last notjust
BBCNEWS,Newsday,blueprint band pop star continu perform live music without contribut climat chang tyndal centr climat chang research use tour data donat group massiv attack laura foster report teardrop fire
BBCNEWS,Breakfast,nation infrastructur make sure meet challeng around climat chang thati hope th decemb specif infrastructur climat chang voter scotla nd scotland may feel thing like
BBCNEWS,BBC News,welcom back good us bbc news latest headlin new warn unit nation current target cut greenhous ga emiss fall woefulli short protest turn anger malta prime minist polic step investig murder investig journalist
BBCNEWS,BBC News,decad stop global warm degre celsiu anytim bbc websit reach us twitter thank watch
BBCNEWS,The Briefing,paper say ms lagard believ global warm mission critic prioriti presid trump sign democraci legisl back protest hong kong despit angri object china front page
BBCNEWS,Ask the Leaders,terribl need look true cost environ would hit carbon tax peopl hope would shoulder big busi make
BBCNEWS,HARDtalk,six death widespread destruct call govern take climat chang serious im nuala mcgovern london also programm
BBCNEWS,BBC News at Five,latest aim damag caus climat chang becom irrevers wa nt want go fast humanli possibl tackl climat chang say fast enough point huge
BBCNEWS,BBC News,part go even win battl climat chang even get net zero rest world follow fact matter enough climat chang system alreadi us
BBCNEWS,BBC News,could address year ago sign proven howev believ govern hardli say word climat chang bit ofan word climat chang bit uphil battl us
BBCNEWS,BBC News,climat chang univers new south wale thank much us start comment made deputi prime minist australia say peopl rais issu climat chang time rave
BBCNEWS,BBC News,pin bushfir australia climat chang say effect climat chang warmer temperatur drought make bushfir wors say new south wale scent
BBCNEWS,BBC News,climat chang made campaign speech swindon parti promis make newbuild home zero carbon within three year effort curb hous shortag tackl climat chang mr corbyn also dismiss govern call halt frack elect stunt
BBCNEWS,BBC News,face intens heatwav drought flood think thing need rememb climat chang critic period climat chang well see decis make last notjust decad even centuri
BBCNEWS,BBC News,mean individu countri one thing done set new climat chang commiss model uk climat chang committe give us author scienc base target may target said chang time
BBCNEWS,BBC News at 9,british scientist creat blueprint band pop star continu perform live music without contribut climat chang tyndal centr climat chang research use tour data donat group massiv attack band said want help find solut
BBCNEWS,BBC Newsroom Live,move along upper sustain tabl dont talk saw fan realli like hear good stuff club import club also import talk help normalis action climat
BBCNEWS,The Briefing,yesterday us presid donald trump announc america formal withdraw pari climat agreement time respons rest scientif commun countri realli dont care your go see rest world move toward address climat
BBCNEWS,BBC Newsroom Live,fifth largest economi world total u na cce pta ble total unaccept stop time time fail protect invest ur invest still invest face scale emerg face climat
BBCNEWS,BBC News at One,one note hope today assess cost renew energi fallen massiv price last decad world move away coal rapidli embrac wind solar might fight chanc limit damag climat
BBCNEWS,Your Questions Answered,decemb cours main stori date far conserv complain broadcast regul channel accus bia pull polit stunt broadcast replac bori johnson ice sculptur declin take part climat
BBCNEWS,BBC News,come provid great opportun involv actual scienc go ina region region world dont lot data also increas awar guest problemat climat
BBCNEWS,Newsday,nation ever seen im ben bland london also programm tackl global warm go air condition one american man environment action alreadi help climat feel stress
BBCNEWS,Newsday,im ben bland london also programm tackl global warm go air condition one american man environment action alreadi help climat feel stress meet lilou world first airport therapi pig
BBCNEWS,BBC News,effort adopt worldwid seri climat defend ahead major un confer global warm maryam moshiri went meet northern spain sun set spain coal mine industri
BBCNEWS,Business Briefing,global warm rise sea level import second thing also good busi aircraft fuel effici mean reduc cost per seat mile
BBCNEWS,BBC News at Five,£ billion year carbon emiss amount carbon dioxid releas burn fuel contribut global warm ur correspond chri morri examin propos green polici introduc univers basic incom
BBCNEWS,BBC Wales Live,global warm ga therefor mankind isnt impact temperatur conserv ever suggest clearli carbon dioxid affect climat question uk emit
BBCNEWS,BBC News,latest headlin new report show concentr carbon dioxid main ga behind global warm record level hong kong chief execut carri lam acknowledg defici govern reaction
BBCNEWS,BBC News,youll happi know today lowest carbon footprint global cement world easi emiss cement industri contribut global warm three orfour time aviat
BBCNEWS,Newsday,global cement world easi emiss cement industri contribut global warm three orfour time aviat becom carbon neg requir huge invest cut edg technolog remov
BBCNEWS,Beyond 100 Days,footprint world easi emiss cement industri contribut global warm time aviat becom carbon neg requir huge invest cuttingedg technolog remov
BBCNEWS,BBC News,latest headlin new report show concentr carbon dioxid main ga behind global warm record level hong kong chief execut carri lam acknowledg defici govern reaction
BBCNEWS,Ask the Leaders,noon pay carbon tax big busi need decid whether take profit pass tri make easi also implement univers basic
BBCNEWS,Your Questions Answered,propos meat dairi tax would propos carbon tax right across economi agricultur ring fenc proce tax put back
BBCNEWS,Newsday,top stori new warn unit nation time run stop temperatur rise climat disast current target cut greenhous ga emiss short limit agre pari climat accord un say global emiss need fall everi year
BBCNEWS,HARDtalk,top stori new warn unit nation time run stop temperatur rise climat disast current target cut greenhous ga emiss short limit agre pari climat accord un say global emiss need fall everi year
BBCNEWS,BBC News,mayor venic blame part climat chang call work studi effect bbc news datelin london
BBCNEWS,The Papers,scientist attack tori environment record import extrem weather last coupl year realli made impact peopl opinion climat chang someth thati climat chang someth go happen year fire california
BBCNEWS,BBC News,climat chang politician urg climat chang one thing think nifesto one thing think manifesto differ time around two year ago two year ago sinc
BBCNEWS,HARDtalk on the Road,zambia presid recent tweet shot expans rock call stark remind climat chang elisha moyo zimbabwean govern lead climat chang research constantli monitor fall cours fall season someth happen seem goe beyond season chang
BBCNEWS,The Briefing,photo regard climat chang photo isjust hour regard climat chang photo hour old regard climat chang photo isjust hour old hope child got ” photo isjust hour old hope child got think realli interest pick realli interest pick realli interest pick upona realli interest pick new realli interest pick new type popul see clearli
BBCNEWS,BBC News,chilean presid sebastian pinera back away plan cut corpor tax yet anoth concess antiauster protest decis follow number major stepdown chilean govern includ announc withdraw host nation two major intern summit includ un climat
BBCNEWS,Beyond 100 Days,fuel industri million greenjob green job come greenjob come polici liber democrat ina pact polici liber democrat pact plaid cymru parti liber democrat say theyll spend £ billion year five year tackl climat
BBCNEWS,Newsday,top stori new warn unit nation time run stop temperatur rise climat disast current target cut greenhous ga emiss short limit agre pari climat accord un say global emiss need fall everi year next decad stop warm
BBCNEWS,Asia Business Report,top stori new warn unit nation time run stop temperatur rise climat disast current target cut greenhous ga emiss short limit agre pari climat accord un say global emiss need fall everi year next decad stop warm
BBCNEWS,The Papers,climat chang serious im nuala mcgovern london also programm shame suicid south korea claim law fail victim spi camera crime
BBCNEWS,BBC News,protect climat call transit one woman lead effort adopt worldwid seri climat defend ahead major un confer global warm maryam moshiri went meet northern spain
BBCNEWS,The Briefing,adopt worldwid seri climat defend ahead major un confer global warm maryam moshiri went meet northern spain sun set spain coal mine industri year industri
BBCNEWS,Our World,heat ocean mean great barrier reef face temperatur cant live end centuri global warm go like carthag heap white pillar lean
BBCNEWS,Beyond 100 Days,well love talk take whole programm last month hottest octob record evid longterm trend global warm yet us offici begun process withdraw
BBCNEWS,The Papers,idea global warm overtak us seem like defenc inadequ spent £ million boost defenc river waterjust flood top show even though take
BBCNEWS,BBC News,today lowest carbon footprint global cement world easi emiss cement industri contribut global warm three orfour time aviat becom carbon neg requir huge invest
BBCNEWS,The Briefing,emiss cement industri contribut global warm three orfour time aviat becom carbon neg requir huge invest cut edg technolog remov remain carbon dioxid cement danger planet
BBCNEWS,BBC News,climat chang hand climat chang big problem affect sport first time premier leagu clu bs first time premier leagu club start tri understand impact someth your right bit variat
BBCNEWS,BBC News,briefli climat chang thought one strike moment whenjeremi corbyn said poorest peopl world affect climat chang actual got barix section audienc said oh key issu
BBCNEWS,Dateline London,success movement actual come popular climat chang top prioriti public ask urgent prioriti ye compar countri climat chang top prioriti ask peopl
BBCNEWS,BBC News,labour leaderjeremi corbyn promis lead govern that tough environment protect win elect decemb th speak campaign speech swindon mr corbyn said greater issu face world climat chang one way look climat chang catastroph
BBCNEWS,Worklife,increas carboncut ambit five fold world avoid danger level climat chang consum group warn thatjust one black friday deal
BBCNEWS,Worklife,took long accept climat crisi one stori thank greta thunberg chang way thank
BBCNEWS,Newsday,trend bbccom highest tide year caus sever flood venic italian citi mayor blame climat chang that stay bbc world news
BBCNEWS,Breakfast,hospit penzanc west cornwal hospit born year ago say that year ago say that idea peopl natur curiou made decis go debat climat
BBCNEWS,The Briefing,sea storm surg concern start enough action ur planet crisi know know climat chang key social polit issu report author say govern busi public must tackl caus climat chang chant extinct rebellion
BBCNEWS,BBC News,level realli given us ipcc report last year there obvious debat mean individu countri one thing done set new climat chang commiss model uk climat chang committe give us authorit sciencebas target mayb target weve set
BBCNEWS,Newsday,bushfir definit link climat chang canjust climat chang see prolong drought australia australia itsjust made australia made bushfir much wors bushfir season get earlier earlier get stronger stronger well someth seen
BBCNEWS,BBC News,special report aviat climat chang bombast establish
BBCNEWS,HARDtalk,measur cope climat chang drought killer
BBCNEWS,Newsday,free concert ticket fight climat chang realli hurt babi
BBCNEWS,BBC Newsroom Live,futur unusu extrem weather pattern go increas global warm massiv effect around world mean thing differ parti first parliament london propos declar climat emerg
BBCNEWS,The Papers,shock sheffield dam repair la st sheffield dam repair last year cost £ million alreadi becom inadequ global warm differ
BBCNEWS,Outside Source,footprint global cement world lowest carbon footprint easi emiss cement industri contribut global warm three orfour time aviat becom carbon neg requir huge invest cuttingedg technolog remov remain
BBCNEWS,Breakfast,extrem weather event caus global warm anyth peopl go vote gener elect one hous affect flood fish lake
BBCNEWS,BBC News at Five,tackl climat crisi vote liber democrat want build brighter futur vote liber democrat cheer applaus
BBCNEWS,Beyond 100 Days,countri world make climat chang lesson schoolchildren compulsari
BBCNEWS,The Briefing,climat chang issu govern
BBCNEWS,The Briefing,outspoken journalist plu tackl climat chang critic catch
BBCNEWS,BBC Wales Live,question jason come rose id like ask specif plan stop climat crisi jame well k
BBCNEWS,Afternoon Live,global warm degre exceed sort threshold moment warmer usual drier dri whole host thing marker discuss ther host thing marker discuss thing
BBCNEWS,Newsday,call transit one woman lead effort adopt worldwid seri climat defend ahead major un confer global warm maryam moshiri went meet northern spain sun set spain coal mine industri foryear
BBCNEWS,BBC News at Five,global warm sportjos mourinho aim ta ke tottenha sportjos mourinho aim take tottenham jump leagu knockout stage win first home match charg even chief new zealand cricket said alleg
BBCNEWS,BBC News,bbc news latest headlin new report show concentr carbon dioxid main ga behind global warm record level hong kong chief execut carri lam acknowledg defici govern reaction landslid victori prodemocraci parti
BBCNEWS,The Travel Show,typic celsiu bbc news welcom your watch uk pb america around globe im mike embley top stori new report show concentr carbon dioxid main ga behind global warm record level
BBCNEWS,BBC News,tax use money carbon tax give back peopl form basic incom actual get support need navig zero carbon green one mp last parliament look
BBCNEWS,Beyond 100 Days,polit also environment think govern get elect go one resolv climat crisi like whatjeremi corbyn
BBCNEWS,BBC News,climat chang serious million american around world orbit celebr thanksgiv
BBCNEWS,BBC News,inund italian citi three worst ten flood sinc record began nearli hundr year ago happen week mayor venic blame part climat chang
BBCNEWS,Newsday,missil russia video trend bbccom highest tide year caus sever flood venic italian citi mayor blame climat chang that stay bbc world news
BBCNEWS,BBC News,australia specif event australia specif event rather doctor thoma munsen colleagu yea rs thoma munsen colleagu year ago show bushfir link global warm recent studi australian depart meteorolog look
BBCNEWS,BBC Wales Live,current fossil fuel industri switch renew let ta ke let take point bear mind climat crisi jane dodd
BBCNEWS,BBC Newsroom Live,use tour data donat group massiv attack band said want help find solut climat crisi here environ report laura foster
BBCNEWS,Our World,new south wale queensland fuell cultur war climat chang australia react
BBCNEWS,BBC News,seen deepli damag burn coal huge driver climat chang produc around
BBCNEWS,BBC News,citi water mayor say climat chang blame join chri mason half hour time
BBCNEWS,The Papers,climat chang import issu face countri concern environ gone mainstream look greta thunberg
BBCNEWS,Electioncast,part answer tackl climat chang that problem complic make fight plastic pollut seem rel easi
BBCNEWS,Afternoon Live,parti look tech enabl solv climat chang problem cheltenham amaz cyber chang workspac
BBCNEWS,BBC News,pledg plant tree futur look parti plan tackl climat crisi well take indepth look
BBCNEWS,Newsday,travel far wide whether that north south pole wit first hand impact global warm fact even part first solarpow antarct expedit year old polar explor barney swan discuss new documentari air singapor tonight nake arctic adventur
BBCNEWS,Our World,bbc news world australia struggl climat chang nick lazared meet blame declin great
BBCNEWS,The Briefing,tackl climat chang meanwhil mirror lead pledg labour parti spend £ billion nh
BBCNEWS,HARDtalk,happen week mayor venic blame part climat chang bbc news hardtalk
BBCNEWS,Afternoon Live,young peopl creep left polit climat chang group left polit someth
BBCNEWS,Breakfast,absolut amaz thought energi climat chang sue barr let talk area energi
BBCNEWS,BBC News at 9,latest album fan billi eilish fight climat chang go given free concert ticket
BBCNEWS,BBC News,world took place protest climat chang around demonstr stage uk well countri
BBCNEWS,Afternoon Live,main focu obvious climat crisi unashamedli ambiti programm tri transform economi make countri carbon neutral everyth need chang
BBCNEWS,BBC News at Six,carbon tax give money back peopl form basic incom actual theyr get support need navig zerocarbon economi green one mp last parliament theyr look jessica parker bbc news ever sinc eu referendum elect
BBCNEWS,Afternoon Live,danger phil mercer bbc news sydney sever flood venic result climat chang leav perman mark
BBCNEWS,BBC News,increas carbon emiss special report aviat climat chang anoth super success england win new zealand h
BBCNEWS,BBC News at One,vow snp mp would pressur govern take stronger action climat chang campaig box club north london
BBCNEWS,BBC Newsroom Live,climat chang affect gener come thing cover report like biodivers see
BBCNEWS,BBC News,necessari journey heavier weight plane mean higher emiss drive climat chang chief environ correspond justin rowlatt report
BBCNEWS,BBC News,sinc record began nearli hundr year ago happen week mayor venic blame part climat chang call work studi effect number home busi gloucestershir flood
BBCNEWS,The Briefing,seen deepli damag burn coal huge driver climat chang produc around global carbon dioxid emiss
BBCNEWS,BBC News at Six,answer tackl climat chang that problem complic make fight plastic pollut seem rel easi david shukman bbc news
BBCNEWS,BBC News at 9,climat chang start paraathlet hannah cockroft time world champion pick two gold
BBCNEWS,Newsday,catastroph climat chang smog crisi engulf india capit youngest poorest resid risk kill children
BBCNEWS,Beyond 100 Days,climat chang demonstr thought like claimant strike like protest fact shortag term could
BBCNEWS,Ask the Leaders,let get brexit sort focu climat chang arrest member extinct rebellion wont presum go
BBCNEWS,BBC News,climat chang smoke creat real public health nuisanc send peopl hospit caus heart attack
BBCNEWS,BBC News at Five,amount sir david king former chief scientif advis uk govern foreign secretari special repres climat chang
BBCNEWS,Breakfast,morn look issu environ climat chang send question david shukman environ editor
BBCNEWS,BBC News,feel best sum one teenag speaker bushfir definit link climat chang see
BBCNEWS,Newsday,climat chang serious let take look front page around world start singapor strait time report
BBCNEWS,Newsday,tyndal centr climat chang research use tour data donat group massiv attack laura foster report teardrop fire
BBCNEWS,BBC News,guest problem climat chang exampl mani chang take place trip ashor care control
BBCNEWS,BBC Newsroom Live,apprenticeship certainli look nation educ servic green industri revolut mean tackl climat crisi reduc inequ actual go
BBCNEWS,BBC Newsroom Live,carbon neutral green tackl climat crisi green remain transform green build better britain borisjohnson jeremi corbyn go head head first tv debat elect campaign
