Station,Show,Snippet
BBCNEWS,Newsday,problem climat chang draw carbon alreadi atmospher buy us time basic slow stop emit stop emiss dont thinkll success unless realli leverag agricultur get
BBCNEWS,BBC Newsroom Live,european elect campaign urg peopl say brexit climat chang parti field candid across england wale parti colead sian berri jonathan bartley said green sensibl choic voter
BBCNEWS,BBC News at Five,via videolink tomorrow green parti launch campaign european elect may rd messag ye europ climat chang gain hundr council seat last week english local elect parti hope
BBCNEWS,BBC News at Six,standoff theresa may polit parti prime minist team down street keep wait one mpjoke becom bit like one climat chang protest storm parliament coupl week ago glu
BBCNEWS,Breakfast,tax sure want becom increasingli concern effect climat chang similarli invest greater product produc end ata higher tax bill alreadi
BBCNEWS,BBC News at Ten,launch campaign european parliamentari elect take place later month urg peopl say ye europ climat chang gain council seat last week english local elect parti hope improv three
BBCNEWS,Breakfast,hospit school tube station seriou risk flood urgent action taken tackl climat chang accord report london assembl green parti look capit affect increas temperatur
BBCNEWS,Election 2019,prime thing take away elect phenomen result green great see climat chang come onto agenda clear anger two big parti gone
BBCNEWS,Breakfast,vent protest use independ avail also green said perhap help discuss climat chang vote averag doubl figur one best perform local
BBCNEWS,Afternoon Live,guarante stabl climat ambiti attempt yet stop ad climat chang nation canadian aerospac firm bombardi put belfast oper sale part reorganis busi compani also
BBCNEWS,BBC Newsroom Live,effect climat chang accord environ agenc say five million peopl england could affect commun move elsewher ur environ analyst roger harrabin explain flood wreak havoc uk recent year
BBCNEWS,BBC Newsroom Live,rain continu coastal eros climat chang say current twothird properti england serv infrastructur risk flood calcul everi home flood around suffer problem power transport telecommun
BBCNEWS,BBC Newsroom Live,rain continu coastal eros climat chang say current twothird properti england serv infrastructur risk flood calcul everi home flood around suffer problem power transport telecommun
BBCNEWS,Breakfast,rain continu coastal eros climat chang say current twothird properti england serv infrastructur risk flood calcul everi home flood around suffer problem power transport telecommun
BBCNEWS,Breakfast,recognis climat chang acceler bring intens rainfal sea sea level rise continu wage war water build ever higher flood build ever higherflood defenc barrier prepar
BBCNEWS,Breakfast,clear ye europ climat chang watch programm morn look massiv carbon emiss aviat featur report huge cost reloc town face flood need
BBCNEWS,Breakfast,face flood need eu parliament august pro european parti term represent europ need mp continu good work climat chang stop border stay europ
BBCNEWS,Victoria Derbyshire,£ billion year need spent protect home infrastructur effect climat chang accord environ agenc say five million peopl england could affect commun move elsewher
BBCNEWS,BBC News at One,turn mean spend protect green group say uk tri harder prevent climat chang first place believ resili undeni import protect commun countri risk flood
BBCNEWS,BBC News,govern deni climat chang dismantl countri exist environment protect eight former minist said administr creat climat impun risk control illeg deforest amazon say author forestri water servic
BBCNEWS,Asia Business Report,much focu brexit environ climat clearli bigger brexit remain eu mean end climat chang doesnt stop border say critic point campaign stay
BBCNEWS,Weather World,across affect area track idai give clue flood bad doubl hit scale devast led mani ask role climat chang fact frequenc tropic
BBCNEWS,The Papers,well die labour tri get territori would jeremi corbyn tri claim climat chang move territori actual tori michael go went met tri get
BBCNEWS,Weather World,happen world around us happen climat chang plant becom extinct time notjust natur climat pressur peopl plant place like island vulner rise sea level alpin speci
BBCNEWS,Newsday,mine compani build road port mine site local use “ use local use r mayb build school local see fewer rich climat chang seriou impact one south
BBCNEWS,The Papers,time front page eye eye notjust brexit next trimest think climat chang momentum continu build global come feel among peopl govern
BBCNEWS,Sportsday,leader weekend newspap say climat chang activist vow blockad heathrow airport june vow blockad heathrow airport injun injuli everyon go away holiday independ say singer labour parti figur
BBCNEWS,The Papers,say climat chang activist vow blockad heathrow airport june vow blockad heathrow airport injun injuli everyon go away holiday independ say singer labour parti figur warrant jimmi corbin must
BBCNEWS,BBC News at Five,first could opportun countri busi govern work togeth back busi rescal nation tackl climat chang tackl inequ let second realli import messag that possibl deal
BBCNEWS,Outside Source,climat chang play big part death bodi dead puffin start wash coast saint paul island us scientist say around sea bird die month emaci scientist believ bird
BBCNEWS,BBC News at Five,us specif deal think us would agre need final resolut question mani bigger question climat chang child poverti gross inequ island current current get
BBCNEWS,Beyond 100 Days,debat climat chang polici germani well realli rerun presidenti elect emanuel mccraw mari pen ina emanuel mccraw mari pen strang way frame interview
BBCNEWS,BBC News at Six,brexit deadlock tri pleas remain brexit may cost labour support green grab support big parti mayb help voter worri climat chang liber democrat hope gain ground support
BBCNEWS,Breakfast,neg agenda countri damag economi damag influenc world prevent fight climat chang effect couldnt realli work govern like also huge doubt aboutjeremi corbyn dont realli trust brexit
BBCNEWS,HARDtalk,yearold son think father view technolog progress quit neg issu human face today issu get onto sustain economi deal climat chang issu socal
BBCNEWS,Beyond 100 Days,join us cb news fourth worst tornado season record bad blame climat chang let talk man know extrem weather expert dr victor gensini join us illinoi good us victor
BBCNEWS,BBC News,around world school strike movement continu grow call urgent action climat chang basic two demand want ambiti zero carbon act also want govern declar climat emerg fundament
BBCNEWS,BBC News Special,inde think reflect two trend see germani firstli interest climat chang environment polici realli come fore top list voter vote rs co nce rn voter concern runup vote secondli
BBCNEWS,Breakfast,ireland vote thursday green parti believ well back voter concern climat chang offici result announc poll close even fire safeti expert warn build england risk fail
BBCNEWS,BBC Business Live,cours think even though european parliament proeu go start consid euroscept want well smaller green parti particularli term thing like climat chang one thing saw boast pari
BBCNEWS,Afternoon Live,stori half past back stori half past would possibl refreez north pole way repair damag done climat chang itsjust one idea look new research centr cambridg univers
BBCNEWS,Newsday,climat chang becom defin elect issu concern carbon emiss pit import coal industri bbc hywel griffith queensland hand margin seat could decid result coal oil keep
BBCNEWS,BBC News at Five,issu import consid voter look main issu trust ta ke take action climat chang also sociallyjust parti ca care reduc inequ look polici also
BBCNEWS,Breakfast,tress fli less there shortag idea come tackl climat chang labour plan involv grant million solar panel renationalis uk energi network rebecca longbailey shadow busi secretari tell us good morn good morn
BBCNEWS,BBC News,key factor climat chang system wood like uk absorb one tropic climat theyr vulner rise temperatur went see ecologist work take sampl kew garden use dna test tell what
BBCNEWS,BBC News at One,afternoon top stori lunchtim itv axe thejeremi kyle show guest took part programm found dead come get plot bafta urg televis show stori line refer climat chang help tackl issu
BBCNEWS,BBC News,writer say show sustain way live screen begin see realworld effect climat chang peopl choic bear brunt think drama televis reflect
BBCNEWS,BBC News at Nine,food wast countri equival carbon emiss come everi third motorcar road everi heavi good vehicl someth think climat chang debat catalyst busi
BBCNEWS,HARDtalk,mention climat chang plan coincid first time fund climat action plan first law climat wasnt even interest polit life polit scene iceland
BBCNEWS,BBC News at One,man who led effort heart govern combat climat chang year help set new research centr develop way repair damag that alreadi done urgenc issu littl time left
BBCNEWS,BBC News,bbc news im shaun ley headlin admiss fli uk may restrict climat chang campaign say rethink essenti know got reduc emiss urgent radic expand go
BBCNEWS,Tuesday in Parliament,secur blanket unit state provid world last year absolut fundament prosper area like climat chang trade defend nh must continu work european partner european parliament
BBCNEWS,Breakfast,televis soap scum comedi come drama writer say show sustain way live screen begin see realworld effect climat chang peopl choic bear brunt
BBCNEWS,BBC News,special programm extra time take detial look tonight bafta award ceremoni un secretari gener warn politician enough tackl climat chang speak new zealand ahead tour pacif island antonio guterr warn world
BBCNEWS,BBC News,mosqu christchurch visit includ travel island pacif region lowli countri could disappear complet rise sea level realli front line dramat impact climat chang absolut must abl stop
BBCNEWS,BBC News,peopl face famin concern climat chang might restrict growth fli uk accord senior civil servant jeremi corbyn announc labour would pay yearold minimum wage everyon els win next elect
BBCNEWS,BBC News,suddenli climat chang much concern look campaign last five week clear major parti concentr economi believ econom manag key elect
BBCNEWS,BBC News,poll station open australia gener elect nalyst australia gener elect analyst predict x closest mani year climat chang immigr issu us canada scrap aluminium steel tariff impos year ago could pave
BBCNEWS,Living Rough,poll station open australia gener elect nalyst australia gener elect analyst predict x closest mani year climat chang immigr issu us canada scrap aluminium steel tariff impos year ago could pave
BBCNEWS,Breakfast,queensland seen terribl condit think made real live issu thought climat chang someth futur australia frontlin poll suggest select
BBCNEWS,BBC News,reallyjust made fun labor parti climat polici realli dont im actual excit talk climat chang real issu notjust environment issu issu everyon live safeti
BBCNEWS,Thursday in Parliament,place day teach climat chang denier hous young peopl taught conspicu absenc recent debat clearli havent got confid put case fact scienc
BBCNEWS,BBC News,envisag pari climat chang agreement theori rise sea level would endang mani citi possibl submerg much bangladesh nile valley spoke one senior scientist involv report professor michael oppenheim depart geoscienc princeton
BBCNEWS,BBC News,differ modestli higher countri citi peopl abl adjust time climat chang sea level rise fast emiss high overwhelm abil adapt except perhap area settl peopl
BBCNEWS,Breakfast,wont enough man who led effort heart govern combat climat chang year help set new research centr role repair damag that alreadi done look process
BBCNEWS,Breakfast,eight saturday th may top stori morn concern climat chang might restrict growth fli uk govern admit senior civil servant said minist may review aviat strategi includ plan expand heathrow advisori committe
BBCNEWS,BBC News,labour idea clearli design appeal younger voter verdict busi detail need let take look today news concern climat chang might restrict growth aviat uk govern admit senior civil servant
BBCNEWS,BBC News,climat emerg hour later shortli midnight climat chang committe independ expert advisori bodi govern said got get uk net zero emiss two fundament chang sinc judgment last week
BBCNEWS,Lula,headlin concern climat chang might restrict growth fli uk accord senior civil servant un say houthi rebel yemen appear honour pledg withdraw troop key port open lifelin million peopl face famin
BBCNEWS,BBC News,includ climat chang ask view role realli chang go back hundr year mysteri post job life occas peopl would oblig write commiss royal occas
BBCNEWS,BBC News,headlin bbc news concern climat chang might restrict growth fli uk accord senior civil servant aid worker say pledg houthi rebel yemen withdraw troop key port big game changer may open
BBCNEWS,Breakfast,simon armitag name new poet laureat role last year pledg give away salari £ year say want use role ensur poetri embrac major global issu includ climat chang here art editor
BBCNEWS,The Travel Show,hello bbc news shaun ley headlin concern climat chang might restrict growth fli uk accord senior civil servant theresa may expect give detail come day leav down street accord senior
BBCNEWS,Coastal Britain,hello bbc news shaun ley headlin concern climat chang might restrict growth fli uk accord senior civil servant un say houthi rebel yemen appear honour pledg withdraw troop key port
BBCNEWS,BBC News,fli meet climat chang target possibl aviat keep expand end think logic complet inevit know reduc emiss urgent radic expand go opposit direct
BBCNEWS,BBC News,new poet laureat role last year west yorkshir writer say want use role ensur poetri embrac major global issu includ climat chang earlier colleagu shaun ley ask view role realli chang
BBCNEWS,Sportsday,kitchen someon scream lost car key wonder could read us someth say poetri crazi time well calm time poem climat chang clean air someth talk earlier
BBCNEWS,BBC Newsroom Live,underpin countrym talk noth help climat chang cost punit busi rate hit manufactur factori like scunthorp like scu nthorp like scunthorp like rotherham noth also deal
BBCNEWS,BBC News,deliv anoth one cheer applaus chant elect bill gener shift young peopl put climat chang centr debat demand new coal mine open tide turn toward liber despit two year trail behind labor poll
BBCNEWS,BBC News,chant elect bill gener shift young peopl put climat chang centr debat demand new coal mine open tide turn toward liber despit two year trail behind labor poll cours form govern
BBCNEWS,BBC News,slender major oi reli crossbench mp prop parliament actual could bea parliament actual could realli interest factor climat chang debat crossbench mp
BBCNEWS,BBC News,rural queensland coal still king work labor want greater action climat chang mean side lose seat one quit sure emerg victor labor poll led us believ would
BBCNEWS,BBC News,vote everywher place dead certainli independ one climat polici weve got real challeng countri concern climat chang damag caus see
BBCNEWS,BBC News,member innerc area tradit liber seat got reduc vote peopl concern climat chang number independ actual think liber parti yesterday nation parti think climat polici
BBCNEWS,BBC News,action climat chang mean side lose seat nobodi sure emerg victori labour puls lead believ australia sixth prime minist within six yea rs sixth prime minist within six year pole lead us
BBCNEWS,Breakfast,real mep europ work politician issu real concern auster climat chang tax avoid thing think peopl realli concern fight everi vote elect come thursday
BBCNEWS,Afternoon Live,wikilea ks cofound julian assang sentenc week jail breach bail condit labour leaderjeremi corbyn come spotlight antisemit parti tri put focu climatechang polici
BBCNEWS,Afternoon Live,wikilea ks cofound julian assang sentenc week jail breach bail condit labour leaderjeremi corbyn come spotlight antisemit parti tri put focu climatechang polici
BBCNEWS,BBC Newsroom Live,chief execut committe climat chang report main author chri stark good us today thank time uk becom leader look question one remark thing
BBCNEWS,Newsday,british parliament endors motion declar climat chang emerg measur symbol direct polici consequ come increas pressur vocal activist group extinct rebellion brought part london standstil recent nonviol civil disobedi protest
BBCNEWS,BBC News at One,station explain six month year china realli push govern deal climat chang domest n one hand pioneer new energi vehicl electr vehicl want fifth vehicl road
BBCNEWS,BBC News,govern risk includ climat chang chang pa rt chang chang part britain lead part financ light recommend aim nearli zero admiss
BBCNEWS,Beyond 100 Days,job rural area coalmin lot plant use lot run hour day even run peopl complain air pollut complain climat chang also china one
BBCNEWS,BBC News at Nine,home charg electr car foot bill treasuri sa report suggest mani thing treasuri need help truth happen achiev target unless climat chang brought back
BBCNEWS,BBC News at Nine,let us discuss join north london rachel huxley she director knowledg learn environ group c network citi around world take action climat chang good us
BBCNEWS,BBC News at Nine,think far away lobbi earli stage climat chang act pass initi want reduct got go net zero still far away aim alway
BBCNEWS,The Briefing,goal leader battl climat chang talk aviat obvious one set realli watch term guilti contribut issu one sector
BBCNEWS,Newsday,british parliament endors motion declar climat chang emerg measur symbol direct polici consequ come increas pressur vocal activist group extinct rebellion brought part london standstil recent nonviol civil disobedi protest
BBCNEWS,BBC News,good even welcom bbc news britain drastic cut carbon emiss next year lead globalfight climat chang that view govern independ advis say uk cut greenhous emiss virtual zero scotland target five year sooner
BBCNEWS,BBC News at Ten,respons great deal warm world see climat chang see also consum lot two factor especi mean uk realli mean uk go faster earlier
BBCNEWS,Wednesday in Parliament,greenwash tinker order day prime minist say would run greenest govern histori say vote blue get green weve govern minist jet around globe summit address climat chang former labour leader
BBCNEWS,Wednesday in Parliament,climat chang secretari express regret truth feel sens guilt feel sens guilt done issu didnt leader parti talk issu
BBCNEWS,Newsday,import regul ecosystem good good good speci indic good addit environ tell us whole ecosystem thing like climat chang affect
BBCNEWS,Weather World,peak insect abund chang abl feed chick look ahead potenti implic futur bird popul number instanc climat chang also habitat loss well well bird adapt
BBCNEWS,Weather World,doubl hit scale devast led mani ask role climat chang fact frequenc tropic cyclon area decreas slightli recent decad evid show form
BBCNEWS,Weather World,world largest seed bank wild speci insur polici happen world around us happen climat chang plant becom extinct time notjust natur climat pressur peopl plant place like island
BBCNEWS,BBC News at Ten,ye weve plenti warn natur world neverin never strike languag never scale scientist tri captur attent govern say top climat chang plastic pollut ocean
BBCNEWS,Dateline London,done much differ thing might expect dont think think mayb see green better across europ recent public climat chang there sens urgenc
BBCNEWS,BBC News at Six,she arriv canada green parti launch campaign european parliamentari elect later month urg peopl say ye europ climat chang polit correspond chri mason report terribl terribl blu tack skill
BBCNEWS,BBC News,climat chang gain hundr council seat last week english local elect parti hope improv three mep secur time say ye europ ye invest commun climat chao
BBCNEWS,BBC News at Ten,environ climat clearli bigger brexit remain eu mean end climat chang doesnt stop border say critic point campaign stay eu simpli
BBCNEWS,Breakfast,travel weather good morn bbc london news im alic salfield hospit school tube station seriou risk flood urgent action taken tackl climat chang accord report london assembl green parti
BBCNEWS,Dateline London,across europ ce nt across europ recent public climat chang sens urgenc long slow process big far right blog say liber elit
BBCNEWS,Newswatch,cover week aspect bbc news detail contact us end programm last week discuss whether bbc news give subject climat chang prioriti warrant urgent seriou problem
BBCNEWS,,seat local campaign last yea rs year wonder also given headlin news activ peopl seen street intervent younger climat chang activist speak around europ last
BBCNEWS,,vote went extraordinari peopl green campaign know green campaign know green win big interest eco interest surg climat chang push
BBCNEWS,,peopl turn us lib dem got brexit strung strong brexit climat chang strong auster year thing peopl posit vote auster strongli
BBCNEWS,BBC News at Nine,£ billion year need spent protect home infrastructur effect climat chang accord environ agenc say five million peopl england could affect commun move elsewher ur environ analyst
BBCNEWS,BBC News,dismantl countri exist environment protect govern deni climat chang eight former minist said bolsonaro administr creat climat impun risk control illeg deforest amazon say author forestri water servic
BBCNEWS,BBC News at One,futur talk eu posit world america china big poll eu act climat chang global trade rule defenc democraci rule law also talk
BBCNEWS,HARDtalk,ca ptu red captur sequest acr forest year unit state wale good combat climat chang wa nt want kill talk two speci doesnt affect impact
BBCNEWS,Asia Business Report,european parliamentari elect take place later month urg peopl say ye europ climat chang gain council seat last week english local elect parti hope improv three mep secur polit correspond
BBCNEWS,Weather World,look ahead potenti implic futur bird popul number instanc climat chang also habitat loss well well bird adapt dont evolv arriv earlier date potenti obvious could caus signific declin popul
BBCNEWS,Dateline London,across europ recent public climat chang sens urgenc long slow process big far right bloc say liber elit move charg
BBCNEWS,Beyond 100 Days,report destruct speci import interest know climat chang third seriou threat scientist say see come road isa seriou report sens hope
BBCNEWS,BBC News at Five,candid commiss presid realli go deliv new chang europ go act climat chang go put social polici candid support manfr weber major
BBCNEWS,EU Elections 2019,wa keywa key stand remain wakeywakey care climat chang environ would vote green rang issu lib dem polici hug good local good
BBCNEWS,EU Elections 2019,go go away climat chang unfortun go go away becom import ithink month month month rise european agenda smart thing next commiss make centrepiec
BBCNEWS,EU Elections 2019,futur id ink way turnout one highest past year also reflect european understood issu work togeth migrat climat chang thing european mind
BBCNEWS,BBC News at Nine,hundr wealthiest famili charit institut britain sent letter group lead scientist ask help tackl climat chang letter highlight danger deforest carbon emiss speci extinct ask signific invest prevent call ecolog catastroph
BBCNEWS,Breakfast,enhanc subject english math vocat handson tangibl young peopl learn subject english math crucial well engin technolog combat climat chang futur help young peopl
BBCNEWS,The Briefing,relat climat chang trade say us work work independ countri unilater basi point viewer air forc one actual taken air forc one
BBCNEWS,BBC News,explos describ year old w search polic school student hold strike countri around world today demand action climat chang organis said million peopl expect join least countri
BBCNEWS,Paths to Peace,irish prime minist warn negoti could enter danger new phase estim one million young peopl estim join latest intern protesst climat chang school student join coordin march hundr countri japan philippin delhi istanbul citi across europ
BBCNEWS,Outside Source,issu voter translat green exceed climat chang move still agenda voter politician feel reson brussel see manifest term polici weve got result
BBCNEWS,Newsday,coal industri govern everywher need stop give fossil fuel cant fossilfuel cant fossil fuel cant action climat chang still mine coal oil ga ridicul govern claim take action climat simultan
BBCNEWS,Breakfast,encourag us mani year weve encourag take individu respons climat chang there noth wrong know that enough need take old govern action know govern labour govern would
BBCNEWS,Breakfast,compani profit compani paid £ billion dividend sharehold wa nt want profit invest back system also use bring peopl bill tackl climat chang spare
BBCNEWS,BBC News at Nine,writer say show sustain way live screen begin see realworld effect climat chang peopl choic bear brunt think drama televis reflect ourjob properli
BBCNEWS,BBC News at Nine,last four year plateau need pretti aggress thing across differ stakehold order make commit regard make commit regard climat chang said introduct amount carbon emiss come
BBCNEWS,BBC News,uk transport energi technolog network letter philip hammond nation infrastructur commiss chairman sirjohn armitt demand action meet challeng face uk help tackl climat chang sirjohn letter outlin four test commiss believ success nation infrastructur strategi need meet
BBCNEWS,BBC News,although peopl could continu fli meet climat chang target possibl aviat keep expand end think logic complet inevit know reduc emiss urgent radic expand go opposit direct
BBCNEWS,BBC News,concern climat chang might restrict growth fli uk accord senior civil servant houthi rebel yemen say theyll begin withdraw key port today open lifelin million peopl face famin theresa may expect give detail come day
