Station,Show,Snippet
BBCNEWS,Weather World,main driver greenhous ga emiss produc still reliant fossil fuel like coal global level carbon dioxid record high weve got reduc emiss greenhous gase
BBCNEWS,BBC News,roger harrabin report fli govern plan continu grow climat chang might ask current polici industri cut greenhous gase
BBCNEWS,Afternoon Live,your watch afternoon live headlin former defenc secretari gavin williamson stress innoc sack leak nation secur council meet report commiss govern say uk becom world leader tackl climat chang cut greenhous gase
BBCNEWS,World News Today,follow lead introduc zero carbon bill earlier week countri set target reduc greenhous gase except biogen methan zero climat chang
BBCNEWS,BBC News,feel global warm support renew energi given concern major parti creat polici climat chang
BBCNEWS,Afternoon Live,atmospher mean examin altern look process scalabl mean process take billion tonn greenhous gase year
BBCNEWS,BBC Newsroom Live,atmospher mean examin altern look process scalabl mean process take billion tonn greenhous gase year
BBCNEWS,BBC News,greenhous gase that alreadi atmospher mean examin altern look process scalabl mean process take billion tonn greenhous
BBCNEWS,BBC News,greenhous gase aviat expand govern consid plan virtual elimin emiss civil servant admit letter green group may take note advic independ climat chang
BBCNEWS,BBC News at Nine,chief scientif advis new research centr next year realli determin futur human alreadi gone far emit billion tonn greenhous gase
BBCNEWS,BBC Newsroom Live,new research centr develop way repair damag that alreadi done urgenc issu littl time left weve got pull stack greenhous gase that alreadi
BBCNEWS,BBC News,start characteris incred import ecosystem first time two main type fungal network suck greenhous ga carbon key factor climat chang
BBCNEWS,Afternoon Live,help set new research centr develop way repair damag that alreadi done urgenc issu littl time left weve got pull stack greenhous gase that alreadi
BBCNEWS,Newsday,climat chang seriou impact one south korea beauti island rise temperatur mean island ofjejutx mapi lose mani flora fauna speci becom endang result farmer adapt grow translat global warm chang everyth
BBCNEWS,BBC Newsroom Live,die age univers cambridg scientist consid radic new way revers global warm
BBCNEWS,Newsday,data machin learn take data thousand peopl around world start characteris incred import ecosystem first time two main type fungal network suck greenhous ga carbon key factor climat chang
BBCNEWS,BBC News,data machin learn take data thousand peopl around world start characteris incred import ecosystem first time two main type fungal network suck greenhous ga carbon key factor climat chang
BBCNEWS,BBC Newsroom Live,see rise temperatur sea level affect everyon get much wors degre global warm tip point realli contain global warm
BBCNEWS,BBC News,kill air pollut ne kill air pollut one main stori report uk lead global fight climat chang cut greenhous
BBCNEWS,BBC News at Five,land use agricultur land red meat particularli target burp methan methan higher global warm impact
BBCNEWS,Breakfast,uk lead world away danger climat chang cut greenhous gase virtual zero accord new report committe climat chang govern offici
BBCNEWS,BBC Newsroom Live,main stori today new report say uk lead world away danger climat chang cut greenhous gase virtual zero committe climat chang join
BBCNEWS,BBC News at Five,studio environment scientist angela terri found nehom uk first consum websit climat action provid advic adapt prevent global warm
BBCNEWS,BBC Newsroom Live,that sport ill next hour one main stori today new report say uk lead world away danger climat chang cut greenhous
BBCNEWS,Breakfast,climat revers global warm consid scientist univers cambridg part new research centr among idea scheme refreez polar region reflect sunlight away earth spray water ship atmospher fear current approach tackl global warm wont go
BBCNEWS,BBC Newsroom Live,westminst found uk lead world away danger climat chang cut greenhous gase virtual zero accord new report committe climat chang govern offici advis say countri follow suit
BBCNEWS,BBC News,age big data machin learn take data thousand peopl around world start characteris incred import ecosystem first time two main type fungal network suck greenhous ga carbon
BBCNEWS,Business Briefing,report commiss govern say uk lead global fight climat chang cut greenhous gase almost zero committe climat chang say would mean peopl eat less meat take fewer flight give car roger harrabin report
BBCNEWS,BBC News,reduc greenhous gase except biogen methan zero climat chang human also wildlif take polar bear exampl
BBCNEWS,Afternoon Live,climat chang cut greenhous gase almost zero canadian aerospac firm bombardi put belfast oper sale part reorganis busi
BBCNEWS,Outside Source,hurri find plan perspect cdu parti here rightw afd parti say climat chang posit climat chang
BBCNEWS,Wednesday in Parliament,around emiss climat chang gener incred serious consist said climat chang one greatest challeng wellhead face im proud wreck govern deal climat chang
BBCNEWS,BBC News at Ten,huge challeng britain industri revolut first start pump gase rais temperatur report say britain could lead way cleaner futur help limit global warm
BBCNEWS,Victoria Derbyshire,committe climat chang advis govern say uk lead global fight climat chang cut greenhous gase nearli zero suggest car need electr sale petrol car ban
BBCNEWS,Breakfast,uk lead world away danger climat chang cut greenhous gase virtual zero accord new report committe climat chang govern offici advis say countri follow suit world stand chanc keep global temperatur
BBCNEWS,BBC News,climat chang might ask current polici industri cut greenhous gase aviat expand govern consid plan virtual
BBCNEWS,Beyond 100 Days,bbc clair marshal report could help tackl climat chang
BBCNEWS,BBC News,event that bill last chanc prevent irrevers climat chang
BBCNEWS,BBC News,previou assess mention ipcc intergovernment panel climat chang assess
BBCNEWS,BBC News,introduc zero carbon bill earlier week countri set target reduc greenhous gase except biogen methan x climat chang human
BBCNEWS,BBC News at Five,well greenhous gase releas air travel contribut climat chang tini proport passeng choos offset impact flight new research found thatjust passeng pay
BBCNEWS,Afternoon Live,pressur govern tackl climat chang new report suggest confirm cut zero baro brown who deputi chair committe climat chang
BBCNEWS,BBC News at Nine,much uk lead world away danger climat chang cut greenhous gase virtual zero accord new report committe climat chang govern offici advis say countri follow suit world stand chanc keep global temperatur
BBCNEWS,BBC News,climat chang might ask well current polici industri cut greenhous gase aviat expand govern consid plan virtual elimin emiss
BBCNEWS,BBC News,climat chang might ask current polici industri cut greenhous gase aviat expand govern consid plan virtual elimin emiss
BBCNEWS,BBC News,climat chang might ask current polici industri cut greenhous gase aviat expand govern consid plan virtual elimin emiss
BBCNEWS,BBC News,climat chang might ask current polici industri cut greenhous gase aviat expand govern consid plan virtual elimin emiss
BBCNEWS,BBC News,climat chang might ask current polici industri cut greenhous gase aviat expand govern consid plan virtual elimin emiss
BBCNEWS,BBC Newsroom Live,therefor matter prime minist say close report commiss govern say uk becom world leader tackl climat chang cut greenhous gase almost zero
BBCNEWS,Afternoon Live,govern say uk becom world leader tackl climat chang cut greenhous gase almost zero canadian aerospac firm bombardi put belfast oper sale part
BBCNEWS,BBC News at Nine,describ radic ambiti even riski scientist say run time option prevent damag irrevers climat chang ipcc say net c irrevers climat chang
BBCNEWS,BBC News,remov greenpeac climat chang protest sydney harbour bridg cabl suspend bridg hold small banner read ne hundr renew hundr renew make whole histori climat chang
BBCNEWS,BBC News,septemb event that bill last chanc prevent irrevers climat chang hundr mother father children took street london earlier today demand urgent action climat chang
BBCNEWS,Afternoon Live,stabl climat ambiti attempt yet nation stop ad climat chang roger harrabin bbc news find lot issu includ new climat chang
BBCNEWS,Breakfast,chines tech giant huawei newspap opposit parti demand crimin investig scotland yard say current carri inquiri uk lead world away danger climat chang cut greenhous gase virtual zero accord new report committe climat chang govern offici
BBCNEWS,BBC News,un septemb event that bill last chanc prevent irrevers climat chang
BBCNEWS,BBC News,climat chang might ask current polici industri cut greenhous gase aviat expand govern consid plan virtual elimin emiss civil servant admit ina
BBCNEWS,Breakfast,fli govern plan continu grow climat chang might ask current polici industri come greenhous gase aviat expand
BBCNEWS,Breakfast,climat chang might ask current polici industri come greenhous gase aviat expand govern consid plan virtual elimin emiss civil servant admit
BBCNEWS,BBC Newsroom Live,report commiss govern say uk becom world leader tackl climat chang cut greenhous gase almost zero voter head poll council mayor elect across england northern ireland
BBCNEWS,BBC Newsroom Live,tackl climat chang cut greenhous gase almost zero voter head poll council mayor elect across england northern ireland new photograph princess charlott taken mother releas
BBCNEWS,BBC Newsroom Live,report commiss govern say uk becom world leader tackl climat chang cut greenhous gase almost zero new inquest order death nineyear
BBCNEWS,Victoria Derbyshire,want tackl climat chang get greenhous gase virtual zero help save planet cleaner air that accord independ report today detail
BBCNEWS,Outside Source,britain told lead global fight climat chang cut greenhous gase nearli zero that recommend govern advis report say world first industrialis nation
BBCNEWS,World News Today,middl east australia europ school children skip class call action climat chang
BBCNEWS,BBC News at Five,build environment work make sure get proper plan tackl climat chang demonstr seen enorm concern public crisi climat chang
BBCNEWS,Breakfast,climat chang seriou issu urgent action need look socal target import drive way forward make sure attack deal climat chang take
BBCNEWS,BBC News,oil firm adapt risk climat chang two third fund manag consid oilfirm attract invest base target pari agreement un climat chang
BBCNEWS,BBC News at Five,ambiti attempt yet nation stop ad climat chang roger harrabin bbc news professor pier forster he director priestley intern centr climat member committe climat chang publish
BBCNEWS,The Papers,crimin investig claim disclos topsecret inform thati disclos topsecret inform front addit top stori time messag climat chief say britain must plant billion tree help contribut global warm
BBCNEWS,BBC News,chang number one googl issu australia peopl find inform parti say climat chang
BBCNEWS,BBC News,environ analyst roger harrabin report fli govern plan continu grow climat chang might ask current polici industri cut greenhous gase aviat expand
BBCNEWS,BBC News,fli govern plan continu grow climat chang might ask current polici industri cut greenhous gase aviat expand govern
BBCNEWS,BBC News,follow lead introduc zero carbon bill earlier week countri set target reduc greenhous gase except biogen methan zero climat chang human also wildlif
BBCNEWS,BBC News,fli govern plan continu grow climat chang might ask current polici industri cut greenhous gase aviat expand govern
BBCNEWS,Afternoon Live,report commiss govern say uk becom world leader tackl climat chang cut greenhous gase almost zero canadian aerospac firm bombardi put belfast oper sale part reorganis busi
BBCNEWS,BBC News at One,greenhous gase releas air travel contribut climat chang tini proport passeng choos offset impact flight new research found thatjust one percent passeng pay carbon offset jet fuel one biggest
BBCNEWS,HARDtalk,climat chang organis say promot growth phytoplankton dont know good take greenhous gase atmospher carri carbon ocean floor studi shown sperm whale sale much carbon
BBCNEWS,World News Today,rise sea level realli front line dramat impact climat chang absolut must abl stop dramat trend revers dramat trend allow runaway climat chang
BBCNEWS,BBC News,concern climat chang might restrict growth aviat uk govern admit senior civil servant say minist may review strategi includ plan expand heathrow follow recent warn committe climat chang
BBCNEWS,BBC News,concern climat chang might restrict growth aviat uk govern admit senior civil servant say minist may review strategi includ plan expand heathrow follow recent warn committe climat chang
BBCNEWS,BBC News,specul let say school striker peopl show leadership around issu climat chang theresa may ever show one paralysi parliament last year issu like climat chang arent
BBCNEWS,BBC News,demonstr india protest new zealand around world school strike movement continu grow call urgent action climat chang
BBCNEWS,BBC News,lead climat action summit un septemb event that bill last chanc prevent irrevers climat chang
BBCNEWS,Breakfast,hello breakfast charli stayt tina daheley good morn here summari today main stori bbc news concern climat chang might
BBCNEWS,BBC Newsroom Live,foremost part european famili nation european union lead player find global respons climat chang ina
BBCNEWS,Weather World,spend winter notjust chang weather climat along rout winter ground ye climat chang
BBCNEWS,Breakfast,danni shaw bbc news £ billion year need spent protect home infrastructur effect climat chang
BBCNEWS,The Travel Show,pursu poetri embrac major global issu includ climat chang salari £ per year yearold yorkshireman say give away speak art editor gompertz simon armitag read present poem climat chang
BBCNEWS,Afternoon Live,also there muchjeopardi climat chang right tear apart comedi drama tend get thing like game throne whole dead wall winter come kind play like metaphor climat chang
BBCNEWS,BBC News,say countri follow lead introduc zerocarbon bill earlier week countri set target reduc greenhous gase except biogen methan zero climat chang human also wildlif
BBCNEWS,BBC News at Five,climat chang cut greenhous gase nearli zero accord new report commiss govern new inquest order death nineyearold london girl ella kissidebrah mother believ kill illeg level
BBCNEWS,BBC News,stay us bbc world news still come japan germani countri school children skip class demand action climat chang
BBCNEWS,BBC News at Ten,accumul carbon start releas rate see chang acceler even there effect way help fight climat chang
BBCNEWS,BBC Newsroom Live,wind turn lighter ambiti new target uk cut carbon emiss almost zero next year govern climat chang
BBCNEWS,BBC News at Five,chart way forward without uk think eu countri need focu next five yea rs year climat chang thirdli
BBCNEWS,BBC News,feul global warm actual understand fuel global warm support renew energi two major parti havent necessarili talk lot climat chang past given concern your talk embrac concern polici tri win vote
BBCNEWS,BBC News,good afternoon welcom bbc news concern climat chang might restrict growth aviat uk govern admit senior civil servant say minist may review strategi includ plan expand heathrow follow recent warn committe climat chang
BBCNEWS,BBC News,good morn welcom bbc news concern climat chang might restrict growth aviat uk govern admit senior civil servant say minist may review strategi includ plan expand heathrow follow recent warn committe climat chang
BBCNEWS,Victoria Derbyshire,shakeup sit depend view brexit primarili well realli hope get away singl issu polit need polit deal public servic economi educ climat crisi
BBCNEWS,BBC News,moment well busi news first headlin bbc news report commiss govern say uk becom world leader tackl climat chang cut greenhous gase almost zero former defenc secretari gavin williamson stress innoc
BBCNEWS,Beyond 100 Days,globalfight govern say uk lead global fight climat chang cut greenhous gase nearli zero go get car need electr sale petrol car ban ten year earlier
BBCNEWS,BBC News at Six,sack uk lead globalfight sack uk lead global fight climat chang cut greenhous gase almost zero accord report commiss govern new inquest order death nineyearold london girl electr kiss
BBCNEWS,Sportsday,sack uk lead globalfight sack uk lead global fight climat chang cut greenhous gase almost zero accord report commiss govern new inquest order death nineyearold london girl electr kiss
BBCNEWS,Victoria Derbyshire,committe say farmer larg escap attent climat chang agricultur major produc greenhous gase farmer need turn land woodland feed cattl special diet reduc amount methan burp atmospher
BBCNEWS,BBC News at Five,headlin bbc news govern say plan call polic leak nation secur council led defenc secretari gavin williamson sack uk lead global fight climat chang cut greenhous gase nearli zero
BBCNEWS,Afternoon Live,becom world leader tackl climat chang cut greenhous gase almost zero new inquest order death nineyear old london girl ella kissidebra mother believ kill air pollut welcom decis here busi headlin afternoon live
BBCNEWS,BBC News at Nine,explain track data channel amount nearli programm find mention environ climat chang
BBCNEWS,BBC News,otherwis dri edinburgh manchest cardiff london weather hello bbc news martin croxal headlin concern climat chang
BBCNEWS,Breakfast,gompertz want offer daughter tast glazier sens world simon armitag read present poem climat chang
BBCNEWS,BBC Newsroom Live,unchang today court percent bank england leav interest rate unchang uk lead world away danger climat chang
BBCNEWS,Beyond 100 Days,meanwhil divis democrat parti bubbl surfac last night alexandria ocasiocortez junior congresswoman get plenti focu speak stage berni sander wasjo biden climat chang plan got rile listen congress first notifi nasa climat chang
BBCNEWS,BBC News,marcher street spain demonstr india protest new zealand around world school strike movement continu grow call urgent action climat chang
BBCNEWS,BBC News,news bomb french citi lyon injur eight peopl estim one million school children countri skip class demand action stop climat chang
BBCNEWS,BBC News,environmentalist peopl work around climat chang shock result reel see real setback ye labour promis stronger action climat
BBCNEWS,BBC News,approach well voter approach econom reform labor set fairli courag reform agenda lot peopl watch australia happen climat chang
BBCNEWS,BBC News,think case better devil know labour one mayb broad polici platform key climat chang
BBCNEWS,BBC News at Five,jeremi corbyn criticis govern handl brexit crossparti talk stark warn commun may move threat pose climat chang flood
BBCNEWS,Afternoon Live,net zero greenhous ga emiss one second butjust one second right honour friend immedi commiss climat chang committe put tell us govern
BBCNEWS,BBC News,climat chang one idea examin new research centr cambridg univers scientist fear simpli reduc greenhous ga emiss wont enough stop irrevers damag environ
BBCNEWS,HARDtalk,valu ocean accord one report un climat chang rganis say promot growth phytoplankton dont know good take greenhous gase atmospher carri carbon ocean floor southern ocean studi shown sperm whale allow
BBCNEWS,BBC Newsroom Live,cut greenhous gase virtual zero accord new report committe climat chang govern offici advis say countri follow suit world stand chanc keep global temperatur increas degre report also list number thing
BBCNEWS,Afternoon Live,your watch afternoon live headlin former defenc secretari gavin williamson stress innoc sack leak nation secur council meet report commiss govern say uk becom world leader tackl climat chang cut greenhous gase almost zero
BBCNEWS,Business Briefing,culprit also independ accord new studi european need work far shorter hour week help combat climat crisi say exist carbon intens economi would need adopt ninehour work week order cut emiss enough keep global
BBCNEWS,Beyond 100 Days,frequenc extraordinari weather event see step worri bit prematur conclus link frenet activ climat chang
BBCNEWS,BBC News,news bomb french citi lyon injur eight peopl estim one million school children countri skip class demand action stop climat chang
BBCNEWS,BBC News,area rehydr ramp diplomaci lead climat action summit un septemb event that bill last chanc prevent irrevers climat chang
BBCNEWS,Breakfast,twitter bbcclick that week thank watch well see soon good morn welcom breakfast charli stayt tina daheley ur headlin today concern climat chang
BBCNEWS,Click,degre tuesday wednesday becom pretti warm bbc news im martin croxal headlin fli uk may restrict climat chang
BBCNEWS,BBC News,lose someth actual seem small inconsequenti actual anim depend start lose specif ecosystem function depend upon differ thing like climat chang mitig
BBCNEWS,Breakfast,housebuild floodplain cope grow popul warm mean properti built doubl next year govern said take risk climat chang serious
BBCNEWS,BBC News,kept freeflow futur still topic know former environ minist brazil accus presid air bolsonaro govern deni climat chang
BBCNEWS,BBC Newsroom Live,past idea describ radic ambiti even riski scientist say run time option prevent damag irrevers climat chang
BBCNEWS,BBC News,visit includ travel island pacif region lowli countri could disappear complet rise sea level realli front line dramat impact climat chang absolut must abl stop dramat trend revers dramat trend allow runaway climat chang
BBCNEWS,BBC News,visit includ travel island pacif region lowli countri could disappear complet rise sea level realli front line dramat impact climat chang absolut must abl stop dramat trend revers dramat trend allow runaway climat chang
BBCNEWS,Breakfast,britain want give peopl final say dont think democrat futur stop brexit emphasis need ambiti climat chang
BBCNEWS,Afternoon Live,cool earth past idea describ radic ambiti even riski scientist say run time option prevent damag irrevers climat chang
BBCNEWS,Afternoon Live,day life felt panic revuls realis babi mix race would possibl refreez north pole way repair damag done climat chang
BBCNEWS,BBC News,migrant coast libya tunisia migrant boat capsiz kill least peopl british scientist unveil say radic new plan tackl climat chang
BBCNEWS,Breakfast,rise theyv invest enough infrastructur requir push forward renew agenda want make sure institut local nation would drive forward energi effici climat chang
BBCNEWS,Dateline London,british young peopl hadnt gone vote big enough number referendum realis languag futur eu climat chang
BBCNEWS,Lula,hello bbc news headlin un say houthi rebel yemen appear honour pledg withdraw troop key port open lifelin million peopl face famin concern climat chang
BBCNEWS,World News Today,migrant coast libya coast tunisa migrant boat capsiz kill least peopl british scientist unveil say radic new plan tackl climat chang
BBCNEWS,Breakfast,still shower around certainli today ill fill detail around quarter hour saturday th may top stori morn concern climat chang
BBCNEWS,BBC News at Nine,sharehold dividend compani invest infrastructur push forward renew agenda want make sure institut local nation would drive forward energi effici climat chang target
BBCNEWS,The Briefing,secur meet gavin williamson refus go quietli say strenuous deni alleg eat less meat take fewer flight give car uk could becom world leader tackl climat chang
BBCNEWS,Afternoon Live,wale cut emiss farm industri environ correspond kevin kean spent day one famili aberdeenshir bit fight climat chang
BBCNEWS,BBC News at Five,cant continu wage war water build ever higherflood defenc barrier prepar resili measur bring rang differ method better protect commun flood climat chang
BBCNEWS,Breakfast,one five polic offic suffer post traumat stress disord win war water stark warn commun may move threat climat chang
BBCNEWS,Weather World,track idai give clue flood bad doubl hit scale devast led mani ask role climat chang
BBCNEWS,BBC Newsroom Live,cool earth past idea describ radic ambiti even riski scientist say run time option prevent damag irrevers climat chang
BBCNEWS,Newsday,greenhous ga carbon key factor climat chang system wood like uk absorb system wood like uk absorb one tropic climat theyr vulner rise temperatur
BBCNEWS,BBC News,continu grow climat chang might ask current polici industri cut greenhous gase aviat expand govern consid plan virtual elimin emiss civil servant admit letter green group may
BBCNEWS,Breakfast,ms onasanya jail injanuari lie speed offenc expel labour convict repres citi independ byelect injun uk lead world away danger climat chang cut greenhous gase virtual zero accord new report
BBCNEWS,Breakfast,alreadi gone far emit billion ton greenhous gase atmospher everi year learn first take greenhous gase alreadi put air bring
BBCNEWS,BBC News,tri harder prevent climat chang first place believ resili undeni import protect commun countri risk flood govern realli want protect commun need tackl climat
BBCNEWS,Newsday,famou masterpiec museum islam art doha saturday australian go poll decid whether want fourth prime minist four year climat chang
BBCNEWS,BBC News at One,blue planet chang way think plastic soap opera often prais rais awar difficult social health issu bafta say time put spotlight climat chang
BBCNEWS,HARDtalk,see govern realli chang good iceland societi mention social infrastructur public health care educ new polici invest innov research mention climat chang plan
BBCNEWS,The Travel Show,giant natur world california redwood tree tallest live thing earth amongst oldest far invulner mike corey big sur find climat chang caus
BBCNEWS,BBC News,hello welcom bbc news poll open australia gener elect choos countri sixth prime minist mani year tight race predict fierc polit battleground feder polit climat chang
