Station,Show,Snippet
BBCNEWS,Can Flying Go Green - Panorama,sustain sourc lifecycl youv actual got genuin carbon dioxid reduct sound good still contribut climat chang least emiss c engin stay
BBCNEWS,BBC News at Five,blue flag repres best valu democraci rule law free trade free speech freedom love whoever choos tackl climat chang protect wildlif
BBCNEWS,Afternoon Live,day glastonburi got word got prime minist pend arriv group protest climat chang activist somebodi bear labour placard anti
BBCNEWS,BBC News at One,tackl climat chang dont forget remain allianc liber democrat plaid cymru run seat around england wale
BBCNEWS,BBC News,vulner effect climat chang plan flood defenc scheme delay year corrupt scandal overspend littl comfort watch tide rise fall rise jenni hill bbc news venic
BBCNEWS,BBC News,venic lie low prone flood vulner effect climat chang plan flood defenc scheme delay year corrupt scandal overspend littl comfort watch tide rise fall rise
BBCNEWS,Afternoon Live,environ promis spend extra p pound five year capit spend public sector also want focu climat chang protect environ £ billion ed
BBCNEWS,BBC News,warm planet climat chang realli press issu absolut clear reach net zero emiss tonight investig industri tri clean act
BBCNEWS,Breakfast,spend pledg liber democrat promis £ billion tackl climat chang conserv say theyll help left behind town good morn aberdeen key centr oil ga industri
BBCNEWS,Breakfast,bt tax tech giant rais £ billion spend pledg liber democrat promis £ billion tackl climat chang conserv say theyll help leftbehind town good morn
BBCNEWS,Can Flying Go Green - Panorama,warm planet climat chang realli press issu absolut clear reach net zero emiss tonight investig industri tri clean act
BBCNEWS,Can Flying Go Green - Panorama,recognis cant cost weve got meet nois target weve got meet air qualiti target weve got meet carbon target climat chang realli press
BBCNEWS,Can Flying Go Green - Panorama,climat chang british airway insid prepar blow whistl believ industri put profit planet he worri speak cost job want remain anonym
BBCNEWS,BBC News,involv fill locat fuel cheaper thu fli fuller tank necessari journey heavier weight plane mean higher emiss drive climat chang ur chief environ correspond justin rowlatt report
BBCNEWS,BBC News,granddaughterour partner sever burn tri get away us neighbour kill car tri get away believ climat chang emerg
BBCNEWS,BBC News,meantim whole gener larkana spend rest live live hiv fight climat chang put urgent focu carbon emiss aviat someth industri
BBCNEWS,Outside Source,associ increas length fire season inc climat chang includ increas temperatur contribut chang may surpris know becom politic quickli australia deputi prime minist
BBCNEWS,The Papers,mention particularli last year agenda uk lot peopl young old concern around world impact climat chang conserv
BBCNEWS,The Papers,local level individu level isa huge chang lifestyl peopl view climat chang impact vote base econom secur your
BBCNEWS,The Papers,motiv climat chang realli know stuff truth peopl invest may would take issu good ballot box stay subject let
BBCNEWS,BBC News,climat chang gener one degre longterm averag temperatur temperatur import factor fire behaviour abil sustain fire particularli fire get go start richard want
BBCNEWS,BBC News,support later sport australia prime minist scott morrison dodg question climat chang visit area impact bushfir new south wale least three peopl
BBCNEWS,Business Briefing,prize brexit also said conserv govern would spearhead drive tackl climat chang meanwhil mirror lead pledg labour parti spend £ billion nh
BBCNEWS,BBC News at 9,recent extrem weather climat chang call done translat water devast citi venetian knee pray venic stand alway stand
BBCNEWS,BBC Newsroom Live,tackl issu climat chang environ import young peopl zero carbon target carbon neutral target approach
BBCNEWS,Newsday,climat chang unusu relationship snow tend occur highest area mani food resourc well impact climat chang depend cold
BBCNEWS,Newsday,seem surviv climat chang throughout fossil record mani group disappear lot realli interest thing pop fossil record hope
BBCNEWS,Victoria Derbyshire,rais environ analyst bbc flood problem arent easili fix unpredict weather said climat chang potenti play issu concern public anger
BBCNEWS,The Papers,first edit take closer look climat chang ask vote could help save planet welcom matter brandnew elect show bbc news lot peopl
BBCNEWS,Afternoon Live,big lucr industri said climat chang denier futur industri lie develop synthet fuel littl faith electr batteri altern biofuel
BBCNEWS,Breakfast,help talk lot weather seen scene croatia venic tie climat chang lead pressur lot big art institut come recent
BBCNEWS,Our World,australia great barrier reef lost third coral danger collaps australian caught grip bitter cultur war climat chang impact reef
BBCNEWS,BBC News,hour put compet climat chang polici conserv say plant million tree year win gener elect libdem say plant twice mani tree
BBCNEWS,BBC Newsroom Live,surprisingli front commit huge improv respons climat chang said suggest would carbon neutral would achiev huge spend splurg
BBCNEWS,BBC Newsroom Live,centrepiec manifest scale outstrip everyth els talk spend billion year climat chang tackl billion would come borrow also addit borrow put
BBCNEWS,Newsday,fight climat chang centr protest polit discours worldwid seen one greatest threat planet next guest went actual frontlin battl
BBCNEWS,BBC News,scienc editor david shukman report new seri david attenborough attract huge audienc revel natur world climat chang profil like never peopl care
BBCNEWS,BBC News,new seri david attenborough attract huge audienc revel natur world climat chang profil like never peopl care protest extinct rebellion
BBCNEWS,BBC News at Ten,climat chang uk elect next govern hope ur scienc editor david shukman report new seri david attenborough attract huge audienc
BBCNEWS,BBC News at Ten,revel natur world climat chang profil like never peopl care protest extinct rebellion annoy inspir mani other love
BBCNEWS,Breakfast,transit blue badg holder bristol member uk uk citi lead climat chang clear need support invest put public transport
BBCNEWS,Sport Today,welcom bbc news im mike embley top stori sixpoint plan save planet thousand scientist demand deep last chang curb catastroph climat chang pressur build presid trump
BBCNEWS,BBC News,welcom bbc news im mike embley top stori sixpoint plan save planet thousand scientist demand deep last chang curb catastroph climat chang pressur build presid trump
BBCNEWS,BBC News,research said particular trigger well what happen decid work climat emerg paper climat chang seem acceler faster scientist
BBCNEWS,BBC News,bbc news latest headlin thousand scientist urg peopl polici maker industri make deep last chang curb catastroph climat chang key wit donald trump impeach inquiri said ukrain
BBCNEWS,HARDtalk,headlin sixpoint plan save planet thousand scientist demand deep last chang curb catastroph climat chang smog crisi engulf india capit youngest poorest resid risk
BBCNEWS,Breakfast,meanwhil green parti launch elect campaign today pledg spend addit £ billion year tackl climat chang earlier spoke colead jonathan bartley said spend price worth
BBCNEWS,Breakfast,region accord eu climat chang servic ctober global warmest record mayb cold time across rest globe temperatur averag yet mention snow
BBCNEWS,BBC Newsroom Live,lead world cut c tackl climat chang clean green technolog stand valu around world countri everybodi opportun make
BBCNEWS,Newsday,differ activ go discuss around climat chang think go see polici start rapidli one climat report coauthor william rippl
BBCNEWS,Afternoon Live,arctic problem consist signal alway climat chang feedback loop normal explain normal activ region cover ice
BBCNEWS,Afternoon Live,anywher one thing see climat chang lose ice top planet ice reflect solar radiat goe shrink planet abl
BBCNEWS,The Briefing,brief im salli bundock top stori sixpoint plan save planet thousand scientist demand deep last chang curb catastroph climat chang democrat gain ground
BBCNEWS,Business Briefing,brief bbc news latest headlin thousand scientist urg peopl polici maker industri make deep last chang curb catastroph climat chang democrat gain ground
BBCNEWS,BBC Newsroom Live,better tackl public health emerg face power employ law protect worker right increas live wage real action climat chang demand uk furtherand
BBCNEWS,BBC Newsroom Live,global problem like read crop withstand diseas climat chang natur also hold clue new medicin human basic malaria said one letter could
BBCNEWS,BBC News,climat adapt rather climat chang dont think realli go move forward welsh govern like govern got start treat climat adapt unsurprisingli peopl
BBCNEWS,BBC News,climat chang blame bushfir say effect warm dri climat exacerb situat current new south wale grappl drought
BBCNEWS,BBC News,promis theyr make cant fulfil progress candid welcom michael bloomberg race tweet attack wealth businessman pour money liber caus climat chang gun control
BBCNEWS,Breakfast,protest greta thunberg came profil think yeah know climat chang seriou weve got address urgent
BBCNEWS,Breakfast,north lo angel thousand peopl ask would fight climat chang project launch sever common committe effort achiev zero carbon emiss middl centuri
BBCNEWS,BBC News,show peopl seriou tackl climat emerg call invest public spend next year tackl climat chang frack play
BBCNEWS,BBC News,peopl ask would fight climat chang project launch sever common committe effort achiev zerocarbon emiss middl centuri special citizen assembl
BBCNEWS,Breakfast,get back done matter week said didnt happen think core issu elect ye focu hous climat chang everyth els
BBCNEWS,BBC News at One,almost noth climat chang except plant tree brexit parti may sign former conserv ann widdecomb field enough candid win elect nigel farag describ parti
BBCNEWS,BBC News at Ten,repres younger demograph share valu one spoke young peopl issu concern mental health climat chang social servic knife crime london ask knife crime take
BBCNEWS,Afternoon Live,start cut vat domest fuel hope import product outsid eu lead lower price extinct rebellion outsid almost noth climat chang except plant tree
BBCNEWS,Afternoon Live,mental health climat chang big issu doorstep mani peopl talk brexit wonder death benefit tori hold let talk
BBCNEWS,Afternoon Live,comparison someth like brexit debat certainli norwich concern climat chang seen school strike involv extinct rebellion certainli awar
BBCNEWS,Afternoon Live,almost noth climat chang except plant tree brexit parti may sign former conserv ann widdecomb field enough candid win elect nigel farag describ
BBCNEWS,BBC News at One,snp launch elect manifesto say time put scotland futur scotland hand hold anoth independ referendum next year come climat chang hot topic parti elect
BBCNEWS,BBC News at One,wasnt play footbal back elect discuss climat chang environ play bigger part campaign far ever main parti
BBCNEWS,BBC News at One,compar pledg environ analyst roger harrabin report year massiv environ gener climat chang particular weve teenag campaign greta thunberg weve extinct rebellion
BBCNEWS,BBC News,emiss fall far short what requir prevent disastr climat chang annual report say global emiss need fall everi year next decad govern must act faster
BBCNEWS,Your Questions Answered,question st centuri climat chang answer would encapsul key phrase heart green movement think global act local face global
BBCNEWS,BBC News,key consider snp manifesto full idea public spend climat chang pledg increas nh spend end auster snp know doesnt matter
BBCNEWS,Asia Business Report,surviv current econom climat majorjob cut tata steel thank much updat join us mumbai bureau european central bank new presid push tackl climat chang part
BBCNEWS,Victoria Derbyshire,mysteri said ban wont lift time soon labour given us legal issu would labour get round make sure climat chang greenhous emiss tabl
BBCNEWS,HARDtalk,almost stone us go tradit leader say problem face must support climat chang get wors
BBCNEWS,BBC News at Five,last decad world move away coal rapidli embrac wind solar might fight chanc limit damag climat chang inevit matt mcgrath bbc news
BBCNEWS,BBC News,spoke jame shaw new zealand minist climat chang also lead green countri coalit govern earlier month pass law make new zealand becom carbon neutral
BBCNEWS,BBC News,give hope countri mayb thing new zealand minist climat chang court washington rule former white hous counsel mcgahn must compli
BBCNEWS,HARDtalk,chase us away go tradit leader say problem face must support togeth “ climat chang get wors conflict wildlif
BBCNEWS,HARDtalk,believ countri strategi cope adapt manag drought wider issu climat chang appear affect subsaharan africa zimbabw alarm
BBCNEWS,HARDtalk,fairli averag rain given us wakeup call need come robust climat chang measur move much much closer renew energi particularli solar
BBCNEWS,BBC News at One,world meteorolog organ say increas co contribut climat chang averag rise record last decad level warm gase methan nitrou oxid also risen
BBCNEWS,Breakfast,biomass plant take bbc breakfast sofa amaz place look energi climat chang would tell process take away
BBCNEWS,Breakfast,plant talk littl bit later talk climat chang energi want talk polit well wale nation vote brexit beyond
BBCNEWS,Breakfast,abid well let talk elect particular interest parti talk climat chang talk environ differ polici normal elect
BBCNEWS,Breakfast,iam pembrokeshir biomass plant latest elect broadcast talk welsh polit energi climat chang england wale cricket board launch investig
BBCNEWS,HARDtalk on the Road,threat climat chang adapt late victoria fall one wonder natur world water zambezi river plung metr along fault line divid
BBCNEWS,HARDtalk,zimbabw face existenti threat climat chang adapt late victoria fall one wonder natur world water zambezi river plung metr along
BBCNEWS,Afternoon Live,gener public support polici take decis provid lot lad say forecast tool addit servic help mitig climat chang help
BBCNEWS,Breakfast,good even biggest issu planet big debat climat chang notabl absenc replac kept invit open leader conserv parti brexit parti
BBCNEWS,Breakfast,runaway climat chang speak volum unfit offic said clear link decid commit conserv parti clear
BBCNEWS,Breakfast,brexit parti well he done issu climat chang deliv chang politician debat poorer prime minist much
BBCNEWS,The Briefing,morrison admonish coupl local council leader link bushfir climat chang hundr peopl outsid liber parti headquart sydney mani demonstr part countri get
BBCNEWS,BBC News,protest say climat chang make fire intens much anger direct toward australian prime minist scott morrison he accus littl countri burn
BBCNEWS,Asia Business Report,drive rise whole trend base climat chang base food secur insecur food safeti scientif actual wing health standpoint medic
BBCNEWS,Newsday,demonstr occur town citi say climat chang make wire intens much anger direct toward prime minist scott morrison littl countri burden
BBCNEWS,Newsday,want make deal australia bushfir crisi continu protestor sydney demand govern take climat chang serious fire kill least six peopl devast part new south wale queensland
BBCNEWS,HARDtalk,want make deal australia bushfir crisi continu protestor sydney demand govern take climat chang serious fire kill least six peopl devast part new south wale queensland
BBCNEWS,BBC News at Ten,parti polici climat chang visit bbccoukelect borisjohnson still hasnt confirm hell interview bbc andrew neil elect mr neil interview parti leader alreadi includ
BBCNEWS,BBC News,missionari foreign field duh fan billi eilish earn free concert ticket fight climat chang realli hurt babi realli cut babi day without night
BBCNEWS,Victoria Derbyshire,bori fundament commit environment protect climat chang natur protect nonsens prove afraid actual take andrew neil offer andrew neil
BBCNEWS,Your Questions Answered,debat climat chang last night brexit parti nigel farag also stay away replac sculptur five parti leader took part let get polit correspond helen catt
BBCNEWS,BBC News,even jubil atmospher banner peopl carri messag realli stark essenti run time save planet stop climat chang protest like one
BBCNEWS,BBC News,need take action climat chang everyon need help richer nation need help poorer nation achiev richer nation need chang develop busi usual
BBCNEWS,Breakfast,latest televis debat brought togeth senior figur seven parti discuss issu includ brexit nh climat chang three peopl stab attack busi shop street hagu
BBCNEWS,Worklife,climat chang base food secur insecur food safeti scientif factual thing health standpoint medic profession doctor also come bring side
BBCNEWS,BBC News at One,decis take part tv debat climat chang ur polit correspond helen catt report bori johnson borisjohnson big bori johnson big pledg borisjohnson big pledg get brexit done say
BBCNEWS,BBC News,london bridg tone initi mute one nation health servic climat chang spend among issu rais question public well brexit here littl said
BBCNEWS,BBC News at Ten,hazard level air pollut join march madrid environment anticonsumer came togeth black friday protest world leader gather spain capit next week un climat chang talk label
BBCNEWS,BBC News at Ten,need take action climat chang everyon need help richer nation need help poorer nation achiev richer nation need chang develop busi usual
BBCNEWS,BBC Newsroom Live,public reflect polici uk see climat chang rippl polici differ parti put forward differ urgenc come way
BBCNEWS,BBC News,tourism climat chang take toll region visitor greener sustain way get andi beatt report ladi gentlemen wonder first day antarctica
BBCNEWS,BBC News,tourism climat chang take toll region visitor greener sustain way get andi beatt report ladi gentlemen wonder first day antarctica
BBCNEWS,BBC News,evid effect climat chang crane use move ferri got stuck bridg mayor say declar disast zone ask govern
BBCNEWS,Beyond 100 Days,build say venic everi two year say finish anoth two year much climat chang italian mismanag venic drown peril mix sad see
BBCNEWS,Outside Source,combin high spring tide storm surg driven strong wind citi mayor among blame climat chang make situat wors matt mcgrath explain jenni hill venic
BBCNEWS,Breakfast,question climat crisi way farm land overus concret need come good leadership insur scheme carri k ok fair need make sure peopl one farmer real
BBCNEWS,BBC News at One,green polici introduc univers basic incom abolish tuition fee student reform vote system want remain european union main focu obvious climat crisi unashamedli ambiti programm transform economi make countri
BBCNEWS,BBC Newsroom Live,save futur green tackl climat crisi green remain transform green build better britain last elect take first step right path must vote green
BBCNEWS,Afternoon Live,climat chang certainli nh educ focu taken brexit think well time talk talk anyth els peopl watch home lad
BBCNEWS,Afternoon Live,potenti climat chang sydney seen humid wind push sea good thing new south wale queensland wind still dri land low humid help
BBCNEWS,Afternoon Live,get act togeth green energi stop obsess nuclear power campaign edinburgh vow snp mp would pressur govern take stronger action climat chang green parti say new govern need
BBCNEWS,Afternoon Live,get togeth mayor said climat chang behind know difficult venic meteorolog thing venic sink put togeth
BBCNEWS,BBC News at Five,thousand superb new home brownfield site plant million tree tree notjust beauti help us us deal flood climat chang want imaginea britain
BBCNEWS,BBC News at Five,climat chang want imagin britain whose region experienc renaiss time incompar capit citi lengthen lead financi busi tech artist cultur academ capit europ world
BBCNEWS,Afternoon Live,instead everi two year say oh finish anoth two year much climat chang italian mismanag venic drown peril mix mark lowen bbc news time look weather
BBCNEWS,BBC News at One,tornado chanc build barrier save venic instead everi two year say oh finish anoth two year much climat chang italian mismanag venic drown
BBCNEWS,BBC News,simon jack bbc news let us take look elect news liber democrat say invest heavili tackl climat chang elect power want spend area
BBCNEWS,BBC News at Five,liber democrat promis spend extra £ billion tackl climat chang win elect speech today sir ed davey said fiveyear invest would jumpstart effort combat climat emerg
BBCNEWS,BBC News,that agreement end let take look today elect news liber democrat say theyd invest heavili tackl climat chang theyr elect power want spend billion
BBCNEWS,Breakfast,democrat conserv pledg plant tree effort tackl climat chang win gener elect emerg crew work night tackl fire student block flat greater manchest
BBCNEWS,Our World,tell us great barrier reef dont believ rubbish element australia dont believ mike agre climat chang theyr understand dont want
BBCNEWS,Our World,threaten great barrier reef river system view dr ridd also take issu belief overwhelm number scientist greatest threat reef climat chang warm sea disagre
BBCNEWS,Breakfast,labour promis free broadband everyon say nationalis part bt tax tech giant rais £ billion spend pledg liber democrat promis £ billion tackl climat chang conserv say theyll
BBCNEWS,BBC Newsroom Live,wont despit campaign fight govern base upon societi socialjustic equal tackl climat chang social emerg face lay
BBCNEWS,Can Flying Go Green - Panorama,climat chang offset ryanair emiss plant tree theyd cover uk point youv got larg grow airlin emit lot carbon dioxid
BBCNEWS,BBC News,aw problem like villag face today see action mean action climat chang action protect properti weve heard complaint author arent enough cours
BBCNEWS,BBC News,week month main topic campaign even littl discuss issu like economi educ health care even climat chang whole campaign
BBCNEWS,BBC Newsroom Live,campaign posit campaign us continu present posit vision societi want creat tackl climat chang tackl exactli sonia said ramp equal
BBCNEWS,BBC Newsroom Live,independ mr corbyn speech hour ago build behind spoke issu climat chang flood england listen say yesterday flood victim
BBCNEWS,The Papers,actual scale back mani share price offer one thing could link climat chang may oil oil compani arejust compel invest longer year ago would
BBCNEWS,Breakfast,busi hell offer review england reelect prime minist four labour go talk apprenticeship climat chang huge number apprenticeship labour say would want
BBCNEWS,BBC Newsroom Live,privat sector help drive chang would abl tackl climat chang engag busi engag compani like
BBCNEWS,BBC Newsroom Live,emphasis brexit term leav jeremi corbyn talk longterm area like climat chang think wait expect realli mean term want deliv
BBCNEWS,The Briefing,end slightli lower small relief resid busi owner mayor venic blame recent extrem weather climat chang call done translat water devast citi
BBCNEWS,Dateline London,brought plagu question suppos china longterm think better kind elector polit western liber democraci deal climat chang emerg
BBCNEWS,Business Briefing,convers climat chang poll isnt realli pull right product make access costeffect easi use manufactur bit differ price point come onto market
BBCNEWS,Breakfast,caus rise water level level geograph level geograph climat chang structur citi tell venic provid interest exampl interact man
BBCNEWS,BBC News at Six,sink prone flood consid vulner effect climat chang author renew pressur everyon look waterway citi see next hour
BBCNEWS,BBC Newsroom Live,countri continu one richest nation global continu deal global issu face whether that climat chang peac across nation continu deliv
BBCNEWS,BBC News,extinct rebellion protest nd extinct rebellion protest lot attent urgenc climat chang interest see havent got much detail yet except thatjohn mcdonnel
BBCNEWS,Afternoon Live,highlight effect climat chang start that sport one main stori bori johnson jeremi corbyn go head head theirfirst gener elect tv debat tonight
BBCNEWS,BBC News,money mainli borrow use invest project design tackl climat chang polit correspond iain watson cover debat salford night us get reaction politician
BBCNEWS,Dateline London,climat chang strang weather event increas unit state least part polit convers seriou way local wildfir arent fire truck
BBCNEWS,Breakfast,big art organis due come end question renew climat chang nightmar desper need leadership unpack live
BBCNEWS,BBC News,investig way caus fire student accommod build bolton firefight spent nine hour put compet climat chang polici conserv say plant million tree
BBCNEWS,BBC News,parti elect manifesto compet climat chang polici conserv say plant million tree year win gener elect lib dem say plant twice mani tree
BBCNEWS,BBC News,compet climat chang polici conserv say plant million tree year win gener elect lib dem say plant twice mani tree bbc news
BBCNEWS,BBC News,investig way caus fire student accommod build bolton firefight spent nine hour put compet climat chang polici conserv say plant million tree
BBCNEWS,Dateline London,would actual attack realli bad imag week success week term climat chang dont see big topic british campaign surpris
BBCNEWS,Beyond 100 Days,thing done ne demand mani instal like vast solarfarm china theyr one part answer tackl climat chang that problem complic make fight plastic pollut
BBCNEWS,BBC News at Ten,parti say would invest £ billion year part green new deal pledg push ten new bill two year cover climat chang fair economi peopl vote brexit correspond
BBCNEWS,BBC News at Ten,say climat chang countri cant afford act last elect take first step right path must vote green
BBCNEWS,BBC News,vulner beg scrap wildlif centr today green parti announc big plan mean big spend say climat chang countri cant afford act last elect take first
BBCNEWS,Electioncast,due slogan question climat chang area big idea borisjohnson put forward idea coalit labour snp someth deni bori
