Station,Show,Snippet
BBCNEWS,BBC News,climat chang faster peopl suckl world aim limit climat chang celsiu empti max politician enough see everywher clear demonstr track achiev
BBCNEWS,BBC News,runaway climat chang need protect live peopl need protect planet speak recent flood mozambiqu said world feel effect climat chang faster human effort
BBCNEWS,BBC News,climat chang faster human effort tackl pari agreement climat chang aim tri limit global temperatur celsiu antonio guterr say politician arent enough paradox
BBCNEWS,BBC News,bleach last summer consecut peopl experienc damag caus climat chang concern climat chang skyhigh peopl buy coal good anymor actual understand
BBCNEWS,Breakfast,read present oppon climat chang climat changelj climat chang think absolut essenti poetri respond issu id like kind platform competit award recognis
BBCNEWS,BBC News,letter green group may take note advic independ climat chang committe say although peopl could continu fli meet climat chang target possibl aviat
BBCNEWS,BBC News,climat chang committe say although peopl could continu fli meet climat chang target possibl aviat keep expand end think logic complet inevit know
BBCNEWS,BBC News,could realli interest factor climat chang debat crossbench mp moder conserv voic believ strong action climat chang see one core mission parliament
BBCNEWS,Victoria Derbyshire,inquiri report commiss govern say uk becom world leader tackl climat chang carbon neutral committe climat chang say tougher target could mean peopl take fewer flight eat less red meat
BBCNEWS,Weather World,ye climat chang intern problem bird start reach formerli stopov site impact climat chang refuel move might impact arriv
BBCNEWS,Afternoon Live,cant tell commiss whole idea next execut prioriti remain climat chang fight climat chang growth job invest mr presid
BBCNEWS,BBC News,advis govern plan increas aviat would need curb control carbon emiss ur environ analyst roger harrabin report fli govern plan continu grow climat
BBCNEWS,Beyond 100 Days,venezuelan peopl tri chang countri back million venezuelan full intern commun thank stori continu pleas come back climat
BBCNEWS,BBC News at Five,believ northern ireland need countri help need moment peopl strong vision futur believ cooper collabor challeng face go forward intern challeng climat
BBCNEWS,BBC News at Nine,comedian jim davidson describ greatest radic new way repair climat revers global warm consid scientist univers cambridg part
BBCNEWS,Dateline London,climat chang fade approach berlin thick fog close visibl becom zero berlin commemor key moment cold war
BBCNEWS,The Week in Parliament,push climat chang say polit tackl fade berlin commemor key moment cold war
BBCNEWS,BBC News,manila world track tackl climat chang polit act fade that uncompromis messag un secretari gener antonio guterr speak new zealand describ climat chang defin issu time
BBCNEWS,BBC News,mozambiqu said world feel effect climat chang faster human effort tackl pari agreement climat chang aim tri limit global temperatur celsiu antonio guterr say politician arent enough
BBCNEWS,BBC News,admit letter green group may take note advic independ climat chang committe say although peopl could continu fli whilst meet climat chang target possibl aviat keep expand
BBCNEWS,BBC News,googl issu australia right peopl find inform parti stand say climat chang top issu australian put climat chang bigger issu terror first time
BBCNEWS,Asia Business Report,conserv prime minist scott morrison tight race labour bill shorten whoever win pressur tackl climat chang ne tackl climat chang one recent poll show voter thought countri lead
BBCNEWS,Breakfast,letter green group may take note advic independ climat chang committe say although peopl could continu fli meet climat chang target possibl aviat keep expand
BBCNEWS,BBC News,civil servant admit letter green group may take note advic independ climat chang committe say although peopl could continu fli meet climat chang target possibl aviat
BBCNEWS,Outside Source,equal tea that equal step believ climat chang happen believ seriou problem tackl believ human certain amount answer come climat chang billion peopl
BBCNEWS,BBC News,futur ceo climat grip organis work busi govern leader around world address climat chang thank join address climat chang thank forjoin us know
BBCNEWS,BBC News,bank england estim £a trillion valu fossil fuel risk climat chang trillion kind compani across economi climat chang unless act well inclin
BBCNEWS,Breakfast,effect climat chang accord environ agenc say five million peopl england could affect commun move elsewher recognis climat chang acceler bring
BBCNEWS,Beyond 100 Days,see erod loss speci call action lot climat chang call last six month call action one interest climat chang mention throughout
BBCNEWS,Outside Source,issu elect eu leader commit make europ energyeffici past year eu work toward call target reduct greenhous ga emiss level increas share renew energi make
BBCNEWS,The Papers,turn heat eat less meat switch electr car fli less need slash greenhous ga emiss prime minist say case close defenc secretari gavin williamson sack leak nation secur council labour demand polic
BBCNEWS,BBC Newsroom Live,well live china see rest world combat climat chang also lunchtim
BBCNEWS,BBC News,global warm section melt sever expos rock scientist warn may sign thing come life behind bar tough
BBCNEWS,Breakfast,reflect sunlight away earth spray water ship atmospher fear current approach tackl global warm wont go far enough stop irrevers damag planet
BBCNEWS,BBC News,revers dramat trend allow runaway climat chang need protect live peopl need protect planet speak recent flood mozambiqu said world feel effect climat chang faster human
BBCNEWS,BBC News,civil servant admit letter green group may take note advic independ climat chang committe say although peopl could continu fli meet climat chang target possibl aviat keep expand
BBCNEWS,BBC News,elect state victoria last year swung realli hard toward govern support climat chang unexpect think start find around pm australian time tonight know climat chang exampl number one
BBCNEWS,BBC News,govern admit concern climat chang might restrict growth aviat uk senior civil servant say minist may review strategi includ plan expand heathrow follow recent warn committe climat chang advis govern
BBCNEWS,BBC News,civil servant admit letter green group may take note advic independ climat chang committe say although peopl could continu fli meet climat chang target possibl aviat keep expand
BBCNEWS,BBC News,civil servant admit letter green group may take note advic independ climat chang committe say although peopl could continu fli meet climat chang target possibl aviat keep expand
BBCNEWS,BBC News,civil servant admit letter green group may take note advic independ climat chang committe say although peopl could continu fli meet climat chang target possibl aviat keep expand
BBCNEWS,BBC News,concern climat chang might restrict growth aviat uk govern admit senior civil servant say minist may review strategi includ plan expand heathrow follow recent warn committe climat chang advis govern
BBCNEWS,BBC Newsroom Live,authent audienc also there jeopardi climat chang right tear apart comedi drama charli brooker one writer hasnt afraid use climat chang stori part show black mirror tend get thing
BBCNEWS,BBC Newsroom Live,suggest ukip could lose seat london green parti buoy whole issu climat chang huge climat chang protest london hope mean pick
BBCNEWS,BBC News,peopl need brief ourfellow citizen need brief choos pension recognis financi risk climat chang other there great deal today move climat chang committe first class simon
BBCNEWS,Afternoon Live,let return one main stori govern independ advis climat chang say uk cut greenhous emiss virtual zero say there time lose committe climat chang releas differ emisison target england northern ireland
BBCNEWS,BBC Newsroom Live,custom someth control alreadi lot us district heat scheme thing get involv contribut lower carbon emiss oppos centralis energi committe climat
BBCNEWS,Newsday,exercis frequent highlevel talk reuter websit new research suggest hundr million peopl could lose water suppli global warm caus asia glacier melt report publish
BBCNEWS,BBC News,play crucial role shape futur life earth global warm caus ice sheet antarctica greenland melt scientist believ climat model underestim level
BBCNEWS,Breakfast,tariff hike came dont know interest thank robin radic new way repair climat revers global warm consid scientist univers
BBCNEWS,BBC News,long new design like mean plausibl britain art global warm key question govern whether go agre zero carbon
BBCNEWS,Business Briefing,mirror british climat committe outlin countri need tackl global warm effect wire tech websit pick apart speech part mark zuckerberg develop
BBCNEWS,BBC News,squar kilometr feed dozen glacier southern argentina chile global warm ice field melt sever expos rock scientist warn may
BBCNEWS,Newsday,insuffici nepales author say retriev ten ton rubbish mount everest year climb season come end global warm mean glacier melt reveal wast includ plastic bottl empti
BBCNEWS,Beyond 100 Days,marketplac price carbon pollut best way allow market work incentivis capit invest research develop deploy consum consum action carbon tax scheme place
BBCNEWS,BBC News at Six,age big data machin learn take data thousand peopl around world start characteris incred import ecosystem first time two main type fungal network suck greenhous ga carbon key factor
BBCNEWS,BBC News at One,scientist fear simpli reduc greenhous ga emiss wont enough stop irrevers damag environ project first kind examin new idea well dismiss past farfetch pallab ghosh report scorch earth peopl poorer less food
BBCNEWS,Breakfast,climat chang core part school curriculum accord labour parti say children need learn ecolog social impact climat chang earli age govern say subject import alreadi form part nation curriculum primari secondari pupil
BBCNEWS,BBC News,realli front line dramat impact climat chang absolut must abl stop dramat trend revers dramat trend allow runaway climat chang need protect live peopl need protect planet
BBCNEWS,BBC News,letter green group may take note advic independ climat chang committe say although peopl could continu fli meet climat chang target possibl aviat keep expand end think logic
BBCNEWS,Afternoon Live,tackl climat chang report advisor say aim reduc harm emiss zero committe climat chang say could mean us switch diesel petrol vehicl electr one eat less meat plant tree here environ analyst roger harrabin
BBCNEWS,BBC Newsroom Live,econom play part someon pay look ata pay look longterm scenario climat chang limit factor get climat chang right econom becom secondari economi build
BBCNEWS,The Travel Show,tall tallest one incred tough resili realli import ecolog support habitat provid habitat lot plant anim also incred beauti icon ive tri get better understand respond climat
BBCNEWS,Outside Source,brexit withdraw bill climat chang import
BBCNEWS,BBC News at Nine,likelihood level global warm associ sea level rise atjust essenc worstcas scenario profound potenti consequ human urg politician reduc carbon emiss urgent carolin rigbi bbc news
BBCNEWS,BBC Business Live,hospit set foundat help homeless anoth said help homeless anoth said would spend technolog help save planet prevent global warm want globalwarm want move anoth stori
BBCNEWS,BBC News at One,like metaphor climat chang everybodi war get caught polit squabbl face sort annihil tough nut crack isnt call make documentari climat chang planet take planet put everi singl piec
BBCNEWS,BBC News,speak recent flood mozambiqu said world feel effect climat chang faster human effort tackl pari agreement climat chang aim tri limit global temperatur celsiu antonio guterr say politician arent enough see everywher clear
BBCNEWS,World News Today,hello welcom world news today world track tackl climat chang polit act fade that uncompromis messag un secretari gener antonio guterr speak new zealand describ climat chang defin issu time sunita jaswal
BBCNEWS,BBC News,peopl need protect planet speak recent flood mozambiqu said world feel effect climat chang faster human effort tackl pari agreement climat chang aim tri limit global temperatur celsiu antonio guterr say politician
BBCNEWS,Breakfast,saturday th may top stori morn concern climat chang might restrict growth fli uk govern admit senior civil servant said minist may review aviat strategi includ plan expand heathrow advisori committe climat chang recent said uk plan increas
BBCNEWS,BBC News,think inevit bit labour one mayb broad polici platform key climat chang poll worth told us climat chang one issu voter seem particularli place like queensland still huge
BBCNEWS,BBC Newsroom Live,like metaphor climat chang everybodi war get caught polit squabbl face sort annihil tough nut crack isnt call make documentari climat chang planet take planet put everi singl piec
BBCNEWS,Afternoon Live,tackl climat chang report advisor say aim reduc harm emiss zero committe climat chang say could mean us switch diesel petrol vehicl electr one eat less meat plant tree here environ analyst roger harrabin britain spark
BBCNEWS,Afternoon Live,there pressur govern lead world tackl climat chang report advisor say aim reduc harm emiss zero committe climat chang say could mean us switch diesel petrol vehicl electr one eat less meat plant tree
BBCNEWS,BBC News at Nine,climat chang say govern big industri make signific chang former defenc secretari gavin williamson sack
BBCNEWS,Breakfast,climat chang core part school curriculum accord labour parti say children need learn ecolog social impact climat chang earli age govern say subject import alreadi form part nation curriculum primari secondari pupil like arsen wenger dont
BBCNEWS,Breakfast,climat chang core part school curriculum accord labour parti say children need learn ecolog social impact climat chang earli age govern say subject import alreadi form part nation curriculum primari secondari pupil english math core subject
BBCNEWS,BBC News,need protect live peopl need protect planet speak recent flood mozambiqu said world feel effect climat chang faster human effort tackl pari agreement climat chang aim tri limit global temperatur celsiu antonio
BBCNEWS,Breakfast,afraid use climat chang stori part show black mirror tend get thing like game throne whole dead wall winter come play like metaphorfor metaphor climat chang everybodi war get caught theirown polit squabbl
BBCNEWS,BBC News,saturday th may top stori morn concern climat chang might restrict growth fli uk govern admit senior civil servant said minist may review aviat strategi includ plan expand heathrow advisori committe climat chang recent said uk plan increas aviat would need
BBCNEWS,BBC News,govern consid plan virtual elimin emiss civil servant admit letter green group may take note advic independ climat chang committe say although peopl could continu fli meet climat chang target possibl aviat
BBCNEWS,Afternoon Live,programm mental health problem peopl went sought help bafta say time put spotlight climat chang live planet ignor authent audienc also there muchjeopardi climat chang right tear apart comedi drama
BBCNEWS,World News Today,human also wildlif take polar bear exampl global warm mean there less sea ice hunt seal limit access food threaten surviv african eleph need drink
BBCNEWS,BBC News,author report likelihood level global warm associ sea level rise rise atjust essenc worstcas scenario rise atjust essenc worstcas scenario profound potenti consequ
BBCNEWS,The Briefing,vast ici landscap remot planet play crucial role shape futur life earth global warm caus ice sheet antarctica greenland melt scientist believ climat
BBCNEWS,BBC Newsroom Live,remot planet play crucial role shape futur life earth global warm caus ice sheet antarctica greenland melt scientist believ climat model underestim like level melt
BBCNEWS,BBC News,great last month protest demand action global warm think new planet live thing ijust turn thermostat back let flight ok think truth
BBCNEWS,BBC News,event major chang like new blade wind turbin test stagger metr long new design like mean plausibl britain add global warm key question
BBCNEWS,Afternoon Live,like metaphor climat chang everybodi war get caught polit squabbl face sort annihil tough nut crack
BBCNEWS,Breakfast,londonderri follow report suspici packag two yearold boy yearold boy arrest climat chang core part school curriculum accord labour parti say children need learn ecolog social impact climat chang earli age govern say subject import alreadi form part
BBCNEWS,BBC News at One,also there muchjeopardi climat chang ripe tear apart comedi drama charli brooker one writer hasnt afraid use climat chang stori part show black mirror tend get thing like game throne whole dead wall winter come kind play
BBCNEWS,BBC Newsroom Live,also there muchjeopardi climat chang right tear apart comedi drama charli brooker one writer hasnt afraid use climat chang stori part show black mirror tend get thing like game throne whole dead wall winter come kind play
BBCNEWS,Paths to Peace,news bomb french citi lyon injur eight peopl estim one million school children countri skip class demand action stop climat chang
BBCNEWS,BBC News,climat chang admit govern campaign say rethink essenti yearold man shot crossbow adjust satellit dish home good
BBCNEWS,The Papers,news bomb french citi lyon injur eight peopl estim one million school children countri skip class demand action stop climat chang
BBCNEWS,BBC News,headlin concern climat chang might restrict growth fli uk accord senior civil servant un say houthi rebel yemen appear honour pledg
BBCNEWS,Newsday,hundr million peopl could lose water suppli global warm caus asia glacier melt report publish journal natur find loss glacier make nation india kazakhstan much vulner drought eight year
BBCNEWS,BBC News,take polar bear exampl global warm mean less sea ice hunt seal limit access food threaten surviv african eleph need drink litr water day chang weather pattern mean
BBCNEWS,Victoria Derbyshire,fear current approach tackl global warm wont go far enough stop irrevers damag planet one four teacher england say wit pupil remov school attempt artifici boost school result improv leagu tabl stand studi
BBCNEWS,BBC Newsroom Live,ye good chunk bangladesh dutch good protect would get scurri build fast situat avoid author report likelihood level global warm associ sea
BBCNEWS,BBC News at Six,new design like mean plausibl britain add global warm key question govern whether agre push zero carbon futur find plenti
BBCNEWS,BBC News at Ten,stagger metr long new design like mean plausibl britain add global warm key question govern whether agre push zerocarbon futur
BBCNEWS,BBC News,nepales author retriev ten tonn rubbish mount everest year climb season come end global warm mean glacier melt reveal wast includ plastic bottl empti can discard climb gear grim remind danger face mountain
BBCNEWS,Beyond 100 Days,meet say basic pay pay later talk effect sound like carbon tax idea around long time would work would get polit system republican colleagu
BBCNEWS,Breakfast,ensur poetri embrac major global issu includ climat chang here art editor gompertz
BBCNEWS,BBC News at Five,threat pose climat chang flood latest sport
BBCNEWS,BBC News,driver climat chang michael cowan look scale uk food wast problem
BBCNEWS,BBC News,australia head poll examin debat climat chang domin campaign
BBCNEWS,BBC Business Live,flight give car uk could becom world leader tackl climat chang us attorney gener refus testifi second congression committe handl mueller report
BBCNEWS,BBC News,take polar bear exampl global warm mean there less sea ice hunt seal limit access food threaten surviv african eleph need drink litr water day chang weather pattern mean risk live travel unprotect
BBCNEWS,Victoria Derbyshire,climat revers global warm consid scientist univers cambridg part new research centr among idea consid scheme refreez polar region reflect sunlight away earth use water spray atmospher ship
BBCNEWS,BBC News at Ten,month great last month protest demand action global warm think new plan still live thing ijust turn thermostat ijust take one less flight go ok think truth
BBCNEWS,Newsday,nepales author say retriev ten ton rubbish mount everest year climb season come end global warm mean glacier melt reveal wast includ plastic bottl empti can discard climb gear grim remind danger face mountain four bodi also
BBCNEWS,Iraqs Poisoned Rivers,well climat chang marsh surviv millennia may last much longer
BBCNEWS,BBC News at One,tri combat climat chang shanghai tri hard china sign pari card
BBCNEWS,Victoria Derbyshire,disney shot number blockbust movi includ black panther aveng endgam climat chang play role
BBCNEWS,BBC Newsroom Live,protect climat committe climat chang releas differ emisison target england northern ireland scotland wale
BBCNEWS,BBC News,reach area british parliament endors motion declar climat chang emerg measur symbol
BBCNEWS,BBC News at Nine,radic new way repair climat revers global warm consid scientist univers cambridg part plan new research centr among idea scheme refreez polar region reflect sunlight away earth spray water ship atmospher
BBCNEWS,The Briefing,situat avoid author report likelihood level global warm associ sea level rise atjust essenc worstcas scenario profound potenti consequ human urg politician reduc carbon emiss urgent carolin rigbi bbc news
BBCNEWS,BBC News,britain industri revolut first start pump gase rais rais temperatur report say britain could lead way clean futur help limit global warm respons great deal warm world see
BBCNEWS,BBC News,dont dress gown dont sock ive never sock month great last month protest demand action global warm think new plan still live thing ijust turn thermostat
BBCNEWS,BBC Newsroom Live,radic new way tri repair climat revers global warm consid scientist univers cambridg part plan new research centr among idea scheme refreez polar region reflect sunlight away earth spray water ship atmospher
BBCNEWS,BBC News,say polit tackl climat chang fade approach berlin thick fog close visibl becom zero berlin commemor key
BBCNEWS,BBC News,elect liber say economi wherea labour climat chang pass bob hawk remind us
BBCNEWS,BBC News,concern climat chang might restrict growth fli uk accord senior civil servant un say houthi rebel yemen appear honour pledg withdraw troop key port open lifelin
BBCNEWS,Breakfast,climat chang recent said uk plan increas aviat would need curb restrict c roger harrabin
BBCNEWS,BBC News,setback ye labor promis stronger action climat chang emiss reduct target compar coalit promis
BBCNEWS,BBC Newsroom Live,spotlight climat chang live planet ignor authent audienc
BBCNEWS,BBC Newsroom Live,committe climat chang releas differ emisison target england northern ireland scotland ccc said england elimin emiss
BBCNEWS,Breakfast,use front page criticis dame emma thompson fli new york afterjoin recent climat chang protest london
BBCNEWS,BBC Newsroom Live,economi countri tackl injustic inequ climat crisi need unit overwhelm major peopl ta ke take privileg power labour address
BBCNEWS,BBC News,take polar bear exampl global warm mean there less sea ice hunt seal limit access food threaten surviv african eleph need drink litr water day chang weather pattern mean risk live travel unprotect area rehydr ramp diplomaci
BBCNEWS,Breakfast,warm consid scientist univers cambridg part new research centr among idea scheme refreez polar region reflect sunlight away earth spray water ship atmospher fear current approach tackl global warm wont go far enough stop irrevers
BBCNEWS,BBC News at Nine,vast ici landscap remot planet play crucial role shape futur life earth global warm caus ice sheet antarctica greenland melt scientist believ climat model underestim like level melt centuri turn extent sea level rise
BBCNEWS,BBC News at Six,door shut see door wide open alway open dont dress gown dont sock ive never sock month great last month protest demand action global warm think new plan
BBCNEWS,BBC News,good morn welcom bbc news concern climat chang might restrict growth aviat uk govern admit
BBCNEWS,The Travel Show,mike corey big sur find climat chang caus fear futur amaz speci
BBCNEWS,The Travel Show,area find climat chang caus danger speci western california complex be
BBCNEWS,Thursday in Parliament,need amend isnt nobl lord right young peopl awar frighten effect climat chang environ
BBCNEWS,Lula,well bbc news headlin fli uk may restrict climat chang admit govern campaign say
BBCNEWS,BBC News,hywel griffith bbc news sydney climat chang key issu elect kelli oshanassi ceo australian conserv foundat
BBCNEWS,Afternoon Live,emerg follow radic urgent action must taken accord intergovernment panel climat chang avert disastr effect
BBCNEWS,BBC News at Ten,climat chang that view govern independ advis say uk cut greenhous emiss virtual zero
BBCNEWS,Afternoon Live,that busi news today report committe climat chang say aim reduc harm emiss zero
BBCNEWS,Outside Source,absolut air forc must learn work togeth nation issu like climat chang effect
BBCNEWS,Breakfast,back voter concern climat chang offici result announc poll close even sunday time say found
BBCNEWS,BBC News,seen evid public concern climat chang parti still behind fianna fail fine gael sinn fein join us
BBCNEWS,BBC News at Six,effect climat chang walk wood enter peac familiar world look beneath everi forest wood
BBCNEWS,Dateline London,languag futur eu climat chang geostrateg choic econom model hadnt taken opportun
BBCNEWS,BBC News,well calm time poem climat chang clean air someth talk earlier call prais air
BBCNEWS,Sport Today,million head poll philippin crucial midterm elect could cement rodrigo dutert presid unit nation kick major push climat chang say polit tackl fade berlin commemor key moment cold war
