Station,Show,Snippet
BBCNEWS,The Briefing,beaten peopl elect other religion base happen indivis second begin environ climat chang peopl say get smart metr rest
BBCNEWS,Breakfast,renew awar environment issu pledg spend addit £ billion year tackl climat chang speak parti coleaderjonathan bartley good morn thank join us aw lot
BBCNEWS,Outside Source,extinct rebellion high court challeng metropolitan polic london climat chang campaign given londonwid protest ban last month deem unlaw lawyer act group say met face claim fals
BBCNEWS,Beyond 100 Days,look research around world issu grim warn u ntold untold suffer climat chang human chang way say everyth need replac fossil fuel pollut
BBCNEWS,Breakfast,transform fund line talk decarbonis economi got intergovernment panel climat chang state carri vast major decarbonis work otherwis revers
BBCNEWS,Victoria Derbyshire,biggest issu climat chang hearten see one parti take serious talk chang economi way work us interest pick polici area
BBCNEWS,BBC News at One,resist climat chang £ million extra fund announc uk part project call tree life scienc correspond richard westcott see money spent earlham institut
BBCNEWS,BBC Newsroom Live,health servic public hand protect creep privatis best perform accid emerg servic anywher unit kingdom scotland world leader renew energi fight climat chang
BBCNEWS,Beyond 100 Days,climat chang look far see transform take place offshor wind taken place conserv got world lead offshor wind industri last
BBCNEWS,BBC News at Six,labour govern tri bring nation debt asa rule instead increas borrow fund billion invest solv call social climat chang emerg isnt interest
BBCNEWS,Afternoon Live,time pass world lead climat chang legisl protect educ nh public servic support across scotland know progress govern mean need also engag opposit get thing done
BBCNEWS,BBC News,attack wealth businessman pour money liber caus climat chang gun control nce republican call donald trump threat nation white hous presid word fellow
BBCNEWS,The Papers,thing climat chang invent chines gain econom benefit look pictur listen terribl stori suffer tragedi afflict peopl today say say
BBCNEWS,BBC News,defenc certainli test futur occas ye held next time know everi event one thing know well know climat chang expect flood event
BBCNEWS,BBC News at Six,know well know climat chang expect flood event sever time river weav around sheffield thousand peopl live work alongsid whenev delug worri
BBCNEWS,BBC News,feasibl protect everi part countri flood particularli context climat chang flood occur becom frequent limit protect help
BBCNEWS,BBC News,sylvia stevenson one villag resid unless start look climat adapt rather climat chang dont think realli go move forward welsh govern like govern got start treat climat adapt
BBCNEWS,BBC News,committe climat chang made realli clear govern alreadi set polici make sure new home combin heat power rather ga boiler long term real case frack long
BBCNEWS,Breakfast,peopl ask would fight climat chang project launch sever common committe effort achiev zero carbon emiss middl centuri special citizen assembl meet first time next year
BBCNEWS,Breakfast,peopl ask would fight climat chang project launch sever common committe effort achiev zero carbon emiss middl centuri special citizen assembl meet first time next year
BBCNEWS,Breakfast,much overt environ concern noth climat chang decis studi amount gase mean import rather produc downsid uk economi
BBCNEWS,BBC News,chilean presid back away tax cut number stepdown chilean govern includ announc withdraw host nation two major intern summit includ un climat chang confer also face mount critic
BBCNEWS,BBC News,new citizen assembl consid tackl climat chang invit letter sent behalf six common select committe work togeth project govern set target achiev netzero emiss
BBCNEWS,BBC News,effort curb hous shortag tackl climat chang mr corbyn also dismiss govern call halt frack elect stunt think sound like frack could come back decemb elect back offic
BBCNEWS,Afternoon Live,like offer better altern conserv come tackl climat chang clive lewi activ push green new deal labour quit appeal anoth thing consid peopl think
BBCNEWS,BBC News at Five,invest public servic tackl climat chang return key util public ownership labour manifesto would see daytoday govern spend speak economist professor michaeljacob sheffield polit economi research institut michael special advis
BBCNEWS,Afternoon Live,manifesto gener elect lunchtim commit social hous windfal tax oil compni million green job help tackl climat chang afternoon he campaign trail dudley give detail plan
BBCNEWS,Afternoon Live,liber democrat vote climat chang featur heavili elect agenda parti promis variou target net carbon zero ur scienc editor david shukman look uk ever chang energi suppli
BBCNEWS,Your Questions Answered,carbon zero wast quickli holli make point un report concentr climat chang gase hit high alarm want come back ye ijust one question
BBCNEWS,Newsday,abl provid next gener increas thermal toler toler brood stock buy short amount time need global action climat chang right otherwis restor effo rt effort reef around world
BBCNEWS,BBC News at Six,weapon weapon mass destruct safeti absolut paramount would obvious key consider snp manifesto full idea public spend climat chang pledg increas nh spend end
BBCNEWS,Outside Source,want uk elect campaign lot bbc news websit yet stark languag climat chang un say countri need reduc carbon emiss five time current target
BBCNEWS,Outside Source,kill peopl four crise year mani scienc clear singl event directli attribut climat chang rise temperatur caus make disast sever frequent
BBCNEWS,BBC News at Five,conserv also accus muslim council britain fail deal islamophobia parti bleak outlook climat chang unit nation say world act much faster avoid danger level
BBCNEWS,Electioncast,greater proport rel cohort popul larg thing announc channel announc thursday pm climat chang deem tv debat jeremi corbyn nicola sturgeon jo swinson sian barri
BBCNEWS,BBC News at Ten,last year increas emiss bigger previou month higher averag past decad critic period climat chang well see decis make last notjust decad even centuri
BBCNEWS,BBC News at 9,yesterday borisjohnson live stream ask question parti leader come channel four climat chang debat thursday think matter didnt answer think matter didnt
BBCNEWS,Outside Source,give back variou caus whether begun control realli tri take nra pour lot money guncontrol initi even realli upfront climat chang one un envoy issu know
BBCNEWS,Outside Source,last year increas emiss bigger previou month higher averag past decad critic period climat chang well see decis make last notjust decad even centuri
BBCNEWS,HARDtalk,face must support togeth climat chang get wors conflict wildlif particularli eleph human popul go get wors go get wors number remain high
BBCNEWS,HARDtalk,must also make nois climat chang real tree destroy veget lost issu ten young eleph hwang drop ocean felt even take thousand
BBCNEWS,BBC Newsroom Live,interest keen get involv environment issu perhap gener definit partli new scientif report came last month suggest climat chang distant problem
BBCNEWS,BBC Newsroom Live,refineri ga termin fossil fuel rich littl corner st west wale discuss climat chang thing difficult transit job econom benefit tie
BBCNEWS,BBC Newsroom Live,liber democrat stop bori johnson brexit un say countri increas carboncut ambit fivefold world avoid danger level climat chang australian polic say miss british man aslan king found dead
BBCNEWS,BBC Newsroom Live,un say countri increas carboncut ambit fivefold world avoid danger level climat chang warn thatjust one black friday deal genuin consum group say annual shop event hype
BBCNEWS,BBC Newsroom Live,border issu extrem concern liber democrat climat chang doesnt follow border either need recognis import european union countri come togeth work mani year matur
BBCNEWS,The Briefing,walk class join ralli demand stronger action rein climat chang said contribut countri bushfir crisi ralli sydney major australian citi first seri protest student
BBCNEWS,BBC News,mani teenag take day school join ralli sydney feel best sum one teenag speaker bushfir definit link climat chang see prolong drought weve australia
BBCNEWS,Asia Business Report,want make deal australia bushfir crisi continu protestor sydney demand govern take climat chang serious fire kill least six peopl devast part new south wale queensland pictur trend
BBCNEWS,BBC News,million tree year next two decad first time gener elect climat chang environment question featur promin ultim count whoever win actual deliv david shukman bbc news
BBCNEWS,Newsday,anger australia bushfir crisi death widespread destruct call govern take climat chang serious im nuala mcgovern london also programm shame suicid south korea claim law fail victim spi camera crime
BBCNEWS,Newsday,emerg climat chang environment ralli ride around world your watch newsday bbc still come programm call south korea tougher penalti spi camera offend follow suicid kpop superstar goo hara
BBCNEWS,Newsday,first time musician spoken issu last week coldplay announc wouldnt go tour latest album fan billi eilish earn free concert ticket fight climat chang realli hurt babi
BBCNEWS,The Briefing,reckon new leader ecb say climat chang go critic polici far concern go forward think absolut right governor bank england mark carney
BBCNEWS,Brexitcast,leader debat climat chang borisjohnson nigel farag invit turn replac ice sculptur michael gove turn say repres conserv let
BBCNEWS,BBC Newsroom Live,afford stay also health care nation health servic worri climat chang everyth absolut everyth dont mind ask decid vote basi
BBCNEWS,BBC News at One,environ brexit say close cooper european countri crucial tackl climat chang reject suggest would put forward differ messag leav vote area say messag everywher went
BBCNEWS,Victoria Derbyshire,countri arrog unbeliev jenni say bori absolut right send michael dell talk climat chang excel environ minist best understand countri issu good bori send expert
BBCNEWS,Your Questions Answered,conserv sent michael gove accompani pm father stanley johnson reject debat parti leader much climat chang elect issu come green parti colead jonathan bartley take question
BBCNEWS,BBC News,time save planet stop climat chang protest like one happen town citi world day protest began sydney smoke recent devast bush fire still hung air
BBCNEWS,BBC News,student rate climat chang top prioriti issu propos would help achiev immedi chang first thing would say student alreadi chang thing never believ make differ fact
BBCNEWS,BBC News at Ten,even jubil atmospher banner peopl carri messag realli stark essenti run time save planet stop climat chang protest like one happen town citi world
BBCNEWS,BBC Newsroom Live,grandchildren educ train need get build strong economi need meet urgent challeng climat chang invest renew countri need becam labour mp
BBCNEWS,BBC Newsroom Live,good health sign way mani pet like climat chang thing realli import everybodi world today would like see next govern tri help plug
BBCNEWS,Victoria Derbyshire,everybodi morn concern social ca care enough money put social care three main parti compet throw billion billion climat chang whatev
BBCNEWS,Victoria Derbyshire,nichola dean nichola dean land farmer norfolk l nichola dean land farmer norfolk assur audienc climat chang real applaus step light see neighbour whose fan
BBCNEWS,BBC News,also increas awar guest problem climat chang exampl mani chang take place trip ashor care control tourist keep well away wildlif clean person effect avoid introduct
BBCNEWS,Click,also increas awar guest problem climat chang exampl mani chang take place trip ashor care control tourist keep well away wildlif clean person effect avoid introduct
BBCNEWS,Dateline London,welcom four year ago climat chang bare regist voter issu british elect time prioriti true battl democrat presidenti nomin us voter anxieti translat govern action
BBCNEWS,BBC News,threaten ancient woodland dont climat crisi ecolog crisi biodivers cant ecolog crisi biodivers cantjust restor plant tree ta ke take decad hundr year develop midst sixth mass distinct speci everi day lost us
BBCNEWS,BBC Newsroom Live,ur manifesto vision futur countri ur ten bill new parliament make vision realiti everi singl green mp elect dedic agenda green mp chanc save futur green tackl climat crisi green remain transform green build
BBCNEWS,Afternoon Live,homeown busi owner realli know risk think climat chang factor grow factor may need tear predict expect mani bettor go come
BBCNEWS,BBC News,peopl san francisco unveil later vit feet tall feet wide ide mural creat argentin street artist andr petreselli say hope remind resid citi danger pose climat chang one previou work
BBCNEWS,Can Flying Go Green - Panorama,that gimmick green gimmick rather seriou attempt slow climat chang offset ryanair emiss plant tree theyd cover uk point youv got larg grow airlin
BBCNEWS,Afternoon Live,reach anoth record need everyon lend hand need unit face evid effect climat chang crane use move ferri got stuck bridg mayor say
BBCNEWS,Afternoon Live,price exact support futur labour govern green parti billion year next ten year tackl climat chang dont forget remain allianc liber democrat plaid cymru
BBCNEWS,Afternoon Live,tornado chanc build barrier save venic instead everi two year say oh finish anoth two year much climat chang italian mismanag venic drown peril mix
BBCNEWS,BBC News at Ten,let take look today elect news liber democrat say would invest heavili tackl climat chang theyr elect power want spend £ billion five year area clean energi transport home insul
BBCNEWS,Afternoon Live,moment latest busi news first look headlin afternoon live liber democrat promis £ billion tackl climat chang labour promis free fullfibr broadband everi home uk pm dismiss plan crackpot scheme
BBCNEWS,Breakfast,everi year effort tackl climat chang win gener elect parti claim treepla nting programm would biggest uk histori let speak tom brake liber democrat who london newsroom pledg spend billion
BBCNEWS,Outside Source,especi among rural mayor mayor town alreadi impact fire say isnt situat climat chang realli impact commun bit chang feel among peopl notjust someth peopl dismiss easili
BBCNEWS,Outside Source,degre well averag time year mid cours question get ask time moment connect broader climat chang situat cant realli attribut one
BBCNEWS,BBC News at Five,govern thought tori tooth nail tri stop take action climat chang beat two way beat massiv invest renew thank liber democrat renew power countri quadrupl
BBCNEWS,BBC News,prime minist scott morrison dodg question climat chang visit area affect bushfir new south wale least three peopl kill author fear number rise broadcast high temperatur strong wind
BBCNEWS,Breakfast,next decad help discov new medicin fight diseas new crop resist climat chang research chariti wellcom trust confirm provid almost ten million pound fund toward uk part project call tree life richard westcott report
BBCNEWS,BBC Newsroom Live,wait weve reach anoth record need everyon lend hand need unit face evid effect climat chang mayor went say tide leav indel wound citi
BBCNEWS,BBC News,“ mayor scott morrison hand want answer question climat chang state debat countri think obvious polaris view aspect clear say
BBCNEWS,BBC News at Six,futur threat dont know what around corner woodland threat climat chang plant health threat pest diseas land use chang dont know what go happen woodland futur bank
BBCNEWS,Breakfast,reult cours rise sea level result centimetr high tide want look major caus could put climat chang rise sea level increas frequenc wind torm need add
BBCNEWS,The Papers,see elect go green ive never seen go loo arctic last year david report climat chang world rapidli countri
BBCNEWS,Business Briefing,world greatest rainforest increas threat illeg log mine land grab led vast area rainforest lost huge store carbon vital tackl climat chang brazilian govern presid bolsonaro far deni problem
BBCNEWS,BBC News,build call new futur uk insid european union parti claim stay eu give £ billion boost spend public servic climat chang theyr set target gener electr
BBCNEWS,Victoria Derbyshire,lot peopl share sentiment want go around circl howev circl howev lam concern stanc climat chang nh believ negoti privatis come
BBCNEWS,BBC News,go commit free dental check england although wont see exact word manifesto ben thursday elsewher conserv liber democrat promis plant million tree tackl climat chang win elect
BBCNEWS,Our World,bang gun tabl burn hous week unpreced bushfir australia fuell fierc debat climat chang there battl rage save nation icon six eight cross channel pass crest right zero
BBCNEWS,Dateline London,compar challeng idea seen big climat chang fund treepla nting project seen pledg carbon neutral say less aspir offer get germani
BBCNEWS,BBC News,elsewher conserv liber democrat promis plant million tree tackl climat chang win elect tori said would million new tree everi year lib dem pledg plant twice mani
BBCNEWS,Electioncast,day huge pledg tackl climat chang £ billion year want put tackl use lowkey listen cochair said anyth lowkey fuel full climat emerg
BBCNEWS,BBC News at Six,netzero carbon economi kind target committe climat chang suggest wasnt credibl entir honest ambiti green new deal anywher world accept limit set green messag
BBCNEWS,HARDtalk,climat chang global terror could struggl diseas one day idea somehow protect pull back world would argu fundament flaw popular point view happen inaccur
BBCNEWS,BBC News,talk born presidenti race struggl bit campaign moment moment realli struck talk climat chang particularli gun control shoot summer
BBCNEWS,BBC News,struck talk particularli climat chang gun control particularli passion shoot home citi el paso earlier summer ultim often case american polit come money simpli
BBCNEWS,Newsday,someth big busi celebr part thank come talk us film adventur concern around climat chang issu love show start last month tokyo
BBCNEWS,BBC News,verg see tax return peter thank much let get day news trump administr formal notifi unit nation intend withdraw us pari climat chang agreement first formal step
BBCNEWS,Afternoon Live,also bear mind someth thati quit popular thing amongst presid trump support idea climat chang word hoax pick governor california worst fire figur
BBCNEWS,BBC News,pari climat chang agreement first formal step process take year effect pari agreement commit nearli nation reduc greenhous emiss sign barack bama four year ago china presid said
BBCNEWS,BBC News,climat chang agreement first formal step process take year effect pari agreement commit nearli nation reduc greenhous emiss sign barack obama four year ago china presid said high degre trust
BBCNEWS,BBC Newsroom Live,shape europ look eu put forward term climat talk great progress made ed davey climat chang secretari instrument get european union strong posit
BBCNEWS,BBC Newsroom Live,put referendum give us time space opportun get transform thing work peopl across world green industri revolut tackl climat chang emerg face
BBCNEWS,Newsday,earlier spoke one report coauthor oregon state univers ecolog professor william rippl ask scientist warn risk untold suffer global popul realli concern runaway climat chang call catastroph
BBCNEWS,The Papers,especi reluct bori johnson foreign secretari relu cta nt johnson foreign secretari reluct talk climat chang interest someon credibl talk openli busi govern inde gener issu absolut crucial aw lot
BBCNEWS,The Briefing,wealthier peopl afford make transit toward renew energi first put away thu weather role govern come work partnership compani make right choic afford that climat chang agreement broken pari
BBCNEWS,BBC News,earlier ask ecolog professor william rippl one lead author studi felt compel put report togeth well what happen decid work climat emerg paper climat chang seem acceler faster scientist
BBCNEWS,BBC News at Ten,john mcdonnel hometown announc labour govern tri bring nation debt rule instead increas borrow fund hundr billion invest solv call social climat chang emerg isnt interest
BBCNEWS,BBC News at Ten,say climat chang emerg emerg term socialfabr care social fabric care home hous like conserv though half money still huge amount sajid javid suggest ye give spend want
BBCNEWS,BBC Newsroom Live,auster time scotland independ evolut signific power need tackl challeng face greater item uk govern climat chang would signific number thing gotten interest mani interest
BBCNEWS,Beyond 100 Days,messag danger blue dont think danger blue dont think messag consist infrastructur public servic commit climat chang seen literatur pudsey
BBCNEWS,Newswatch,may rightli actual thing import whether eu eu one climat chang would like see think media cover extinct rebellion
BBCNEWS,BBC News,wealth businessman put wealth businessman put money liber caus climat chang guncontrol republican call donald trump threat nation white hous presid word
BBCNEWS,BBC News at Ten,everi event differ one thing know know climat chang expect flood event sever time river weav around sheffield thousand peopl live work alongsid
BBCNEWS,BBC News,crowd field someth like peopl vy becom presidenti candid parti certainli strong issu like climat chang guncontrol announc go go ahead race
BBCNEWS,Afternoon Live,climat chang consult doctor nick brook went away drawn back glori norfolk constitu inj back glori norfolk constitu norwich south although may chang futur
BBCNEWS,Afternoon Live,havent liber move toward net zero recent rollback target lot stuff detail everyth report committe climat chang detail propos move toward net zero
BBCNEWS,Ask the Leaders,let talk thing nifesto let talk thing manifesto money would spend tackl climat chang would go thing like decarbonis public transport insul home rip pollut ga boiler everi home know mani ga
BBCNEWS,BBC News at Five,environ climat chang parti fit bill seen conserv nifesto seen conserv manifesto yet interest thing labour parti manifesto particularli around carbon account notjust product basi import
BBCNEWS,Afternoon Live,govern also set world lead target climat chang say undermin target ban cheapest form energi onshor wind found elect ye green parti respond emerg
BBCNEWS,Afternoon Live,cost renew energi fallen massiv price last decad world move away coal rapidli embrac wind solar might fight chanc limit damag climat chang inevit matt mcgrath bbc news
BBCNEWS,Beyond 100 Days,key consider snp manifesto full idea public spend climat chang pledg increas nh spend end auster snp know doesnt matter mani vote get scotland doesnt matter mani seat
BBCNEWS,BBC News,type heat get exacerb climat chang smoke creat real publichealth nuisanc peopl hospit caus heart attack caus kid miss class peopl ms univers real
BBCNEWS,BBC News,safeti absolut paramount would obvious key consider snp manifesto full idea public spend climat chang pledg increas nh spend end auster snp know doesnt matter
BBCNEWS,BBC Wales Live,manmad climat chang rise co level need deal one thing nobodi talk need plant million tree notjust countri across globe need work
BBCNEWS,BBC Wales Live,griffith welsh govern declar climat emerg declar clear plan want bold tackl climat chang feel absolut essenti get move
BBCNEWS,BBC News at Ten,un environ agenc say current target cut carbon emiss fall far short what requir prevent disastr climat chang annual report say global emiss need fall everi year next decad govern must act faster
BBCNEWS,Victoria Derbyshire,idea furtherfood label also cautiou employ rule noth climat chang also want chang rule gender equal us demand extens dont know far british govern
BBCNEWS,HARDtalk,anim anim intern commonwealth support nois make took ten young eleph china must also make nois climat chang real tree destroy veget lost issu
BBCNEWS,BBC News,climat chang well see decis make last notjust decad orfor centuri potenti longer hong kong chief execut carri lam acknowledg defici govern reaction landslid victori prodemocraci parti
BBCNEWS,BBC News,well obvious great news doesnt come great surpris either know although number countri start make quit aggress move climat chang havent yet bent curv term global co emiss theyr still go
BBCNEWS,Electioncast,climat chang well see decis make last notjust decad orfor centuri potenti longer hong kong chief execut carri lam acknowledg defici govern reaction landslid victori prodemocraci parti
BBCNEWS,BBC News,critic period climat chang see decis make last notjust decad centuri potenti longer migrant bodi found lorri contain essex man plead
BBCNEWS,BBC News at Ten,climat chang say he scare futur planet follow latest report world meteorolog organ sir david king former chief scientif advis uk govern say lack polit leadership tackl scale problem
BBCNEWS,BBC News at Ten,good news peopl around world becom awar problem think greta thunberg fact mani parti uk made tackl climat chang key part manifesto next week unit nation host anoth intern climat
BBCNEWS,HARDtalk,easi place marvel victoria fall one climat chang list said figur show year whole flow water fall almost see dri area
BBCNEWS,Outside Source,commit fight stop climat chang disast us michael bloomberg posit pragmat centrist mean hell compet vote anoth yearold wouldb presid joe biden mr biden also centrist agenda
BBCNEWS,Breakfast,bag trash set pile festiv period done stop us rubbish christma live london that top stori tuesday th novemb three quarter us say climat chang prioriti
BBCNEWS,HARDtalk on the Road,zambezi river cours easi place marvel victoria fall one climat chang analyst said figur show year whole flow water fall almost
BBCNEWS,Breakfast,field futur climat chang look like ital doncast floodplain moment air pressur rise carbon releas thing like start get rain becom heavi water keep rise
