Station,Show,Snippet
BBCNEWS,HARDtalk,reveget restor wetland thing uk familiar first step year announc bviousli climat chang urgent matter
BBCNEWS,BBC News at Nine,man who led effort heart govern combat climat chang year help set new research centr role repair damag that alreadi done
BBCNEWS,BBC News,carri global economi suffer jon sopel bbc news washington headlin bbc news concern climat chang might restrict growth fli uk
BBCNEWS,The Travel Show,see impact climat chang world tallest tree temperatur increas dri thing temperatur get warmer that big consider particular tree need much water
BBCNEWS,The Travel Show,old conway colonis america make felix pakistan sandbox insignific pretti humbl experi isnt chart climat chang condit dri thing
BBCNEWS,Beyond 100 Days,plastic bag see amaz divers marin speci mani threat overfish pollut climat chang provinc go way bottom
BBCNEWS,BBC News,tackl pari agreement climat chang aim tri limit global temperatur celsiu antonio guterr say politician arent enough see everywher clear demonstr
BBCNEWS,BBC News,event bill last chanc prevent irrevers climat chang sunita jaswal bbc news stay us bbc news still come overcom odd meet rise teenag
BBCNEWS,BBC News,conspir foreign power nation ralli say sue defam world track tackl climat chang polit act fade that uncompromis messag
BBCNEWS,Victoria Derbyshire,europ challeng big issu day tackl climat chang start reduc massiv inequ countri protect freedom movement good go ahead
BBCNEWS,BBC News,pacif region lowli countri could disappear complet rise sea level realli front line dramat impact climat chang absolut must abl stop
BBCNEWS,BBC News,dramat trend revers dramat trend allow runaway climat chang need protect live peopl need protect planet speak recent flood
BBCNEWS,World News Today,climat chang aim tri limit global temperatur celsiu antonio guterr say politician arent enough see everywher clear demonstr track achiev object
BBCNEWS,BBC News,climat chang economi immigr among major issu record elig voter enrol cast ballot australia vote compulsori million peopl done earli
BBCNEWS,BBC News,kid futur that sort convers countri point time your say coalit conserv necessarili embrac climat chang polici poll realli close
BBCNEWS,BBC News,tight race predict fierc polit battleground feder polit climat chang economi immigr among major issu record elig voter enrol cast ballot
BBCNEWS,The Briefing,job economi top concern around fring climat chang main worri richer countri stop heart contest pro european sceptic franc
BBCNEWS,Thursday in Parliament,peopl tomorrow could ask minist would locat mayb tiptop teacher school provid scienc climat chang young citizen mayb invit come
BBCNEWS,Newsday,particularli would consid workingclass folk peopl rural area coal mine import didnt realli believ chang climat chang would help call bill shorten labor leader
BBCNEWS,Newsday,futur biodivers un reelect govern climat chang oblig pari treati conserv govern bad presid trump
BBCNEWS,The Film Review,migrant boat capsiz kill least peopl british scientist unveil say radic new plan tackl climat chang faster internet fascin footbal childen africa
BBCNEWS,World News Today,man who led effort heart govern combat climat chang year help set new research centr develop way repair damag that alreadi done
BBCNEWS,BBC News,environ analyst roger harrabin report fli govern plan continu grow climat chang might ask current polici industri cut
BBCNEWS,BBC News,committe say although peopl could continu fli meet climat chang target possibl aviat keep expand end think logic complet inevit
BBCNEWS,BBC News,gener see high teen low weather forecast hello bbc news shaun ley headlin concern climat chang might restrict growth fli uk
BBCNEWS,BBC News,bbc news im martin croxal headlin fli uk may restrict climat chang admit govern campaign say rethink essenti know reduc
BBCNEWS,BBC News,govern climat chang oblig latest report suggest actual suppos zero carbon thati difficult see work present aircraft technolog interest
BBCNEWS,BBC News,product cost shop carri global economi suffer headlin bbc news concern climat chang might restrict growth fli uk
BBCNEWS,BBC News,four crazi time well calm time poem climat chang clean air someth talk earlier prais air write prais air iwa
BBCNEWS,Breakfast,good morn welcom breakfast charli stayt tina daheley headlin today concern climat chang could restrict air travel futur rais question around heathrow expans plan prime minist could give
BBCNEWS,The Briefing,watch read scientist cambridg univers tri open new research centr look old idea tackl climat chang today ask idea ne
BBCNEWS,Breakfast,consid plan virtual elimin emiss civil servant admit letter green group may take note advic independ climat chang committe say
BBCNEWS,The Travel Show,still come travel show mike california see impact climat chang world temperatur increas tri thing temperatur get warmer that big consider
BBCNEWS,The Travel Show,california redwood tree tallest live thing earth amongst oldest far invulner mike corey big sur find climat chang caus fear
BBCNEWS,The Travel Show,admiss fli uk may restrict climat chang campaign say rethink essenti know got reduc emiss urgent radic expand
BBCNEWS,Dateline London,ever websit bbc news im shaun ley headlin admiss fli uk may restrict climat chang campaign say rethink essenti
BBCNEWS,BBC News,kill least one person fli uk may restrict climat chang admit govern campaign say rethink essenti yearold man shot crossbow
BBCNEWS,BBC News,australia elect result mean world websit climat chang immigr foreign polici bbccomnew address take look leader nationalist
BBCNEWS,BBC News,moder conserv voic believ strong action climat chang see one core mission parliament demand hold govern account thank
BBCNEWS,BBC News,weve latest analysi australia elect result mean world websit climat chang immigr foreign polici bbccomnew address take look
BBCNEWS,BBC News,poll theyr worth told us climat chang one issu voter seem particularli place like rural queensland coal industri still huge domin
BBCNEWS,BBC News,labour govern australia result domest key issu poll suggest voter actual discuss climat chang labour ambiti target come
BBCNEWS,The Week in Parliament,follow two crossbench peer lord singh put polit request presid trump listen climat chang concern side pond could govern get unit state presid drop
BBCNEWS,Afternoon Live,went sought help bafta say time put spotlight climat chang live planet ignor authent audienc
BBCNEWS,Afternoon Live,declin evid point climat chang axe warm popul sand eel stapl diet puffin move away show happen garner support
BBCNEWS,BBC Newsroom Live,un intergovernment panel climat chang predict end centuri global sea level would rise around one metr research suggest sea could rise twice amount
BBCNEWS,Afternoon Live,spotlight antisemit parti tri put focu climatechang polici here hous common wherejeremi corbyn urg mp declar nation climat emerg research hail astonish
BBCNEWS,BBC News,spotlight antisemit parti tri put focu climatechang polici here hous common wherejeremi corbyn urg mp declar nation climat emerg research hail astonish
BBCNEWS,BBC Newsroom Live,committe climat chang right track report mirror greenpeac set action think believ planet need take absolut
BBCNEWS,BBC Newsroom Live,posit global flip around dont other follow follow set bypass climat chang act thousand eight real statement governor accept
BBCNEWS,BBC Newsroom Live,plan govern would like host big summit run un moment world countri come togeth tackl climat chang decid uk hous
BBCNEWS,The Papers,london peopl say need dramat method make point whatev think manag skyrocket climat chang top agenda met michael gove said
BBCNEWS,BBC News at One,ambiti new target uk cut carbon emiss almost zero next year govern climat chang advis say there time lose theyr call us switch electr vehicl
BBCNEWS,BBC News at One,guarante stabl climat ambiti attempt yet nation stop ad climat chang roger harrabin bbc news committe report set differ target differ part uk
BBCNEWS,BBC News,join show possibl thank forjoin us find climat chang report websit includ jargon buster explain key term prime minist
BBCNEWS,BBC News,hello bbc news headlin uk lead globalfight headlin uk lead global fight climat chang reduc emiss nearli zero plan
BBCNEWS,BBC News at Six,inform climat chang today report bbc websit includ new jargon buster explain key term woman contract hiv husband given contamin blood product
BBCNEWS,BBC News at Nine,realli import thing far signific resign cabinet minist instanc committe climat chang govern offici advis say uk follow suit uk
BBCNEWS,Breakfast,deni alleg eat less meat take fewer flight give car uk could becom world leader tackl climat chang healthi economi bank england tell us
BBCNEWS,Wednesday in Parliament,would import uk environment regul eu adopt good progress often go far enough beat climat chang countri around world
BBCNEWS,Wednesday in Parliament,pay liber democrat leader turn current concern climat chang depart expect warn climat emerg requir fresh approach highli pollut rapidli grow sector like aviat
BBCNEWS,Weather World,plant place like island vulner rise sea level alpin speci vulner climat chang cant go higher there nowher go seed arriv start
BBCNEWS,Weather World,level caus climat chang could bring us unexpect benefit ill deep insid vault bank money could prove priceless natur world
BBCNEWS,Weather World,vulner rise sea level alpin speci vulner climat chang cant go higher there nowher go seed arriv start ye crate
BBCNEWS,Newsday,thing like climat chang go affect sort environ throughout world particularli alpin environ go chang monitor stonefli tell us
BBCNEWS,BBC News at One,green parti launch campaign european elect may rd messag ye europ climat chang gain council seat last week english local elect parti hope
BBCNEWS,Election 2019,like climat chang lead debat whole area crime argu polic bread butter issu think got strong posit
BBCNEWS,Afternoon Live,solut stop contribut climat chang reach zero emiss stop orderfor us order us need signific acceler across sector mean
BBCNEWS,Afternoon Live,climat chang bill reflect wale mani opportun suggest need emiss reduct target overal uk meet net zero
BBCNEWS,BBC News at Five,believ climat chang must get seriou polici invest common money chang also present argument us china india follow europ
BBCNEWS,Beyond 100 Days,climat chang steer direct go import crucial charact come leader move direct power game inde thank
BBCNEWS,BBC News,prepar resili measur bring rang differ method better protect commun flood climat chang whole commun may abandon get harm way
BBCNEWS,Breakfast,govern said take risk climat chang serious would seek evid flood polici autumn train compani make hard passeng claim compens servic
BBCNEWS,Breakfast,climat chang good morn royal windsor hors show see dressag hors main arena familiaris therefor competit later warm weather
BBCNEWS,Breakfast,accord environ agenc say five million peopl england could affect commun move elsewher recognis climat chang acceler bring intens
BBCNEWS,BBC News at Nine,year agenc said govern said take risk climat chang serious would seek evid flood polici autumn roger harrabin bbc news join isjim hall
BBCNEWS,The Briefing,footprint that despit jet fuel creat million ton carbon dioxid add problem climat chang scientist warn weve got less year avoid climat catastroph laura foster
BBCNEWS,Weather World,reach formerli stopov site impact climat chang refuel move might impact arriv condit arriv therefor
BBCNEWS,Weather World,could one result climat chang mitig effect rise sea level forecast flood land near coast wetland suck store atmospher carbon warm planet
BBCNEWS,Weather World,becom bbc weather watcher sign onlin bbc co ukweatherwatch still come weather world carbon captur rise sea level caus climat chang could bring us unexpect benefit
BBCNEWS,Weather World,insur polici happen world around us happen climat chang plant becom extinct time notjust natur climat pressur peopl
BBCNEWS,Weather World,plant place like island vulner rise sea level alpin speci vulner climat chang cant go higher there nowher go seed arriv start
BBCNEWS,Weather World,defenc cut wetland shut system conservationist call protect regener wetland around world help fight climat chang ensur carbon remain stuck mud
BBCNEWS,Dateline London,think see green better across europ recent public climat chang sens urgenc
BBCNEWS,Iraqs Poisoned Rivers,marsh drain brought back life threat differ theyr pollut lack water well climat chang peopl keep dump raw
BBCNEWS,Weather World,led mani ask role climat chang fact frequenc tropic cyclon area decreas slightli recent decad evid show form
BBCNEWS,Weather World,notjust chang weather climat along rout winter ground ye climat chang intern problem bird start reach formerli
BBCNEWS,Weather World,vulner climat chang cant go higher there nowher go seed arriv start ye crate come namibia one partner africa
BBCNEWS,BBC Newsroom Live,agre ten year save human basic planet surviv surviv willjust reboot need look revers climat chang stuff
BBCNEWS,BBC News,make presenc felt protest climat chang read pleas forgiv background nois join busi two comment first
BBCNEWS,BBC News,colleagu geeta gurumurthi outsid hous parliament thank havejust thank got school climat chang protest behind us busi colleg green opposit hous
BBCNEWS,BBC News,protect environ elimin plastic wast tackl climat chang improv air qualiti decent conserv govern common ground british polit achiev even tackl
BBCNEWS,The Papers,huawei deal climat crisi may forc uk town abandon say guardian report environ agenc say huge number town threat coastal river flood time launch clean airforal campaign investig say million children attend school britain
BBCNEWS,BBC News at One,caus far two hors race candid made pitch parti member yesterday along stop brexit want climat chang prioriti crisi brexit liber democrat commit
BBCNEWS,BBC News at Five,candid made speech yesterday along stop brexit climat chang prioriti ye crisi brexit liber democrat come commit stop believ track record ab
BBCNEWS,HARDtalk,reason im cautious optimist problem threaten human today problem causat threaten unstopp asteroid come toward us threaten thing climat chang caus fossil
BBCNEWS,BBC News,shape brexit deadlock tri pleas remain brexit may cost labour support green grab support big parti mayb help voter worri climat chang liber democrat hope
BBCNEWS,Breakfast,ask help tackl climat chang letter highlight danger deforest carbon emiss speci extinct ask signific invest prevent call ecolog catastroph call nato
BBCNEWS,Breakfast,well engin technolog combat climat chang futur help young peopl solut need one rock music famou row final resolv last year
BBCNEWS,HARDtalk,norm anymor mayb assum contrari given steep challeng face climat chang cant expect ever greater standard life qualiti econom qualiti life actual world
BBCNEWS,Beyond 100 Days,younger voter younger candid climat chang drive issu someth wasnt talk american polit year ago come green well european elect final
BBCNEWS,BBC News,socialist believ real surpris shall top result ireland vote thursday green parti believ done well back voter concern climat chang offici eu wide result
BBCNEWS,BBC News,school student hold strike countri around world demand action climat chang organis say million peopl expect join least countri strike spark swedish student
BBCNEWS,Outside Source,populist euroscept parliament climat chang social justic agenda parti well think abl get look green shop list
BBCNEWS,BBC News,result also emphasis perhap centrist parti like given voter solut problem care like immigr climat chang may case centrist parti must make sure voic
BBCNEWS,Outside Source,first time seen climat chang key issu decid major elect swing europ mayb sign thing come fact two main bloc european parliament
BBCNEWS,Afternoon Live,wont enough man who led effort heart govern combat climat chang year help set new research centr develop way repair damag that alreadi done
BBCNEWS,Newsday,want whoever win cut carbon emiss bring end australia huge coal industri govern everywher need stop dig fossil fuel cant action climat chang your still mine coal
BBCNEWS,Newsday,bbc clair marshal report could help tackl climat chang walk wood enter peac familiar world look beneath everi forest wood kind mysteri
BBCNEWS,BBC News,effect climat chang walk wood enter peac familiar world look beneath everi forest wood kind mysteri underground social network let peel back
BBCNEWS,BBC News,there effect way help fight climat chang that plant tree new map wood wide web use guid planter know right network plug tree flourish
BBCNEWS,BBC News at Nine,soap opera often prais rais awar difficult social health issu bafta say time put spotlight climat chang live planet ignor
BBCNEWS,BBC News at Nine,tough nut crack isnt call make documentari climat chang planet take planet put everi singl piec output televis soap comedi drama
BBCNEWS,BBC News at One,output televis soap comedi drama writer say show sustain way live screen begin see realworld effect climat chang peopl choic
BBCNEWS,The Travel Show,california redwood tree tallest live thing earth amongst oldest far invulner mike corey big sur find climat chang caus fear futur
BBCNEWS,Afternoon Live,go actual absolut emiss go ata absolut emiss go moment ip pc ipcc intern punnet climat chang said
BBCNEWS,HARDtalk,also scientif argument presenc whale regard valuabl presenc whale regard scientist real valu ocean accord one report un climat chang rganis say promot growth
BBCNEWS,BBC News,time meet govern climat chang oblig latest report suggest actual suppos zero carbon difficult see work present aircraft
BBCNEWS,BBC News,review strategi includ plan expand heathrow follow recent warn committe climat chang advis govern plan increas aviat would need curb control carbon emiss environ analyst
BBCNEWS,The Travel Show,still come travel show mike california see impact climat chang world tallest tree temperatur increas tri thing temperatur got warmer that big consider particular
BBCNEWS,Click - Short Edition,action climat chang ijust wonder bbc realli think import sure young famili delight hope good life isnt realli tail end human interest stori
BBCNEWS,BBC News,letter philip hammond nation infrastructur commiss chairman demand action meet challeng face uk help tackl climat chang letter outlin four test flew back commiss believ success info structur need
BBCNEWS,BBC News,disappear complet rise sea level realli front line dramat impact climat chang absolut must abl stop dramat trend revers dramat trend allow
BBCNEWS,BBC News,runaway climat chang need protect live old peopl need protect planet old peopl antonio guterr need protect planet old peopl antonio guterr say world face effect
BBCNEWS,Tuesday in Parliament,happen disagre trump administr climat chang one iran nuclear deal anoth discuss time mean shouldnt respect offic respect countri
BBCNEWS,Breakfast,health danger give alabama strictest antiabort law america us state alreadi tighten abort restrict year bafta call tv show plot line refer climat chang help rais awar
BBCNEWS,Victoria Derbyshire,believ canjust say work partner europ issu way climat chang doesnt know nation border requir intern action good thing transform energi system
BBCNEWS,World News Today,bbc world news today top stori unit nation kick major push climat chang say polit tackl fade less two week britain goe poll european elect
BBCNEWS,World News Today,bbc world news today latest headlin unit nation kick major push climat chang say polit tackl fade day go european elect
BBCNEWS,The Travel Show,still come travel show mike california see impact climat chang world tallest tree temperatur increas dri thing temperatur get warmer that big consider particular tree
BBCNEWS,BBC News,poem climat chang clean air someth talk earlier call prais air write prais air six five conjur open knot fist held
BBCNEWS,BBC News,includ plan expand heathrow follow recent warn committe climat chang advis govern plan increas aviat would need curb control carbon emiss environ analyst roger harrabin report
BBCNEWS,BBC News,climat chang target possibl aviat keep expand end think logic complet inevit know reduc emiss urgent radic expand
BBCNEWS,The Papers,troop key port open lifelin million peopl face famin concern climat chang might restrict growth fli uk accord senior civil servant yearold man shot
BBCNEWS,BBC News,ever document australia two major parti promis action vari degre environ think australia slow address issu climat chang think think make
BBCNEWS,BBC News,said done six oclock even count begin time tomorrow australia know next prime minist n issu climat chang mention talk lot
BBCNEWS,The Papers,pollut climat chang way thati sustain life style lifestyl peopl becom accustom realist ban air travel move toward someth sustain need consensu
BBCNEWS,BBC News,realli close much climat chang realli go present key issu go forward given peopl still will vote conserv parti look go close elect perhap actual
BBCNEWS,BBC News,minist scott morrison climat chang seen prime issu phil mercer voter poll station sydney vote australia compulsori australia street poll station seat
BBCNEWS,BBC News,futur saturday australian go poll decid whether want fourth prime minist four year climat chang becom defin elect issu concern carbon emiss pit coal industri
BBCNEWS,BBC News,need protect live peopl need protect planet speak recent flood mozambiqu said world feel effect climat chang faster human effort tackl
BBCNEWS,Beyond 100 Days,impeach see republican break pic issu climat chang especi miami dustup republican run offic say real climat chang
BBCNEWS,BBC News at Ten,simon armitag read present poem climat chang subject close heart top poet laureat nifesto top poet laureat manifesto definit want initi someth around idea
BBCNEWS,World News Today,lizzi thank let return new plan tackl climat chang speak tim kruger senior fellow geoengin programm univers oxford welcom back talk briefli boat reflect like keep
BBCNEWS,Breakfast,role last year pledg give away salari year say want use role ensur poetri embrac major global issu includ climat chang here art editor gompertz
BBCNEWS,BBC News,hello your watch bbc news channel concern climat chang might restrict growth fli uk govern said senior civil servant said minist may review aviat strategi includ plan expand heathrow
BBCNEWS,Victoria Derbyshire,fli uk may restrict climat chang admit govern campaign say rethink essenti know reduc emiss urgent radic expand go opposit direct
BBCNEWS,BBC News,bbc news im shaun ley headlin admiss fli uk may restrict climat chang campaign say rethink essenti know god reduc
BBCNEWS,BBC News,say want use role ensur poetri embrac major global issu includ climat chang here art editor gompertz want offer daughter tast glacier simon armitag read present
BBCNEWS,BBC News,good morn welcom bbc news concern climat chang might restrict growth aviat uk govern admit senior civil servant say minist may review strategi includ plan expand heathrow
BBCNEWS,BBC News,last stage day ago defeat high court cours challeng review thejudg said none climat chang criteria applic law recognis
BBCNEWS,BBC News,admiss fli uk may restrict climat chang campaign say rethink essenti know god reduc emiss urgent radic expand go
BBCNEWS,Breakfast,later demand action climat chang demo organis campaign group mother rise end ralli parliament squar broadcast konni huq address crowd shejoin us good morn nice see tell
BBCNEWS,Coastal Britain,fli uk may restrict climat chang admit govern campaign say rethink essenti know reduc emiss urgent radic expand go
BBCNEWS,BBC News,includ plan expand heathrow follow recent warn committe climat chang advis govern plan increas aviat would need curb control carbon emiss environ analyst roger harrabin report
BBCNEWS,BBC News,consid plan virtual elimin emiss civil servant admit letter green group may take note advic independ climat chang committe say although peopl could continu
BBCNEWS,BBC News,houthi rebel yemen withdraw troop key port big game changer may open lifelin million peopl face famin concern climat chang might restrict growth fli uk
BBCNEWS,BBC News,review strategi includ plan expand heathrow follow recent warn committe climat chang advis govern plan increas aviat would need curb control carbon emiss ur environ analyst
BBCNEWS,Sportsday,peopl say tent look good let see come day whether that fulfil peopl live save fli uk may restrict climat chang admit govern campaign say
BBCNEWS,Outside Source,here head ofjuso young socalist part spd think mani young peopl care lot climat chang polici social justic spd code right mani peopl believ
BBCNEWS,Outside Source,would say domin climat chang definit think chang definit think chang european elect particip elect bigger degre issu
BBCNEWS,Outside Source,campaign intoa campaign nation side immigr franc want talk yellow that germani climat chang close singl biggest elector issu explain next minut
BBCNEWS,Outside Source,ana carbajosa berlin correspond el pai andrea rommel professor commun herti school govern im afraid start rain apologis let talk anger merkel climat chang made promis get better
BBCNEWS,Outside Source,frustrat deliv yeah accord poll green taken second posit elect climat chang becom biggest concern voter futur citi
BBCNEWS,BBC News,see real setback ye labor promis stronger action climat chang emiss reduct target compar coalit promis peopl endors seemingli coalit vision crosstalk
BBCNEWS,BBC News,well clearli one coalit key point climat chang action someth meet pari agreement will anyth would harm economi
BBCNEWS,BBC News,climat chang action briefli count still go go see outright major lower hous conserv might bit hung parliament hand
BBCNEWS,BBC News,econom reform labour set fairli courag reform agenda lot peopl watch australia happen climat chang stop argument australia experienc effect extrem weather
