Station,Show,Snippet
BBCNEWS,BBC News,becom common climat chang intensifi today learn gase trap heat atmospher caus global warm hit record level yet let see concentr main greenhous ga
BBCNEWS,BBC News at Ten,becom common climat chang intensifi today learn gase trap heat atmospher caus global warm hit record level yet let see concentr main greenhous ga
BBCNEWS,BBC News at Ten,tonight ten level greenhous gase break new record expert express fear futur planet sinc there increas warm effect climat rang greenhous gase
BBCNEWS,Outside Source,tonight ten level greenhous gase break new record expert express fear futur planet sinc there increas warm effect climat rang greenhous gase
BBCNEWS,BBC News,one world lead expert climat chang say he scare futur planet follow latest report world meterolog organ sir david king former chief scientif advis uk govern say lack polit leadership tackl scale problem amount carbon dioxid greenhous gase
BBCNEWS,Afternoon Live,criticis conserv handl claim islamophobia parti news bleak outlook say un climat chang world act much faster avoid danger level global warm
BBCNEWS,BBC News,climat chang intensifi today learnt gase trap heat atmospher caus global warm hit record level yet let see concentr main greenhous ga carbon dioxid risen
BBCNEWS,BBC News at Ten,confer time madrid hope help ralli world make quicker deeper cut greenhous ga emiss
BBCNEWS,Afternoon Live,michael think advis peopl vote liber democrat european elect sens consist think wrong bleak outlook say un climat chang world act much faster avoid danger level global warm
BBCNEWS,BBC News at Five,islamophobia parti well latest elect campiagn trail hour final deadlin regist vote main stori bbc news pm bleak outlook climat chang unit nation say world act much faster avoid danger level global warm
BBCNEWS,BBC News,easi emiss cement industri contribut global warm
BBCNEWS,Worklife,travel tourism add trillion global economi billion trip expect year climat cost high global greenhous ga emiss
BBCNEWS,Afternoon Live,boss emir biggest longhaul airlin world say took long time face climat crisi speak dubai airshow sir tim clark say he climat chang believ
BBCNEWS,BBC News,bbc news welcom your watch uk pb america around globe im mike embley top stori new report show concentr carbon dioxid main ga behind global warm record level critic period climat chang well
BBCNEWS,Afternoon Live,islamophobia parti un say world act much faster avoid danger level global warm
BBCNEWS,BBC News at One,elect come later programm world fail meet goal avoid danger level global warm
BBCNEWS,BBC News,concentr greenhous gase earth atmospher reach anoth record high statist world meteorolog organis collect thirti year suggest rise concentr carbon dioxid methan greenhous gase drive sever climat chang sign slowdown
BBCNEWS,Newsday,page around world start intern edit new york time remind reader world leader gather madrid avert climat catastroph unit nation said greenhous ga emiss
BBCNEWS,BBC Newsroom Live,access loan mortgag also easier boss emir biggest longhaul airlin world say took long time face climat crisi speak dubai air show sir tim clark say he climat chang believ
BBCNEWS,BBC News,new figur confirm concentr greenhous gase earth atmospher reach anoth record high statist world meteorolog organis collect thirti year suggest rise concentr carbon dioxid methan greenhous gase drive sever climat chang sign slowdown
BBCNEWS,HARDtalk on the Road,new figur confirm concentr greenhous gase earth atmospher reach anoth record high statist world meteorolog organis collect thirti year suggest rise concentr carbon dioxid methan greenhous gase drive sever climat chang sign slowdown
BBCNEWS,BBC News,demonstr held across australia citi well centr like citi mani campaign make link australia continu bushfir crisi global warm stop
BBCNEWS,BBC News,destin airlin save money fill fuel cheap dont buy fuel expens problem fuel mean heavier plane heavier plane mean greenhous ga emiss
BBCNEWS,Afternoon Live,criticis conserv handl claim islamophobia parti un say world act much faster avoid danger level global warm
BBCNEWS,The Travel Show,bbc news headlin new figur confirm concentr greenhous gase earth atmospher reach anoth record high statist world meteorolog organis collect thirti year suggest rise concentr carbon dioxid methan greenhous gase drive sever climat chang sign slowdown
BBCNEWS,HARDtalk,measur cope climat chang
BBCNEWS,Newsday,demand govern take climat chang serious
BBCNEWS,Newsday,way life daniela relph bbc news your watch newsday bbc still come programm climat defend person stori peopl look solut global warm
BBCNEWS,Can Flying Go Green - Panorama,journey pollut emit greenhous gase like carbon dioxid gase respons global warm industri reduc emiss aviat expect becom uk biggest emitt ad emiss
BBCNEWS,BBC News,absolut call unpreced recordbreak thing call predict wasjust predict predict wasjust sometim year ago scientist predict exactli would happen cut greenhous ga emiss
BBCNEWS,Afternoon Live,lead muslim organis criticis conserv handl claim islamophobia parti news un say world act much faster avoid danger level global warm
BBCNEWS,BBC News at Five,attack messeng instead resolv problem led comment like made snp nicola sturgeon world fail meet goal avoid danger level global warm
BBCNEWS,BBC News,withdraw pari agreement your actual see extraordinari action state level particularli place like california new york also citi level countri around world believ countri realli move front demonstr bring greenhous ga emiss
BBCNEWS,BBC News,relat climat chang arson one thing see strang event happen peopl say talk climat chang fire
BBCNEWS,BBC News,gase actual acceler spoke jame shaw new zealand minist climat chang
BBCNEWS,BBC News,demonstr held across australia region town citi well biggest centr sydney citi well biggest centr sydney mani campaign make link australia continu bushfir crisi global warm
BBCNEWS,BBC News,know know climat chang key social polit issu report author say govern busi public must tackl caus climat chang
BBCNEWS,Ask the Leaders,committe climat chang say target committe admiss us committe admiss us chanc avoid runaway climat chang think
BBCNEWS,BBC News,face intens heatwav drought flood think thing need rememb climat chang critic period climat chang
BBCNEWS,Newsday,climat chang come un organis say level greenhous gase atmospher reach new high last year despit intern pledg curb emiss environ correspond matt mcgrath explain
BBCNEWS,Electioncast,suggest rise concentr carbon dioxid methan greenhous gase drive sever climat chang sign slowdown hong kong chief execut carri lam acknowledg defici govern
BBCNEWS,BBC News,suggest rise concentr carbon dioxid methan greenhous gase drive sever climat chang sign slowdown hong kong chief execut carri lam acknowledg defici govern
BBCNEWS,The Briefing,tanker european root could result addit greenhous ga emiss equival produc town peopl call best reduc issu climat
BBCNEWS,BBC Newsroom Live,shout thank much thank much im talk common threat face climat chang need elect govern that seriou climat chang
BBCNEWS,BBC Newsroom Live,biggest player intern scene british scientist creat blueprint band pop star continu perform live music without contribut climat chang tyndal centr climat chang research
BBCNEWS,BBC Newsroom Live,teardrop fire find music industri bit climat chang
BBCNEWS,Breakfast,wild time naga everi year collin english dictionari reveal word year climat strike beat hefti list contend top spot essenti mean skip school work order attend global warm protest
BBCNEWS,Breakfast,vietnam slow control forc wade lake affect water shortag said ironi lost man trust host car programm limit seven mile hour global warm
BBCNEWS,BBC News,carri graci team discuss trump impeach inquiri ongo crisi hong kong climat chang
BBCNEWS,BBC News,let temperatur rise warn face intens heatwav drought flood think thing need rememb climat chang critic period climat chang
BBCNEWS,Afternoon Live,peopl get confus climat chang global warm chang globalwarm chang global warm global phenomenon look chart orang place averag temperatur octob
BBCNEWS,BBC News,send kid school start busi place lead world clean green technolog tackl climat chang greenhous gase let get brexit done friend get oui project sensibl moder
BBCNEWS,Newsday,honour promis climat chang come un organis say level greenhous gase atmospher reach new high last year despit intern pledg curb emiss environ correspond matt mcgrath explain scientist
BBCNEWS,The Briefing,intens bushfir eastern australia recent week area eastern australia recent week result climat chang mani scientist say australia annual bushfir season get longer intens impact climat chang thank
BBCNEWS,BBC Newsroom Live,applaus support go electr vehicl govern improv air qualiti tackl climat chang
BBCNEWS,BBC News,stay us bbc news still come airlin fuell practic increas carbon emiss special report aviat climat chang
BBCNEWS,Our World,dr ridd also take issu belief overwhelm number scientist greatest threat reef climat chang
BBCNEWS,HARDtalk,affect us give us protect age globalis whether talk fire california climat chang
BBCNEWS,BBC News at 9,un say countri increas carboncut ambit five fold world avoid danger level climat chang
BBCNEWS,Outside Source,group scientist endors stark messag climat base new studi look year data conclud climat crisi arriv
BBCNEWS,Newsday,criticis local council leader link fire emerg global warm view talk climat chang feel effect climat chang need drastic climat
BBCNEWS,BBC Newsroom Live,revenu expect rais next five year set asid help area heavili depend oil ga like aberdeen switch greener economi help tackl climat crisi
BBCNEWS,BBC News at Ten,last two month solar pump stop water hole dri drought condit eleph popul unsustain climat chang real
BBCNEWS,HARDtalk,expect fairli averag rain given us wakeup call need come robust climat chang
BBCNEWS,BBC News,meet intern emiss target howev mani protest say prime minist need grow listen scienc climat chang
BBCNEWS,Dateline London,term climat chang environment polici dont see big topic british campaign surpris extinct rebellion success movement actual come fierc popular fact climat chang
BBCNEWS,The Papers,gener vote proclim issu get wors score say parti said lib dem leader jo swinson score even though lib dem criticis tori take climat chang serious sometim hard see effect climat chang
BBCNEWS,BBC News,labour leaderjeremi corbyn said greater issu face world climat chang made campaign speech swindon parti promis make newbuild home zero carbon within three year effort curb hous shortag tackl climat chang
BBCNEWS,Can Flying Go Green - Panorama,emit greenhous gase like carbon dioxid gase respons global warm industri reduc emiss aviat expect becom uk biggest emitt ad emiss flight world aviat would top ten emitt aviat emiss project doubl tripl potenti even quadrupl come decad
BBCNEWS,The Briefing,warm welcom programm brief need know global news busi sport also programm climat chang activist
BBCNEWS,BBC News at Five,world leader offshor wind power thank liber democrat europ abl go british member european union manag get countri take climat chang serious liber democrat passion tackl climat chang
BBCNEWS,Breakfast,rip histor italian citi beach gondola trash hotel leav tourist wade rise water citi mayor said damag would leav perman mark latest flood show effect climat chang join shouro dasgupta climat chang lectur
BBCNEWS,BBC News,organis friend fo earth realli first disast seen flood fire infir fire variou other around globe realli symptom climat crisi ye
BBCNEWS,Breakfast,high tide sinc offici statist first produc strong wind made flood wors mayor venic blame part climat chang
BBCNEWS,Asia Business Report,missil russia video trend bbccom highest tide year caus sever flood venic italian citi mayor blame climat chang
BBCNEWS,Tuesday in Parliament,welcom bbc news im mike embley top stori sixpoint plan save planet thousand scientist demand deep last chang curb catastroph climat chang
BBCNEWS,BBC News,welcom bbc news im mike embley top stori sixpoint plan save planet thousand scientist demand deep last chang curb catastroph climat chang
BBCNEWS,BBC News,eleph starv death last two month solar pump stop waterhol dri drought condit eleph popul unsustain climat chang real
BBCNEWS,BBC News at Five,join winchest good join us thank much earlier today express alarm fear trend climat chang
BBCNEWS,BBC Newsroom Live,anderton park primari school birmingham un say countri increas carboncut ambit five fold world avoid danger level climat chang
BBCNEWS,Can Flying Go Green - Panorama,limit emiss commit airlin keep emiss panorama given detail industrywid practic odd promis climat chang
BBCNEWS,Our World,tourism offici poor condit billion question unleash seri cultur climat chang
BBCNEWS,HARDtalk,mile away learnt affect us give us protect age globalis whether talk fire california climat chang
BBCNEWS,Beyond 100 Days,chang polici fight climat chang believ creat lesson give space lesson give dynam lesson clement chang amjust wonder come climat
BBCNEWS,Newswatch,smoke bushfir common australia dramat start fire season scientist warn grow longer intens climat chang
BBCNEWS,The Briefing,ur headlin today frozen row conserv channel break block ice use place borisjohnson tv debat climat chang
BBCNEWS,Breakfast,throughout morn friday th novemb top stori major row broken channel four conserv parti follow last night leader debat climat chang
BBCNEWS,BBC News at Ten,new warn melt ice sheet relentless increas global temperatur street fill young protest flood middl winter elect climat chang
BBCNEWS,BBC News,govern spend power parti claim unlock almost £ billion pound cours next parliament plan use boost economi tackl climat chang
BBCNEWS,BBC News,hello concentr greenhous gase earth atmospher reach new high accord latest figur sign declin even slowdown one world lead expert climat chang said like mani peopl scare futur planet
BBCNEWS,BBC News,hello concentr greenhous gase earth atmospher reach new high accord latest figur sign declin even slowdown one world lead expert climat chang say he scare futur planet latest report world meteorolog
BBCNEWS,BBC News at Five,amount carbon dioxid greenhous gase atmospher reach new high last year world meteorolog organ say increas co contribut climat chang averag rise record last decad level warm gase methan nitrou oxid also risen averag
BBCNEWS,BBC News at Ten,first funer held vietnam peopl found dead refriger lorri essex last month politician side pledg plant tree futur look parti plan tackl climat crisi
BBCNEWS,BBC News,today figur show effort cut emiss work truth wors concentr greenhous
BBCNEWS,The Briefing,get resolv daili mail interest day sorri daili mirror dedic pretti much entir paper today lot issu regard climat chang
BBCNEWS,Beyond 100 Days,leader issu ur scienc editor david shukman find new seri david attenborough attract huge audienc revel natur world climat chang
BBCNEWS,BBC News at Six,govern hope ur scienc editor david shukman report new seri david attenborough attract huge audienc revel natur world climat chang
BBCNEWS,HARDtalk,fall shouldnt full right look like zambia presid recent tweet shot expans rock call stark remind climat chang
BBCNEWS,HARDtalk on the Road,look ambiti reforest strategi next year alon plan plant less million tree measur cope climat chang
BBCNEWS,BBC Newsroom Live,perman ban outsid anderton park primari school birmingham un say countri increas carboncut ambit five fold world avoid danger level climat chang
BBCNEWS,BBC News,parti leader campaign trail well labour leaderjeremi corbyn said greater issu face world climat chang made campaign speech swindon parti promis make newbuild home zero carbon within three year effort curb hous shortag tackl climat chang
BBCNEWS,Outside Source,time well begin see reduct reflect kind figur concentr greenhous gase atmospher know greenhous gase mean increas temperatur turn rang consequ wildfir california
BBCNEWS,Can Flying Go Green - Panorama,would imped abil keep grow wont fli less industri effort arent enough option may govern get tougher ultim go solv climat chang
BBCNEWS,BBC News at Six,almost revenu increas connect manifesto specif spend rise last tax cannabi goe polic air passeng rise connect fund fight climat chang
BBCNEWS,BBC News,commit free dental check england although wont see exact word manifesto thursday elsewher conserv liber democrat promis plant million tree tackl climat chang
BBCNEWS,The Travel Show,said candid offer induc conserv stand gener elect campaign trail conserv liber democrat make promis plant million tree tackl climat chang
BBCNEWS,BBC News,substanc call psa blood could help find tumour earlier easier treat unit state formal notifi unit nation intend withdraw pari climat chang agreement
BBCNEWS,HARDtalk,head sunday brief im salli bundock top stori sixpoint plan save planet thousand scientist demand deep last chang curb catastroph climat chang
BBCNEWS,BBC News,gordon constitu jewish chronicl highlight blog post said compar israel abus child becom abus adult liber democrat set plan tackl climat chang
BBCNEWS,BBC News,warm temperatur realli conspir whip fire caus lightn discard cigarett deliber arsonist exampl cours add mix impact climat chang
BBCNEWS,BBC News,massiv invest renew energi export technolog becom world leader renew thank peopl across uk invit tojoin new citizen assembl consid tackl climat chang
BBCNEWS,BBC News at Five,problem believ crisi also lack polit leadership issu around world british govern led world climat chang
BBCNEWS,Breakfast,player see struggl say return polit first time uk polit parti devot sizabl chunk manifesto polici aim mitig climat chang
BBCNEWS,Breakfast,u nfortu nate think slightli unfortun argument fcom ice sculptur certainli overshadow import initi channel major import debat environ climat chang
BBCNEWS,Sportsday,guilti verdict outrag telegraph report channel threaten major shakeup conserv parti accus broadcast refus entri televis debat climat chang
BBCNEWS,BBC Newsroom Live,first time musician spoken issu last week coldplay announc wouldnt go tour latest album fan billi eilish fight climat chang
BBCNEWS,Can Flying Go Green - Panorama,climat chang least emiss c engin stay absolut clear burn plane go releas amount greenhous ga emiss current kerosen
BBCNEWS,Newsday,point exactli year ago world climat confer warn urgenc tackl climat chang greenhous ga emiss due shoot caus whole rang impact
BBCNEWS,BBC News,centr sydney mani campaign make link australia continu bushfir crisi global warm protest say climat chang make fire
BBCNEWS,The Papers,ﬂit “ mr w etmil il w w r “ nigﬁit injob might ohour contract hour contract stage wheel could come quickli end street climat chang politician urg climat chang
BBCNEWS,The Briefing,ur headlin today labour promis free broadband everyon say nationalis part bt tax tech giant rais £ billion spend pledg liber democrat promis £ billion tackl climat chang
BBCNEWS,The Papers,load australia vast nothing intens rural wildfir say could ta ke take month get fulli control ten mile north central sydney kind ramif climat chang
BBCNEWS,Newsday,thought less live alpin region across new south wale victoria hayley bate univers new south wale sydney research possum ask climat chang
BBCNEWS,Newsday,daytim speed limit car reduc nitrogen emiss maximum daytim speed kilometr hour equival around mile per hour prime minist mark rutt said necessari combat climat chang
BBCNEWS,BBC News at Ten,here someth dont often see almost revenu increas connect manifesto specif spend rise last tax cannabi goe polic air passeng rise connect fund fight climat chang
BBCNEWS,BBC News,design flood defenc given frequenc flood add percentag top moment flood defenc design account futur climat chang
BBCNEWS,BBC News at One,theyr one uk biggest band sell huge venu around world past two decad coldplay decid go tour promot new album theyr worri climat chang
BBCNEWS,HARDtalk,grip sever drought fall shouldnt full right look like zambia presid recent tweet shot expans rock call stark remind climat chang
BBCNEWS,BBC News,new york citi join crowd race becom democrat candid million ad campaign focus issu concern includ tackl gun violenc climat chang
BBCNEWS,BBC News at Six,bring total concentr per part per million go happen tell us concentr increas warm gase mean prone see climat chang
BBCNEWS,BBC News,uk last month setback fight ebola four health worker kill democrat republ congo anger australia bushfir crisi death widespread destruct call govern take climat chang serious
BBCNEWS,Victoria Derbyshire,chief execut incom owner eon next moment row conserv broadcast channel intensifi block ice use place borisjohnson tv debat climat chang
BBCNEWS,Your Questions Answered,your watch bbc news nine annita mcveigh headlin row conserv broadcast channel intensifi block ice use place borisjohnson tv debat climat chang
BBCNEWS,BBC News,gener elect campaign event suspend respons london bridg attack stab overshadow latest televis debat brought togeth senior figur seven parti discuss issu includ brexit nh climat chang
BBCNEWS,BBC Newsroom Live,chief execut incom owner en next moment row conserv broadcast channel intensifi block ice use place borisjohnson tv debat climat chang
BBCNEWS,BBC News,weather event like becom common climat chang intensifi today learnt gase trap heat atmospher caus global warm hit record level yet
BBCNEWS,Afternoon Live,effect winter winter home commun get destroy result longterm action put place realli put climat chang even met offic say link climat
BBCNEWS,The Papers,appeal extinct rebellion type persuad pledg climat chang tori look electr car manufactur industri train fix car industri part countri also offer climat
BBCNEWS,BBC News,peak fire outbreak emerg level fire burn simultan across new south wale could unpreced outbreak wildfir earli season offer glimps thing come australia much factor climat chang
BBCNEWS,Newsday,netherland cut daytim speed limit car reduc nitrogen emiss maximum daytim speed kilometr hour equvial around mile per hour prime minist mark rutt said necessari combat climat chang
BBCNEWS,Dateline London,extens rebellion success movement popular climat chang top prioriti public ask urgent prioriti ifi urgent prioriti compar urgent prioriti ifi compar countri climat
BBCNEWS,BBC News,three number fall forest fell planet crisi know know claim chang key social polit issu report author say govern busi public must tackl caus climat chang
BBCNEWS,Outside Source,john mcdonnel hometown announc labour govern tri bring nation debt rule instead increas borrow fund hundr billion invest solv call social climat chang emerg
BBCNEWS,BBC News,deal immedi crisisl lot work plan ahead look futur flood risk design flood risk design flood defenc obvious factor climat chang allow
BBCNEWS,BBC News,jeremi corbyn allow antisemit poison labour parti labour leader say form racism unaccept conserv parti also accus muslim council britain fail deal islamophobia bleak outlook climat chang
BBCNEWS,Worklife,driven consum ask fact peopl feel guilti dispos fashion think throw away ye think huge chang societi want climat chang
BBCNEWS,HARDtalk,reli hydro part look ambiti forest strategi next year alon plan blood less million tree measur cope climat chang
BBCNEWS,Breakfast,weekend sunshin offer well detail ten minut friday th novemb top stori major row broken channel four conserv parti follow last night leader debat climat chang
BBCNEWS,Asia Business Report,bbc news top stori hour presid trump made unannounc trip afghanistan tell us troop believ taliban open ceasefir australia bushfir crisi continu protestor sydney demand govern take climat chang serious
BBCNEWS,BBC News,later talk peopl concern think prioriti next elect british scientist creat blueprint band pop star continu perform live music without contribut climat chang
BBCNEWS,Newsday,point exactli year ago world im confer warn urgenc tackl climat chang greenhous ga emiss due shoot caus whole rang impact say effect noth done
BBCNEWS,Victoria Derbyshire,pippa negoti trade talk pepper pippa climat chang aspect trade talk point made us document us congress decid would mention greenhous ga emiss reduct trade agreement trade
BBCNEWS,Newsday,socal climat defend person stori peopl take practic step reduc global warm hannah longhiggin report man solv problem climat chang isnt matter ofjust tackl one issu dont solv problem
BBCNEWS,BBC News,scientist prove global warm real caus episod politician refus deal sooner later deal hope sooner new link climat chang specif bushfir
BBCNEWS,Afternoon Live,islamophobia parti bleak outlook say un climat chang world act much faster avoid danger level global warm come afternoon live sport ben croucher tottenham manchest
BBCNEWS,BBC News at One,bleak outlook say un climat chang world act much faster avoid danger level global warm sir andi murray speak return tenni hipsurgeri he live life full
BBCNEWS,BBC News,first ounc first bounc bleak outlook climat chang unit nation say world act much faster avoid danger level global warm remark comeback spur book place
BBCNEWS,BBC News,scientist say extrem weather event like becom common climat chang intensifi today learnt gase trap heat atmospher caus global warm hit record level yet let see concentr
BBCNEWS,Breakfast,news lead figur labour trade union movement meet morn decid polici includ parti elect manifesto meanwhil liber democrat conserv pledg plant tree effort tackl climat chang
BBCNEWS,BBC News at Five,elect referendum doesnt mean chang belief would realli weird democraci liber democrat internationalist believ work countri see mutual benefit thing like trade economi climat chang secur
BBCNEWS,BBC News,unrest though seek cata la n unrest though seek catalan independ happi success far right tonight alreadi plan demonstr jenni hill madrid thank fight climat chang
