Station,Show,Snippet
CNN,CNN Newsroom,reason cant get substant climat chang cant convinc car industri make sens financi obama lot someth provid job clean air talk polici sound simpl anna
CNN,CNN Newsroom,hurrican katrina everyth month cant fix problem scientist believ solut facebook friend say queson time climat chang legisl time talk
CNN,CNN Newsroom,peopl march demand want action climat chang among call presid obama kill big keyston xl pipelin report crowd afternoon take
CNN,CNN Newsroom,top stori follow right cnn newsroom hour thousand peopl march washington want action climat chang among demand theyr look presid obama kill keyston xl pipelin
CNN,Erin Burnett OutFront,use alway knew weather could big littl climat chang overpopul model ts overthink mani model look one look
CNN,EarlyStart,union address job economi probabl issu number one presid also expect make case immigr reform well climat chang cours gun control cnn live coverag address begin pm eastern time
CNN,EarlyStart,ever fourth state union address lot agenda immigr reform climat chang gun control want exampl divid countri look audienc survivor sandi hook elementari massacr
CNN,Piers Morgan Tonight,chang enough mean look im huge support obama first presid ever donat money think term climat chang environ he best disappoint thought decent rhetor
CNN,CNN Saturday Morning,probabl made decis keyston polit calculu obviou come go pay big price presid obama talk climat chang state union address last week specif mention keyston xl pipelin
CNN,CNN Newsroom,keyston pipelin report know got go state state legisl boo legisl look state west presid obama carri last coupl elect oregon california state like climat chang big
CNN,CNN Newsroom,keyston xl dirti danger pipelin liter cut countri half carri danger fuel caus run away climat chang report flipsid lot folk say tighter emiss standard alreadi cost job coal plant
CNN,CNN Newsroom,republican respons state union parti that divid think past elect saw republican parti wrong side histori come climat chang gun gay marriag job issu presid laid
CNN,Piers Morgan Tonight,otherwis would ad destruct futur superstorm rise sea level also fuel climat chang satellit space measur sea level millimet accuraci sinc sea level gone inch sinc
CNN,Erin Burnett OutFront,climat chang snow last year brought memori big snow storm plu inch new york would peopl cross countri ski park avenu middl new york citi fun amaz imag right
CNN,CNN Newsroom,listen listen news what follow twitter see go im still slightli shock happen histori made washington thousand march action climat chang organ claim biggest ralli kind ever
CNN,CNN Saturday Morning,alway camera obvious white hous there go even possibl today environment activist across countri plan ralli washington bring attent climat chang start mall believ end white hous got earli start
CNN,Piers Morgan Tonight,donat money think term climat chang environ he best disappoint thought decent rhetor dont know there teeth know look complic cant think politician feel like polit suicid talk environ
CNN,CNN Saturday Morning,environment activist come hope heat polit talk climat chang plan gather nation mall march white hous second highprofil event organ week group includ sierra club org
CNN,Piers Morgan Tonight,storm littl bit make littl bit wors otherwis would ad destruct futur superstorm rise sea level also fuel climat chang satellit space measur sea level millimet accuraci sinc sea level gone inch sinc
CNN,CNN Newsroom,realli quit livid surpris march forward agenda quit liber gun control gay right talk whole bunch climat chang near dear issu democrat republican dont want work think well know tonight he go stick
