Station,Show,Snippet
CNN,CNN Tonight With Don Lemon,person concierg servic execut polici agenc donald trump specif want chang made reduc feder regul pull pari climat deal share presid view global warm climat chang
CNN,CNN Newsroom With Victor Blackwell and Christi Paul,bilater meet french presid emmanuel macron cut presid time quebec short presid miss number session relat climat chang
CNN,Early Start with Christine Romans and Dave Briggs,im dave brigg east air forc one wheel canada g summit presid trump stay long plan leav quebec tomorrow morn skip climat chang environ
CNN,Early Start with Christine Romans and Dave Briggs,im dave brigg east air forc one wheel canada g summit presid trump stay long plan leav quebec tomorrow morn skip climat chang environ
CNN,New Day Saturday,well yeah dont need see g meet go chang problem transatlant relat trade climat chang symbol
CNN,CNN Tonight With Don Lemon,presid view global warm climat chang polici popular amongst mani peopl look report he certainli spotlight laundri list thing play mani
CNN,CNN Newsroom Live,summit summit sourc indic hesit attend fight public battl unit state closest alli trade iran nuclear deal climat
CNN,New Day Saturday,climat chang perhap surpris he skip he previous claim climat chang hoax perpetr chines point one thing lot leader trudeau macron teresa may
CNN,CNN Newsroom With Brooke Baldwin,war tri justifi nation secur reason slap catariff canada presid leav summit somewhat earli he go miss session take place tomorrow afternoon climat
CNN,New Day Saturday,walk chew gum okay say oh presid reject climat chang discuss he get tough trade non seqular doesnt agre agenda climat chang show
CNN,New Day Sunday,presid administr take issu serious report white hous declin comment climat chang refer us cdc make clear climat chang increas number diseas caus mosquito tick statement white hous
CNN,Smerconish,notabl he leav g earli probabl surpris he miss session climat chang claim climat chang hoax perpetr chines howev heard sourc insid white hous presid
CNN,CNN Newsroom With Ana Cabrera,increasingli frequent rate across planet australia alon stop global warm caus burn fossil fuel scientist warn unless chang incred reef
CNN,New Day Sunday,understand antarctica broken three region peninsula west antarctica east antarctica hear global warm nay sayer say actual
CNN,CNN Special Report,squid even light attack squid catch say global warm fish die squid popul increas soon sea fill plenti kwid
CNN,CNN Newsroom With Victor Blackwell and Christi Paul,issu tough issu like climat chang presid seem
CNN,CNN Newsroom With Ana Cabrera,cost capit north america expens person tax highest feder tax feder carbon tax north america sudden trump come say look want
CNN,Wolf,discuss climat chang unrel environment issu order sed singapor jim acosta quebec citi
CNN,Inside Politics,differ opinion thing there question trade climat chang issu differ perspect
CNN,CNN Newsroom With Fredricka Whitfield,polici secret youv great opposit implement climat chang initi report trip
CNN,CNN Newsroom With Fredricka Whitfield,jongun trump leav g summit earli trip skip climat chang session today fellow g leader presid left
CNN,CNN Newsroom With Fredricka Whitfield,jongun trump leav g summit earli trip skip climat chang session today fellow g leader presid left
CNN,Early Start with Christine Romans and Dave Briggs,stick togeth despit fact presid trump seem want pull intern agreement trade climat chang dave atika shubert live berlin imag
CNN,Early Start with Christine Romans and Dave Briggs,midmorn tomorrow skip meet climat chang expect brawl alli trade thursday afternoon question made sens go outnumb key
CNN,CNN Newsroom With John Berman and Poppy Harlow,gay marriag realli open door compani say capit conscienc climat chang gun control immigr one anoth mani compani come
CNN,Early Start with Christine Romans and Dave Briggs,tomorrow morn skip climat chang environ ocean summit expect brawl alli trade thursday afternoon question made sens go outnumb key
CNN,Early Start with Christine Romans and Dave Briggs,climat chang environ ocean summit expect brawl alli trade thursday afternoon question made sens go outnumb key issu sourc say presid
CNN,CNN Newsroom With Ana Cabrera,battl friend g countri g prepar battl multipl front us tariff polici usiran polici climat chang polici canada prepar real substant agenda
CNN,CNN Newsroom With Ana Cabrera,presid trump head singapor chose make earli exit g he miss discuss environ clean ocean halt climat chang late australia
CNN,CNN Newsroom With Ana Cabrera,strateg stop climat chang clean world ocean great barrier reef die surviv could depend world leader find solut appar without us input ivan watson went scuba
CNN,CNN Newsroom With Ana Cabrera,dramat element trade one key compon g agenda year climat chang alway go question whether trump would sign
CNN,Smerconish,talk turn climat chang topic urgent concern among make trump republican base here cnn jennif gray report trump may refus meet climat
CNN,Inside Politics,republican say that divid immigr climat chang trump support say immedi action big problem tradit republican view concern unwarr
CNN,New Day Sunday,flea tripl expert say public health depart unlik counti wellfund warn presid trump ignor one reason tick mosquito prolif climat chang wonder
CNN,CNN Newsroom With Brooke Baldwin,presid find know way levi call nation secur threat couldnt believ upset thing climat chang last year iran nuclear
CNN,Wolf,us tariff iran polici climat chang outlier issu last point made alli point finger us
CNN,Situation Room With Wolf Blitzer,ill never didnt anyth wrong everybodi know report presid plan leav summit earlier expect expect miss meet climat chang state
CNN,New Day Saturday,tradit scrollsign ceremoni anoth session depart earli presid origin set take part number session dedic environ climat chang he skip essenti get readi depart singapor
CNN,Smerconish,increasingli power gulf storm caus rise sea level climat chang without marsh would get wipe coast louisiana report without marsh cajun life along bayou vanish along
CNN,New Day Saturday,that drop crazi climat chang deal america econom secur interest he tri forc nato countri europ pay nation defens that someth lot
CNN,Early Start with Christine Romans and Dave Briggs,consid trade climat chang whatev intern agreement closest alli donald trump intent remov break singl canada critic twitter
CNN,Inside Politics,climat chang guarante odd man person attack year host canada trudeau didnt set well leader russia surpris chang club membership
CNN,Fareed Zakaria GPS,damag dont yet know squall climat chang that fundament issu presid trump clearli bring new level focu perceiv profit loss account american engag
CNN,The Lead With Jake Tapper,trade iran nuclear deal climat chang russia trump suggest vladimir putin seat tabl group seven russia meet meet without russia
CNN,CNN Newsroom With Ana Cabrera,alist flock washington use influenc push polici secret youv great opposit tri implement climat chang initi report celebr trip pennsylvania avenu could receiv big award
CNN,CNN Newsroom With Victor Blackwell and Christi Paul,environ health world ocean perhap surpris consid presid call climat chang hoax that perpetr chines may hear presid talk convers quebec
CNN,New Day Saturday,trade negoti issu like climat chang gender equal fact get economi move hold hold hold hold hold presid walk room
CNN,Smerconish,obvious white hous offici told us depart earli he take part number session dedic environ climat chang health world ocean presid arriv late meet perhap
CNN,Inside Politics,almost half republican republican donald trump say hoax say hoax concern climat chang sun warrant tradit republican think big divid new republican brought
CNN,Fareed Zakaria GPS,creat mutual support geniu period that need work across atlant global truth refuge flow climat chang cyber secur global public good need nurtur
CNN,Fareed Zakaria GPS,damag dont yet know squall climat chang that fundament issu presid trump clearli bring new level focu perceiv profit loss account american engag intern
CNN,Fareed Zakaria GPS,act creat mutual support structur mutual support geniu parti that need work global truth refuge flow climat chang cyber secur global public good need nurtur
CNN,CNN Newsroom With Fredricka Whitfield,believ public educ epa administr ought know someth climat chang see enthusiasm one broad array issu fight good wage fight health care fight futur fight democraci
CNN,New Day Saturday,countri reduc trade barrier everi time enter negoti talk white hous trade repres everi time start talk canada new trade arrang bring issu like gender equal climat chang noth new trade
CNN,CNN Newsroom With Fredricka Whitfield,feet there pattern love annoy european dont vote parad tough line trade protection good base theyr interest issu tpp iran agreement climat chang summari basic
CNN,The Lead With Jake Tapper,ardant understand polici polici past ivanka jare troubl presid polici transgend kid bathroom theyr sin presid decis climat chang think see younger american lot
CNN,Situation Room With Wolf Blitzer,right pardon ill never didnt anyth wrong everybodi know report presid plan leav summit earlier expect tomorrow miss meet quebec climat chang state world
CNN,CNN Newsroom Live,need presid miss meet climat chang state world ocean ocean cross sit may import negoti life upcom nuclear talk
CNN,CNN Newsroom With Fredricka Whitfield,lectur unit state america climat chang listen presid trump turn economi around job worker help north korea far relev usual european
CNN,At This Hour With Kate Bolduan,cours rest world want us go pay ten hundr billion dollar pay trump basic said interest world major produc oil ga coal climat chang deal want put
CNN,Inside Politics,yet come blue convers today go presid go leav earli doesnt want sit lectur climat chang leader presid go told he wrong everybodi els tabl
