Station,Show,Snippet
CNN,CNN Newsroom,thank ben cold day talk global warm thousand descend nation mall demand action climat chang
CNN,Erin Burnett OutFront,natur ga without drill kind miracl right theyr make fuel pond scum give challeng ahead us global warm
CNN,Fareed Zakaria GPS,like china india continu add power plant essenti everi week look say climat chang go happen matter point well climat chang
CNN,State of the Union 2013,sake children futur must combat climat chang
CNN,Piers Morgan Tonight,sorri yeah mani weather expert believ sandi grim preview futur power damag storm fuel climat chang
CNN,CNN Newsroom,freak coincid choos believ overwhelm judgment scienc act late climat chang activist
CNN,The Situation Room,countri havent major snowfal event two year pattern get set get repetit storm exactli what happen midwest cant relat individu storm global warm aspect
CNN,Fareed Zakaria GPS,thorniest problem face yeah cours believ move boldli agenda articul inaugur address pleas put climat crisi front
CNN,CNN Newsroom,lot thing wake becom part global phenomenon call internet everyth tree talk network talk scientist climat chang
CNN,CNN Newsroom,like environment safe natur dirti danger pipelin that go cut countri half carri da danger fuel caus run away climat chang
CNN,Piers Morgan Tonight,cant bowman warn need storm barrier year ago warn new york time katrina tri climat chang
CNN,Anderson Cooper 360,diesel call ega accord brian fuel futur compani figur way make brand natur ga without drill kind miracl right theyr make fuel pond scum give challeng ahead us global warm
CNN,CNN Newsroom,money help repair road address climat issu without use languag seem make peopl bristl reason look here deal climat chang regul
CNN,Fareed Zakaria GPS,know wonder sinc youv brought issu havent realli abl much unit state european union done someth term kind thing want see cap trade perhap carbon tax thing
CNN,Starting Point,second term presid obama unveil slate new propos aim improv live middl class take everyth univers preschool educ repair nation age infrastructur address threat climat chang
CNN,CNN Newsroom,thank ben cold day talk global warm thousand descend nation mall demand action climat chang three two one
CNN,Fareed Zakaria GPS,phenomenon yeah know wonder sinc youv brought issu havent realli abl much unit state european union done someth term kind thing want see cap trade perhap carbon tax thing
CNN,Piers Morgan Tonight,wasnt organ im involv rain forest action network peopl heard presid speak last night climat chang must someth climat
CNN,CNN Newsroom,play presid agenda want go hear echo inaugur speech see thing like immigr climat chang mayb littl meat bone like climat
CNN,Piers Morgan Tonight,earli watercolor that famili tough tough pain sorri yeah mani weather expert believ sandi grim preview futur power damag storm fuel climat chang
CNN,Starting Point,state union report end presid obama frame much agenda umbrella econom growth talk tax reform govern spend propos educ climat chang immigr
CNN,CNN Newsroom,tip stori other break lot thing wake becom part global phenomenon call internet everyth tree talk network talk scientist climat chang
CNN,State of the Union 2013,hoover laugh flub prompter someth els well littl danc climat chang love van jone great name good move happi mention climat
CNN,CNN Newsroom,global warm climat chang someth soon edg next stori carbon dioxid abl go warmer ocean water true one issu look type
CNN,CNN Newsroom,establish tighter standard current power plant word dont want current power plant produc much greenhous gase futur power plant go built one alreadi built right want presid obama
CNN,CNN Newsroom,chang legisl washington climat chang activist bill ad largest climat chang ralli histori also chant hey
CNN,CNN Newsroom,hurri wont last welcom new half hour talk show three hot topic great guest tap today presid obama tea time tiger fight climat
CNN,CNN Newsroom,help protect eye health that pill worth take male announc ocuvit help protect eye health onto section talk back question time climat
CNN,CNN Newsroom,believ global climat chang real presid rather pass global climat chang tri chang economi countri weve never unemploy go pass crippl regul hurt
CNN,CNN Newsroom,climat chang respond threat climat chang know failur would betray children futur gener report reduc deficit save safeti net program commit make
CNN,Piers Morgan Tonight,expert say weather pattern chang due global warm dispatch team team
CNN,Fareed Zakaria GPS,climat chang go happen matter point well climat chang alreadi happen continu happen physic problem quit challeng put well energi use earth inc
CNN,CNN Newsroom,held note climat chang skeptic govern cant chang weather pass bunch law destroy economi isnt go chang weather climat chang activist dc want presid talk keyston
CNN,CNN Newsroom,saw draft memo coupl week ago intern panel climat chang predict temperatur increas wildli overst last year time climat chang get research order make
CNN,CNN Newsroom,time climat chang legisl ye obama lot climat chang need start simpl need take bold idea john mccain pitch around promis chang delet car
CNN,Starting Point,wind back observ say presid obama cant appear bullhead start second term point soledad question aggress presid obama would topic climat
CNN,Piers Morgan Tonight,race time determin fulfil mission work fast put right peopl place im train astronaut im satisfi back home mission success crucial mission climat
CNN,Piers Morgan Tonight,rainforest action network peopl heard presid speak last night climat chang must someth climat chang enough mean look im huge support obama first presid ever
CNN,Piers Morgan Tonight,someth climat chang enough mean look im huge support obama first presid ever donat money think term climat chang environ he best disappoint thought decent rhetor
CNN,Reliable Sources,your sell televis network ga oil support emer isnt one problem global warm ye
CNN,Reliable Sources,somehow ad global warm hand al jazeera stretch beyond stretch al gore sell compani al jazeera own
CNN,Fareed Zakaria GPS,degrad co water methan leakag may occur suffici quantiti outweigh global warm advantag switch ga coal think frack
CNN,Fareed Zakaria GPS,methan leakag may occur suffici quantiti outweigh global warm advantag switch ga coal think frack stori need written
CNN,Fareed Zakaria GPS,measur global warm impact strategi choos look latest satellit pictur north america there new ball light larg chicago
CNN,Fareed Zakaria GPS,requir epa regul pollut suprem court agre obviou interpret global warm pollut pollut appli new coal plant appli facil
CNN,CNN Newsroom,pipelin like add collus problem part caus global warm pipelin creat job energi independ yeah ga price gallon
CNN,CNN Newsroom,temperatur nation mall demand action climat chang heart beat heartbeat continu
CNN,The Situation Room,jazeera think charg made al gore he hypocrit passion global warm sell compani signific part compani al jazeera realli
CNN,CNN Saturday Morning,global warm knew huge consequ huge problem got togeth friend found could turn waist cook oil diesel fuel mani famili
CNN,Fareed Zakaria GPS,congression approv law book requir epa regul pollut suprem court agre obviou interpret global warm pollut pollut appli new coal
CNN,Reliable Sources,media hold account he big spokesman global warm principl man big fat target sold network worth
CNN,Reliable Sources,million mitt romney he seen guy enrich rather advanc caus open critic peopl like global warm denier strike
CNN,Anderson Cooper 360,young heard global warm knew huge consequ huge problem got togeth friend found could actual turn oil batteri fuel
CNN,CNN Newsroom,howev senior vatican spokesman saturday said could happen earlier plan th march im ben wedeman cnn report rome right thank ben cold day talk global warm thousand brave frigid
CNN,Weekend Early Start,young heard global warm knew huge consequ huge problem got togeth friend found could actual turn wast cook oil biodiesel fuel
CNN,Weekend Early Start,young heard global warm knew huge consequ huge problem got togeth friend found could actual turn oil batteri fuel
CNN,Piers Morgan Tonight,young heard global warm knew huge consequ huge problem got togeth friend found could actual turn wast cook oil biodiesel fuel
CNN,Fareed Zakaria GPS,care term measur global warm impact strategi choos look latest satellit pictur north america there new ball light larg chicago
CNN,CNN Newsroom,yourng heard global warm knew huge consequ problem got togeth friend found could actual turn wast cook oil knew fuel mani famili
CNN,Anderson Cooper 360,young heard global warm knew huge consequ huge problem got togeth friend found could actual turn oil batteri fuel
CNN,Anderson Cooper 360,young heard global warm knew huge consequ huge problem got togeth friend found could actual turn oil batteri fuel
CNN,CNN Saturday Morning,contribut global warm hln susan hendrick spoke kennedi happen think presid handl issu think virtual everybodi crowd peopl got arrest thousand peopl
CNN,State of the Union,kind carbon tax manufactur know clean vote system rais minimum wage what realli go happen agre senat schumer immigr reform form
CNN,CNN Newsroom,biggest factk factor contribut climat chang put hand sad
CNN,CNN Newsroom,ocean around world danger estim coral reef planet destroy next ten year that mostli global warm scientist think tini miner might hold key
CNN,CNN Newsroom,world one french fri time look young heard global warm knew huge consequ huge problem got togeth friend found could
CNN,Starting Point,conor kennedi daryl hannah arrest protest demand obama administr take concret action climat chang activist chant presid
CNN,Starting Point,new propos take everyth univers preschool educ prepar age infrastructur address threat climat chang urg congress put
CNN,CNN Newsroom,think yeah littl press confer today announc gave blueprint away want tell full screen quot one benefit global warm hasnt mani iceberg north
CNN,CNN Newsroom,young heard global warm knew huge consequ huge problem got togeth friend found could actual turn wast cook oil biodiesel fuel mani famili
CNN,CNN Newsroom,young heard global warm knew huge consequ huge problem got togeth friend found could actual turn wast cook oil biodiesel fuel mani famili
CNN,CNN Newsroom,republican republican dont believ scienc climat chang biggest threat outsid nuclear holocaust dont believ scienc embarrass
CNN,CNN Newsroom,point climat believ climat chang manmad cant anyon find common ground there certainli doubt disput factor
CNN,CNN Newsroom,small busi belov home state california home hope chang global climat chang whatnot green regul kill california
CNN,CNN Newsroom,endang speci list wolverin run climat chang there left us interest rise temperatur northern rocki caus
CNN,State of the Union,get said state union necessarili get done least right away let ask immigr reform tax code kind carbon tax manufactur know clean vote system rais minimum wage
CNN,CNN Newsroom,danger pipelin liter cut countri half carri danger fuel caus run away climat chang report flipsid folk say tighter emiss standard
CNN,Around the World,climat chang prolong drought advers condit freez condit havent seen much unsan ter unsanitari condit like alreadi distribut
CNN,Piers Morgan Tonight,storm barrier year ago warn new york time katrina tri climat chang panel mayor bloomberg none built
CNN,Piers Morgan Tonight,organ im involv rain forest action network peopl heard presid speak last night climat chang must
CNN,CNN Newsroom,bond hear tuesday say kill model girlfriend reeva steenkamp thousand march washington action climat chang organ claim
CNN,The Situation Room,hurrican sandi that unit state extrem weather condit weather event happen around globe peopl ask question think global warm band extrem weather event well first
CNN,Erin Burnett OutFront,give challeng ahead us global warm solut pond scum perfect low cost renew raw materi convert ofuel use diesel engin man said goal
CNN,Fareed Zakaria GPS,face cours believ move boldli agenda articul inaugur address pleas put climat crisi front center first issu brought bold commit
CNN,State of the Union 2013,controversi issu spoke address topic climat chang choos believ super storm sandi sever drought decad
CNN,Fareed Zakaria GPS,control climat chang much come also money bank account week major african nation probabl ill explain first here take
CNN,Reliable Sources,al gore busi countri enabl ultim foe climat chang think understand your get disagre fare zakaria ask
CNN,The Situation Room,enomenon call internet everyth tree talk network talk scientist climat chang car talk road sensor talk stoplight traffic effici
CNN,Piers Morgan Tonight,crucial mission climat chang threaten intensifi storm ahead next polar icecap tell us damag storm could next polar icecap
CNN,Starting Point,agenda immigr reform climat chang audienc victim sandi hook massacr along rocker gun right advoc ted nugent brianna keilar expect
CNN,Piers Morgan Tonight,crucial mission climat chang threaten intensifi storm ahead next polar icecap tell us damag storm could next polar icecap
CNN,CNN Newsroom,action deb know chri presid obama talk pretti tough climat chang want see thing happen anyth like happen especi respect
CNN,CNN Newsroom,stop climat chang join us chad meyer phillip cousteau good couch final person love good great tell us
CNN,Anderson Cooper 360,talk scientist climat chang car talk road sensor talk stoplight traffic effici ambul talk patient record talk doctor save live
CNN,CNN Newsroom,talk scientist climat chang car talk road sensor talk stoplight traffic effici ambul talk patient record talk doctor save live
CNN,State of the Union 2013,propos aim improv live middl class take everyth univers preschool educ repair nation age infrastructur address threat climat chang urg congress put
CNN,CNN Newsroom,facebookcomcarolcnn tweet mecarolcnn time climat chang legisl loud parti sound hi im ensur clear clear huh im juic fanci water ive got nine gram protein
CNN,Erin Burnett OutFront,tree talk network talk scientist climat chang car talk road sensor talk stoplight traffic effici ambul talk patient record talk doctor save live
CNN,EarlyStart,repair nation age infrastructur address threat climat chang urg congress put partisan differ asid imag immigr stay focus plan jump start nation letharg economi
CNN,CNN Newsroom,call internet everyth tree talk network talk scientist climat chang car talk road sensor talk stoplight traffic effici ambul talk patient record
CNN,EarlyStart,spend propos educ climat chang immigr wind back observ say presid obama cant appear bullhead start second term brianna keilar cnn white
CNN,CNN Newsroom,tree talk network talk scientist climat chang car talk road sensor talk stoplight traffic effici ambul talk patient record talk doctor save live
CNN,CNN Newsroom,lot thing wake becom part global phenomenon call internet everyth tree talk network talk scientist climat chang car talk road sensor
CNN,CNN Newsroom,white hous urg presid obama take action climat chang must kill extens keyston pipelin keyston xl dirti danger pipelin liter go cut
CNN,Fareed Zakaria GPS,environment activist al gore american polit gun control climat chang much come also money bank account week major african nation probabl ill explain
CNN,The Situation Room,talk scientist climat chang car talk road sensor talk stoplight traffic effici ambul talk patient record talk doctor save live go amaz
CNN,The Situation Room,lot thing wake becom part global phenomenon call internet everyth tree talk network talk scientist climat chang car talk road sensor
CNN,Anderson Cooper 360,call internet everyth tree talk network talk scientist climat chang car talk road sensor talk stoplight traffic effici ambul talk patient record
CNN,The Situation Room,call internet everyth tree talk network talk scientist climat chang car talk road sensor talk stoplight traffic effici ambul talk patient record
CNN,CNN Newsroom,talk scientist climat chang car talk road sensor talk stoplight traffic effici ambul talk patient record talk doctor save live go amaz
CNN,Piers Morgan Tonight,storm barrier year ago warn new york time katrina tri climat chang panel mayor bloomberg none built barrier sand berm
CNN,Piers Morgan Tonight,yeah mani weather expert believ sandi grim preview futur power damag storm fuel climat chang storm wouldnt occur wouldnt happen anyway
CNN,Piers Morgan Tonight,new york time katrina tri climat chang panel mayor bloomberg none built barrier sand berm built last eight
CNN,CNN Newsroom,lot thing wake becom part global phenomenon call internet everyth tree talk network talk scientist climat chang car talk road sensor
CNN,Erin Burnett OutFront,lot thing wake becom part global phenomenon call internet everyth tree talk network talk scientist climat chang car talk road sensor
CNN,CNN Newsroom,climat chang immigr issu nation border thing cathol think global context think opportun next pontiff reorient
CNN,Piers Morgan Tonight,mani weather expert believ sandi grim preview futur power damag storm fuel climat chang storm wouldnt occur wouldnt happen anyway
CNN,Piers Morgan Tonight,forecast seen anyth like call superstorm fuel chang climat higher temperatur rise sea level climat chang real go happen peopl citi safe
CNN,CNN Newsroom,call internet everyth tree talk network talk scientist climat chang car talk road sensor talk stoplight traffic effici ambul talk patient record
CNN,The Situation Room,lot thing wake becom part global phenomenon call internet everyth tree talk network talk scientist climat chang car talk road sensor
CNN,CNN Newsroom,tree talk network talk scientist climat chang car talk road sensor talk stoplight traffic effici ambul talk patient record talk doctor save live
CNN,The Situation Room,call internet everyth tree talk network talk scientist climat chang car talk road sensor talk stoplight traffic effici ambul talk patient record
CNN,CNN Newsroom,activist climat chang activist dc concentr keyston pipelin concentr couldnt pick someth els cute visual make sens peopl dress bald
CNN,Anderson Cooper 360,becom part global phenomenon call internet everyth tree talk network talk scientist climat chang car talk road sensor talk stoplight traffic effici
CNN,Erin Burnett OutFront,what go climat chang dont know overpopul model overthink mani model look one look one two
CNN,Erin Burnett OutFront,knew weather could big littl climat chang overpopul model ts overthink mani model look one look
CNN,EarlyStart,union end presid obama frame much agenda umbrella econom growth talk tax reform govern spend educ climat chang immigr wind back
CNN,State of the Union 2013,pollut prepar commun consequ climat chang speed transit sustain sourc energi four year ago countri domin clean energi market job came weve begun chang
CNN,State of the Union 2013,chang man get giddi want give climat chang matter question howev foment debat left fundament proposit deal immin
CNN,State of the Union 2013,go back forth hard democrat republican actual mirror imag come climat chang democrat say moral oblig act keep
CNN,EarlyStart,infrastructur address let threat climat chang urg congress put partisan differ asid issu immigr stay focus plan jumpstart nation letharg economi american peopl
CNN,Piers Morgan Tonight,great thank actress daryl hannah among peopl arrest handcuf white hous gate today protest keyston oil pipelin come one day presid obama made climat chang prioriti issu
CNN,Piers Morgan Tonight,climat chang choos believ superstorm sandi worst sever drought decad wildfir state ever seen freak coincid choos believ overwhelm
CNN,Piers Morgan Tonight,actress daryl hannah among peopl arrest handcuf white hous gate today protest keyston oil pipelin come one day presid obama made climat chang prioriti issu state union address
CNN,State of the Union 2013,make meaning progress issu drive strong econom growth urg congress get togeth pursu bipartisan marketbas solut climat chang like one john mccain joe lieberman work togeth year ago
CNN,CNN Newsroom,spend propos educ climat chang immigr wind back observ say presid obama cant appear bullhead start second term carol also news
CNN,CNN Newsroom,bene healthi weight find us facebook help put play day huge ralli nation mall washington today thousand well plead action climat chang chri lawrenc talk
CNN,CNN Newsroom,horrif time address climat chang year ago carol someth biggest issu person bought chevi volt
CNN,CNN Newsroom,huge ralli nation mall washington today thousand well plead action climat chang chri lawrenc talk brave freez temperatur hope lead chang us energi polici
CNN,Piers Morgan Tonight,call superstorm fuel chang climat higher temperatur rise sea level climat chang real go happen peopl citi safe eye furi see weather chang
CNN,Starting Point,propos educ climat chang immigr wind back observ say presid obama cant appear bull head start second term realli rare chanc presid obama talk directli
CNN,Piers Morgan Tonight,actress daryl hannah among peopl arrest handcuf white hous gate today protest keyston oil pipelin come one day presid obama made climat chang prioriti issu state union address
CNN,Erin Burnett OutFront,wake becom part global phenomenon call internet everyth tree talk network talk scientist climat chang car talk road sensor talk stoplight traffic effici
CNN,Piers Morgan Tonight,climat chang real go happen peopl citi safe eye furi see weather chang absolut era superstorm water level rise substanti
CNN,Piers Morgan Tonight,futur superstorm rise sea level also fuel climat chang satellit space measur sea level millimet accuraci sinc sea level gone inch sinc
CNN,Piers Morgan Tonight,im train astronaut im satisfi back home mission success crucial mission climat chang threaten intensifi storm ahead next polar icecap tell us damag
CNN,Anderson Cooper 360,earth speci capabl least prepar lot thing dont prepar includ climat chang like think prepar enough realiz larg object like
CNN,CNN Newsroom,yearold cassandra lynn want help environ keep peopl commun warm winter friend found great way young heard global warm knew huge consequ huge problem got togeth friend found could
CNN,CNN Newsroom,presid say come climat chang perhap say say tonight lot environmentalist hope would say he go pursu new regul exist power plant big produc carbon
CNN,EarlyStart,last night know divid gun control climat chang area divid everi poll see even though lot emot behind issu scienc know togeth
CNN,CNN Newsroom,sleep number comfortindividu huge ralli nation mall washington today thousand well plead action climat chang chri lawrenc talk brave freez temperatur hope lead chang us energi polici
CNN,CNN Newsroom,caus run away climat chang report flipsid folk say tighter emiss standard alreadi cost job coal plant place like west virginia tighten go squeez part economi even sol
CNN,CNN Newsroom,huge ralli nation mall washington today thousand plead action climat chang among demand protest want presid obama reject keyston xl pipelin get environment protect agenc set carbon standard
CNN,CNN Newsroom,countri half carri danger fuel caus runaway climat chang alison kosik new york stock exchang your new york stock exchang recogn differ background good let talk ga price
CNN,CNN Newsroom,presid take action climat chang part obama urg tell congress move issu state union choos believ super storm sandi sever drought decad
CNN,CNN Newsroom,loom high unemploy question time climat chang legisl lz ye think go difficult time use exact languag think pass thing like admiss tax talk use
CNN,CNN Saturday Morning,face today weather also mind climat chang activist washington today take messag front gate white hous here emmi schmidt temperatur weekend washington dc
CNN,CNN Newsroom,statement releas manag compani short time ago back big stori hour histori made washington thousand march action climat chang organ claim biggest ralli kind ever us
CNN,CNN Newsroom,runaway climat chang report yet talk lot folk younger voter say back presid obama last two elect caus near dear heart around expect sort
CNN,CNN Newsroom,gay marriag contracept instead faith known teach relat common good issu like climat chang need reorient world economi better meet need world poor much
CNN,CNN Newsroom,restrict air space forc leav area huge ralli nation mall washington today thousand plead action climat chang chri lawrenc middl demand peopl
CNN,CNN Newsroom,scienc school pass bill would requir teacher address theori like evolut climat chang lesson plan bill also pave way student challeng call univers accept scientif theori legal analyst sunni hostin
CNN,The Situation Room,there much specul climat chang see extrem weather pattern emerg your readi draw conclus yet respect individu storm evid suggest well
CNN,The Situation Room,bone im told also talk gay right women right climat chang big differ inaugur presid view tomorrow night big opportun speak american peopl stake across board budget
CNN,Piers Morgan Tonight,em fire come boy point around point got good look face eye roll back head ive seen look climat chang real go happen
CNN,CNN Newsroom,movi trailer state union fulllength featur immigr job gun climat chang talk hope accomplish think clark right need reach honest he made
CNN,Piers Morgan Tonight,ad destruct futur superstorm rise sea level also fuel climat chang satellit space measur sea level millimet accuraci sinc sea level gone inch sinc
CNN,Anderson Cooper 360,dont prepar includ climat chang like think prepar enough realiz larg object like sever enough dont move there get way disast larg enough produc global fire
CNN,Anderson Cooper 360,capabl least prepar lot thing dont prepar includ climat chang like think prepar enough realiz larg object like sever enough dont move there
CNN,CNN Newsroom,appreci let get took hour big stori histor ralli washington thousand march action protest climat chang organ claim biggest ralli kind ever us chri lawrenc spent date
