Station,Show,Snippet
FOXNEWS,Fox News  Night With Shannon Bream,fuel us within ten year renew energi illumin greenhous gase
FOXNEWS,Tucker Carlson Tonight,govern tri impos antiglob warm ga tax upon nevertheless lot american includ outgo senat jeff flake think time america carbon tax
FOXNEWS,Tucker Carlson Tonight,ridicul peopl go work tucker way realli believ climat chang matter your fli privat plane need realli look mirror think deepli think carbon tax
FOXNEWS,The Ingraham Angle,cost cost life properti decis make build kind build materi use also pollut put atmospher collect societi weve made decis bump billion ton greenhous gase
FOXNEWS,Fox News  Night With Shannon Bream,fund cool week special counsel ramp plenti drama plu violent riot franc spark carbon tax
FOXNEWS,FOX  Friends,night somehow forgot mention word climat chang outrag climat chang caus devast problem countri world futur planet stake climat chang
FOXNEWS,Tucker Carlson Tonight,drive suv pick kid hockey practic know peopl lectur us realli make sacrific stop global warm storag
FOXNEWS,Tucker Carlson Tonight,fifth centuri ad byzantin sixth centuri ancient regim rome fall apart whole bunch peopl question global warm
FOXNEWS,Americas Newsroom With Bill Hemmer and Sandra Smith,launch damn satellit greenhous ga contribut global warm californian certain age might sound like deja vu
FOXNEWS,The Daily Briefing With Dana Perino,migrat dana anoth issu climat chang take listen audienc member scof unit state climat chang confer
FOXNEWS,Fox News  Night With Shannon Bream,beto orourk shannon peter dooci hill thank franc carbon tax stori lead world tell lawmak carbon tax design fund effort combat global warm go away
FOXNEWS,Tucker Carlson Tonight,invest im certainli hope think bill creat enough incent throughout entir econom system creat type innov know need carbon tax china
FOXNEWS,Special Report With Bret Baier,export base subsidi paid us taxpay doesnt make sens greenpeac other state cold turkey approach necessari hold temperatur degre fight global warm
FOXNEWS,Watters World,violenc didnt hear anyth below climat chang hondura cold hot compar caravan global
FOXNEWS,Watters World,that happen beauti central america sunni everi day climat crisi want climat
FOXNEWS,Watters World,that happen beauti central america sunni everi day climat crisi want climat
FOXNEWS,Tucker Carlson Tonight,fact climat chang directli relat growth terror ye mr trump climat chang real tucker real feel deepli nbc one anchor wonder climat
FOXNEWS,Tucker Carlson Tonight,feel deepli nbc one anchor recent wonder climat chang seriou might render live without mean fire flood store famin effect climat chang
FOXNEWS,Outnumbered Overtime With Harris Faulkner,movement got close look saturday smash window burn car protest start angri respons man hike price ga line govern respons global warm
FOXNEWS,Fox News  Night With Shannon Bream,rise cost live govern look increas polic power protest initi complain sharp increas diesel tax alon year presid macron said increas necessari help curb global warm
FOXNEWS,Special Report With Bret Baier,go end said space technolog pinpoint sourc methan potent greenhous ga contribut global warm initi enabl us spotlight methan
FOXNEWS,Fox and Friends First,horribl protest see week peopl refus pay ga tax climat chang
FOXNEWS,Fox and Friends First,come us threaten pull arm treati accus russia violat term russia say done noth wrong french presid emmanuel macron scrap carbon tax week protest meant curb global
FOXNEWS,The Ingraham Angle,right sent increas ten sent increas diesel un climat expert want transfer lot wealth corrupt third world countri estim twelv year go need carbon tax give
FOXNEWS,Fox and Friends First,speech commun leader carley offici look protest demand month fieri revolt manual macron climat chang agenda
FOXNEWS,Fox News  Night With Shannon Bream,protest tax increas macron put ga diesel fight climat chang specif carbon tax place fight climat chang shannon izac fact
FOXNEWS,Special Report With Bret Baier,hama activ ist west bank pair deadli shoot group small countri vulner climat chang
FOXNEWS,Americas News HQ,doubl rar credit also drew critic say fail deliv clear commit reduc climat chang
FOXNEWS,Fox News  Night With Shannon Bream,carbon tax place fight climat chang fact tri twice washington past coupl elect sort forc carbon tax us voter reject wont like happen
FOXNEWS,Fox News  Night With Shannon Bream,pinpoint sourc methan potent greenhous ga contribut global warm initi enabl us spotlight methan pollut abl posit point pollut develop
FOXNEWS,Justice With Judge Jeanine,almost countri approv guidelin reduc greenhous ga emiss consid pledg take ambiti action fight climat chang postpon next year
FOXNEWS,Fox News  Night With Shannon Bream,cut issu like health care cultur thing like immigr end care climat chang
FOXNEWS,Tucker Carlson Tonight,riot street news outlet lie wont tell turn backlash climat chang agenda
FOXNEWS,Tucker Carlson Tonight,order fairli compet job run citi comparison what come yeah thing bloomberg emphasi climat chang gun
FOXNEWS,Fox and Friends First,democrat support capitol hill environment initi say protest turn rob politician left ralli green polici combat climat chang
FOXNEWS,Fox and Friends First,year think jeff flake gone one promis republican politician america one doesnt home rob climat chang
FOXNEWS,FOX  Friends,futur emul europ train climat chang immigr european right well case european french exactli global climat
FOXNEWS,Americas News HQ,face disastr climat chang unit state second highest produc emiss world also held event promot fossil fuel critic say agreement didnt enough reduc climat
FOXNEWS,Hannity,downward wage pressur wage leftright thing beyond left war poverti spend money climat chang
FOXNEWS,Fox News  Night With Shannon Bream,lawmak carbon tax design fund effort combat global warm go away move follow week deadli protest franc largest farmer union protest next week truck union call
FOXNEWS,Watters World,below climat chang hondura cold hot compar caravan global warm fit
FOXNEWS,Fox and Friends First,plan look tweet mister flay republican need get seriou climat chang introduc carbon tax bill sever year ago reduc bipartisan revenu neutral carbon tax bill provid honest path clean energi bad plan lot peopl agre need
FOXNEWS,Fox and Friends First,face speak elect rumor presidenti candid michael bloomberg head iowa tomorrow former new york citi mayor recent regist democrat host panel climat chang
FOXNEWS,Special Report With Bret Baier,mike mike gillian turner washington thank socal keep ground movement aim stop use oil coal natur slow climat chang
FOXNEWS,Tucker Carlson Tonight,stick wouldnt display good faith peopl behind legisl said first thing go ban privat air travel climat chang
FOXNEWS,Tucker Carlson Tonight,happen brooklyn peopl talk televis know what actual go tell rise oil price that fals climat chang
FOXNEWS,Fox News  Night With Shannon Bream,potenti bid appear solar electr panel instal compani cedar rapid iowa light snow degre temperatur said would everyth power make climat chang primari
FOXNEWS,Fox News  Night With Shannon Bream,primari shannon interest collect import polit state thank california governor plan yet anoth move defi trump administr push climat chang agenda
FOXNEWS,The Ingraham Angle,laura greenhous ga emiss gone last month go record check laura answer question accept premis question reason act climat chang
FOXNEWS,Americas Newsroom With Bill Hemmer and Sandra Smith,make california new plan fight climat chang outer space jerri brown say state launch satellit track greenhous ga emiss live stori today
FOXNEWS,The Ingraham Angle,tragic presid tikrit cal moment choos firefight arson weve got kid dont want slowli burn death planet climat chang could
FOXNEWS,Fox News  Night With Shannon Bream,let creat retir plan let creat plan what next like get plan that right td ameritrad shannon year republican complain obama administr depriorit space explor favor climat chang
FOXNEWS,FOX  Friends,landslid dont like peopl vote peopl dislik brian pari climat chang whole global warm thing compani becom trumplik nontrumplik number two caravan
FOXNEWS,Fox News  Night With Shannon Bream,ga price decent see economi trend upward thing look want see cut cost issu like healthcar cultur thing like immigr care climat chang
FOXNEWS,FOX  Friends,meanwhil thank carley defens secretari jame matti issu new order border democrat make new demand wall live grow fight caravan mexico come next brian plu advoc climat chang
FOXNEWS,Tucker Carlson Tonight,use market forc disincentiv pollut one big issu carbon tax argu want whether climat chang manmad know mercuri
FOXNEWS,The Journal Editorial Report,obsess climat chang someth averag voter dont trust elit yeah averag voter know china doesnt anyth know global warm paul india indonesia
FOXNEWS,Special Report With Bret Baier,fight global warm climat chang follow yesterday suspens reaction two week violent protest french citizen demonstr expand beyond energi issu complaint mani topic today franc union said
FOXNEWS,Americas News HQ,true make new york make anywher even iowa former new york citi mayor michael bloomberg could join lengthi list democrat trip hawkey state week said visit rais climat chang awar
FOXNEWS,Tucker Carlson Tonight,idea interest anyth that happen inh brooklyn peopl talk televis know what actuallyli go heyr tell rise oil price that fals climat chang
FOXNEWS,FOX  Friends,brain brian one biggest stori happen week week violent protest french governor suspend carbon tax design fight climat chang work middl class protest accus presid macron polici
FOXNEWS,Special Report With Bret Baier,presid emmanuel macron emmanuel macron polit backtrack fuel tax design fight climat chang global warm didnt work protest stop kept come still come presid franc say
FOXNEWS,Tucker Carlson Tonight,report want gallon ga tax year need say fight global warm fight climat chang would fold increas tax franc
FOXNEWS,Special Report With Bret Baier,bret welcom back white hous frimpleg presid emmanuel macron bow intens pressur tonight suspend ago fuel tax util price hike combat global warm climat chang protest rock pari worst riot
FOXNEWS,Tucker Carlson Tonight,almost half tax tax want per gallon ga tax year need say fight global warm climat chang would fold increas
FOXNEWS,The Five,line someth love good see kind love still exist face new thing fall love still peopl will wait line sandra time two half hour thank everyon next climat chang alarmist
FOXNEWS,Tucker Carlson Tonight,carbon tax argu want whether climat chang manmad know mercuri pollut potent neurotoxin know sulfur pollut signific health effect know groundbas ozon
FOXNEWS,Tucker Carlson Tonight,peopl lectur us realli make sacrific stop global warm storag tell us much rest us might inclin follow exampl wont elit impos new tax sake climat chang ordinari citizen
FOXNEWS,FOX  Friends,schwarzenegg went un summit poland call presid trump crazi believ climat chang commut daili governor mansion governor time tout global warm bill total disconnect claim
FOXNEWS,The Next Revolution With Steve Hilton,peopl felt left behind presid trump abl cap forgotten men women that fuel victori abl identifi peopl counti felt left behind democrat parti regard franc obvious individu reject idea increas staff name climat chang
FOXNEWS,Fox and Friends First,find way reduc greenhous gase ever happen dinner tabl nice sit togeth tell someth
FOXNEWS,FOX  Friends,poll land summit particular protest stuf head gear green note say act goal find way reduc greenhous gase rememb scene classic movi christma vacat
FOXNEWS,FOX  Friends,aim reduc greenhous gase emiss ton tax rate rise year distribut proce monthli household rebat say thing french wrong charg peopl
FOXNEWS,Tucker Carlson Tonight,depart charl krauthamm conserv understood thing well thing economist love carbon tax transpar direct politician hate carbon tax reason
FOXNEWS,Americas Newsroom With Bill Hemmer and Sandra Smith,traffic circl block along highway weekend toll booth torch propos hike ga tax combat global
FOXNEWS,Tucker Carlson Tonight,depart charl krauthamm conserv understood thing well thing economist love carbon tax transpar direct politician hate carbon tax reason might good reason
FOXNEWS,Tucker Carlson Tonight,discuss declin fortun american men pari still cope riot govern tri levi carbon tax lawmak want carbon tax that next psoriasi littl thing big deal
FOXNEWS,Tucker Carlson Tonight,night somehow forgot mention word climat chang outrag climat chang caus devast problem countri world climat chang great
FOXNEWS,Fox News  Night With Shannon Bream,renew energi elimin greenhous gase also new infrastructur coastal commun deal rise sea level izac realist see cant get whole lot stuff done capitol hill tall order resolut
FOXNEWS,The Ingraham Angle,materi use also pollut put atmospher collect societi weve made decis bump billion ton greenhous gase atmospher laura think basic immedi go radic like
FOXNEWS,Tucker Carlson Tonight,mention word climat chang outrag climat chang caus devast problem countri world climat chang great globaglob environment crisi face
FOXNEWS,Tucker Carlson Tonight,actual carbon tax work reduc tax anoth way charl krauthamm propos think could see dont think democrat go actual propos carbon tax goe along tax cut somewher els
FOXNEWS,The Journal Editorial Report,repeal carbon tax yet friend even theori think free market point view carbon tax would effici way tri actual slow carbon emiss reduc use carbon fuel
FOXNEWS,Tucker Carlson Tonight,centuri beyond control congress becom entitl program get automat increas everi year cant go poll station dont like essenti put carbon
FOXNEWS,Tucker Carlson Tonight,might good reason actual carbon tax work reduc tax anoth wayax charl krauthamm propos think could see dont think democrat go actual propos carbon tax goe along
FOXNEWS,Watters World,sunni everi day climat crisi want climat crisi ir guess survey say peopl want modern santa
FOXNEWS,Tucker Carlson Tonight,think carbon tax becom compon debat next elect think carbon tax compon think becom litmu test democrat candid tri seek democrat nomin presid theyv got care
FOXNEWS,Watters World,mix list jess merri christma happi new year bless hole citi berni sander claim climat
FOXNEWS,Cavuto Live,american believ use free market solv lot problem weve reduc greenhous ga significantli countri innov overtax unit state depend
FOXNEWS,Fox News  Night With Shannon Bream,spacebas technolog pinpoint sourc methan potent greenhous ga contribut global morn initi enabl us spot methan pollut point
FOXNEWS,Fox News  Night With Shannon Bream,beto orourk franc draft controversi carbon tax leav world franc prime minist tell
FOXNEWS,Tucker Carlson Tonight,global environment crisi face fact climat chang directli relat growth terror ye mr trump climat chang real tucker real
FOXNEWS,Americas News HQ,greenhous ga unit state wct second highest world emiss said didnt welcom find climat report presid trump vow bow pari climat accord
FOXNEWS,The Ingraham Angle,eiagov laura greenhous ga emiss gone last month go record check laura answer question accept premis question reason act
FOXNEWS,Fox News  Night With Shannon Bream,temperatur everyth make climat chang primari issu democrat took us weight climat chang skeptic look best scienc
FOXNEWS,Watters World,cold hot compar caravan global warm fit
FOXNEWS,Americas Newsroom With Bill Hemmer and Sandra Smith,start macron carbon tax polici morph someth bigger hear macron
FOXNEWS,Tucker Carlson Tonight,tucker that pari war zone dana perino host daili brief cours dana perino great see thank tucker think argument whether climat
FOXNEWS,The Ingraham Angle,noth frosti someth relat climat chang thank much fox news alert associ press report
FOXNEWS,Fox and Friends First,deal scientif commun tell us great crisi face planet climat chang climat chang someth worri first thing get
FOXNEWS,Fox and Friends First,car right thing republican need get seriou climat chang say stunt want get seriou climat chang two week left
FOXNEWS,Fox and Friends First,worri make end meet lose join us like american worri make end meet thing get tighter tighter especi lower middleclass throughout west doesnt mean climat
FOXNEWS,The Ingraham Angle,norm climat chang obvious one thing im talk climat chang nick norm lot stuff migrat talk migrat immigr year talk
FOXNEWS,Tucker Carlson Tonight,climat chang one person shout real dont evid grant everyth say climat chang thank that start admit tucker realli believ say
FOXNEWS,FOX  Friends,climat depotcom author polit incorrect guid climat chang marc thought privat jet contribut climat chang yeah accord green peac time wors train travel signific
FOXNEWS,Watters World,music throughout jess caravan crisi still loom border al gore say exampl global warm tweet
FOXNEWS,Fox and Friends First,carbon tax shift renew sourc within ten year support group right midterm deadli winter storm across
FOXNEWS,Fox News  Night With Shannon Bream,place didnt return revenu citizen that would introduc first carbon tax give revenu back
FOXNEWS,Watters World,global warm tweet migrant caravan recent startl exampl ing financi time video connect dot profound
FOXNEWS,Tucker Carlson Tonight,pay attent tell us lot side elit forc ordinari peopl bear entir burden fight climat chang better concern climat chang dont want give plane
FOXNEWS,Fox News  Night With Shannon Bream,atlant lengthi piec talk john delaney check sever progress box back univers healthcar mandatori minimum wage carbon tax piec legisl
FOXNEWS,Fox and Friends First,global warm benjamin hall stori protest keep riot report french govern perform embarrass turn
FOXNEWS,Special Report With Bret Baier,global warm serious nation need act boldli advert catastroph rise temperatur end centuri qatar say withdraw
FOXNEWS,Watters World,illeg obtain american dream sinc gore keep talk global warm stop drive car stop fli plane
FOXNEWS,Watters World,al gore say exampl global warm tweet migrant caravan recent startl exampl ing financi time video
FOXNEWS,The Ingraham Angle,norm climat chang one thing im talk climat chang case norm lot stuff migrat talk illeg immigr issu year talk fact
FOXNEWS,Tucker Carlson Tonight,newscast tucker yeah isnt climat chang doesnt realli matter let take serious second theyr alway tell us let take say face valu care deepli climat chang care deepli say
FOXNEWS,Tucker Carlson Tonight,confus debat climat chang real dont evid grant grant everyth say climat chang thank that start admit tucker realli believ say berni sander realli
FOXNEWS,Tucker Carlson Tonight,climat chang better concern climat chang dont want give plane want pay pump workabl longterm approach elit refeet rethink theyr doubl recent statement
FOXNEWS,The Journal Editorial Report,next year that american interest climat chang plan like go add trillion economi hurt econom growth make measur differ climat chang nanci pelosi better think real hard want agenda
FOXNEWS,Fox and Friends First,condemn hama fire rocket israel leader hama call effort delegitim palestinian resist french presid emmanuel macron scrap carbon tax week protest
FOXNEWS,The Journal Editorial Report,climat chang ambit ram bill hous play small role democrat lose hous next year that american interest climat chang plan like go add trillion economi hurt econom growth make measur
FOXNEWS,The Journal Editorial Report,right parti win alberta year sorri also exampl saskatchewan theyr take feder fuel carbon tax court say
FOXNEWS,Tucker Carlson Tonight,household theyr prepar deal whatev bill that propos carbon tax propos unit state propos
FOXNEWS,Americas News HQ,tax aim combat global warm presid punch macron last week offer tax cut handout protestor might kept saturday number number
FOXNEWS,Watters World,could walk illeg obtain american dream sinc gore keep talk global warm stop drive car stop fli plane
FOXNEWS,Watters World,global warm stop drive car stop fli plane lean tech firm he tide make money that keep crank
FOXNEWS,Tucker Carlson Tonight,selffund presidenti campaign global warm gun grab central focu american peopl want that come next maria ramirez hi
FOXNEWS,Fox and Friends First,carley french protest challeng govern latest climat chang initi american lawmak push similar law year rob french protest bad sign bigger movement tax regul curb climat chang carley weigh graham allen thank us
FOXNEWS,FOX  Friends,carbon tax tax coal oil ga et cetera et cetera would rais billion washington state five year voter complet reject goe back point
FOXNEWS,Tucker Carlson Tonight,franc senat flake coon put forward revenu neutral carbon tax dividend mean whatev tax money come get distribut american taxpay progress
FOXNEWS,Tucker Carlson Tonight,american includ outgo senat jeff flake think time america carbon tax wise mark reynold execut director citizen climat lobbi join us
FOXNEWS,Tucker Carlson Tonight,carbon tax beyond democrat account doesnt well repres franci rooney lead republican sponsor florida say like bill marketbas actual let market
FOXNEWS,Tucker Carlson Tonight,actual elimin fossil fuel complet here mantra want everyon rememb elit care global warm driver care fuel price polit driver alway
FOXNEWS,Fox and Friends First,origin plan way tax meant curb global warm macron latest move may enough one protest encourag protest keep push higher minimum wage
FOXNEWS,Watters World,im surpris complain christma light promot global warm that would assum would complain remind clark griswold hous movi christma vacat
FOXNEWS,Americas Newsroom With Bill Hemmer and Sandra Smith,toll booth set fire began protest hike ga tax combat global warm macron gave elect held
FOXNEWS,Special Report With Bret Baier,approach necessari hold temperatur °c fight global warm stop project one thing ultim price current oversuppli fossil
FOXNEWS,Americas News HQ,present threat chang global warm way stop stop burn fossil fuel rather find everi well target choke point pipelin
FOXNEWS,FOX  Friends,platform plan includ carbon tax shift fulli renew energi sourc within year congresswoman elect alexandria ocasiocortez support group join sitin nanci pelosi offic
FOXNEWS,Fox News  Night With Shannon Bream,shape form problem green tax polici carbon tax idea sold way help entir world becom better environ us truth hurt
FOXNEWS,Special Report With Bret Baier,decad may appeas correspond benjamin hall tell us tonight french govern perform embarrass uturn today violent protest new carbon tax forc back prime minist said
FOXNEWS,Tucker Carlson Tonight,arizona senat jeff flake team delawar democrat chri coon impos nationwid carbon tax california radio host join us tonight much come think pretti clear
FOXNEWS,The Ingraham Angle,foreign minist call marxist hoax buy carbon tax rebellion donald trump critic emmanuel macron promot nation pull un pari agreement week later pari ablaz
FOXNEWS,The Ingraham Angle,stori need login instead clear cut vast swath call sustain log bottom line carbon tax would increas admiss hamstr develop world unit state
FOXNEWS,Tucker Carlson Tonight,unit state simultan us propos actual fundament differ franc senat flake coon put forward revenu neutral carbon tax dividend mean whatev tax money come get distribut
FOXNEWS,The Daily Briefing With Dana Perino,left decid two differ vision democrat spend month argu support carbon tax want abolish ice impeach presid bloodi nasti primari make
FOXNEWS,FOX  Friends,question face politician push carbon tax get kick offic democrat know convinc one republican one republican senat everi republican said
FOXNEWS,Tucker Carlson Tonight,know come tucker discuss declin fortun american men pari still cope riot lawmak want carbon tax that next woman candac two minut
FOXNEWS,Tucker Carlson Tonight,think bill creat enough incent creat innov know need there carbon tax china pollut river world what come stream
FOXNEWS,FOX  Friends,averag america steve american believ global warm caus major problem within life time accord gallup got half countri believ
FOXNEWS,The Daily Briefing With Dana Perino,price ga line govern respons global warm someth bigger anti tax anti low wage govern seen touch peopl
FOXNEWS,FOX  Friends,especi come tax hike that blame aim cours global warm exact mantra democrat today
FOXNEWS,Special Report With Bret Baier,instruct call yellow past protest demand suspens ga tax deal global warm protest began increas minimum wage
FOXNEWS,Watters World,complain christma light promot global warm that would assum would complain remind clark griswold hous movi christma vacat wonder got grief
FOXNEWS,Americas News HQ,world cours degre global warm cap panel want degre cap presid trump vow bow pari climat accord us still present confer
FOXNEWS,Americas News HQ,protest thai govern gasolin tax aim combat global warm french presid macron last week offer tax cut govern handout protest might kept saturday number
FOXNEWS,Americas Newsroom With Bill Hemmer and Sandra Smith,well california trump administr continu haggl global warm jerri brown take matter hand announc eye sky program seek sourc pollut
FOXNEWS,Fox News  Night With Shannon Bream,rumor presidenti run push climat chang voter listen
FOXNEWS,FOX  Friends,hat coast guard todd never job governor california mean allow say whatev want like jerri brown said fight climat chang obvious california big fight climat chang made interest
FOXNEWS,Americas Newsroom With Bill Hemmer and Sandra Smith,govern tri combat global warm turn broader protest high tax low wage govern thought touch peopl mean french presid macron vote last year
FOXNEWS,The Ingraham Angle,holdren predict global warm could lead death one billion starv peopl month left happen anoth recent predict way get
FOXNEWS,The Ingraham Angle,scienc czar predict global warm could lead death billion starv peopl month left happen anoth recent predict get
