Station,Show,Snippet
FOXNEWS,Fox News  Night With Shannon Bream,far use video folder bear die canadian arctic promot climat chang
FOXNEWS,Hannity,im okay interview nightmar must stop america wake vote summer reason know mean trump fault hot promot climat chang
FOXNEWS,Shepard Smith Reporting,greenhous ga high agenda wheeler follow step scott pruitt also greenhous ga emiss limit nationwid limit greenhous ga emiss support continu use fossil fuel
FOXNEWS,Shepard Smith Reporting,carbon tax help fight climat chang he face pushback member parti well speak live congressman florida next thought marri italian lineag vecchio zuccoli ancestri
FOXNEWS,FOX  Friends,climat chang state first sue largest petroleum compani blame global warm claim compani knowingli caus catastroph event like extrem weather like super storm sandi first time ever scientist captur planet born astronom share imag planet known pb research statu two three
FOXNEWS,The Daily Briefing With Dana Perino,border day deadlin reunit kid parent live texa republican congressman take histor stand tri save planet say time carbon
FOXNEWS,Shepard Smith Reporting,public work wheeler consid chiropract nationwid limit greenhous ga emiss support continu use fossil fuel cours key push administr limit
FOXNEWS,Fox and Friends First,sean protest ye go back got souvenir sean import sean could sign absolut rememb trump guilti climat
FOXNEWS,Shepard Smith Reporting,save planet say time carbon tax republican repres florida th district join us live let get
FOXNEWS,Fox and Friends Saturday,fault hot nobut vote doesnt believ global warm base parti move socialist
FOXNEWS,Hannity,realli amus tell least know trump respons global warm peopl would like
FOXNEWS,Hannity,gather outsid sean protest ye go back got souvenir sean import sean could sign absolut rememb trump guilti climat
FOXNEWS,Shepard Smith Reporting,year gop congressman introduc pass law would fight carbon emiss put price carbon tax introduc republican lawmak bill florida
FOXNEWS,Hannity,amus tell least know trump respons global warm peopl would like see least mani brit go demonstr
FOXNEWS,Fox and Friends First,amus tell least know trump respons global warm peopl would like see least mani brit go demonstr
FOXNEWS,Hannity,sean cours thought global warm big geopolit threat mainstream media rememb hous intel committe chairman devin nune sound alarm russia malici intent caus chao around
FOXNEWS,Hannity,presid trump begin import issu import issu nuclear issu know presid obama said global warm biggest problem would
FOXNEWS,Hannity,call ask foreign polici back cold war year sean thought global warm big geopolit threat mainstream media rememb
FOXNEWS,Fox and Friends Saturday,also close loophol that trillion right implement carbon tax that addit amount larg amount revenu last key extrem extrem import
FOXNEWS,Your World With Neil Cavuto,lot peopl use cours somebodi work senat didnt believ global warm also cours work mouthpiec lot coal compani keep
FOXNEWS,The Five,jess firework california patriot use took away jess global warm probabl juan kid idea mind thought
FOXNEWS,Hannity,nuclear issu know presid obama said global warm biggest problem would say biggest problem factor million nuclear problem
FOXNEWS,The Five,russia tough peopl abbi peopl wont even say radic get upset pour water terrorist face think global warm bigger threat terror ran away surrend
FOXNEWS,The Five,rais corpor tax rate even high right two thing also close loophol that trillion right implement carbon tax that addit
FOXNEWS,The Five,rais middleclass tax bracket go take corpor tax rate go impos carbon tax go impos nation sale tax
FOXNEWS,Fox and Friends Saturday,revers tax bill rais corpor tax rate two thing also close loophol that trillion right implement carbon tax that addit amount larg amount
FOXNEWS,Hannity,noth littl hillari got embarrass email came chelsey wed pleas guy arent tough think global warm threat terror your afraid pour water terrorist head youv noth russia
FOXNEWS,Hannity,littl hillari clinton got embarrass email came chelsea wed guy tough think global warm threat terror that true guy done noth russia complain
FOXNEWS,Hannity,love clean water peopl protect environ peopl believ climat chang would urg resign
FOXNEWS,Fox and Friends First,promot climat chang donald welcom free melania detest trump polici homophobia misogyni
FOXNEWS,The Daily Briefing With Dana Perino,point disagr see trade climat chang iran nuclear deal see discuss defens spend fact nato
FOXNEWS,Hannity,promot climat chang donald welcom free melania detest trump polici homophobia misogyni twofac
FOXNEWS,Shepard Smith Reporting,climat chang burn fossil file congressman curbelo join glad good shepard chanc what point think innov
FOXNEWS,Fox and Friends Saturday,hot summer reason know mean donald trump fault hot think promot climat chang america wake vote
FOXNEWS,The Daily Briefing With Dana Perino,socialist leader stand fight human stand fight climat chang stand fight muslim palestinian wide rang ralli mani peopl differ reason
FOXNEWS,FOX  Friends,steve presid iradoesntagre thn nuclear deal climat chang trade war well go interest coupl day know put unit state announc
FOXNEWS,Special Report With Bret Baier,unintellig protest presid visit also variou fight climat chang fight palestinian right fight socialist fight muslim right biggest protest
FOXNEWS,Fox News Sunday With Chris Wallace,climat chang happen need stop report doesnt plan ever ing believ congress benefit fromom churn new member idea iin dont see
FOXNEWS,Hannity,rememb trump guilti climat chang tortur sean everi hill ill world state record low unemploy hispan american africanamerican women workplac job
FOXNEWS,Your World With Neil Cavuto,cours look big pictur neil big target mani left environmentalist movement concern skeptic climat chang brought mission great zeal im wonder littl
FOXNEWS,Hannity,anticapit anarchist gosh know tri produc program climat chang list goe style left wing media particularli countri antitrump
FOXNEWS,Fox and Friends First,anticapit anarchist gosh know tri produc program climat chang list goe style left wing media particularli countri antitrump
FOXNEWS,Fox News  Night With Shannon Bream,time world nation geograph say wen far use video appear polar bear die canadian arctic promot climat chang video view billion time
FOXNEWS,The Five,industri sell media replac climat chang trump chang everyth due term even life improv never better spot north korea gdp grow unemploy rank
FOXNEWS,Fox and Friends Saturday,rachel vile sign messag love pete hot trump promot climat chang todd spoken individu dont necessarili posit dont like guy look alway
FOXNEWS,The Next Revolution With Steve Hilton,pop fail climat chang accord peopl tri pop us american hardwork taxpay dollar subsid economi estat altogeth term offer
FOXNEWS,Hannity,anticapit anarchist gosh know theyr tri produc program climat chang list goe style left wing media particularli countri antitrump silli thing
FOXNEWS,The Story With Martha MacCallum,complet unseat presid unit state protest mani issu though crowd led variou chant fight climat chang fight palestin fight social even fight muslim right biggest protest uk seen
FOXNEWS,The Journal Editorial Report,new tax law need implement cheer agenc get long overdu new polit leadership alicia hit feder judg san francisco bill clinton appointe throughout lawsuit san francisco oakland oil compani caus climat chang judg even went far say
FOXNEWS,The Journal Editorial Report,think happen trump go wake european side question european get yet didnt believ trump would pull pari climat chang agreement didnt believ go pull iran deal didnt believ go
FOXNEWS,Americas News HQ,think happen trump go wake european side question european get yet didnt believ trump would pull pari climat chang agreement didnt believ go pull iran deal didnt believ go put tariff
