Station,Show,Snippet
FOXNEWS,Hannity,unit state contribut greenhous gase caus climat chang
FOXNEWS,Your World With Neil Cavuto,climat chang isnt put asid still hold climat changer true believ doesnt mean arent deepli invest whole industri global warm
FOXNEWS,The Real Story With Gretchen Carlson,mile long final one see current pipelin compar what suggest built environment review project say littl affect greenhous ga
FOXNEWS,On the Record With Greta Van Susteren,head facebook twitter tell us answer fun question cold winter evelik morn midst global warm k
FOXNEWS,The OReilly Factor,broken immigr system right presid announc analyz tonight folk think immigr controversi also denni miller global warm possibl caus
FOXNEWS,The OReilly Factor,broken immigr system right presid announc analyz tonight folk think immigr controversi also denni miller global warm possibl caus
FOXNEWS,Sunday Morning Futures With Maria Bartiromo,canadian oil world market unit state contribut greenhous gase caus climat chang presid remain defiant
FOXNEWS,FOX and Friends,senat defeat one vote maria bartiromo say bad news ga price she live next time fill pump could see sticker guilt global warm
FOXNEWS,Bulls and Bears,right unbeliev brenda notic way climat chang global warm rebrand hasnt global warm year second interest
FOXNEWS,The Five,inequ final get vote theyr go vote democrat that theyr reli think commun problem love fact that opinion global warm
FOXNEWS,FOX and Friends,fight get fight stay im go fight peopl state day leav hope soon vote without environment protest say creat global warm
FOXNEWS,Your World With Neil Cavuto,ride probabl volat e volatil lot bigger swing climb chang folk say climat chang ye theyr tri blake lot lake effect global
FOXNEWS,Special Report With Bret Baier,noaa scientist coauthor studi that turn hot button manmad global warm say degre increas greenhous ga specif natur
FOXNEWS,The Journal Editorial Report,whop billion midterm next gen polit action committe like ad rick scott scientist agre climat chang
FOXNEWS,Happening Now,look fox news poll came exit poll number one issu job go way number list get climat chang american peopl put job ahead climat chang
FOXNEWS,Your World With Neil Cavuto,run senat your say disenchant younger gener cell phone time care climat chang
FOXNEWS,Sunday Morning Futures With Maria Bartiromo,santa ana california vehicl abandon near accid happen owner longer live address victim rang year old climat chang happen
FOXNEWS,FOX and Friends,youv got keyston pipelin bill climat chang deal go talk two new senat republican senat tom cotton jame langford talk climat
FOXNEWS,FOX and Friends,verifi penetr get blame ebola rememb go bring ebola countri fair peopl follow rule republican believ climat chang would blame immigr climat
FOXNEWS,Americas Newsroom,hong kong got ten thousand peopl street hong kong push democraci mani issu presid engag engag climat chang
FOXNEWS,Special Report With Bret Baier,obama best thing could possibl happen get town week would annñ uncomfort week think one item could negoti im seriou climat chang
FOXNEWS,The Real Story With Gretchen Carlson,whitman back former bill clinton pollster ceo whitman insight strategi right two back studio real stori show democrat parti projob pro climat chang
FOXNEWS,Special Report With Bret Baier,littl effect fate mari landrieu howev presid indic past consid move environ term epa regul deal china climat chang
FOXNEWS,The Five,talk global warm everybodi know there climat chang there lot politician band gong environmentalist tom stier one
FOXNEWS,The Five,talk global warm everybodi know there climat chang there lot politician band gong environmentalist tom stier one
FOXNEWS,FOX and Friends Saturday,sleep though presid obama touch australia annual g econom summit fox news senior white hous correspond ed henri travel presid good morn ed good morn guy someth presid want talk climat chang
FOXNEWS,Special Report With Bret Baier,scientist declin camera interview say he alreadi get backlash pro global warm commun may face sea chang climat chang republican wave crest crash
FOXNEWS,Your World With Neil Cavuto,undergrad storm time like one im say didnt movement stick global warm chang climat chang bad market climat particular
FOXNEWS,FOX and Friends,climat chang presid obama strike climat deal china would cut greenhous ga emiss us third great agreement sign china hold us join us sister
FOXNEWS,FOX and Friends,weve got hollywood type everyon across board common theme tell theyr scare futur someth that concern lot peopl concern economi lot peopl worri global climat chang
FOXNEWS,Your World With Neil Cavuto,get hint thing go go believ put statement video say look winter pattern climat chang
FOXNEWS,Special Report With Bret Baier,offer measur vote hous presid obama burma tonight hour tri address yet anoth element foreign polici fail live expect left china presid struck deal climat chang
FOXNEWS,Bulls and Bears,screw go blame climat chang global warm say money stay still one there enough evid yet point fact crazi weather jona im keep money
FOXNEWS,The Real Story With Gretchen Carlson,there also focu carl levin michigan tie labor union that big play within democrat parti tradit blue collar labor union want see job mention begin catch mean environmentalist oppos climat chang
FOXNEWS,FOX News Sunday With Chris Wallace,fuel planet add equat dramat increas effect carbon pollut greenhous gase friend side agre real
FOXNEWS,FOX News Sunday With Chris Wallace,tar sand creat greenhous gase typic oil full capac pipelin would creat much carbon pollut million new car road what answer sir
FOXNEWS,Hannity,environment protect agenc shape rule regul emiss greenhous gase obvious supplement bunch stuff nobodi suggest isnt author doubl fuel effici standard car
FOXNEWS,FOX News Sunday With Chris Wallace,tar sand creat greenhous gase typic oil full capac pipelin would creat much carbon pollut million new car road what answer sir
FOXNEWS,FOX News Sunday With Chris Wallace,tar sand probabl filthiest fuel planet add equat dramat increas effect carbon pollut greenhous gase friend
FOXNEWS,FOX News Sunday With Chris Wallace,tar sand probabl filthiest fuel planet add equat dramat increas effect carbon pollut greenhous gase friend
FOXNEWS,FOX News Sunday With Chris Wallace,tar sand creat percent greenhous gase typic oil full capac pipelin would creat much carbon pollut five million new car road answer
FOXNEWS,Bulls and Bears,know trust celebr today feel confid tomorrow chase snow job snowstorm citi shovel shovel blame global
FOXNEWS,Your World With Neil Cavuto,cavuto know come see later forget arctic blast grip much face presid blast consum onslaught execut action global
FOXNEWS,Happening Now,report mcconnel boehner also say push legisl put peopl work portion keyston xl pipelin held state depart environment studi white hous spokesman josh earnest told cnn morn still clear would increas greenhous
FOXNEWS,The Five,make moral argument would want let slate someth need fact back doesnt say articl say scienc point human caus global
FOXNEWS,The Five,make moral argument would want let slate someth need fact back doesnt say articl say scienc point human caus global
FOXNEWS,FOX and Friends,forward interest statement thank join us vermont morn eye happen futur thank thank elisabeth well make green sermon one state offer preacher tax break talk global
FOXNEWS,Happening Now,senat floor expect argument issu mani democrat oppos white hous hint presid obama would veto democrat talk climat
FOXNEWS,Red Eye,flat insist center univers ignor pollut ga safe noth wrong cfc tell us climat
FOXNEWS,FOX and Friends,one major determin whether approv pipelin ship canadian oil world market unit state contribut greenhous gass caus climat
FOXNEWS,FOX News Sunday With Chris Wallace,greenhous ga pollut countri join us discuss john thune rhode island democrat sheldon whitehous senat whitehous one lead environmentalist
FOXNEWS,FOX News Sunday With Chris Wallace,presid obama reach deal china cut greenhous ga pollut countri join us discuss john thune rhode island democrat sheldon
FOXNEWS,Special Report With Bret Baier,immigr climat chang forget need lead global fight climat chang report leader found leadership spot massachusett senat elizabeth warren countri head wrong direct game
FOXNEWS,FOX News Sunday With Chris Wallace,say human activ add climat chang without get detail dont someth well look climat chang occur alway occur chri number factor contribut
FOXNEWS,The Kelly File,blame peopl everyth fals isi ebola would blame immigr climat chang believ climat chang theyv made scapegoat minut left want ask switch
FOXNEWS,On the Record With Greta Van Susteren,blame peopl everyth fals isi ebola would blame immigr climat chang believ climat chang theyv made scapegoat minut left want ask switch
FOXNEWS,The Kelly File,blame peopl everyth fals isi ebola would blame immigr climat chang believ climat chang theyv made scapegoat minut left want ask switch
FOXNEWS,FOX Report,doesnt think cute presid use speech brisban basic promot agenda term battl climat chang toni abbott said he skeptic climat chang here presid take
FOXNEWS,The OReilly Factor,tonight special respons lead global effort climat chang that today proud announc histor agreement critic say china con us climat chang issu tonight talook
FOXNEWS,The OReilly Factor,tonight special respons lead global effort climat chang that today proud announc histor agreement critic say china con us climat chang issu tonight take hard
FOXNEWS,Outnumbered,even interest environment committe current run liber democrat big global warm believ barbara boxer replac probabl jame inhoff conserv oklahoma
FOXNEWS,Shepard Smith Reporting,also got climat chang keyston xl pipelin get vote even though presid said would veto climat chang deal china want ask want ask one thing
FOXNEWS,FOX News Sunday With Chris Wallace,climat chang dont someth look climat chang occur alway occur number factor contribut includ human activ question go cost presid agre bad deal pain gain
FOXNEWS,FOX News Sunday With Chris Wallace,repres direct govern final move forward keyston xl pipelin presid obama reach deal china cut greenhous ga pollut countri discuss jonathan south john thunem
FOXNEWS,FOX and Friends First,talk presid obama promis drastic emiss cut part new climat deal china goal cut greenhous ga emiss us percent doubl pace
FOXNEWS,The OReilly Factor,look statesman like im im global warm warrior china worst pollut earth presid ginn
FOXNEWS,Hannity,fun question cold winter evelik morn midst global warm k stupid think nathan gruber
FOXNEWS,FOX and Friends,first go check martha mccallum what come top hour good morn strang outcom mani way presid trip china odd runin putin one side deal mani say climat
FOXNEWS,Red Eye,respons global warm support isi examin wick minut im dana perino greg
FOXNEWS,Your World With Neil Cavuto,busi network log find could imagin could nation climat changer stuck global warm thing awkward hear syndic
FOXNEWS,Shepard Smith Reporting,state around countri republican may tough time challeng deal sinc suprem court rule epa regul greenhous ga emiss pollut still first time chines agre
FOXNEWS,The OReilly Factor,ga guzzl bmw go huge driveway beauti lawn go local chop hous steak cow moo creat littl greenhous ga digest steak meat
FOXNEWS,Outnumbered,might make way peopl becom hyster fat peopl like epidem societi isi global warm fat peopl littl chunki
FOXNEWS,The OReilly Factor,usa chines work togeth work toke cut carbon emiss thought mani provok global warm say histor other say huge con
FOXNEWS,The OReilly Factor,cut carbon emiss thought mani provok global warm say histor other say huge con conserv blog red statecom nonbeliev
FOXNEWS,FOX and Friends,sticker ga pump warn consum burn fuel contribut global warm propon sticker hope motiv peopl drive less oil compani say
FOXNEWS,The OReilly Factor,francoi say global warm bad miller could lead war could lead war french get littl mellow dramat someon left bernais
FOXNEWS,The OReilly Factor,rain dont think laughter guy nut told holland global warm caus white hot hatr muslim immigr
FOXNEWS,The OReilly Factor,francoi say global warm bad miller could lead war could lead war french get littl mellow dramat someon left bernais
FOXNEWS,The OReilly Factor,rain dont think laughter guy nut told holland global warm caus white hot hatr muslim immigr
FOXNEWS,The OReilly Factor,week elect give propaganda though presid obama look statesman like im im global warm warrior china worst pollut earth
FOXNEWS,The OReilly Factor,california spend lot tax money one thing came global warm villain lawn miller lawn okay miller la
FOXNEWS,The OReilly Factor,motoriemot emiss isg world hotter ought asham miller here feel global warm cant jump ga guzzl bmw drive
FOXNEWS,The Five,look whoever could pay power guess sound like putin go russian want know al gore offend greenhous ga emiss hous like
FOXNEWS,Shepard Smith Reporting,limit greenhous ga emiss environmentalist welcom deal chines put new coal fire power plant line everi eight ten day air pollut beij bad liter close factori take car
FOXNEWS,Shepard Smith Reporting,old divid conclud strong global climat agreement next year report agreement commit chines max greenhous ga emiss doubl power gener nuclear energi shepard
FOXNEWS,The Journal Editorial Report,senat mark udal ran climat chang marx mark udal lost
FOXNEWS,The OReilly Factor,aa factor move along even denni miller worri global warm may caus war find that find that dick cabot patent sonic technolog
FOXNEWS,FOX and Friends,thank come one state pay pastor preach global warm guess pay cours stuart varney say presid immigr power move cost everi singl american household
FOXNEWS,Outnumbered,much oppon skeptic global warm said actual think would creat less gridlock reason republican
FOXNEWS,Your World With Neil Cavuto,listen gruber hardli singl incid whole global warm industri full gruber much american govern full gruber allegedli object consult rentseek suck
FOXNEWS,The OReilly Factor,aa factor move along even denni miller worri global warm may caus war find that dick cabot funniest american ever hope stay tune report
FOXNEWS,Bulls and Bears,warm get help white hous launch task forc help citi prepar global warm blenlg billion help nation fight gari b say enough alreadi
FOXNEWS,Bulls and Bears,differ reason im six feet right epicent global warm look im patch hole raft end day money well spent
FOXNEWS,FOX and Friends,form park lot unless start preach green thing sustain global warm stuff like heard think well cours first reaction
FOXNEWS,FOX and Friends Saturday,snowmageddon white hous get spend global warm get fire cost freedom come get redhead skeleton hoodi save johnni morri carbonlit baitcast reel
FOXNEWS,On the Record With Greta Van Susteren,sound smarter colleagu decad final box ador kitten racist respons global warm support isi examin
FOXNEWS,The Five,water someth get free billion spend twice much money global warm billion spend border secur dont think compar campaign contribut broader use money
FOXNEWS,The Five,love fact that opinion global warm base fact dont john deari wrote book poor peopl poor incom
FOXNEWS,Shepard Smith Reporting,consum onslaught execut action global warm welcom everyon im stewart neil cavuto world even republican take control congress report today presid plan bypass congress
FOXNEWS,Cashin In,footprint im privat jet use transport kind dont get global warm manmad come ridicul like fantasi
FOXNEWS,Cashin In,even jonathan would agre he made money want squander that busi spend busi cant automat deni global warm deni
FOXNEWS,The OReilly Factor,twitter tell us answer fun question cold winter evelik morn midst global warm thank join us well see back tomorrow night oreilli factor
FOXNEWS,FOX and Friends,could acceler global warm peopl outsid today said sound good time new york citi right wind chill degre degre warmer
FOXNEWS,Your World With Neil Cavuto,hank thank much much snow soon winter four week away forget global warm readi case global nation freez what go
FOXNEWS,The OReilly Factor,hit us global warm thing least wait feet snow thanksgiv basic level that bad time sell polici right know bob marley guy late bob marley jamaican sicker
FOXNEWS,The Five,improv situat global warm go forward well resourc develop better technolog eric alarm alway goe peopl use kind reason say your nice your selfish polit reason
FOXNEWS,The OReilly Factor,hit us global warm thing least wait feet snow thanksgiv basic level that bad time sell polici right know bob marley guy late bob marley
FOXNEWS,Special Report With Bret Baier,drive influenc thing ocean sun main point like polit weather driver local former colleagu univers washington agre global warm global
FOXNEWS,The OReilly Factor,dont love much truth serum everybodi come right back miller time charl manson get marri global warm war corpor pot high miller next patent sonic technolog
FOXNEWS,Justice With Judge Jeanine,got tonight red eye come red eye global warm chang face detroit better may want rethink holiday travel plan plu presid reconsid thought
FOXNEWS,Your World With Neil Cavuto,go one way look take exampl whole scientist agre global warm utterli fraudul number simpl true someth like john kerri peopl say
FOXNEWS,Forbes on FOX,sabrina like global warm know im sorri argument there scientif argument discuss peopl like lot issu talk today mike right dont want see
FOXNEWS,Cashin In,carbon air reason celebr love global warm issu environment make feel better democrat dont understand scienc dont understand scientist dont realiz theyr bad
FOXNEWS,Cashin In,resoundingli fact peopl back almost unequivoc lost across board thought stier million wast global warm well he entitl listen made money money spend howev want
FOXNEWS,The OReilly Factor,conserv blog red statecom nonbeliev global warm mr erickson think world warm cool sever billion year would put natur phenomenon camp feel cycl natur
FOXNEWS,Your World With Neil Cavuto,get pipelin pipelin first obamacar fix much much later byron york thank much thank talk global warm much nation deal arctic blast meteorologist deep
FOXNEWS,Americas Newsroom,vuitton ferragamo heather new report hous gop push rein nation scienc foundat accord politico republican quot plan push propos cut fund global warm social scienc research put strict new
FOXNEWS,The OReilly Factor,marri global warm war corpor pot high miller next im jane copd im dave copd im kate copd
FOXNEWS,The Five,improv situat global warm go forward well resourc develop better technolog eric alarm alway goe peopl use kind reason say your nice your selfish polit reason
FOXNEWS,FOX and Friends,fuel contribut global warm oil compani say pass sue violat first amend decis expect earli next year great freedom slip chart part new
FOXNEWS,The Five,washington post david nashou call climat chang polit selfish smear exempt
FOXNEWS,Americas Newsroom,kerri fossil fuel natur ga contribut climat chang greater threat russia china islamist
FOXNEWS,The OReilly Factor,franc jew told would confront know cold billi basic level could toll global warm alarmist freez tuka bad time
FOXNEWS,Red Eye,tonight red eye come red eye global warm chang face detroit better may want rethink holiday travel plan plu presid reconsid thought man land dont make sens
FOXNEWS,Bulls and Bears,white hous dig blitz global warm come amid winter cant say thank enough made life special apart everyon cheer glad made buddi thank invit
FOXNEWS,Bulls and Bears,gore world hope move keep money jessica think well first global warm hottest octob record storm place like buffalo direct
FOXNEWS,Bulls and Bears,billion hurrican sandi disput settl dont know global warm think money throw money gari right conclus evid mother natur
FOXNEWS,Hannity,cold winter evelik morn midst global warm thank join us well see back tomorrow night oreilli factor tonight paid defend law contracth
FOXNEWS,The OReilly Factor,franc jew told would confront know cold billi basic level could toll global warm alarmist freez tuka bad time
FOXNEWS,Cashin In,environ dont realiz theyr bunch hypocrit global warm manmad way hype actual juan fli privat jet dc new york give make carbon
FOXNEWS,FOX and Friends,school calendar appar offens muslim go talk presid obama cut deal presid china curb global warm guarante affect power bill maria bartiromo
FOXNEWS,The OReilly Factor,discuss glenn beck adren shutdown could futur controversi number front number one report earlier came big global warm deal paper sign
FOXNEWS,The OReilly Factor,know live univers california spend lot tax money one thing come global warm villain lawn lawn appar miller lawn emot
FOXNEWS,Your World With Neil Cavuto,decad centuri back forth design planet see individu winter act similar similar winter good thing drop global warm thing minut soon
FOXNEWS,The Five,david nashou call climat chang polit selfish smear exempt marshal fact suggest
FOXNEWS,Happening Now,push back climat chang war coal think white hous embrac make
FOXNEWS,The Five,bob your say someon disagre interpret fact immor believ lot stuff lot fact side global warm dont agre that fine said fact side
FOXNEWS,FOX and Friends,televis hear happen admit wonder kind drink one state pay pastor preach global warm sustain money come taxpay what
FOXNEWS,FOX and Friends Saturday,first billion that much tax money presid obama pledg help fight global warm around world that three time countri give next hour that long yearold polish woman
FOXNEWS,Red Eye,tonight red eye come red eye global warm chang face detroit better may want rethink holiday travel plan plu presid reconsid thought man land dont make sens true
FOXNEWS,The OReilly Factor,controversi number front number one report earlier came big global warm deal paper sign yeah improv thing deceas doesnt matter us
FOXNEWS,The OReilly Factor,global warm mr erickson think world warm cool sever billion year would put natur phenomenon camp feel cycl natur carbon emiss noth someth minuscul
FOXNEWS,FOX and Friends,year vote without environmentalist protest say pipelin creat global warm way activist wear whole bunch coat scarv brave degre temperatur dc brandnew report
FOXNEWS,The Five,bob your say someon disagre interpret fact immor believ lot stuff lot fact side global warm dont agre that fine said fact side
FOXNEWS,FOX News Sunday With Chris Wallace,im chri wallac congress get back work battl brew immigr obamacar climat chang would welcom presid move middl
FOXNEWS,Happening Now,hammer new trade agreement along controversi deal climat chang increas anti american rhetor china former cian
FOXNEWS,The Five,debat climat chang frame moral issu washington post columnist think greg take washington post
FOXNEWS,Your World With Neil Cavuto,washington natur human tendenc talk book seiv across ge lob yesterday passion climat chang legisl cap trade dont
FOXNEWS,FOX News Sunday With Chris Wallace,congress get back work battl brew immigr obamacar climat chang would welcom presid move middl first indic
FOXNEWS,Shepard Smith Reporting,done someth climat chang dealt ongo terrorist threat help bring stabil around world thing everi singl
FOXNEWS,The Five,okay next debat climat chang frame moral issu washington post columnist think greg take u
FOXNEWS,Your World With Neil Cavuto,market climat chang cover answer right got wild stuff thank god come attack school
FOXNEWS,Americas News Headquarters,immigr obamacar climat chang would welcom presid move middl first indic help there absolut reason cant work togeth
FOXNEWS,Your World With Neil Cavuto,stabl younger kid get better educ greater energi independ environ cleaner done someth climat chang dealt ongo
FOXNEWS,FOX Report,poke prime minist develop focu economi forget need lead global fight climat chang know that
FOXNEWS,The Five,think line jim assum fact evid bob still think earth flat nobodi deni climat chang accept bob apolog graciou
FOXNEWS,FOX News Sunday With Chris Wallace,never treatment climat chang serious look one side bunch job direct job good
FOXNEWS,On the Record With Greta Van Susteren,go record good night oreilli factor tonight special respons lead global effort climat chang that today proud
FOXNEWS,Bulls and Bears,get oil market wors pipelin option best want help environ consid tax kiss environmentalist doesnt actual help global warm anyth better way presid deal issu fight thing time
FOXNEWS,Americas Newsroom,threaten unilater action take unilater action global climat chang presid reckless write support pipelin
FOXNEWS,FOX News Sunday With Chris Wallace,im chri wallac congress get back work balesrew im congress get back work immigr climat chang obamacar would welcom presid move middl
FOXNEWS,MediaBuzz,im chri wallac congress get back work balesrew im congress get back work immigr climat chang obamacar would welcom presid move middl
FOXNEWS,The Five,msm say dont want cover stori block immigr c climat chang three issu predic
FOXNEWS,Americas Election HQ,democrat want look he got problem parti obama agenda right push sweep intern climat chang keyston xl pipelin
FOXNEWS,Americas Newsroom,white hous give away store china get noth return new climat chang agreement us set stringent new goal slash coal emiss home china
FOXNEWS,Americas Newsroom,number agreement struck look climat chang deal us cut emiss go go
FOXNEWS,Hannity,india climat chang import presid trip oversea particular chines tri curb carbon emiss reduct ebola
FOXNEWS,FOX Report,make friend australia climat chang tell us well probabl upset australian prime minist toni abbott littl bit pose coupl time kuala
FOXNEWS,Special Report With Bret Baier,cant interpret law use way epa essenti take energi economi name global warm think done think republican ought give shot go presid desk steve happen
FOXNEWS,The Journal Editorial Report,well think interest that one place countri trier spend money climat chang messag place loser doesnt talk real
