Station,Show,Snippet
FOXNEWS,Americas Newsroom With Bill Hemmer and Sandra Smith,global warm technolog feel fact dont know true today true spoke microsoft stock valu compani world
FOXNEWS,Fox and Friends First,real indign deliv protest yellow vest protest demand especi ga tax hike global warm protest began increas minimum wage tax overtim use
FOXNEWS,Watters World,properti one pay im surpris complain christma light promot global warm that would assum would complain remind clark
FOXNEWS,Tucker Carlson Tonight,polit parti contin tie say financ peopl welfar nobodi seek rais carbon tax fight global warm ive heard
FOXNEWS,Special Report With Bret Baier,fuel rais fund renumb energi counter global warm furi across franc peopl said care food tabl warmth home dont give damn
FOXNEWS,Americas News HQ,solar mani environmentalist tha global warm threat fa gone urgent stop new fossil fuel keep ground strategi work far
FOXNEWS,Tucker Carlson Tonight,whole bunch peopl question global warm seen europ immigr dictat peopl that never subject ramif
FOXNEWS,Americas News HQ,els mani environmentalist use see ga clean bridg fuel say global warm urgent one use fossil fuel industri say william
FOXNEWS,Tucker Carlson Tonight,tucker go back michael bloomberg anoth billionair may readi selffund presidenti campaign global warm gun grab central focu american peopl
FOXNEWS,Tucker Carlson Tonight,michael bloomberg stand well back w michael bloomberg anoth billionair may readi self fund presidenti campaign global warm gun grab central focu american peopl
FOXNEWS,Special Report With Bret Baier,call green new deal talk carbon tax talk posit thing know messag make peopl worri rais cost talk massiv
FOXNEWS,The Journal Editorial Report,govern paul kim washington state novemb referendum second time washington state recent year went overwhelm defeat impos carbon tax rememb toni abbott former prime minist australia
FOXNEWS,Your World With Neil Cavuto,implement carbon tax fuel suppos go effect januari st go june st protest die maria basic peopl say look dont want increas
FOXNEWS,Fox News  Night With Shannon Bream,problem shannon green tax polici carbon tax idea sold way help entir world globe becom better environ us truth hurt poor
FOXNEWS,Tucker Carlson Tonight,gasolin tax french govern rais gasolin tax obvious climat agenda washington peopl care russia bare notic think carbon tax still great idea great idea outgo
FOXNEWS,Tucker Carlson Tonight,here happen carbon tax suddenli privat jet instead hour tax burn fossil fuel suddenli cost hour tucker guess take
FOXNEWS,The Ingraham Angle,world laura reject franc reject franc brazil new govern foreign minist call marxist hoax buy carbon tax rebellion donald trump critic
FOXNEWS,Tucker Carlson Tonight,nationwid carbon tax california radio host join us tonight much come think pretti clear happen franc may public global isnt board peopl care
FOXNEWS,Tucker Carlson Tonight,libertarian import show privat airport put prison im actual littl bit here happen carbon tax suddenli privat jet instead
FOXNEWS,Tucker Carlson Tonight,view around world carbon tax go kill american energi independ someth interest happen right race new energi economi probabl go either us china china make huge
FOXNEWS,Hannity,along climat chang paper fill antitrump
FOXNEWS,Americas Newsroom With Bill Hemmer and Sandra Smith,diesel fuel govern respons said global warm turn broader protest high tax low wage govern thought touch peopl cours mean french
FOXNEWS,Fox News  Night With Shannon Bream,protest say rural worker unfairli target riot poulin host import want meet global warm sinc pari deal deleg nearli countri discuss shift away fossil fuel
FOXNEWS,Tucker Carlson Tonight,seek rais carbon tax fight global warm ive heard absolut import realiz pari your look gallon fuel almost half tax follow un
FOXNEWS,The Five,connect workingclass voter countri fixat democrat global warm ident polit young peopl west virginia rust belt say famili american
FOXNEWS,Hannity,jerri moonbeam brown lectur democrat parti theyv gotten far left mayb theyv gotten far left governor probabl think global warm bigger peril al gore
FOXNEWS,Tucker Carlson Tonight,laughter go big pharma would roar compani extort poor american life eye save drug like autom trade global warm doesnt matter america vulner hurt actual vulner
FOXNEWS,Tucker Carlson Tonight,tumultu end year like algorithm fell face eggnog french riot month emmanuel macron govern tri impos antiglob warm ga tax upon nevertheless lot
FOXNEWS,Tucker Carlson Tonight,realli fair put tax individu tucker fair someon tell us planet destroy live way suggest actual believ planet destroyedng honestli realli dont get al gore say noth import climat
FOXNEWS,Special Report With Bret Baier,american progress tweet dont understand progress cheer french protest mass carbon tax real divid want tackl especi come left side american
FOXNEWS,The Ingraham Angle,ga tax gallon diesel un climat expert want transfer lot wealth corrupt third world countri estim year go need carbon tax equival
FOXNEWS,The Journal Editorial Report,paul right senat go fascin watch appreci thank paul come back global carbon tax revolt protest continu pari even french presid emanuel rock pull macron pull plug plan fuel
FOXNEWS,The Journal Editorial Report,actual go get rid tax institut carbon tax see addit form taxat top alreadi term tough energi tax especi gasolin tax etc
FOXNEWS,The Journal Editorial Report,one want go there also belief money would rais carbon tax would actual put kind renew energi invest strategi smarter climat know go get
FOXNEWS,Fox News  Night With Shannon Bream,countri squeez middl class environment taxat polici global carbon tax revolt editori board right french latest refus sacrific growth green pieti let get democrat strategist isaac wright fox news contributor
FOXNEWS,FOX  Friends,franc middl class theyr protest carbon tax exactli worldwid left want happen unit state steve go forward big question peopl franc nation your go spend much
FOXNEWS,The Ingraham Angle,bottom line carbon tax would increas admiss hamstr develop world unit state canada western europ that go move industri china place without peer review show admiss decad
FOXNEWS,Tucker Carlson Tonight,well washington peopl care russia bare notic think carbon tax still great idea great idea outgo arizona senat jeff flake team delawar democrat chri coon impos
FOXNEWS,FOX  Friends,retir end year goe want rais tax im kid promin antitrump teem one chri coon carbon tax bill match one hous introduc last month next guest say bill
FOXNEWS,FOX  Friends,nation carbon tax energi tax everyth buy everyth travel everi time go groceri store go cost understand unpopular voter even blue area countri everi time voter face
FOXNEWS,Tucker Carlson Tonight,lead everi onet newscast tucker yeah isnt climat chang doesnt realli matter let take serious second theyr alway tell us let take say face valu care deepli climat chang care deepli say believ destruct planet immin say live
FOXNEWS,FOX  Friends,tax hike punish worker name global warm bottom line know say whatev want donald trump donald trump puls peopl want listen peopl know that
FOXNEWS,Tucker Carlson Tonight,power subcommitte janet yellen came talk global warm way back im date littl bit even back knew immedi thing may could law physic
FOXNEWS,Hannity,governor probabl think global warm bigger peril al gore want singl payer want bullet train nowher he lectur democrat parti go far left think sign
FOXNEWS,Fox News  Night With Shannon Bream,support moment report given govern rigor instruct begin report deliv specif yellow vest protest demand includ ga tag hike aim deal global warm protest began increas
FOXNEWS,FOX  Friends,use less ga conform pari climat accord lesson left america keep rais tax like global warm problem hand steve kid anoth one
FOXNEWS,Fox News  Night With Shannon Bream,fuel protest report third straight weekend protest pari across franc gener diesel tax curb global warm grown larger issu whatev presid macron tax slowli sure
FOXNEWS,Hannity,governor jerri moonbeam brown lectur democrat parti theyv gotten far left mayb mayb theyv gotten far left governor probabl think global warm bigger peril al gore
FOXNEWS,Fox News Sunday With Chris Wallace,instabl extrem poverti talk countri like us northern climat chang chang thing
FOXNEWS,Fox News Sunday With Chris Wallace,instabl extrem poverti talk countri like us northern climat chang chang thing
FOXNEWS,FOX  Friends,see franc net effect steve cost fuel realli hit work poor middl class chuck year unit nation climat report call carbon tax per ton equal
FOXNEWS,Tucker Carlson Tonight,becom compon debat next elect nomin think carbon tax becom compon think becom litmu test democrat candid tri seek democrat nomin presid theyv got care bob thought
FOXNEWS,Fox and Friends First,violent protest new carbon tax forc back prime minist admit would tough take notic anger french work hard difficult time make end meet anger french peopl
FOXNEWS,FOX  Friends,democrat idea brian come yellow vest last time tri carbon tax riot everi weekend last six week hurt lower middl class understand aim cheaper energi that greener
FOXNEWS,Tucker Carlson Tonight,money let make choic want bill propos carbon tax propos unit state propos supposedli give money back household here one big problem
FOXNEWS,Fox and Friends Sunday,welcom back quick headlin democrat happi nanci pelosi climat crisi committe progress self describ like congresswoman elect socialist bronx call ineffici step
FOXNEWS,Watters World,migrant caravan peopl interview talk flee violenc didnt hear anyth below climat chang hondura
FOXNEWS,Americas Newsroom With Bill Hemmer and Sandra Smith,tax govern respons global warm gone antitax movement well cri higher wage complaint govern thought touch peopl french peopl pick piec
FOXNEWS,Tucker Carlson Tonight,janet yellen came talk global warm way back im date littl bit even back knew immedi thing may could law physic point time mean
FOXNEWS,Fox and Friends First,respons renew energi encount global warm furi across franc peopl said care food tabl warmth home dont give damn want enough money end month
FOXNEWS,Fox News  Night With Shannon Bream,presid macron tax global warm come much larger issu one presid macron green tax mani peopl say slowli sure start eat averag man dollar four peopl kill sinc protest start
FOXNEWS,Americas News HQ,regul legisl activist offend say global warm real present danger keep coal oil ga ground way avert climat catastroph talk compani would take oil ga public land
FOXNEWS,The Journal Editorial Report,extent carbon tax ever ballot politician make top prioriti ballot vote someth voter favor paul mari briefli there disconnect elit
FOXNEWS,Fox News  Night With Shannon Bream,shannon benjamin hall thank franc warn rest world happen countri squeez middleclass environment taxat polici global carbon tax revolt wall street editori board right french latest refus sacrific growth greed pieti
FOXNEWS,Fox News  Night With Shannon Bream,peopl blame rise cost live govern look increas polic power protest initi complain sharp increas diesel tax alon year presid macron said necessari curb global warm protest say rural worker unfairli target
FOXNEWS,The Daily Briefing With Dana Perino,chang countri climat chang situat work togeth answer respond situat
FOXNEWS,Fox and Friends First,practic end deport border capitol hill peopl arrest protest climat chang outsid nanci pelosi offic group tri ralli
FOXNEWS,Tucker Carlson Tonight,climat chang serious must denier everi privat plane ban make expens think twice
FOXNEWS,Tucker Carlson Tonight,run citi comparison what come yeah thing bloomberg emphasi climat chang gun control indic that ex
FOXNEWS,Fox and Friends Saturday,climat chang issu import know someon minim real issu need bureaucraci way hypocrit
FOXNEWS,Fox and Friends Sunday,salut honor american hero rachel well done ed nanci polo new climat crisi committe surprisingli democrat happi fresh fallout left come speed look
FOXNEWS,Fox and Friends First,two charg violat campaign law back august fire democrat climat chang want parti embrac new deal
FOXNEWS,FOX  Friends,word warn first mani peopl arrest protest climat chang outsid nanci pelosi offic capit cop say unlaw demonstr final zero dollar
FOXNEWS,Fox and Friends Sunday,climat chang iowa home first contest primari caucu season eric holder also head hawkey state talk redistrict vote right
FOXNEWS,FOX  Friends,ocasiocortez illumin agenda liber agenda frankli around lot longer concern climat chang chuck devor thank
FOXNEWS,Fox News  Night With Shannon Bream,best downplay current rioter protest tax increas macron put get deal fight climat chang specif
FOXNEWS,Tucker Carlson Tonight,pari throughout franc climat chang tell lot attitud peopl charg investig break
FOXNEWS,The Next Revolution With Steve Hilton,fight climat chang go confer guess might call inconveni truth pretti inconveni go around say trump
FOXNEWS,Americas News HQ,that go pay attent arthel well leav gener jack kean thank much eric climat chang focu deleg
FOXNEWS,Americas News HQ,argument peer climat chang stop burn fossil fuel mean oil explor new natur ga drill new strategi
FOXNEWS,Special Report With Bret Baier,plan one final act state leader defi trump administr view climat chang cloudi report move truli world california governor jerri brown
FOXNEWS,Fox News  Night With Shannon Bream,california governor plan anoth move defi trump administr push climat chang agenda claudia cowan report move truli world report jerri brown
FOXNEWS,Fox and Friends Sunday,challeng judici nomine belong knight columbu member cathol organ respond next nanci pelosi new climat crisi committe democrat happi fresh fallout next
FOXNEWS,Fox News  Night With Shannon Bream,noth frosti someth relat climat chang thank much fox news alert associ press report flurri new activ robert mueller team interview toni
FOXNEWS,FOX  Friends,demand democrat climat chang brian tribut found tresiba® reason im lower ac daili tresiba® control blood sugar hour
FOXNEWS,The Next Revolution With Steve Hilton,name climat chang what also iron think french presid thumb nose presid trump pull climat record sign
FOXNEWS,Fox and Friends First,asid pay much attent climat chang problem outsid europ seen economi slow part gone green great
FOXNEWS,Fox News  Night With Shannon Bream,environ there big differ pollut climat chang see bureaucrat across world take control environ peopl live
FOXNEWS,Tucker Carlson Tonight,climat agenda presid implement state purpos fight climat chang fight citizen instead claimant agenda alway crush middl class
FOXNEWS,Tucker Carlson Tonight,utterli alter us economi tucker here im confus understand peopl sincer concern climat chang get im deni exist solut baffl
FOXNEWS,Fox News  Night With Shannon Bream,accus turn blind eye climat chang may hit road bump place like ohio pennsylvania pennsylvania donald trump vow protect
FOXNEWS,Fox News Sunday With Chris Wallace,need thing africa chri seem climat chang could acceler bad thing term agricultur product global health
FOXNEWS,Fox News Sunday With Chris Wallace,need thing africa chri seem climat chang could acceler bad thing term agricultur product global health
FOXNEWS,Watters World,berni sander claim climat chang migrant caravan connect narrat typic vacuum head limit shark invent duo clean deep clean carpet ad soft brush roll
FOXNEWS,Americas News HQ,work argument climat chang way stop stop burn fossil fuel mean new oil coal natur ga
FOXNEWS,Watters World,berni sander claim climat chang migrant caravan connect guy time nothin happenin well there score forc factor rev libido maxim physic respons
FOXNEWS,Americas Newsroom With Bill Hemmer and Sandra Smith,offici face anoth destruct away heather plu jerri brown vow fight climat chang want take matter hand tell
FOXNEWS,Fox and Friends Saturday,taxpay financ california back forth dc republican dont care climat make mistak besid resist climat chang religion left
FOXNEWS,Tucker Carlson Tonight,go big pharma would roar compani extort poor american life save drug like autom trade global warm doesnt matter america vulner hurt actual vulner peopl one dc particularli one left seem care constitu debat wall
FOXNEWS,Fox and Friends First,carley jeff flake time end year goe want rais tax promin antitrump team chri coon push senat version carbon tax bill match hous introduc last month mean wallet cpa financi analyst dan geltrud
FOXNEWS,Hannity,turn social high tax govern enforc claimant shame didnt exactli lead societ euphoria instead push massiv climat chang agenda put bigger burden
FOXNEWS,Fox News  Night With Shannon Bream,administr scientist climat chang opportun invest grow economi root china follow billion far creat new job opportun
FOXNEWS,Tucker Carlson Tonight,go ban privat air travel climat chang seriou next essenti right human race talk tax everyon els like peopl
FOXNEWS,Special Report With Bret Baier,came climat chang realli specif tri clamp depart issu big report come tell assess report wish would actual
FOXNEWS,Tucker Carlson Tonight,say run fight climat chang top prioriti campaign cours emmanuel macron becam presid franc similar agenda face riot
FOXNEWS,Tucker Carlson Tonight,run citi mark comparison come well yeah thing bloomberg emphasi climat chang gun control that extent still
FOXNEWS,FOX  Friends,renew environment activist head capitol hill today fire democrat climat chang group sunris movement want parti embrac green new deal
FOXNEWS,Special Report With Bret Baier,that social background crisi bret interest watch politician peopl countri especi left start climat chang effort fuel tax center
FOXNEWS,Fox and Friends First,impeach proceed meantim michael bloomberg take tour iowa eye toward former new york citi mayor visit new documentari climat chang bloomberg took shot donald trump
FOXNEWS,Fox and Friends First,could mean amazon order preach effect climat chang never guess much berni sander drop privat jet sail across countri campaign
FOXNEWS,The Ingraham Angle,event dont happen schedul right climat chang real happen seen evid laura alway happen year major storm california wildfir problem
FOXNEWS,The Story With Martha MacCallum,creat job clean polit cleaner environ address climat chang realli saw issu spoke peopl district look candid someon
FOXNEWS,Fox News  Night With Shannon Bream,american peopl like mind democrat republican found common ground came togeth common good put countri ahead parti got thing done think climat chang huge
FOXNEWS,Tucker Carlson Tonight,climat chang agenda crush middl class everi countri includ franc first tonight mueller pro continu hurt peopl clearli connect russian spi vladimir putin
FOXNEWS,Fox and Friends First,protest climat chang agenda announc suspens later today week violent protest throughout countri protest pool meet govern offici ambul driver join movement use dozen
FOXNEWS,Tucker Carlson Tonight,thousand peopl would die climat chang two leftw billionair want next presid one along feder govern unfortun financ
FOXNEWS,Fox and Friends Sunday,he got show he bit climat chang he tri rais price ga use less pollut less he also run socialist
FOXNEWS,Tucker Carlson Tonight,deepli deepli concern climat chang much concern deeper thought compassion peopl berni sander exampl deepli concern donald trump spoke last night somehow forgot
FOXNEWS,FOX  Friends,ainsley eye wear sunglass steve senat berni sander lot say climat chang futur planet stake directli relat growth terror steve talk
FOXNEWS,Fox News  Night With Shannon Bream,issu democrat took swipe climat chang skeptic god sake get save want go doctor dont think want best scienc
FOXNEWS,Tucker Carlson Tonight,fuel right away see sign wild fire california huge hurrican thing happen climat chang your right major corpor major corpor respons
FOXNEWS,Cavuto Live,surtax climat chang like enough got ta see middl greg paltrow wish
FOXNEWS,The Next Revolution With Steve Hilton,period fact capita trump america nearli year low turn energi deregul fight climat chang go confer guess might call inconveni truth
FOXNEWS,Tucker Carlson Tonight,franc still burn tonight effort impos child know climat chang agenda congress anxiou give detail break tucker secretari defens gener jame matti
FOXNEWS,Special Report With Bret Baier,rather fight everi drill permit new power plant environmentalist battl climat chang new strategi stoploss product ever get market speak goal keep ground
FOXNEWS,Special Report With Bret Baier,report rather fight everi drill perman powerpl environmentalist battl climat chang new strategi stop fossil fuel product get market goal keep fossil fuel ground dont
FOXNEWS,The Ingraham Angle,democrat today washington post solut climat chang brandnew carbon tax govern incent altern join debat brad johnson cofound well mark moor
FOXNEWS,The Ingraham Angle,climat chang harm caus american world alreadi today laura go cite fund scientist that debunk cross
FOXNEWS,The Ingraham Angle,today washington post solut climat chang brandnew carbon tax govern incent altern join debat brad johnson cofound well mark moor
FOXNEWS,The Ingraham Angle,presid ultim travel ban suprem court everi issu transgend peopl serv militari climat chang censu keyston pipelin activist judg wage
FOXNEWS,The Ingraham Angle,travel ban suprem court everi issu transgend peopl serv militari climat chang sens keyston pipelin activist judg wage assault trump agenda
FOXNEWS,Special Report With Bret Baier,ga product bret see data believ man caus climat chang doubt mind climat chang alway chang chang way dont understand bret mention
FOXNEWS,Special Report With Bret Baier,state legislatur dictat term feder govern ye decis upheld court nation park servic report delet mention human caus climat chang direct absolut patent fals
FOXNEWS,Fox News  Night With Shannon Bream,vote matter primari season california governor take climat chang fight space go launch satellit figur pollut go end
FOXNEWS,The Journal Editorial Report,lousiest idea democrat ever know she bit young might rememb decad ago also barack obama climat chang ambit ran bill play small role democrat lose hous
FOXNEWS,Tucker Carlson Tonight,billion fortun win recent interview bloomberg say run fight climat chang top prioriti campaign cours emmanuel macron becam presid franc
FOXNEWS,Americas News HQ,compromis climat chang health care incom inequ time step forward show american peopl trump stand liber
FOXNEWS,Fox and Friends Saturday,nanci pelosi announc climat crisi committe investig get jet fli thousand mile hawaii burn fuel everyon entitl holiday got back florida wont hypocrit want
FOXNEWS,Tucker Carlson Tonight,reveal ask climat chang inde existenti threat say would support ban privat jet travel deepli moral peopl ask obvious care
FOXNEWS,Tucker Carlson Tonight,tucker that pari war zone dana perino host daili brief cours dana perino great see thank tucker think argument whether climat chang happen less
FOXNEWS,Fox and Friends First,ga tax hike support climat chang agenda live look russia rotunda presid georg hw bush lie state nation gear say final farewel presidenti historian jane hansen cook reflect
FOXNEWS,The Ingraham Angle,right climat chang real happen weve seen evid laura alway happen yeah year major storm california wild fire problem address scientist
FOXNEWS,FOX  Friends,europ pay go work theyr prepar accept french worker went strike theyr riot street pay climat chang theyr pay buck gallon
FOXNEWS,Fox News  Night With Shannon Bream,climat chang research govern step back privat sector step kristin fisher return report breakthrough commerci spaceflight milliondollar view window shannon first time peopl launch space us
FOXNEWS,The Daily Briefing With Dana Perino,climat chang deal els get mock ridicul front intern commun that exact wrong way go bring unit state along theyr tri although appropri
FOXNEWS,Tucker Carlson Tonight,includ franc fall franc began implement ga tax prevent climat chang fourth week row citi pari rock riot mass protest citi burn show
FOXNEWS,The Journal Editorial Report,strike averag person nut alway ernlt dilemma center climat chang propos theyr propos econom polici peopl would push back guess
FOXNEWS,Tucker Carlson Tonight,tout new york time cnn said economi would smaller year thousand peopl would die climat chang report peopl behind studi
FOXNEWS,FOX  Friends,tax particular ga tax one reason essenti carbon tax fossil fuel pari climat chang crisi solv ainsley guess happen morn decid suspend
FOXNEWS,FOX  Friends,pull climat climat chang riot afford your leonardo dicaprio your like french guy live countrysid tough drive work afford seven buck gallon ga
FOXNEWS,Tucker Carlson Tonight,chang seriou might render live without mean fire flood store famin effect climat chang around us accord news essay pen bill mci bon shrink world
FOXNEWS,Tucker Carlson Tonight,climat chang told us issu matter arent live like issu matter come industri industri want make plane exist renew energi rather
FOXNEWS,FOX  Friends,climat chang berni explain spend travel privat jet ainsley plu mega morn deal throw blanket christma bargain come
FOXNEWS,FOX  Friends,mean breakfast said might breakfast realli look forward breakfast know voya help retir steve senat berni sander wont stop talk climat chang donald trump spoke last
FOXNEWS,FOX  Friends,directli relat growth terror steve okay turn sander concern climat chang spent nearli nine day fli around privat jet reaction marc morano execut director
FOXNEWS,Fox News  Night With Shannon Bream,turn blind eye climat chang new york mayor expert point messag may hit road bump place like ohio pennsylvania michigan state presid trump fail protect coal
FOXNEWS,Fox News  Night With Shannon Bream,climat chang theyr go place like south carolina also iowa think play think michael bloomberg high suppli liber democrat parti go embrac father stop
