Station,Show,Snippet
FOXNEWS,FOX News Watch,produc anyway canadian say west coast asia isnt keyston gulf coast would happen us job lost noth global warm climat chang impact
FOXNEWS,FOX and Friends Sunday,recent wall street journal ope scientist wrote there compel scientif evid drastic action global warm
FOXNEWS,FOX News Sunday With Chris Wallace,airlin help caus econom collaps gingrich cash freddi mac paid hour team nanci pelosi global warm sponsor
FOXNEWS,Greta Van Susteren,use he go face campaign cover lot ground flip flop whether gun abort global warm
FOXNEWS,FOX News Sunday With Chris Wallace,think conserv valu play enor enormou speaker explain sit sofa nanci pelosi argu climat chang regul
FOXNEWS,FOX News Sunday With Chris Wallace,select nomine think conserv valu play enor enormou speaker explain sit sofa nanci pelosi argu climat chang regul
FOXNEWS,Happening Now,think itd weak take someon nomin governmentmand health care system would requir everybodi buy health insur feder level someon wall street bailout someon cap trade believ hoax global warm
FOXNEWS,Americas News Headquarters,say reliabl conserv dont think religion go play big factor select nomine think speaker explain sit sofa nanci pelosi argu climat chang
FOXNEWS,Studio B With Shepard Smith,global warm thing know seriou
FOXNEWS,The Five,plu say real kimberli still get spray eric global warm overtalk greg problem global warm show get control go break
FOXNEWS,Americas News Headquarters,civil right say peopl cant chang mind front runner republican parti chang everi singl issu women issu climat
FOXNEWS,The OReilly Factor,help global warm caus check four chri christi take prison realli
FOXNEWS,The OReilly Factor,bill kind hot rhetor help global warm caus check four chri christi take prison
FOXNEWS,America Live,terribl legisl massachusett veto stood famili valu peopl suprem court decis massachusett kept massachusett cap trade region greenhous ga initi know
FOXNEWS,The Five,bob overwhelm plu say real kimberli still get spray eric global warm overtalk greg problem
FOXNEWS,FOX News Sunday With Chris Wallace,well dont think final analysi religion go playal big factor select nomine think conserv valu decemb play enorm role think speaker hao explain sit sofa nanci pelosi argu climat
FOXNEWS,Happening Now,decad epa order heavi truck sold us includ truck made mexico reduc greenhous ga emiss percent engin must becom fuel effici start model built basic mean virtual everi trucker
FOXNEWS,FOX and Friends Saturday,clayton govern step pay dave teach concept global warm middl schooler let us know feel
FOXNEWS,FOX and Friends Sunday,mention costa concordia half submerg run aground coast itali ali alisyn dave global warm real done
FOXNEWS,FOX and Friends,al gore get rich global warm pseudo scienc yeah im pretti much think overreact let tell someth steve come playbook liber idiocrari
FOXNEWS,FOX and Friends,three year day cant period time know that true washington know polit polit polit juan polit environmentalist got hurt greenhous ga revers obama administr
FOXNEWS,FOX and Friends Sunday,join forc debunk myth global warm hear say time panic gun sure wasnt easi difficult
FOXNEWS,FOX News Sunday With Chris Wallace,help caus econom collaps gingrich cash freddi mac paid hour team nanci pelosi global warm sponsor bill gave million
FOXNEWS,Your World With Neil Cavuto,issu opportunist career like say thing popular whether sit couch nanci pelosi global warm go disclaim
FOXNEWS,FOX and Friends Saturday,speaker throw year term conserv tri throw altern dont go attack capitalist system altern dozen promot global warm argu individu mandat
FOXNEWS,The Five,primari coverag current tv vote ocean current four viewer talk global warm part campaign think soc free govern
FOXNEWS,The Five,kimberli dana made priceless facial express hear dana could deja vu global warm al gore gabriel gifford blame tea parti
FOXNEWS,The Five,littl leagu greg happi roll expert academ push crap shouldnt crawl broken glass apolog dana global warm academ walk shame
FOXNEWS,The Five,shouldnt crawl broken glass apolog dana global warm academ walk shame bob segment eric kid grow becom teacher dont forget teacher
FOXNEWS,Stossel,hour team nanci pelosi global warm sponsor bill gave million year un program support china brutal one child polici support tax payer fund abort
FOXNEWS,FOX and Friends Saturday,dave teach concept global warm middl schooler argu perfect scienc taxpay dollar go environment justic follow us twitter need follow
FOXNEWS,The OReilly Factor,cite bill conserv hypocrisi hypocrisi okay im sure hippo critic deviat guy prone go latest idea like global warm bill everybodi knew big target
FOXNEWS,FOX and Friends,dead bodi newt doesnt bodi bag heavi sack behind let honest sack marriag sack endors global warm polici trampl paul ryan
FOXNEWS,The Five,current four viewer talk global warm part campaign think soc free govern peopl one nation best chanc leav world
FOXNEWS,The Five,global warm show get control go break one thing come us confess one thing know mine
FOXNEWS,FOX and Friends Saturday,reagan conserv didnt support bailout couch nanci pelosi talk global warm path legal countri illeg immigr that reagan conserv three disticket
FOXNEWS,FOX and Friends Sunday,need global warm time well first there almost warm ten year clear comput model frighten everyon greatli exagger
FOXNEWS,Special Report With Bret Baier,noth cole epa shut mine mine regul mine cant meet go anyth help global warm chines build
FOXNEWS,FOX News Sunday With Chris Wallace,bill claud dean snyder bill rhode island gener good govern bill second fact team point nanci pelosi global warm dumbest thing done
FOXNEWS,The OReilly Factor,paul ryan plan bill guy whatev audienc love global warm audienc hate paul ryan plan front mainstream media audienc bill he found groov hell say whatev
FOXNEWS,America Live,thing weve heard deal increas tax top earner fair societi talk global warm green energi stuff like dealt issu weve heard
FOXNEWS,FOX and Friends Sunday,say evid global warm counter well global mean averag entir globe look satellit measur temperatur look
FOXNEWS,FOX and Friends Sunday,dont believ there reason panic ope need compet global warm rodney nichol new york economi scienc thank come share perspect thank dont call food
FOXNEWS,FOX News Sunday With Chris Wallace,pelosi global warm dumbest thing done done recent year sit couch pelosi conced clean hit fact technic accur say jump
FOXNEWS,The OReilly Factor,fossil fuel bill fair say unmitig disast anoth global warm play anoth environment thing want volt work think yeah absolut bill would love
FOXNEWS,America Live,stood squall street bailout gingrich romney didnt buy hoax global warm propos cap trade go list real litmu test issu
FOXNEWS,The OReilly Factor,fossil fuel bill fair say unmitig disast anoth global warm play anoth environment thing want volt work think yeah absolut bill would love
FOXNEWS,The OReilly Factor,fossil fuel bill fair say unmitig disast anoth global warm play anoth environment thing want volt work think yeah absolut bill would love
FOXNEWS,FOX and Friends Saturday,leadership unit state hous repres speaker three year term conserv tri throw conserv altern dont go attack capitalist system done conserv dont promot global warm ore
FOXNEWS,FOX and Friends Sunday,though say feccolken val focus valu issu want talk defens issu like nra want talk candid posit global warm nra one issu
FOXNEWS,Special Report With Bret Baier,cole epa shut mine mine regul mine cant meet go anyth help global warm chines build cold pac week export
FOXNEWS,Americas News Headquarters,agre countri must take action address climat chang enough us demand action leader togeth
FOXNEWS,Americas News Headquarters,look endors individu mandat ad cut nanci pelosi climat chang character ryan budget right wing social
FOXNEWS,Special Report With Bret Baier,go effect global warm assum connect bret second local stuff second local stuff idea nebraska sand hill dead kale ecolog spot cant pipelin today nebraska
FOXNEWS,Greta Van Susteren,carolina okay know campaign cover lot ground flipflop mitt made whether gun abort whether tradit marriag whether global warm he go come
FOXNEWS,Stossel,one person tell may bad idea shouldnt repeat idea deal global warm problem scientif valid show reput would show kind
FOXNEWS,Americas Election HQ,carolina okay know campaign cover lot ground flipflop mitt made whether gun abort whether tradit marriag whether global warm he go come
FOXNEWS,Stossel,second fact team point nanci pelosi global warm dumbest thing done done recent year sit couch pelosi conced clean hit
FOXNEWS,Special Report With Bret Baier,go effect global warm assum connect bret second local stuff second local stuff idea nebraska sand hill dead kale ecolog spot cant pipelin today nebraska
FOXNEWS,Happening Now,oil good know global warm whatev yeah jon send china like theyr go eat mean theyr go burn anyway right laughter world go
FOXNEWS,Greta Van Susteren,obamacar new hampshir stand say believ global warm need someth tiger didnt chang tripe stripe said ill differ run john
FOXNEWS,The Five,priceless facial express hear dana could deja vu global warm al gore gabriel gifford blame tea parti said ridicul say say
FOXNEWS,Hannity,out newt mitt wall street bail out go list global warm sit couch nanci pelosi cast conserv great record
FOXNEWS,The OReilly Factor,gingrich past experi suck whatev audienc hell ask paul ryan plan bill guy whatev audienc love global warm audienc hate paul ryan plan front mainstream media audienc
FOXNEWS,Red Eye,stood said global warm reduc emiss much import anyth els ruin entir reput compani stock order prove point didnt look way right charli first thought
FOXNEWS,The Five,say civil risk isnt al gore relev stop talk global warm lest host gig network one watch kimberli king sun burn ill take collect
FOXNEWS,The OReilly Factor,hippo critic deviat guy prone go latest idea like global warm bill everybodi knew big target surpris fall see tomorrow mayb speaker make come back make us look like
FOXNEWS,The Five,say civil risk isnt al gore relev stop talk global warm lest host gig network one watch kimberli king sun burn ill take collect
FOXNEWS,FOX News Sunday With Chris Wallace,idea deal global warm problem scientif valid show reput would show kind braveri need presid point thing slow carbon emiss go nuclear
FOXNEWS,Greta Van Susteren,global warm he go come south talk peopl strong opinion ventur capit versu vultur capit one right go watch close well see next monday
FOXNEWS,FOX News Sunday With Chris Wallace,may bad idea shouldnt repeat idea deal global warm problem scientif valid show reput would show kind braveri need presid point thing
FOXNEWS,Red Eye,famili like rockefel grandchildren start hate fund global warm studi thing like still chanc could less chanc dont figur way perform ouren
FOXNEWS,The OReilly Factor,want find bill would contribut think global warm fire hot that right bill whole thing boondoggl unfortun volt electr car may end fossil fuel
FOXNEWS,Greta Van Susteren,believ global warm need someth tiger didnt chang tripe stripe said ill differ run john mccain moder said conserv turn
FOXNEWS,The OReilly Factor,bill guy whatev audienc love global warm audienc hate paul ryan plan front mainstream media audienc bill he found groov hell say whatev audienc want say attack media
FOXNEWS,The OReilly Factor,hippo critic deviat guy prone go latest idea like global warm bill everybodi knew big target surpris fall see tomorrow mayb speaker make come back make us look like
FOXNEWS,The Five,easi make fun al gore right like make fun climat chang real eric know real whackosn england bob overwhelm
FOXNEWS,The Five,noth take lightli easi make fun al gore right like make fun climat chang real eric know real whackosn england
FOXNEWS,FOX and Friends,come global warm lot peopl cap trade system governor romney issu issu record doesnt reflect primari voter republican parti think there go lot problem let ask
FOXNEWS,The OReilly Factor,catch fire want find bill would contribut think global warm fire hot that right bill whole thing boondoggl unfortun volt electr car may end fossil fuel
FOXNEWS,The OReilly Factor,catch fire want find bill would contribut think global warm fire hot that right bill whole thing boondoggl unfortun volt electr car may end fossil fuel
FOXNEWS,Hannity,wall street bail out go list global warm sit couch nanci pelosi cast conserv great record back would say realli rick santorum one
FOXNEWS,State of the Union,may deep pass comprehens plan climat chang reason congress shouldnt least set clean energi standard creat market innov far havent act
FOXNEWS,Hannity,may deep pass comprehens plan climat chang reason congress shouldnt least set clean energi standard creat market innov far havent act
FOXNEWS,FOX Report,planet climat chang your go look record say he conserv report head florida lot sen tee ballot cost
FOXNEWS,Americas News Headquarters,email white hous advisor director climat chang polici control say here deal compani announc law worker republican investig say sad
FOXNEWS,Red Eye,may deep pass comprehens plan climat chang reason congress shouldnt least set clean energi standard creat market innov far havent act
FOXNEWS,The FOX Report With Shepard Smith,river run beneath antarctica frozen surfac research say studi effect climat chang region that wrap fox trip around world second around world brought
FOXNEWS,FOX and Friends Saturday,support year that reagan conserv reagan conserv isnt someon support wall street bailout that reagan conserv someon couch nanci pelosi talk need someth global warm someon want provid path citizenship illeg
FOXNEWS,Americas Newsroom,weak take someon nomin governmentmand health care system would requir everybodi buy health insur feder level someon wall street bailout someon cap trade believ hoax global warm import
FOXNEWS,FOX and Friends,underneath conserv countri appear ad nanci pelosi tout global warm legisl think thing refer mention zani speaker brian want bring fire employe trot last time
FOXNEWS,FOX and Friends Saturday,white hous aid director energi climat chang polici say deal solyndra announc lay worker good chairman hous energi
FOXNEWS,FOX News Sunday With Chris Wallace,sit sofa nanci pelosi argu climat chang regul say conserv reliabl conserv leader peopl might imagin get chanc frame
FOXNEWS,FOX Report,work forc kept quiet email director climat chang polici offic white hous aid wrote th here deal solyndra go announc lay
FOXNEWS,Americas News Headquarters,think speaker explain sit sofa nanci pelosi argu climat chang regul call paul ryan plan right wing social engin look record say he conserv
FOXNEWS,Happening Now,neighbor state electr percent nation averag consum dont know power come green advoc say renew worth key part climat chang strategi creat good clean
FOXNEWS,FOX News Sunday With Chris Wallace,know law cant direct ad ad saw said forc speakership correct said sat nanci pelosi argu climat chang bill
FOXNEWS,FOX News Sunday With Chris Wallace,nanci pelosi call climat chang right wing social engin look record say conserv reliabl conserv leader get chanc frame issu time goe
FOXNEWS,Happening Now,conserv base republican parti support civil union thin said climat chang strong fist alrecord former governor sue ta tax spend also pretti sure second
FOXNEWS,FOX and Friends Saturday,ok said ought concern climat chang oppos cap trade al goren pelosi model actual testifi us hous day al gore oppos bill ive said dumbest thing
FOXNEWS,Hannity,presid obama issu someon doesnt bad record wall street bailout doesnt bad record health care doesnt bad record climat chang need somebodi sharp contrast show parti believ merg
FOXNEWS,Hannity,presid obama issu someon doesnt bad record wall street bailout doesnt bad record health care doesnt bad record climat chang need somebodi sharp contrast show parti believ merg
FOXNEWS,FOX and Friends Saturday,year sit nanci pelosi support climat chang legisl know youv call biggest mistak polit career wait second know youv said learn wrong mandat wait second go ahead said wrong
FOXNEWS,Americas News Headquarters,slant bias air importantli donor look ad say truth ad shown newt gingrich voic appear nanci pelosi endors climat chang legisl accur
