Station,Show,Snippet
FOXNEWS,Tucker Carlson Tonight,polici need chang need get fossil fuel right away see sign wild fire california huge hur ray contain thing happen climat chang your absolut right major
FOXNEWS,Cavuto Live,overwhelm entir enorm govern structur cant impos go take care climat chang tax ga one constantli requir pay countri street
FOXNEWS,Fox News Sunday With Chris Wallace,doesnt come long period time want say go get million death climat chang end centuri dont look unit state
FOXNEWS,Fox News Sunday With Chris Wallace,youll forest fire death signific number poor countriesbecaus subsystem farm chri say say climat chang weather point human compon question that impress
FOXNEWS,Fox News Sunday With Chris Wallace,doesnt come long period time want say go get million death climat chang end centuri dont look unit state
FOXNEWS,Fox News Sunday With Chris Wallace,youll forest fire death signific number poor countriesbecaus subsystem farm chri say say climat chang weather point human compon question that impress
FOXNEWS,Fox and Friends First,someth climat chang doesnt help lot conserv circl go senat day way go anywher grandstand way door
FOXNEWS,Special Report With Bret Baier,socal keep ground movement aim stop use oil coal natur ga slow climat chang would critic call idea economi killer polici suppos work
FOXNEWS,Tucker Carlson Tonight,hour tax burn fossil fuel suddenli cost hour tucker guess take climat chang serious must denier everi privat plane ban
FOXNEWS,Cavuto Live,rais money help fight climat chang rest key tenet rais ga tax franc alreadi believ equival gallon ga goe among
FOXNEWS,Fox News  Night With Shannon Bream,elect cycl state make vote men primari season california governor take climat chang fight space go launch satellit satellit
FOXNEWS,Fox and Friends First,histor moment take center stage brett kavanaugh better suprem court nomin battl dire climat chang warn scratch surfac top polit event top ash right thank join us
FOXNEWS,Tucker Carlson Tonight,advisor say bloomberg will spend million billion fortun win recent interview limburg say run fight climat chang top prioriti campaign cours emmanuel macron becam
FOXNEWS,Fox and Friends Saturday,democrat whether diann feinstein ted lieu nanci pelosi way check twitter feed tweet climat chang big issu talk polic offic murder cold blood christma night
FOXNEWS,Americas News HQ,that pretti darn quick realli identifi caus might illicit trade tariff might say demograph could name climat chang whatev like end day upon pretti dramat
FOXNEWS,Fox and Friends First,front famili feel better syria think presid commit make sure lee syria isi complet defeat got fight climat chang presid lean took roosevelt mani mani
FOXNEWS,Fox and Friends Saturday,kind thing democrat would show hand elect elect tell peopl dont listen maxin tri impeach presid see month later hire lawyer nanci pelosi establish new hous climat crisi committe littl bit bureaucraci
FOXNEWS,Tucker Carlson Tonight,worst riot countri sinc chop head king thank larg part climat chang polici someth us learn fire rage tonight break moment chang everyth
FOXNEWS,Tucker Carlson Tonight,part fight global climat chang need accept burdensom tax energi use least peopl claim need will pay
FOXNEWS,Tucker Carlson Tonight,tell us much rest us might inclin follow exampl wont elit impos new tax sake climat chang ordinari citizen sometim driven protest instead franc
FOXNEWS,Fox News  Night With Shannon Bream,hot topic democrat concern climat chang gun law republican concern illeg immigr caravan parti concern health care polit divis voter approv job donald trump disapprov
FOXNEWS,Fox News  Night With Shannon Bream,democrat concern climat chang gun law republican concern illeg immigr caravan parti concern health care polit divis overal voter approv job presid trump
FOXNEWS,Tucker Carlson Tonight,solv problem ridicul peopl go work tucker way realli believ climat chang matter your fli privat plane need realli look mirror think deepli
FOXNEWS,FOX  Friends,stuart varney host varney compani say ye ye ainsley green problem sell fix climat chang unit nation recommend green two problem voter prepar pay
FOXNEWS,Tucker Carlson Tonight,pull peopl kept term pari accord includ franc fall franc began implement ga tax prevent climat chang fourth week row citi pari
FOXNEWS,Fox News  Night With Shannon Bream,offic climat chang short skirmish presid wall could show leftlean democrat nanci pelosi seriou will deal would will support degre wall fund solut undocu know
FOXNEWS,The Journal Editorial Report,strike emmanuel macron run higher fuel tax yet thought need impos name climat chang start rural protest peopl reli gasolin get work
FOXNEWS,Tucker Carlson Tonight,tucker here im confus understand peopl sincer concern climat chang get im deni exist come solut baffl tax ga hurt middl class tax
FOXNEWS,Special Report With Bret Baier,martha mccallum outsid cathedr tomorrow next major revers franc presid climat chang agenda seriou riot pari first here fox affili around countri cover tonight
FOXNEWS,Tucker Carlson Tonight,privat plane could could second home realli believ climat chang real use car servic could use mass transit arent vegan arent live
FOXNEWS,Tucker Carlson Tonight,tucker well decad elit told rest us deepli deepli concern climat chang much concern deeper thought compassion peopl berni sander exampl deepli concern donald trump spoke last
FOXNEWS,FOX  Friends,anim right group prais lo angel congressman want requir entertain complex provid vegan option option menu think help combat climat chang peta love say devast wildfir sign must
FOXNEWS,Fox and Friends First,rob hour franc fire protest vow fight countri climat chang plan sign bigger movement happen around globe graham allen think american need take note live next
FOXNEWS,Americas News HQ,climat chang earth warm way stop stop burn fossil fuel well coal plant ga drill new strategi fight everi oil well west
FOXNEWS,Special Report With Bret Baier,thank socal keep ground movement aim stop use oil coal natur ga slow climat chang critic call idea economi killer explain polici suppos work
FOXNEWS,Tucker Carlson Tonight,law want violent crimin street tucker tucker trace gallagh us thank much trace franc still burn tonight effort impos climat chang agenda congress anxiou give
FOXNEWS,FOX  Friends,demand anybodi run plan look see doabl griff plan clearli climat chang plan win issu bad issu democrat primari doesnt gener intens enthusiasm
FOXNEWS,Fox and Friends Saturday,preach climat chang fli thousand mile hawaii interest see take speakership privat jet get california use paul ryan militari jet would take
FOXNEWS,The Journal Editorial Report,differ climat chang ether nanci pelosi better think real hard want agenda face democrat parti paul mari ay miss econom polit disast year connecticut
FOXNEWS,FOX  Friends,happi new year todd governor jerri brown say fight climat chang like fight nazi world war ii dan bongino say anoth long list hysterical
FOXNEWS,FOX  Friends,import viewer understand franc pay gallon almost half tax climat chang tax cent gallon gasolin cent diesel think america though green new deal
FOXNEWS,Tucker Carlson Tonight,endors pari climat accord ask simpl question simpl one reveal here ask climat chang inde existenti threat say would support ban privat jet travelan
FOXNEWS,The Ingraham Angle,weve got kid dont want slowli burn death planet climat chang could kill thousand american cost economi hundr billion dollar suggest dont want believ scienc mayb start climat kid
FOXNEWS,Fox News  Night With Shannon Bream,tie climat chang accord scientist opportun advanc green economi rout china follow invest billion far creat new job opportun us take role
FOXNEWS,Fox News  Night With Shannon Bream,global leader creat job countri take lead climat chang shannon kati come lot peopl first someon hein last year assur gone green way shape form
FOXNEWS,Hannity,design fight climat chang thisli come ga price pari alreadi per gallon realli insan far across franc protest left three dead hundr wound turn social high tax govern enforc
FOXNEWS,Hannity,climat shame didnt exactli lead societ euphoria instead push massiv climat chang agenda put bigger burden lower workingclass peopl franc anywher els use one support violenc destruct surpris
FOXNEWS,Fox News  Night With Shannon Bream,us take role global leader creat job countri take lead climat chang peopl think word solyndra someon china last year assur gone green way
FOXNEWS,Tucker Carlson Tonight,liter livabl read new yorker articl today thought gosh pointless life pointless decis im make daytoday basi focus climat chang everi day lead everi one
FOXNEWS,FOX  Friends,spokesman climat chang even though big activist fli jet around whole airlin hanger home al gore live privat jet fli around huge carbon emiss sort tone deaf arnold
FOXNEWS,Fox News  Night With Shannon Bream,elect public nomine associ heather knew campaign affect want make sure ask michael bloomberg tom stier billionair run messag climat chang regul play
FOXNEWS,Tucker Carlson Tonight,fire california huge hurrican thing happen climat chang your right major corpor major corpor respons emiss planet peopl foot bill listen
FOXNEWS,Fox News Sunday With Chris Wallace,past one year fail harvest predict closer one four year temperatur unfortun climat chang hotter rain come
FOXNEWS,Fox News Sunday With Chris Wallace,past one year fail harvest predict closer one four year temperatur unfortun climat chang hotter rain come
FOXNEWS,Americas News HQ,ground central focu new report highlight say neg impact us economi william la jeuness live lo angel stori speak late keep ground activist argu climat chang real
FOXNEWS,Tucker Carlson Tonight,entiti want feel way thank much franc move side globe face worst riot countri sinc chop head king thank larg part climat chang polici someth us
FOXNEWS,Tucker Carlson Tonight,tucker youv told mani time watch tv america need join pari climat accord immedi pull immor part fight global climat chang need accept burdensom tax energi use least
FOXNEWS,Special Report With Bret Baier,countri front line climat chang stori beyond border tonight well right back greatest wish one bring us togeth lincoln wish list event sign drive new lincoln due sign
FOXNEWS,Fox News  Night With Shannon Bream,individu govern know better economi function rather allow innov new idea come privat sector free market system clean environ big differ pollut climat chang see time
FOXNEWS,Tucker Carlson Tonight,fight climat chang wealth transfer middl class peopl alreadi rich wouldnt chang behavior thing chang behavior isu tax ga lot tucker tax middl class hate thank much great
FOXNEWS,FOX  Friends,number one alway said wall border problem good see video everi day tell peopl tijuana wrong right climat chang australia join us along brazil real problem host pari
FOXNEWS,FOX  Friends,climat chang meet poland fuel pure coal said go leav coal behind year worth suppli howev ear next gener minor commun get
FOXNEWS,Tucker Carlson Tonight,riot take place pari throughout franc climat chang tell lot attitud peopl charg investig break break readi get feast better caus red lobster
FOXNEWS,Fox and Friends First,make great stride improv america environ american taxpay american worker shouldnt pay clean peopl pollut make point dont climat chang deni want pari accord countri still allow pollut donald trump made solid
FOXNEWS,FOX  Friends,harri griff right right dont think climat chang issu griff talk go left enough let go b berni sander mention clearli berni littl bit troubl parti lot success
FOXNEWS,Americas Newsroom With Bill Hemmer and Sandra Smith,plu month financ bed end new year day sleep number proven qualiti sleep rick california governor jerri brown say he take matter hand come battl climat chang state develop special satellit live west coast bureau
FOXNEWS,FOX  Friends,attract case cure wors problem see activist want impos higher cost us make problem case climat chang seem terribl possibl that disturb see coupl
FOXNEWS,Fox News  Night With Shannon Bream,common good put countri ahead parti got busi done climat chang huge problem deal get wors wors day way deal get countri democrat republican independentss behind someth big deal shannon bring
FOXNEWS,FOX  Friends,presidenti candid michael bloomberg head iowa today former new york citi mayor host panel climat chang iowa home first contest presidenti primari know import state bloomberg say decid whether go run februari
FOXNEWS,FOX  Friends,dean governor jerri brown say fight climat chang like fight nazi world war ii im sure opinion nazi comb quit bit doesnt well know godwin rule first person bring hitler lose
FOXNEWS,FOX  Friends,got fight climat chang presid lead took roosevelt mani mani year get america will go world war ii fight nazi fourth come make pass intercept
FOXNEWS,FOX  Friends,perhap much devast similar way got fight climat chang todd yep fight nazi that california governor ask dan bongino felt someth say
FOXNEWS,Tucker Carlson Tonight,destroy live way suggest actual believ planet destroy honestli realli dont get al gore say noth import climat chang im better person care way one largest hous nashvil
FOXNEWS,Fox and Friends Saturday,assess use everi mechan govern affect outcom china pollut develop countri develop countri develop economi bureaucraci doubl standard want hear much climat chang democrat primari rachel teed
FOXNEWS,Tucker Carlson Tonight,way saw tape berni sander care lot yet news stori came today said spent singl month fli privat plane could could second home realli believ climat chang real use car
FOXNEWS,Tucker Carlson Tonight,climat chang realli issu matter arent live like issu matter come industri industri want make plane exist renew energi rather oil ga abl live planet start industri level consum
FOXNEWS,FOX  Friends,syria think presid commit make sure lee syria isi complet defeat got fight climat chang presid lean took roosevelt mani mani year get america will go world war ii
