Station,Show,Snippet
BBCNEWS,BBC News,teachers parents saying rising sea levels punishing droughts life threatening heatwaves potential impacts global warming world taken action agreeing limit rise average temperatures two degrees un climate scientists meeting discuss whether high whether limit 1 5 degrees might safer
BBCNEWS,BBC News,nearly 200 governments meeting south korea week agree new report urging ambitious global warming targets agreed limit increases temperature 1 5 degrees celsius pre industrial levels report published tomorrow advise countries impact adopting tighter limit reached
BBCNEWS,BBC News,next round votes take place end october climate scientists say world must act rapidly prevent dangerous rise temperature intergovernmental panel says massive changes needed keep global warming 1 5 degrees celsius include changes food eat way energy generated
BBCNEWS,Breakfast,quite shocking right big surprise many years timei big surprise many years time covering subject thought global warming took average devil couple degrees would pretty safe would went beyond
BBCNEWS,Victoria Derbyshire,think message comes climate change absolutely good policy mix putting costs fuel consumption especially high carbon fuel consumption
BBCNEWS,Newswatch,come centrally bear equal portion cost government says sea defences built spokesman said people would protected climate change roger harrabin bbc news
BBCNEWS,Afternoon Live,people use energy order restrict rising temperatures intergovernmental panel climate change calling rise earth temperature since industrial age limited 1 5 degrees celsius
BBCNEWS,Afternoon Live,already done scotland recognised across uk around world actions tackle climate change called exemplary united nations make scotland
BBCNEWS,BBC Newsroom Live,reduce carbon emissions 45 given example president trump decision pull international climate change agreement great gulf globe heading
BBCNEWS,BBC Newsroom Live,grantham institute climate change environment imperial college london also joined professor chris fogwill director keele institute sustainable futures keele university ifi
BBCNEWS,BBC News,programme 8 30pm tonight dramatic report intergovernmental panel climate change urging need change avoid worst effects temperature e mail text
BBCNEWS,Climate Change,people live prevent catastrophic changes planet going talking dr corinne le quere professor climate change science policy university east anglia director
BBCNEWS,Newsday,front pages around world front page straits times looks stark un report climate change newspaper quotes 33 page report concludes
BBCNEWS,Victoria Derbyshire,extreme weather events gathered south korean city incheon past week climate change researchers government delegates hammered final details dramatic report outlining consequences
BBCNEWS,The Briefing,lawrence gosling editor chief investment time yesterday live south korea held intercontinental permit climate change extremely
BBCNEWS,Outside Source,iran let talk scientists gathering south korea publish critical controversial report climate change years meeting incheon
BBCNEWS,Newsday,underwater worried never possible hold back sea climate change getting worse says lam van nghia water level rising fast
BBCNEWS,BBC News,destroyed farmland vanishing well farmers saw fields slip underwater worried never possible hold back sea climate change getting worse
BBCNEWS,BBC News at Ten,nhs hospitals england scotland special report vietnam concerns climate change damaging impact changes sea levels even small rise could devastating
BBCNEWS,BBC News at Six,farmers saw fields slip underwater worried never possible hold back sea climate change getting worse says man water level
BBCNEWS,Newsday,climate change researcher suggests prize could give momentum policies aimed helping planet particularly pertinent issue given yesterday united nations climate report brings date
BBCNEWS,The Papers,trump saying complicated talking complicated talking complicated processes papers looking climate change new targets temperature rises one hand
BBCNEWS,Breakfast,intergovernmental panel climate change says limiting temperature rises 1 5 celsius require massive changes way live warns without action could severe consequences
BBCNEWS,Breakfast,25 even green energy revolution comprehensive assessment perils climate change concludes every one us need make changes live lives
BBCNEWS,Beyond 100 Days,killers could responsible donald trump flies face comprehensive scientific evidence says know humans responsible climate change coming next half hour
BBCNEWS,Newswatch,vast majority scientific opinion admits climate change happening man made phenomenon satisfy everybody going shut dissenting voices equally
BBCNEWS,BBC News,line shortly rail franchise east coast mainline collapsed much stake climate change minister responsible tellling us eat less meat
BBCNEWS,BBC News,scientists say urgently needed donald trump says climate change flies face overwhelming scientific evidence gases give away several sources heating planet
BBCNEWS,BBC News,need cut gases causing warming 45 2030 making cut harder america leads global agreement climate change america leads global
BBCNEWS,Outside Source,report african penguin population rapidly declining conservationsists say habitat hit rising tides caused climate change since report un last
BBCNEWS,BBC News,today university south pacific couple watched dance climate change first time long time meghan turn speak
BBCNEWS,Newsday,need learn adapt whether education like community groups resilience really needs built back coast work new sea defences scientists used think safe limit global warming two degrees say need lower target avoid serious damage
BBCNEWS,Victoria Derbyshire,earlier policy analyst grantham research institute climate change environment steve fowler editor motoring magazine auto express welcome maria presume rachel saying
BBCNEWS,Victoria Derbyshire,music ears absolutely transport emissions actually largest emitter uk target within uk reduce emissions 57 part climate change act 2032
BBCNEWS,BBC World News America,trains could soon making way around globe governments look ways meet climate change targets technology considered one cleanest efficient power sources around
BBCNEWS,Newswatch,battered waves train tracks destroyed today report says happen sea levels pushed higher man made climate change another problem committee warns get worse
BBCNEWS,BBC News at One,train tracks destroyed today report says happen sea levels pushed higher man made climate change another problem committee warns get worse homes hemsby norfolk
BBCNEWS,Victoria Derbyshire,threatened coastal flooding erosion 2080s hear coastal communities affected climate change next brazil voting new president sunday jair bolsonaro
BBCNEWS,BBC News at Five,dawlish devon 2014 battered waves train tracks destroyed today report says happen sea levels pushed higher man made climate change another problem
BBCNEWS,Afternoon Live,higher man made climate change another problem committee warns get worse homes hemsby norfolk slipped sea waves ate away cliff report says maybe 100000
BBCNEWS,BBC News,note done us need limit climate change also need find ways learn live worst impacts many thanks
BBCNEWS,Afternoon Live,experiencing climate system unprecedented scale changes humans would implement order keep climate change control unprecedented challenge human civilisation
BBCNEWS,Afternoon Live,today climate change business implications well right report damning says needs done governments people also businesses particular holds
BBCNEWS,Afternoon Live,changes aspects society 0ur science correspondent victoria gill report pictures warming world scientists confident ever impacts climate change playing severity
BBCNEWS,Afternoon Live,talk drjennifer francis research professor department marine coastal sciences rutgers university research mainly focused global arctic climate change well qualified talk us
BBCNEWS,BBC Newsroom Live,even green energy revolution comprehensive assessment perils climate change concludes every one us need make changes live lives live lives
BBCNEWS,BBC Newsroom Live,week theresa may hardly mentioned big speech know president trump sceptical climate change much man made concerned whole issue danger
BBCNEWS,BBC Newsroom Live,electricity 2050 currently account 25 even green energy revolution comprehensive assessment perils climate change concludes every one us need make changes
BBCNEWS,BBC Newsroom Live,moment needs reduce impact climate change pledges countries made paris agreement people added carried
BBCNEWS,BBC Newsroom Live,professorjoanna haigh grantham institute climate change environment professor chris fogwill keele institute sustainable futures keele university sending comments dina asks realistic
BBCNEWS,BBC Newsroom Live,intergovernmental panel climate change calling rise earth temperature since industrial age limited 1 5 celsius professorjoanna haigh co director
BBCNEWS,Climate Change,questions climate change send us text 61124 email askthis bbc co uk tweet using hashtag bbcaskthis first science correspondent pallab ghosh reports described global wake
BBCNEWS,Climate Change,dr le quere right report provided first time amount detail need see differences different levels climate change meeting incredible reports amount
BBCNEWS,Climate Change,united nations asked scientist information actually produce climate change tol 5 1 5 degrees warming comes demands low lying islands first
BBCNEWS,Victoria Derbyshire,panel climate change says limiting temperature rises 1 5 celsius require massive changes way live warns without action world coral reefs die
BBCNEWS,Victoria Derbyshire,victoria gill bbc news 0ur science editor david shukman intergovernmental panel climate change conference south korea told us story many years time
BBCNEWS,Victoria Derbyshire,report intergovernmental panel climate change urges limiting temperature rises 1 5 degrees celsius pre industrial levels says target require massive shifts way live
BBCNEWS,Victoria Derbyshire,scientists issue strongest warning yet climate change saying society must undergo rapid far reaching change meet targets ipcc report says temperature rises limited 1 5 degrees celsius half
BBCNEWS,BBC News,interview bbc newsnight programme broadcaster said doubted extent usa would withdraw global agreements climate change five years ago really really pessimistic
BBCNEWS,Newsday,still come programme journey vietnam find one must vulnerable countries world climate change rising sea levels russia turmoil
BBCNEWS,BBC News at Five,worried never possible hold back sea climate change getting worse says man water level rising fast time build fences threat
BBCNEWS,BBC News at Five,vietnam first say climate change think temperatures flooding fundamental food food important understand delta region biggest
BBCNEWS,Victoria Derbyshire,clothes sell environmental audit committee says fashion industry fuels climate change spreads microplastics oceans fills landfill sites young people uk saving much previous generations
BBCNEWS,Newsday,still come programme journey vietnam find one must vulnerable countries world climate change rising sea levels celebration people
BBCNEWS,BBC News,notjust houses destroyed farmland vanishing well farmers saw fields slip underwater worried never possible hold back sea climate change getting worse
BBCNEWS,BBC News,latest headlines key republican senators say vote judge brett kavanaugh nomination supreme court final senate vote expected saturday un climate change scientists meeting week
BBCNEWS,BBC News,home 18 million people mentioned hotspot climate change makes vulnerable low lying large delta plain sinking sea level coming
BBCNEWS,BBC News,understanding science united states continues lead world climate science united states continues active intergovernmental panel climate change current us administration taken
BBCNEWS,BBC News,special coverage intergovernmental panel climate change monday former chair parliamentary body overseeing mps expenses criticised disability benefits assessment system hostile environment
BBCNEWS,BBC News,exacerbated impact human caused climate change say michael would occurred absence global warning warming mean impact
BBCNEWS,BBC News at Five,embrace plant based diets world wants limit climate change water scarcity pollution k pop fever sweeps london south korean boy band bts make british stage debut 5 clock
BBCNEWS,Breakfast,regret family secrets good morning summary today main stories bbc news scientists given one starkest warnings yet changes needed tackle climate change report
BBCNEWS,Breakfast,low lying regions disappear rising sea levels 0ur science correspondent victoria gill reports pictures warming world scientists confident ever impacts climate change playing
BBCNEWS,Breakfast,environment range actions really reported saying tackle climate change absolute limit achieve moment changes got take place
BBCNEWS,BBC News at Five,analysis showed cost waiting lament changes think one first major development countries actually ask climate change committee advice would look
BBCNEWS,BBC News,published hand know donald trump wants take america paris agreement deal varies tackle climate change internationally know frontrunner brazil presidential election also
BBCNEWS,BBC News at Ten,alarming message climate change modern life keeps moving midst issue truly global one us make choices help urgent fight
BBCNEWS,Afternoon Live,vulnerable anywhere world effects climate change board team scientists let find investigating one scientists board professor dan parsons
BBCNEWS,BBC News at Five,mentioned hotspot climate change makes vulnerable low lying large delta plain sinking sea level coming essentially drowning serious stuff
BBCNEWS,BBC Newsroom Live,transition fine cost money look overall benefit society economy cost reducing climate change enormous look benefits
BBCNEWS,BBC News at Six,climate change real part got keep fossil fuels ground within site deep underground drilling pumping gas way fracking involves
BBCNEWS,Beyond 100 Days,joining us san francisco ron christie former adviser george w bush really jumped reallyjumped everyone deadline gave climate change interview seems
BBCNEWS,Afternoon Live,world climate change scientists reason know politics different one scale know truth argument
BBCNEWS,Newswatch,inter governmental panel climate change latest series warnings risks rising global temperatures reflecting scientific concensus controversial issue among guests discussing panel findings
BBCNEWS,BBC News,rapidly declining registered 70 per cent fall 2001 2013 numbers still going conservationsists say habitat hit rising tides caused climate change campaigners looking
BBCNEWS,Asia Business Report,rice also impacting nutrition value rice climate change carbon dioxide levels increase plants better producing sugar start means might
BBCNEWS,Breakfast,climate change guy singh watson influential green entrepreneur campaigner fears spending much effort cutting plastic rather cutting carbon convoy 2000 honduran migrants continuing march
BBCNEWS,Breakfast,distraction real fight climate change guy singh watson influential green entrepreneur campaigner fears spending much effort cutting plastic rather cutting carbon senior us military commander
BBCNEWS,BBC News,global agreement climate change head un wants see coming back need understand see cities business community states solid
BBCNEWS,BBC News,potentially devastating effects climate change president trump says thinks may real sure man made let return top story prime minister insisted
BBCNEWS,BBC News at Six,since married heard almost nothing today university south pacific couple watched dance climate change first time long time
BBCNEWS,Afternoon Live,since married heard almost nothing today university south pacific couple watched dance climate change first time long time
BBCNEWS,Newsday,wednesday prince harry announced scholarships study climate change says daily threat people living fiji watching newsday ben bland london mariko 0i singapore
BBCNEWS,BBC News at One,university south pacific couple watched dance climate change first time long time meghan turn speak spoke right
BBCNEWS,BBC News,scholarships study climate change says daily threat people living fiji moment get touch twitter thank watching bbc
BBCNEWS,BBC News,professor steve darby university southampton waiting report un climate panel looking implications trying limit global warming way vietnam countries want see going possible man tried push two people onto tracks london underground found guilty attempted murder
BBCNEWS,BBC News,riding mountain bike woods near town les gets saturday evening shot dead victim named locally mark sutton lived area several years told eat less meat help tackle global warming seems sunday roasts steak dinners safe hands government
BBCNEWS,Beyond 100 Days,necessarily increased length cost storms increased five expensive hurricanes history century insurance companies looking closely agreeing climate change factor
BBCNEWS,The Papers,couple experts really worried executive director greenpeace uk also said rushing fracking week give starkest warning climate change like running around house turning
BBCNEWS,BBC News,politics greenpeace non governmental organisation campaigning issues around climate change thank coming bad think report business select committee thought significant
BBCNEWS,BBC Newsroom Live,promised change destiny brazil concerns raised policies climate change deforestation hostility towards minority groups south america correspondent katy watson holding back
BBCNEWS,BBC Newsroom Live,people homes take seriously inevitability sea level rise government says sea defences built spokesman said people would protected climate change 45 year old man arrested
BBCNEWS,BBC News at One,communities warned wake challenges climate change government climate advisers say 1 2 million homes could threatened coastal flooding erosion 2080s worst case scenario
BBCNEWS,Business Briefing,says happen sea levels pushed higher man made climate change another problem committee warns get worse homes hemsby norfolk slipped sea waves ate away clip
BBCNEWS,BBC Business Live,hackers obtained passport numbers hong kong identity card numbers state new york taken legal action exxonmobil accusing oil giant misleading investors risks climate change business exxon allegedly downplayed
BBCNEWS,Afternoon Live,strike eight game street without goal back storyjust half past people living england coastal communities warned wake challenges climate change government climate advisers
BBCNEWS,Afternoon Live,spokesman said people would protected climate change roger harrabin bbc news 45 year old man arrested suspicion trying steal copy magna carta salisbury cathedral police say alarms activated
BBCNEWS,Afternoon Live,dangers climate change four sisters feared dead limousine crash america killed 20 people many young people afford buy new home even afford deposit according new research
BBCNEWS,Afternoon Live,near future governments agreed sort safe limit keep temperatures happening show impacts climate change everything predicted models
BBCNEWS,Afternoon Live,increase currently predicted countries need ambition get moving climate change action going keep 1 5 degrees reach four sisters feared dead limousine crash america killed twenty people
BBCNEWS,Afternoon Live,report therefore milestone conveying message human society countries need ambition get moving climate change action going keep 1 5 degrees within reach action world
BBCNEWS,Afternoon Live,announced today nobel prize economic sciences awarded two men whose work highlights climate change sustainable growth william nordhaus paul romer two men split prize professor nordhaus winning
BBCNEWS,Afternoon Live,get moving climate change action going keep 1 5 degrees within reach action world course breach crucial target early 2030 compromising livability planet
BBCNEWS,Afternoon Live,comprehensive assessment perils climate change concludes every one us need make changes live lives changes start victoria gill bbc news well today report
BBCNEWS,Afternoon Live,atmosphere think hard going two adopted changes know coming given president rob decision pull international agreement climate change great gulf
BBCNEWS,BBC News at One,agreement avoiding climate change difficult impossible question whether national leaders political bring changes recommended little late pallab ghosh bbc news 0ur science editor david shukman
BBCNEWS,BBC News,hour including un climate change report described global wake call planet time look weather tomasz shafernaker weather actually improving
BBCNEWS,Asia Business Report,sustainable economic growth two winners design methods addressed pressing issues today one work climate change affects economic growth looking economic forces affect
BBCNEWS,BBC Newsroom Live,rising sea levels science correspondent victoria gill reports pictures warming world scientists confident ever impacts climate change playing severity frequency droughts storms
BBCNEWS,BBC Newsroom Live,precisely prevented countries need ambition get moving climate change action going keep 1 5 degrees within reach action world course breach crucial
BBCNEWS,BBC Newsroom Live,given example president trump decision pull international climate change agreement great gulf globe heading moment needs reduce impact
BBCNEWS,BBC Newsroom Live,climate change pledges countries made paris agreement people added carried direction even accelerated effo rts efforts beyond 2030 would track three degrees
BBCNEWS,BBC Newsroom Live,unprecedented changes people use energy order restrict rising temperatures intergovernmental panel climate change calling rise earth temperature since industrial age limited 1 5 celsius
BBCNEWS,BBC Newsroom Live,get moving climate change action going keep 1 5 degrees within reach action world course breach crucial target early 2030 compromising livability planet
BBCNEWS,Beyond 100 Days,politicians short term leads life according political cycles electoral cycles tend rather short term think big scheme things climate change inviting humanity begin change
BBCNEWS,Beyond 100 Days,mental chip make decisions climate change good last global problem face century requires long term thinking short term acting actually isa
BBCNEWS,Beyond 100 Days,course good take investment actually investment highest rate return global economy perspective investing climate change going reaping least 20 26
BBCNEWS,Climate Change,according ipcc speed needs scientists saying everybody accelerate action tackle climate change middle century could facing situation
BBCNEWS,Climate Change,forefront terms climate change impacts really cry scientists really clear answer scientists questions governments actually answer yes technically
BBCNEWS,BBC News,world sail past target 2040 authors say every possible option control emissions must considered thing climate change always necessarily fall cliff particular level warming
BBCNEWS,BBC News at One,one half degrees celsius century intergovernmental panel climate change expected warn threshold breached year 20110 unless rapid action taken recommend faster cuts co2 emissions
BBCNEWS,BBC News at Ten,climate change getting worse says man water level rising fast time build defences threat felt throughout mekong delta city tho found flood barrier
BBCNEWS,Outside Source,work world might go limiting rise global temperatures 2 per cent limit agreed paris one country among vulnerable climate change backing tougher 1 5
BBCNEWS,BBC Newsroom Live,also generation leaves planet better state found heard week world facing ecological human disaster climate change radical transport reforms vital
BBCNEWS,Newsday,climate change urged countries stop using coal 2050 avoid increasing global temperatures australia deputy prime minister said coal plays important part country energy supply plans change
BBCNEWS,Outside Source,obtained say stay us outside source still come australia government rejects un report climate change despite dire warning country coral reefs leader scottish national
BBCNEWS,The Papers,serious close 12 year deadline almost two take cognizance fact climate change go brexit negotiations stop weight ok
BBCNEWS,BBC News,kind survivors racism discrimination survivors climate change tipped court constitutional write toa safe legal abortion healthcare tipped towards immigration abuse
BBCNEWS,BBC News,urgent steps cut greenhouse emissions zero 2050 bring full details report special coverage intergovernmental panel climate change monday headlines bbc news
BBCNEWS,BBC Business Live,bigger threats climate change somebody tweeted morning saying donald trump one big reasons strong opinions everyone wants diet preference people
BBCNEWS,Newsday,candidate jair bolsonaro done best first round presidential election tackling climate change scientists may finally answer report south korea landmark report set release live studios singapore
BBCNEWS,Breakfast,tackle climate change worst road accident united states decade 18 people limousine two pedestrians killed facebook said morning tripled amount
BBCNEWS,Breakfast,report intergovernmental panel climate change says limiting temperature rises 1 5 celsius require massive changes way live warns without action could severe consequences global population
BBCNEWS,Breakfast,environments particularly susceptible flooding sea level rise impacts grow time need tackle climate change higher levels warming wait impacts
BBCNEWS,BBC News at Five,experiencing climate system unprecedented scale changes humans would implement order keep climate change control unprecedented challenge human civilisation report therefore
BBCNEWS,BBC News,david shukman bbc news south korea individuals help fight climate change 0ur science correspondent victoria gill looking small changes could make big difference alarming message
