Station,Show,Snippet
BBCNEWS,Newsnight,significant relationship china context important biggest threat everyone prosperity climate change cannot resolved without cooperation particular cooperation
BBCNEWS,BBC News at One,striking careful tone risk climate change exist consequences could serious enough action taken might action
BBCNEWS,Reporters,cameras find adapting climate change threats face given exclusive access report contains flash photography antarctica
BBCNEWS,Newsday,winner trade war also said countries redouble commitment paris climate change agreement mr trump threatened quit translation signatories
BBCNEWS,Newsday,informative went climate change tweet one donald trump closest advisers told bbc us would win trade war china antony scaramucci added
BBCNEWS,BBC News,jinping setting china possible alternative american leadership stepping chinese climate change deal promising go ahead would thought
BBCNEWS,The Papers,president barack obama calls donald trump administration lead example prevent big countries bullying smaller ones scientists declare 2016 warmest year record man made climate change blame
BBCNEWS,BBC News,forests provide essential services people help mitigating climate change carbon stocks help providing clear water people pollinations people grow
BBCNEWS,BBC News,without direction children time debate existence climate change thou busy dealing effects environmental disasters economic disruptions ways climate refugees seeking sanctuary
BBCNEWS,BBC News,called harmful unnecessary climate change policies laura bicker reports president first lady united states take first dance end near
BBCNEWS,BBC News,reconsider using facts hearsay listening experts specifically climate change pretty much thank much indeed lucy barber british expat
BBCNEWS,Click,difficulty year life penguin caught camera penguin caught camera birds adapting climate change america grip heroine
BBCNEWS,The Papers,charles happened great story donald trump seems gauged extraordinary diplomatic row prince wales climate change threatening disrupt
BBCNEWS,Outside Source,face today global terrorism climate change organised crime unprecedented mass movements people respect national borders must turn towards multinational institutions like un nato encourage
BBCNEWS,BBC News at Six,thousands british tourists flown back gambia warnings unrest last year warmest record scientists say climate change blame coming sportsday later
BBCNEWS,World News Today,despite concerns impact global warning researchers receive evidence evidence climate change playing significant role new iceberg formation well much coming including
BBCNEWS,BBC Newsroom Live,obviously strong views climate change meet clearly prince charles would always meet incoming state visit laid format state
BBCNEWS,BBC News Special,climate change eight years halved dependence foreign oil doubled renewable energy let world agreement promise save planet cheering applause
BBCNEWS,BBC Newsroom Live,today look science donald trump presidency mean battle climate change behind next big venture space science correspondent rebecca morelle hi rebecca morelle bbc
BBCNEWS,BBC News,makes mention civil rights healthca climate change new president cabinet beginning take shape retired generaljames mattis sworn defence secretary john kelly retired marine corps general
BBCNEWS,Newsnight,thank late describes three forces accelerating processes drive lives technology globalisation climate change explaining well everything three time pulitzer prize winning journalist
BBCNEWS,Newsnight,world also taking lead climate change business deals renegotiating trade deals cancelling amending one thing going projection military power
BBCNEWS,Breakfast,consumer brazil consumes lower grade coffee grow coffee consumption patterns changing bit supply chains well climate change effect
BBCNEWS,BBC News,new president also instituted media blackout us environmental protection agency past questioned scientific evidence climate change previously stated concept created china actress jane fonda
BBCNEWS,BBC News at Six,new president must abide withdraw paris climate change treaty president trump repeatedly said bring back torture instrument policy sees friday
BBCNEWS,BBC News at Ten,climate change treaty president trump repeatedly said bring back torture instrument policy sees friday prime minister make clear circumstances permit britain
BBCNEWS,BBC News at One,controversial policies build wall christian fraser another big issue facing trump administration climate change alarm threatened pull recently agreed global climate treaty kill
BBCNEWS,President Trump,defence secretary nominee heard shift worldview questions torture questions russian hacking even questions climate change hoax heard variability go donald
BBCNEWS,Review 2016,butjust paris deal came force donald trump elected us president called climate change hoax 2012 tweeted invented chinese harm us businesses
BBCNEWS,HARDtalk,global security situation trump comments climate change said closer doomsday agree agree see imminent threat
BBCNEWS,BBC News,services people help mitigate climate change carbon stocks help providing clear water people pollination services people grow crops reversing declines means looking closely
BBCNEWS,BBC Newsroom Live,strong views climate change environments matter massive importance type person start lecturing anybody certainly aus us president always hesitant
BBCNEWS,BBC News,hope stops state visit already suggested donald trump want bump prince charles want lectured climate change foreign
BBCNEWS,Reporters,big business brazilian government i5 defending plans build dozens huge hydroelectric dams say vital meet country energy needs environmentalists say plans disaster amazon result deforestation global warming wyre davies belo monte site first new called mega dams
BBCNEWS,BBC News,climate change economy race focused younger generation democrat vote rs younger generation democrat voters disillusioned see important really try build
BBCNEWS,Breakfast,relating climate change worries deal foreign issues relative china russia really beginning trumpet year many people concerned many held breath
BBCNEWS,BBC News,new six issue agenda energy foreign policy jobs growth military law enforcement trade deals observers point makes mention civil rights healthca climate change new president cabinet beginning take shape
BBCNEWS,Wednesday in Parliament,climate change commitments low carbon projects core finally minister admit selling could lead bank fatally undermined enduring institution stop killing gib
BBCNEWS,BBC News,wants protectionist isolationist build wall keep muslims repeal abortion rights health care deny climate change basically destroy world uphold constitution
BBCNEWS,Talking Business,climate change science real one big messages today supported women streets men well born austria
BBCNEWS,BBC News,industrial strategy hope people contribute talking mission based approach looks biggest challenges like climate change brexit like automation like ageing
BBCNEWS,BBC News,defence department determine allowed law approach enemies us think big reason climate change one issue prime minister raised
BBCNEWS,Asia Business Report,must abide withdraw paris climate change treaty president trump repeatedly said bring back torture instrument policy sees friday prime minister make clear
BBCNEWS,Wednesday in Parliament,helpful offer services uk scientists convince president climate change hoax invented chinese prime minister well recognise role right honourable gentleman played looking
BBCNEWS,President Trump,policy towards middle east policy towards middle east policy towards cuba climate change list goes yes broadbrush speech donald trump get specifics give us
BBCNEWS,Meet the Author,conscience one thing think could look metaphor climate change know martians planet collapsed terrible way migrants heavily armed migrants come earth gives
BBCNEWS,Review 2016,focus also much planet 2016 declared hottest year record putting climate change tackle spotlight year planet united least
BBCNEWS,BBC News,biggest recorded around 50 times size manhattan island despite concerns impact global warning researchers receive evidence evidence climate change playing significant role new iceberg formation
BBCNEWS,BBC News,mps queued offer issues could take new president must abide withdraw paris climate change treaty president trump repeatedly said bring back torture instrument policy
BBCNEWS,Newsnight,work together consider torture deny climate change went work together really think time self interest think tone self interest
BBCNEWS,Newsday,infographic find something thatis infographic find something looking good informative went climate change tweet ivanka mayich mistaken donald trump four ivanka trump
BBCNEWS,Newsday,listen rather yes absolutely right politics donald trump however thought climate change everything everybody could agree big problem big concern regardless
BBCNEWS,BBC News,also said countries redouble commitment paris climate change agreement mr trump threatened quit translation signatories stick instead walking away responsibility
BBCNEWS,BBC News,pollution climate change normal parts debate said democracy sometimes going win issues sometimes going lose confident rightness positions
BBCNEWS,BBC Newsroom Live,congressional approval many deal climate change clea n clean power plan cut carbon pollution coal fired power plants congress also approve cabinet democrats promising grilling nominees ultimately ultimately expected
BBCNEWS,BBC Newsroom Live,one yet knows recently met climate campaigner al gore also appointed several key cabinet members expressed sceptical views climate change could soon see land speed record broken funding setbacks
BBCNEWS,BBC News at One,way sounds fairly trivial give us way continuing use fossil fuels activity difficult solar power instance thank hear story climate change trump card
BBCNEWS,BBC News at Five,paris climate deal one yet knows recently met climate campaigner al gore also appointed several key cabinet members expressed sceptical views climate change could soon see land speed record broken
BBCNEWS,BBC News at Five,new iceberg one biggest recorded around 50 times size manhattan island despite concerns impact global warning researchers receive evidence evidence climate change playing significant role new iceberg formation
BBCNEWS,The Papers,seek new waters number things climate change affecting fish british waters cold north difficult get said coming soon squid suppers plenty squid
BBCNEWS,Breakfast,skaters would draw huge crowds second half 20th century scenes like ice ground due climate change 90s british long track speed skating gone three
BBCNEWS,Breakfast,missing like climate change lgbt writes lot people lot things say absolutely someone gay feels trump going stand way 0bama
BBCNEWS,BBC News,president 0bama try engage china ona president 0bama try engage china one one basis issues climate change president trump presented something com pletely completely different way used work china china
BBCNEWS,BBC News,christine todd whitman republican told bbc president elect ignoring compelling scientific evidence climate change said mr trump anti environmental policies could harm whole planet accused betraying republican heritage conservation 23 people died i7
BBCNEWS,Review 2016,particular region particular species seen decline past decades delcines likely associatd climate change may link competition fisheries humans obtaining food krill penguins would normally eat
BBCNEWS,Breakfast,discussion climate pa rt part regulation gone protecting environment hear interview radio 4 documentary climate change trump card tomorrow 8pm gun attack istanbul
BBCNEWS,Newsnight,uk first china first japan first think need international cooperation make sure world peace world effectively combat climate change deal many serious
BBCNEWS,BBC News,including climate change study 400 american schoolchildren suggests girls start see less innately talented boys six years old researchers read story really intelligent person young children found boys girls
BBCNEWS,World Business Report,building flood defence schemes across country protecting additional 300000 homes additional300000 homes additional 300000 homes climate change told expect heavy rain increasing flood risk select committee unlikely government current interventions
BBCNEWS,BBC News,hours obama exactly process executive orders things like environmental protection combating climate change minimum wage sorts issues like without actually getting congress even pass law find
BBCNEWS,Review 2016,climate change may also link competition fisheries humans obtaining food krill penguins would normally eat scientists say tracking birds see fare changing world
BBCNEWS,BBC News,united kingdom far beyond 50 billion euros excellent projects energy efficiency climate change projects infrastructure bioscience sorry end day hope come procedure bring close
BBCNEWS,Breakfast,royal family year moment headlines focusing state visit could prove diplomatically challenging know president trump opinions climate change refugees seen last hours different
BBCNEWS,Victoria Derbyshire,posting social media series tweets climate change twitter account badlands national park south dakota deleted meanwhile new administration war words us media shows sign fading away
BBCNEWS,BBC News,well torture two leaders disagree threat russia usefulness nato disagree climate change yet say want strong post brexit trade deal although britain favours free trade mr trump america
BBCNEWS,The Papers,environment right detail top line would think obviously prince charles committed environmentalist president trump climate change denier sort top line
BBCNEWS,BBC News,services people help mitigate climate change carbon stocks help providing clear water people pollination services people grow crops reversing declines means looking closely source products like timber palm oil meat making sure
BBCNEWS,BBC News at Ten,cuba brought world edge nuclear war diplomatic relations restored extraordinary transformation leaves office largely admired popular around world least role global climate change deal tried carve foreign policy saw
BBCNEWS,Newsnight,twitter new york self washington appointing self white house racist sexist climate change denier accept might wrong hey matter say 2017 might year sort
BBCNEWS,Newsnight,going take positions power world look dramatically different one today powerful person world appointing climate change sceptics ted give assurance quite likely america
BBCNEWS,BBC News,climate change going retrograde pulling money retrograde pulling money roads bridges rail going getjobs rust belt
BBCNEWS,BBC News,second half 20th century scenes like indeed ice thin ground due climate change 90s british long track speed skating gone three years ago british long track programme reborn
BBCNEWS,Newsnight,rather going war climate change planetary crisis got work together exploitation children women global crisis got work together think trying develop good trade policies people country around
BBCNEWS,Outside Source,furthering grants business asked employees communicate whether reviewed happen yet know clean air important regarding climate change suggestion white house take central
BBCNEWS,Newsnight,places really great position bunch un leave suddenly united states longer wants part united nations fully know paris climate change deal injeopardy know parts
BBCNEWS,The Papers,rest question rest question rest meet prince charles champion climate change donald trump believe white house agenda said
BBCNEWS,BBC News,appealed americans work together better society looking back eight years office highlighted range policies healthcare climate change equality said made us stronger privilege life
BBCNEWS,BBC News,final new year message barack 0bama spoke legacy president appealed americans work together better society looking back eight years office highlighted range policies healthcare climate change equality said made
BBCNEWS,The Papers,diplomatic row prince charles stance climate change express says prince william harry unveil statue princess diana grounds kensington palace mark 20th anniversary death daily mail reports nhs doctors advised
BBCNEWS,The Papers,forthcoming state visit uk one hand prince charles environmental campaigner hand donald trump isa hand donald trump climate change denier amazing quotes story sunday times
BBCNEWS,Newsday,life opportunity say something people may read listen rather yes absolutely right politics donald trump however ithought donald trump however thought climate change everything everybody
BBCNEWS,HARDtalk,half minutes midnight said considered donald trump election comments considered comments nuclear weapons particular considered global security situation trump comments climate change said closer doomsday
BBCNEWS,BBC News at Five,largely admired popular around world least role world least role global climate change deal tried carve foreign policy saw right times commander chief
BBCNEWS,Outside Source,leaves office largely admired popular around world least role global climate change deal tried carve foreign policy saw right times commander chief given traditional send way
BBCNEWS,BBC Newsroom Live,election said pull paris climate deal one yet knows recently met climate campaigner al gore also appointed several key cabinet members expressed sceptical views climate change could soon see land speed record broken
BBCNEWS,BBC News at Five,scientists monitoring break months even though crack ice shelf got significantly worse december blaming climate change calling natural event environment correspondent matt mcgrath stretching around 100 miles length 100 yard wide rift
BBCNEWS,BBC Newsroom Live,16 16 suppose effect climate change recent years people used cold night several mild winters row caught people balance people balance thank much 0ur weather set get cold
BBCNEWS,BBC News,observers point makes mention civil rights healthca climate change new president cabinet beginning take shape retired generaljames mattis sworn defence secretary john kelly retired marine corps general also sworn head homeland security
BBCNEWS,Breakfast,change donald trump white house christine todd whitman boss environment protection agency george bush president says president elect trump ignoring science climate change failing take right approach issues find worrying
BBCNEWS,BBC News,quality combats climate change every reason government making rail travel attractive affordable possible would equitable way accept rolling stock needs changed would fair way first would
BBCNEWS,BBC News,improves air quality combats climate change every reason government making rail travel attractive affordable possible would equitable way accept rolling stock needs changed would fair way
BBCNEWS,BBC News,special relationship based common history also one values closest jeopardy changes way wishes things know share values climate change share values way
BBCNEWS,BBC News,taken ta ken others taken others committed repealing president obama actions climate change going busy months clearly donald trump also better make busy days starting early quick news update
BBCNEWS,Meet the Author,colonialism damage colonial conscience one thing think could look metaphor climate change know martians planet collapsed terrible way migrants heavily armed migrants come earth gives
BBCNEWS,Outside Source,made chinese hoax appointed people lu kewa rm lukewarm climate change sceptics interesting see scientific immunity respects putting data week president trump comes reinforce
BBCNEWS,Meet the Author,colonialism damage colonial conscience one thing think could look metaphor climate change know martians planet collapsed terrible way migrants heavily armed migrants come earth gives
BBCNEWS,BBC Newsroom Live,putting forward views sure assuming donald trump come assuming prince wales contact one things discuss climate change yes thank much nick week anger
BBCNEWS,HARDtalk,possible nuclear conflict put clock forward two half minutes midnight said considered donald trump election comments considered comments nuclear weapons particular considered global security situation trump comments climate change
BBCNEWS,Victoria Derbyshire,never take nevertake train never take train benefit clearer roads people need drive get need cleaner air better health mitigating climate change rail plays part supporting society economy
BBCNEWS,BBC News at One,researchers said evidence climate change playing significant role new iceberg formation four people charged hate crimes connection assault teenager special needs streamed live facebook two men two women due appear court
BBCNEWS,Breakfast,part regulation gone protecting environment hear interview radio 4 documentary climate change trump card tomorrow 8pm hull year uk city culture started bang last night huge firework display along humber estuary thousands people turned
BBCNEWS,World News Today,users pointing former webpages hosted white house policies climate change lgbt rights civil rights longer available instead sections replaced pages standing law enforcement community america first energy policy among others twitter barack 0bama let go potus handle
BBCNEWS,BBC News,climate change study four hundred children united states suggests girls start see less innately talented boys six years old researchers three universities read story really intelligent person five six seven year old children without revealing gender main character
BBCNEWS,Wednesday in Parliament,country whole international community tone sets ask reassure us sets ask reassure us say president must abide withdraw paris climate change treaty case
BBCNEWS,Click,spent much year using remote cameras find adapting climate change threats face victoria gill given exclusive access research report contains flashing images antarctica following team scientists setting remote cameras penguin colonies
BBCNEWS,Breakfast,assembly botched energy scheme parties centre crisis avoid future conflict also morning climate change research ice huge crack antarctic forcing scientists leave state art station ask impact science perfect lives lived
BBCNEWS,BBC Newsroom Live,theissue honourable gentleman played issue looking climate change change hope recognises commitment government shown issued legislation put two changes brought terms energy sector uses different forms energy 0bama
BBCNEWS,The Papers,muslim countries entering united states sunday times says diplomatic rift president trump prince wales views climate change paper says could disrupt president state visit uk injune sunday express says prince william harry unveil statue
BBCNEWS,BBC News,wind rain may kept outside light air one emerge winner trade war also said countries redouble commitment paris climate change agreement mr trump threatened quit translation signatories stick instead walking away
BBCNEWS,BBC Newsroom Live,pause decrease levelled greeted lot cheer well seen many sceptics climate change serious problem studies questioned idea pause last year report one big
BBCNEWS,Newsday,transformation leaves office largely admired popular around world least role global climate change deal tried carve foreign policy saw right times commander chief given traditional send way destructive us power influence
BBCNEWS,BBC News at Five,trump given approval keystone trump given approval keysto ne x l trump given approval keystone xl pipeline carrying oil canada american refineries gulf coast president obama stopped construction said would undermine efforts get global deal climate change despite president trump says
BBCNEWS,Outside Source,trump unusual look said wants epa wants clea n epa wants clean air clean water much stuff climate change moment put place block epa
BBCNEWS,Newsnight,let clear self interest strong defending climate change interests defend two state solution israel palestine donald trump wants overturn seems good notes theresa may speech tonight mention things main thrust
BBCNEWS,BBC News at Five,today look science ask donald trump presidency mean battle climate change behind next big venture space rebecca morelle hi rebecca morelle bbc global science correspondent look 2017 china heading moon success robotic
BBCNEWS,Outside Source,agriculture employees go well someone access badlands national park treated today amount carbon dioxide atmosphere higher time last 650000 years point say please take climate change seriously couple others deleted matt mcgrath bbc environment correspondent
BBCNEWS,Sportsday,fascinating look life penguin scientists antarctica working groundbreaking project capture activity colony penguins camera spent much year using remote cameras find adapting climate change threats face victoria gill given exclusive access research
BBCNEWS,BBC Newsroom Live,think needs said donald trump rip things say tra ns pacific trump rip things say trans pacific partnership likely say us pa rt likely say us part climate change accords cannot institute new arrangement new deals
BBCNEWS,Breakfast,think try repeal obamacare think try repeal obamaca without think try repeal obamacare without idea cover 20 million americans added gotten security think try ta ke security think try take america climate change chords without idea serious issues
