Station,Show,Snippet
BBCNEWS,BBC Newsroom Live,sea level rise across entire delta hotspot climate change vulnerable low lying large delta plane sinking sea level coming let go see
BBCNEWS,BBC Newsroom Live,science editor david shukman travelled mekong delta vietnam one areas vulnerable effects climate change sent us report incredibly hot mekong delta south vietnam
BBCNEWS,BBC News at Five,sent report incredibly hot mekong delta south vietnam region described one vulnerable anywhere world effects climate change board team
BBCNEWS,Afternoon Live,industrialise beautiful countryside force famine flooding many disasters world vulnerable communities exacerbating climate change fracking beginning right never critical time take action
BBCNEWS,BBC News at Five,climate change fracking beginning right never critical time take action planet needs encourage everyone able join us take action saturday mass demo preston
BBCNEWS,BBC Newsroom Live,power generation put uk among best nations tackling climate change far current levels wind solar power enough supply energy needs last week un climate report calls zero
BBCNEWS,BBC News at Six,scientists issued starkest warning yet rising global temperatures impact planet end century week president trump admitted longer believes climate change hoax
BBCNEWS,BBC News at Six,global agreement climate change head un wants see come back think west rejoin need understand see cities business community
BBCNEWS,Beyond 100 Days,2030 making cut harder america leads global agreement climate change head un come back west rejoin need understand
BBCNEWS,Newswatch,climate change deniers getting much airtime fiona bruce get police escort get studio time present wednesday news six monday report
BBCNEWS,Newswatch,majority scientists significant man made climate change exists minority challenge analysis achieving balance kind bbc policy made clear internal briefing memo
BBCNEWS,Britains Best New Building,beautiful historic landscape sustainability credentials really important us also resilience climate change flood plain building raised flood plain pretty confident going 300
BBCNEWS,Asia Business Report,important crop world directly feeding people food otherfood rice also water intensive given asia growing population possible effects climate change affect rice
BBCNEWS,Sportsday,also resilience climate change flood plain building raised flood plain pretty confident going 300 years college past
BBCNEWS,BBC News,saying notjust cracking digesting climate change want government concerns think cracking interfaith industry began cracking monday say safe
BBCNEWS,The Briefing,african penguin population rapidly declining conservationsists say habitat hit rising tides caused climate change campaigners looking new ways protect birds eliza philippidis reports boulders beach home one
BBCNEWS,BBC News,urgently needed donald trump saying climate change flies face overwhelming scientific evidence gases given traffic power stations sources heating planet last week un climate panel
BBCNEWS,BBC News,subsidies electric cars allowing fracking start shale gas tackling climate change never going easy david shukman bbc news may heard duke duchess sussex harry meghan expecting baby
BBCNEWS,Britains Best New Building,landscape sustainability credentials really important us also resilience climate change flood plain building raised flood plain pretty confident going 300 years
BBCNEWS,Beyond 100 Days,university south pacific couple watched dance climate change first time long time meghan turn speak spoke right education particular
BBCNEWS,BBC News,jailed jail sentence quashed freed wednesday one problems people saying fracking also protesting climate change saying want
BBCNEWS,Beyond 100 Days,eve ryo ne everyone would end right irish minister saying today irish prime minister saying today political equivalent climate change change relationship
BBCNEWS,Beyond 100 Days,americans one thing motto many one still americans brings us together fabric take even issue like climate change example
BBCNEWS,Breakfast,samira ahmed bbc news denying voice climate change deniers getting much airtime fiona bruce get police escort get studio time present wednesday
BBCNEWS,Breakfast,majority scientists significant man made climate change exists minority challenge analysis achieving balance kind bbc policy made clear internal briefing memo
BBCNEWS,BBC News,go past 1 5 look happened 1 climate change temperature rise floods weather seen train exeter yesterday line devon
BBCNEWS,Inside Out,species different pressures climate change loss habitat hunting really multiplying pressure also see mammoth gone gone get back
BBCNEWS,Beyond 100 Days,economy health care big issues immigration become bigger issue certain places like florida climate change previous report showed foreign policy generally determinative think particular issue people seas
BBCNEWS,Afternoon Live,statistics yes fascinating one well set backing climate change warmer air warmerair moisture translating heavy rain warmer ocea ns oceans well pinpoint one thing
BBCNEWS,The Briefing,weekend keep daylight savings finally oregon trial begin lawsuit brought young activists arguing us government violated constitutional rights failing protect climate change syria national museum
BBCNEWS,Beyond 100 Days,un catastrophic climate change experiencing get report detect world leaders robust response piecemeal talk real action somewhat depressed
BBCNEWS,Beyond 100 Days,series crucial meetings un climate change parrot paris agreement looking ratchet paris agreement looking ratchet commitments also convention biological diversity need formulate new plan help loss
BBCNEWS,BBC News,freeze furious budget secured future secured ourfuture instead jeopardises future meets ip cc report landmark un climate change report said 12 years
BBCNEWS,BBC Newsroom Live,england warned sea levels could rise least metre end century committee climate change says 1 2 million homes could risk coastal flooding erosion 2080s says current shoreline plans
BBCNEWS,BBC Newsroom Live,people homes take seriously inevitability sea level rise government says sea defences built spokesman said people would protected climate change roger harrabin bbc news 45 year old man
BBCNEWS,Newswatch,david sillitoe bbc news people living england coastal communities warned wake challenges climate change government climate advisers say one point two million homes could threatened coastal flooding erosion 2080s
BBCNEWS,Business Briefing,seriously inevitability sea level rises government says sea defences built spokesman says people would protected climate change story breakfast coming six clock charlie stayt naga munchetty
BBCNEWS,Afternoon Live,communities warned wake challenges climate change government climate advisers say one point two million homes could threatened coastal flooding erosion 2080s worst case scenario claimed sea levels england
BBCNEWS,Business Briefing,good see vested interests pushing back know huge public interest reducing emissions transport largest source carbon emissions causing climate change know already seeing effects around world
BBCNEWS,Afternoon Live,colleague spoke environmental scientist chief executive climate alliance asked situation came climate change already reached overi degrees warming since preindustrial times heading 1 5 degrees
BBCNEWS,Afternoon Live,scale changes experiencing climate system unprecedented scale changes humans would implement order keep climate change control unprecedented challenge human civilisation
BBCNEWS,Afternoon Live,business news moment first look headlines afternoon live scientists issue starkest warning yet dangers climate change four sisters feared dead limousine crash america
BBCNEWS,Afternoon Live,scientists issued starkest warning yet danger climate change dramatic report un intergovernmental panel says world nowhere near target keeping rise average global temperatures 1 5 degrees celsius instead says heading
BBCNEWS,Afternoon Live,looming eroding consumer confidence watching afternoon live headlines scientists issue starkest warning yet dangers climate change save children publishes internal review following allegations abuse charity one five staff say
BBCNEWS,Afternoon Live,telling us hot business news look forward first though look headlines afternoon live scientists issue starkest warning yet dangers climate change save children publishes
BBCNEWS,BBC News at One,planet peril scientists issue starkest warning yet dangers climate change dramatic report say world course miss target keeping global temperatures countries need ambition get moving
BBCNEWS,BBC News at One,deserves die way thank top story lunchtime planet peril scientists issue starkest warning yet dangers climate change still come two recent deaths children using bouncy castles bbc
BBCNEWS,BBC Newsroom Live,watching bbc newsroom live s11am right main stories scientists issue strongest warning yet climate change saying society must undergo rapid far reaching change meet targets ipcc report says temperature rises limited
BBCNEWS,BBC Newsroom Live,warnings pretty stark clear saying things stand world miss targets rises sea levels effects climate change would like really clear genesis
BBCNEWS,BBC Newsroom Live,back professor talked earlier need political tackle concerned climate change gets pushed agenda uk big issue conservative party conference last
BBCNEWS,BBC Newsroom Live,bejoined report detail 1235 joined professor hague joining us professorjoanna haigh grantham institute climate change environment professor chris fogwill keele institute sustainable futures keele university
BBCNEWS,BBC Newsroom Live,global take steps necessary address time example president trump withdrawn international climate change agreement one strengths particular group ipcc come spent last week government representatives
BBCNEWS,BBC News,sea levels rise intergovernmental panel climate change says world currently track much worse rise three degrees rather one five degrees pre industrial levels end century science editor david shukman
BBCNEWS,BBC News,reaction story special programme 8 30 bbc news tonight putting questions climate change experts text us 611211 email askthis bbc co uk tweet using hashtag bbc ask
BBCNEWS,Beyond 100 Days,still come going electric answer climate change far cars go find like drive one daily basis 42 year old mother 8 named second person died
BBCNEWS,Sportsday,bbc news looking main headlines scientists given starkest warning yet dangers client check climate change saying rapid change needed avoid catastrophe brayden biggest car maker says close solihull
BBCNEWS,Victoria Derbyshire,hello monday nine clock joanna gosling welcome programme drastic changes way live needed bring global temperatures control according new report intergovernmental panel climate change countries need ambition
BBCNEWS,Victoria Derbyshire,episode new doctor jodie whittaker nail let us know think top story today scientists given one starkest warnings yet changes needed tackle climate change report intergovernmental
BBCNEWS,Victoria Derbyshire,currently account 25 even green energy revolution comprehensive assessment perils climate change concludes every one us need make changes live lives changes start
BBCNEWS,BBC News,compared temperature century ago thought really dangerous international treaty climate change paris agreement set limit two degrees long time considered safe new research says lower
BBCNEWS,The Briefing,id tokyo please bring idea tokyo people think would fantastic brings us back story started issue climate change report says think new ways living
BBCNEWS,Click,project trying solve much bigger problem world deliveries climate change shafted couple years ago even though method viable cost teller proud x inventions even costly
BBCNEWS,BBC News,confident ever fingerprint climate change seen severity frequency extreme weather events paris climate agreement committed governments keeping rise global temperatures century well two degrees many researchers believe
BBCNEWS,BBC News at One,authors say every possible option control emissions must considered thing climate change always necessarily fall cliff particular level warming warmer gets globally frankly worse gets
BBCNEWS,Newsday,london also programme western nations attack claim russian spies hacking governments institutions around world travel vietnam find vulnerable climate change rising sea levels midnight london
BBCNEWS,BBC News at One,vulnerable anywhere world effects climate change board team scientists let find investigating one scientists board professor dan parsons university hull
BBCNEWS,The Briefing,ocean getting food chain resonate people buy clothes fashion hear climate change think something mps saying
BBCNEWS,BBC News,vulnerable anywhere world effects climate change board team scientists let find investigating one scientists board professor dan parsons university hull
BBCNEWS,BBC News,substantial costs acting climate change grim message clear message us secretary state mike pompeo met south korean president moonjae seoul brief meeting north korea
BBCNEWS,The Papers,consensus thought paris president trump decided would withdraw president trump thinks climate change hoax created chinese google making administration saying expect global
BBCNEWS,Breakfast,pictures warming world scientists confident ever impacts climate change playing severity frequency droughts storms extreme weather gathered south korean city incheon events
BBCNEWS,Breakfast,severity frequency droughts storms extreme weather events gathered south korean city incheon past week climate change researchers government delegates hammered final details dramatic report outlining consequences
BBCNEWS,Breakfast,together science climate change moment indicating want stay 1 5 celsius certain actions would need happen next decades soon possible
BBCNEWS,Breakfast,time want talk climate change report today really calling strong government fundamental changes made keep temperatures scottish government much priority bad specifically
BBCNEWS,The Briefing,25 even green energy revolution comprehensive assessment perils climate change concludes everyone us need make changes live lives changes start victoria gill news
BBCNEWS,BBC News at Five,want even green energy revolution comprehensive assessment perils climate change concludes every one us need make changes live lives changes start
BBCNEWS,BBC News at Five,unfortunately effects climate change become readily apparent observation seen stronger storms la st seen stronger storms last half degree warming drought intensified heatwaves loss corals loss
BBCNEWS,BBC News at Five,turn lights really capturing hidden cost cost climate change air pollution erect things accounting act become way ahead much
BBCNEWS,BBC News at Six,world top climate scientists say dramatic changes need made quickly lifestyles avoid catastrophic climate change future say give meat throw less away drive electric cars walk fly less governments must make
BBCNEWS,BBC News at Six,homes flooding sea levels rise intergovernmental panel climate change says right world currently track much worse rise three degrees rather one five degrees pre industrial
BBCNEWS,Afternoon Live,able continue try end positive note done us need limit climate change also need find ways learn live worst impacts
BBCNEWS,BBC Newsroom Live,able continue end positive note done us need limit climate change also need find ways learn live worst impacts
BBCNEWS,BBC Newsroom Live,nhs contractor political leaders northern ireland meet eu brexit negotiator brussels discuss possible solutions irish border question fuelling climate change producing much waste mps say britain clothing chains damaging environment must reduce impact
BBCNEWS,BBC News at Five,try limit climate change also need find ways learn live worst impacts many thanks professor steve darby university southampton waiting report un climate panel looking
BBCNEWS,Newsday,meat production isjust meat production responsible carbon emissions climate change cars street today anyone actually want eat travelled cattle country ask diners ozark missouri
BBCNEWS,BBC Newsroom Live,rapidly declining registered 70 per cent fall 2001 2013 numbers still going conservationsists say habitat hit rising tides caused climate change campaigners looking new ways protect birds
BBCNEWS,Beyond 100 Days,trade eu worth watch entirety understand mr trump sees world one issue got particular attention president view climate change 0ur science editor david shukman analysis hurricane michael tore florida
BBCNEWS,Beyond 100 Days,saying climate change flies face overwhelming scientific evidence gases given traffic power stations sources heating planet earlier last week un climate panel said world warned one celsius
BBCNEWS,Newswatch,unhappy assumptions made bbc climate change reporting unhappy way evan davis pressing satisfy think point vast majority scientific science settled
BBCNEWS,Newswatch,overwhelming majority scientific opinion really clear man made climate change exists think important relfect said beginning bbc put new memo training guidance
BBCNEWS,Breakfast,founder britain largest organic vegetable supplier riverford told bbc calls anti plastic religious fervour dangerous distraction fight climate change guy singh watson influential green entrepreneur campaigner fears spending much
BBCNEWS,BBC News,agreement climate changelj america leads global agreement climate change think west rejoin need understand see cities business community states solid commitment climate action governments
BBCNEWS,BBC News,people work solar power coal industry clean energy creating jobs comes climate scientists say urgently needed donald trump saying climate change lies face overwhelming scientific evidence gases
BBCNEWS,BBC News,warming 45 2030 making cut harder america leaves global agreement climate change head un wants see come back think west rejoin need
BBCNEWS,BBC Newsroom Live,since married heard almost nothing today university south pacific couple watched dance climate change first time long time meghan turn speak
BBCNEWS,Breakfast,insight interesting perspective interview trouble viewers frustrated contacted newswatch feel scientific doubt unhappy assumptions made bbc climate change reporting unhappy way
BBCNEWS,Breakfast,evan davis pressing satisfy think point vast majority scientific science settled vast majority scientific opinion admits climate change happening man made phenomenon
BBCNEWS,Newsday,reliant new technology allows us document whales place climate change taking place also commercial krill fishing industry primarily fishes overlapping feeding grounds time
BBCNEWS,Newsday,krill reliant new technology allows us document whales place climate change taking place also commercial krill fishing industry primarily fishes overlapping feeding grounds time
BBCNEWS,BBC Newsroom Live,train tracks destroyed today report says happen sea levels pushed higher man made climate change another problem committee warns get worse homes hemsby norfolk slipped sea ways ate away cliff
BBCNEWS,Victoria Derbyshire,affected climate change say explain happened good morning chloe thank witnessed sea level rise recent years also witnessed massive decline sediment transport sea tried combat
BBCNEWS,Victoria Derbyshire,time need stronger government action climate change thank much speaking us sound familiar right wing presidential candidate courted controversy ridden popularity issues like race abortion gun laws migration populist wants turn back
BBCNEWS,BBC News,thing offsetting sea level rise across entire delta home 18 million people mentioned hotspot climate change makes vulnerable low lying large delta plain sinking sea level coming
BBCNEWS,Afternoon Live,report therefore milestone conveying message human society countries need ambition get moving climate change action going keep 1 5 degrees within reach action world course breach crucial
BBCNEWS,Afternoon Live,nordhaus paul romer two men split prize william nordhaus winning work climate change economics paul romer work economic growth committee said models created help pressing issues time including sustainable
BBCNEWS,Afternoon Live,knock effect food prices also food availability businesses negate impact climate change businesses obvious thing start source energy get rid social fossil fuels throughout
BBCNEWS,Afternoon Live,decide want even green energy revolution comprehensive assessment perils climate change concludes every one us need make changes live lives changes start
BBCNEWS,Afternoon Live,work climate change economics paul romer work economic growth committee said models created help pressing issues time including sustainable growth welfare world population 20 people killed new york state
BBCNEWS,Afternoon Live,building refurbished 2016 watching afternoon live headlines scientists issue starkest warning yet dangers climate change four sisters feared dead limousine crash america killed 20 people many young people afford buy new home
BBCNEWS,Afternoon Live,accelerate action tackle climate change middle century could facing situation simply able cope time china india growing economies planet net
BBCNEWS,Afternoon Live,plea save planet late scientists issue starkest warning yet risks climate change warn huge changes needed government policies individual lifestyles order avoid catastrophic rise global temperatures countries need ambition
BBCNEWS,BBC News at One,climate change action going keep 1 5 degrees within reach latest science editor south korea un report published also lunchtime four sisters feared dead limousine crash america killed 20 people
BBCNEWS,BBC News at One,report therefore milestone conveying message human society countries need ambition get moving climate change action going keep 1 5 degrees within reach action world course breach crucial
BBCNEWS,BBC News at One,decide want even green energy revolution comprehensive assessment perils climate change concludes every one us need make changes live lives changes start
BBCNEWS,BBC News at One,scientists saying everybody accelerate action tackle climate change middle century could facing situation able cope time china india growing economies
BBCNEWS,BBC News,planet peril scientists issue starkest warning yet dangers climate change bbc news one goodbye bbc one nowjoin bbc news teams afternoon latest
BBCNEWS,BBC News,meeting south korea says unprecedented changes people use energy order restrict rising temperatures intergovernmental panel climate change calling rise earth temperature since industrial age limited 1 5 degrees celsius
BBCNEWS,BBC News,example climate change mean places like maldives greater risk flooding higher water levels likely displace large numbers people going impact uk think british government putting sufficiently high
BBCNEWS,BBC News,get moving climate change action four sisters feared dead limousine crash america killed twenty people many young people afford buy new home even afford deposit according new research coming afternoon live
BBCNEWS,BBC Newsroom Live,report intergovernmental panel climate change says limiting temperature rises 1 5 celsius require massive changes way live warns without action world coral reefs die low lying regions disappear
BBCNEWS,BBC Newsroom Live,extreme weather events gathered south korean city incheon past week climate change researchers government delegates hammered final details dramatic report outlining consequences global temperature rise 1 5 degrees plan
BBCNEWS,BBC Newsroom Live,climate change action going keep 1 5 degrees within reach latest science editor south korea un report published also lunchtime four sisters feared dead limousine crash america killed 20 people
BBCNEWS,Beyond 100 Days,washington heart thinking talked two things see happening politics becoming partisan divided issue climate change argument isa financial opportunity 0bama administrative try make
BBCNEWS,Victoria Derbyshire,low lying regions disappear rising sea levels science correspondent victoria gill reports pictures warming world scientists confident ever impacts climate change playing severity frequency droughts storms
BBCNEWS,Victoria Derbyshire,many saying climate change exists natural process nothing prevent banning diesel petrol cars unrealistic unattainable say anyone else thinking way well
BBCNEWS,BBC News at Five,credentials really important us also resilience climate change flood plain building raised flood plain pretty confident going 300 years college past
BBCNEWS,BBC News,also resilience climate change flood plain building raised flood plain pretty confident going 300 years college past find
BBCNEWS,BBC News at One,fingerprint climate change seen severity frequency extreme weather events paris climate agreement committed governments keeping rise global temperatures century well two degrees many researchers believe limit fact high
BBCNEWS,Newsday,farmers saw fields slip underwater worried never possible hold back sea climate change getting worse says man water level rising fast time build defences threat felt
BBCNEWS,BBC News,rise across entire delta home 18 million people mentioned hotspot climate change makes vulnerable low lying large delta plain sinking sea level coming essentially drowning serious stuff
BBCNEWS,The Briefing,conversation slave fast fashion high street knock offs catwalk couture designed last months group british politicians say industry fuelling climate change spreading microplastics oceans tell us think
BBCNEWS,The Papers,able revert tipping point climate change control under1 5 1 5 degrees under1 5 degrees 1 5 degrees think point piece basically look brexit perspective uk less
BBCNEWS,The Papers,equipped deal climate change leave trading scheme regulations court justice would rule climate issues think say going get worse brexit think
