Station,Show,Snippet
BBCNEWS,World News Today,entire housing complex destroyed tremor rising sea levels punishing droughts life threatening heatwaves potential impacts global warming many world vulnerable countries say world must
BBCNEWS,BBC Newsroom Live,future therefore give personal support proposed gb freight move rail scheme would ta ke take lorries roads work cutting co2 emissions contributing global warming poisoning air
BBCNEWS,BBC News,temperature rises 1 5 degrees finalised report due published monday sound warning speed scale measures required protect countries vulnerable global warming rising sea levels expected prompt calls
BBCNEWS,BBC News,bbc iplayer ambitious global warming climates climates agreed limit tempted know 1 tempted know 1 celsius three industrial levels levels tightening ambitions adopted paris 2015
BBCNEWS,Breakfast,saying want tackle limit scale global warming keeping safe level got really change everything everything diet eating less meat thinking commute
BBCNEWS,Business Briefing,must better researchers redouble efforts push new strategy tackle global warming brazil right wing congressman jair bolsonaro takes commanding lead presidential election face run leftist rival fernando haddad
BBCNEWS,BBC News at Five,avoid damaging global warming scientists calling much renewable energy development transport uses less fuel new ways take carbon dioxide atmosphere happening
BBCNEWS,HARDtalk,candidate jair bolsonaro done best first round presidential election tackling climate change scientists may finally answer report south korea landmark report set release
BBCNEWS,BBC News,climate change campaigners looking ways protect birds eliza philippidis reports
BBCNEWS,Afternoon Live,currently predicted ambition get moving climate change action
BBCNEWS,Outside Source,acting climate change report says needs significant shifts four
BBCNEWS,Afternoon Live,temperatures going work get rid carbon dioxide without dumping atmosphere avoid damaging global warming scientists call much renewable energy development transport uses less fuel
BBCNEWS,Afternoon Live,technologies needed remove enough carbon atmosphere yet developed report important also shows options need take shows possible limit global warming 1 5 degrees
BBCNEWS,BBC News at One,size australia technology needed remove enough carbon atmosphere developed report important also shows options need take shows possible limit global warming 1 5 degrees
BBCNEWS,BBC Newsroom Live,even three degrees kind level definitely established report within laws physics chemistry keep global warming within1 5 degrees critical issueis within1 5 degrees critical issue going political
BBCNEWS,BBC Newsroom Live,specifically designed send really serious message potential consequences potential consequences thislj think known long time global warming due human made carbon dioxide impact happen
BBCNEWS,Outside Source,rising global temperatures spell disaster world say u nless unless quick action taken governments individuals melting arctic sea ice rising sea levels extreme weather already result global warming say get much worse
BBCNEWS,Climate Change,governments taking action needed reduce global warming united states picture mixed states corporations massively expanding cheap power sun wind us government signatory climate assessment today
BBCNEWS,Victoria Derbyshire,government put 200 tax flashy cars suv road one cares global warming west personal pleasures comforts get real bbc west totally selfish kevin need
BBCNEWS,Newsday,living region level sea even small rise could devastating vietnam dozens countries facing threat want see global warming limited much possible
BBCNEWS,BBC News,even small rise could devastating vietnam dozens countries facing threat want see global warming limited much possible mean future three years ago primary school
BBCNEWS,Newsday,level sea even small rise could devastating vietnam dozens countries facing threat want see global warming limited much possible mean future
BBCNEWS,BBC News,education like community groups resilience really needs built back coast work new sea defences scientists used think safe limit global warming two degrees say need lower
BBCNEWS,BBC News at Six,needs built back coast work new sea defences scientists used think safe limit global warming two degrees say need lower target avoid serious damage countries like
BBCNEWS,Outside Source,even small rise could devastating vietnam dozens countries facing threat want see global warming limited much possible mean future three years ago primary school
BBCNEWS,World News Today,learn live worst impacts many thanks professor steve darby university southampton waiting report un climate panel looking implications trying limit global warming way
BBCNEWS,BBC News,leftist rival fernando fernando haddad climate scientists say must better report south korea new strategy tackle global warming released tributes paid 20 people killed car crash involving stretch limousine
BBCNEWS,Dateline London,dangerous rise temperature intergovernmental panel says massive changes needed keep global warming 1 5 degrees celsius include changes food eat way energy generated police turkey continuing investigations
BBCNEWS,Breakfast,absolutely stunning giants crowds well back main story morning scientists warn rapid changes needed reverse damage done global warming calling governments stop global
BBCNEWS,Breakfast,higher temperature really bad effects global warming would kick perhaps later century new research says go above1 5 new research says go 1 5 degrees mentioned unpleasant things
BBCNEWS,BBC News at Six,burned give carbon dioxide vast new forests must also planted soak gas chance keeping global warming safe level report sent clear message act
BBCNEWS,BBC News at Six,relies fossil fuels like many development around world incredibly hard change scientists mapped way minimising global warming see everyone makes david shukman bbc news south korea
BBCNEWS,BBC News at Ten,extreme weather already result global warming say get much worse report sets incredibly difficult challenges asking realistic try meet also look
BBCNEWS,The Travel Show,operator need prove travellers hard earned cash put good use joe miller bbc news told eat less meat help tackle global warming seems sunday roasts steak dinners safe
BBCNEWS,Outside Source,translation climate change getting worse says man water level rising fast
BBCNEWS,BBC News,climate change monday one week indonesian island sulawesi hit devastating earthquake tsunami
BBCNEWS,Business Briefing,world problems migration tourism poverty inequality climate change women children rights two things make people
BBCNEWS,Business Briefing,time done 15 yea rs years would years iwould imagine years would imagine many breathing sigh relief absolutely done business cars previously carbon tax credits involved shows
BBCNEWS,Afternoon Live,middle parts week bbc news latest headlines major un report climate change says must
BBCNEWS,Outside Source,starkest warnings climate change today temperatures could rise much three degrees coming
BBCNEWS,BBC News at Five,want analysis reaction ipcc report climate change special report 8 30
BBCNEWS,BBC News,also protesting climate change saying want government concerns fracking
BBCNEWS,BBC News at One,rising sea levels direct result global warming contribute coastal communities everybody country contributes funding come centrally bear equal portion cost government says sea
BBCNEWS,BBC News,professor steve darby university southampton waiting report un climate panel looking implications trying limit global warming way vietnam countries want see going possible three decades
BBCNEWS,Afternoon Live,victoria gill bbc news well today report described global wake call planet governments individuals around world need limit global warming 0ur science correspondent pallab ghosh reports ipcc warned two possible
BBCNEWS,BBC News at One,victoria gill bbc news well today report described global wake call planet governments individuals around world need limit global warming 0ur science correspondent pallab ghosh reports ipcc warned two possible
BBCNEWS,BBC News at One,startling see blunt language used report read many things years usually much cautious 0ver cautious years sense global warming really problem worst
BBCNEWS,BBC Newsroom Live,western parts scotland windy rain talking indian summer hello bbc news headlines environmental experts warning catastrophic consequences unless urgent action taken internationally limit global warming intergovernmental panel
BBCNEWS,Climate Change,options need take shows possible limit global warming 1 5 degrees great transitions across economy change way behave eating less red meat eating fruit vegetables backdrop
BBCNEWS,Victoria Derbyshire,headlines morning thank bbc news headlines climate scientists meeting south korea given one starkest warnings yet scale challenge involved tackling global warming saying society undergo rapid far reaching change
BBCNEWS,BBC News,heatwaves potential impacts global warming world taken action agreeing limit rise average temperatures two degrees un climate scientists meeting discuss whether high whether limit 1 5 degrees may safer
BBCNEWS,BBC News at Five,work new sea defences scientists used think safe limit global warming 2 degrees say need lower target avoid serious damage countries like get major report
BBCNEWS,BBC News,threat want see global warming limited much possible 11 30pm taking depth look papers reviewers talkradio presenter daisy mcandrew katy balls political correspondent spectator stay us good evening
BBCNEWS,BBC News at Ten,vietnam dozens countries facing threat want see global warming limited much possible teenager becomes first football player born century called england football squad coming sportsday bbc
BBCNEWS,BBC News,scale measures required protect countries vulnerable global warming rising sea levels expected prompt calls urgent steps cut greenhouse emissions zero 2050 bring full details report special coverage intergovernmental panel
BBCNEWS,BBC News,must act rapidly prevent dangerous rise temperature intergovernmental panel says massive changes needed keep global warming 1 5 degrees celsius include changes food eat way energy generated police turkey continuing
BBCNEWS,BBC News,must act rapidly prevent dangerous rise temperature intergovernmental panel says massive changes needed keep global warming 1 5 degrees celsius include changes food eat way energy generated police turkey continuing
BBCNEWS,Breakfast,bbc news headlines scientists issue extensive warning yet huge changes needed avoid catastrophic levels global warming police us investigating limousine crash killed 20 people including driver 17 passengers carol look
BBCNEWS,BBC Newsroom Live,many thanks professor steve derby university southampton waiting reports un climate panel looking implication trying limit global warming way vietnam countries want see going possible
BBCNEWS,Beyond 100 Days,gave days ago global warming raised level sea floods serious us government coincide bloom warning worse come president disagrees ” bloom warning worse come president disagrees think
BBCNEWS,Breakfast,take mature special incredible work drawing carbon specimens one thing stop missions climate crisis another thing use tools
BBCNEWS,Beyond 100 Days,facing climate change catastophe today learn 60 global wildlife populations disappeared since 1970 hello welcome
BBCNEWS,BBC News,limit climate change also need find ways learn live worst impacts many thanks
BBCNEWS,BBC Newsroom Live,roger harrabin bbc news let speak laurie laybourn langton director uk health alliance climate change welcome achievable
BBCNEWS,Newswatch,week samira ahmed examines bbc climate change coverage hello welcome newswatch samira ahmed bbc news denying voice
BBCNEWS,BBC News,scholarships study climate change says daily threat people living fiji every drivers might going
BBCNEWS,Afternoon Live,temperatures going work get rid carbon dioxide without dumping atmosphere avoid damaging global warming scientists call much renewable energy development transport uses less fuel new ways take carbon dioxide atmosphere
BBCNEWS,Afternoon Live,carbon afford burn going stabilise temperatures going work get rid carbon dioxide without dumping atmosphere avoid damaging global warming scientists call much renewable energy development
BBCNEWS,Newsday,heatwaves potential impacts global warming many world vulnerable countries say world must limit average rise global temperatures one vietnam science editor david shukman reports painful sight homes lost waves
BBCNEWS,BBC News at Five,devastating vietnam dozens countries facing threat want see global warming ltd much possible biggest publishing day year speak romesh ranganathan new autobiography battle christmas best seller
BBCNEWS,BBC News,community groups resilience really needs built back coast work new sea defences scientists used think safe limit global warming two degrees say need lower target avoid serious damage countries like
BBCNEWS,BBC News at Six,facing threat want see global warming limited much possible mean future three years ago primary school swamped river beside rising waters becoming dangerous researcher florence halsted find children think
BBCNEWS,Outside Source,needs built back coast work new sea defences scientists used think safe limit global warming two degrees say need lower target avoid serious damage countries like get major
BBCNEWS,The Briefing,climate changesays unprecedented changes needed parts society global warming limited 1 5 celsius pre industrial levels achieving would help save millions people flooding preserve endangered species like coral reefs victoria gill pictures warming world
BBCNEWS,BBC News at Five,victoria gill bbc news well today report described global wake call planet governments individuals around world need limit global warming 0ur science correspondent pallab ghosh reports ipcc warned two possible futures planet
BBCNEWS,BBC News,burned give carbon dioxide vast new forests must also planted soak gas chance keeping global warming safe level report sent clear message act substantial reductions carbon dioxide emissions
BBCNEWS,Afternoon Live,south korea discuss rise global warming publish report next week expected say urgent action needed keep rise temperatures 1 5 degrees celsius many low lying countries say may disappear sea limit breached
BBCNEWS,Afternoon Live,many thanks professor steve darby university southampton waiting report un climate panel looking implications trying limit global warming way vietnam countries want see going possible david shukman
BBCNEWS,BBC News at Six,accused scientists political agenda cast doubt claims humans responsible earth rising temperatures science editor david shukman hurricane michael tore florida days ago global warming raised level sea
BBCNEWS,Inside Out,like mammoth hit species different pressures climate change loss habitat hunting really multiplying
BBCNEWS,Victoria Derbyshire,wrote report malcolm kirby campaigns protect coastal communities erosion christyn mcfadyen climate change activist small coastal village scotland
BBCNEWS,Victoria Derbyshire,kasie brook 13 year old girl plymouth worried climate change thank us today professor
BBCNEWS,Business Briefing,time yesterday live south korea held intercontinental permit climate change extremely worrying damning report
BBCNEWS,BBC News,details report special coverage intergovernmental panel climate change monday president european council donald tusk
BBCNEWS,Outside Source,climate records continues cast sceptical eye towards science binds climate change real word
BBCNEWS,BBC News,sta ke journalist much stake climate change minister responsible telling us eat less meat good afternoon
BBCNEWS,BBC News at Five,government says sea defences built spokesman said people would protected climate change roger harrabin bbc news headlines bbc news
BBCNEWS,Afternoon Live,afternoon live scientists issue starkest warning yet dangers climate change four sisters feared dead limousine crash america killed 20 people
BBCNEWS,BBC News,colleague carole walker discussing report professorjoanna haigh co director grantham institute climate change environment imperial college london
BBCNEWS,HARDtalk,winners addressed impressive issues today oppressive climate change affect economic growth also clinic forces affect willing
BBCNEWS,Victoria Derbyshire,wednesday hello monday joanna gosling stark warning climate change scientists say world must keep rise global temperatures 1 5 degrees
BBCNEWS,BBC News at Five,hint misconduct advance major climate change report vietnam millions people live sea level even small rise could
BBCNEWS,BBC News,impact survivors racism discrimination lgbti discrimination lg bti people survivors climate change tipped constitution supreme court make
BBCNEWS,BBC News at Five,think world response climate change report alarming stark ithink true scientists
BBCNEWS,BBC News,tonight voice climate change deniers getting much airtime join us tonight 7 45pm bbc news inquest found
BBCNEWS,BBC News,conservationsists say habitat hit rising tides caused climate change campaigners looking new ways protect birds eliza philippidis reports
BBCNEWS,Breakfast,news six monday report inter governmental panel climate change latest series warnings risks rising global temperatures
BBCNEWS,Beyond 100 Days,dietary choices choose eat around conference centre new skyscrapers highways crawling traffic relies fossil fuels like many developments around world incredibly hard change scientists mapped way minimising global warming see
BBCNEWS,Beyond 100 Days,bbc world news warned need take decisive action limit global warming find like ditch petrol car electric number last night far right candidate first round brazil presidential elections commentators calling seismic shift
BBCNEWS,Newsday,back coast work new sea defences scientists used think safe limit global warming two degrees say need lower target avoid serious damage countries like get major report david shukman bbc
BBCNEWS,BBC News at Five,heatwaves potential impacts global warming world taken action agreeing limit rise average temperatures degrees un climate scientists think might enough limit one half degrees may safer many world vulnerable countries say
BBCNEWS,BBC News at Five,onlyjust onlyjust level sea even small rise could devastating vietnam dozens countries facing threat wa nt want see global warming limited much possible
BBCNEWS,BBC News,need make sure people respect decision even agree much political balance sounds story may still turns thank much rising sea levels floods punishing droughts life threatening heatwaves impacts global warming world powers agreed
BBCNEWS,BBC News at Ten,brings us around avoid ha rd hard border ireland time work running many thanks latest brussels rising sea levels punishing droughts life threatening heatwaves potential impacts global warming world taken action agreeing limit rise
BBCNEWS,BBC News,south korea decide done limit global warming report due monday many countries agreed take steps limit rise average temperatures two degrees scientists concerned even high 0ur science editor david shukman reports vietnam
BBCNEWS,BBC News,dietary choices choose eat around conference centre new skyscrapers highways crawling traffic relies fossil fuels like many development around world incredibly hard change scientists mapped way minimising global warming see everyone makes
BBCNEWS,BBC News,days ago global warming raised sea levels floods serious us government scientists warning worse come president disagrees warning worse come president disagreeslj warning worse come president disagrees think something happening something changing change back
BBCNEWS,Monday in Parliament,scientists issued stark warning yet 12 years tackle climate change avoid climate catastrophe yet one single word
BBCNEWS,Victoria Derbyshire,going get side climate change sea level rise clearly identified adaptation policy methodology
BBCNEWS,Afternoon Live,hello watching afternoon live rebecca jones today 2 planet peril scientists issue starkest warning yet dangers climate change battle
BBCNEWS,Afternoon Live,bring changes recommended little late let talk corinne le quere professor climate change science policy university
BBCNEWS,Afternoon Live,pictures warming world scientists confident ever impacts climate change playing severity frequency droughts storms
BBCNEWS,Afternoon Live,country plays part meeting global challenges age climate change automation ageing population countering forces intolerance respond challenges
BBCNEWS,Victoria Derbyshire,get moving climate change action going keep 1 5 degrees within reach global emissions carbon need halve 12 years limit
BBCNEWS,Victoria Derbyshire,summary latest bbc news 9 30 thank getting touch climate change philip email would start
BBCNEWS,Victoria Derbyshire,co chair climate change panel jim skea live south korea minutes time authorities china said holding worldwide
BBCNEWS,BBC News,paris 2015 report due published tomorrow climate change incheon thank much forjoining us this1 1
BBCNEWS,BBC News at Five,new advice scientists say flexitarian diet tackle climate change water scarcity pollution flexitarian means eating mainly pla nt based foods
BBCNEWS,BBC News at Five,pictures warming world scientists confident ever impacts climate change playing severity frequency droughts storms
BBCNEWS,BBC News,flooding sea levels rise intergovernmental panel climate change says world currently track much worse rise 3 degrees science editor david
BBCNEWS,Afternoon Live,millions ofjobs want put disadvantage joined lord deben chairman committee climate change president trump
BBCNEWS,HARDtalk,conflict climate change europe needs italy others feel europe abandoned core point number migrants coming
BBCNEWS,Politics Live,meaningful strategy creating high skilljobs every region nation failing abysmally invest industries future necessary tackle climate change ipcc report month
BBCNEWS,BBC Newsroom Live,top agenda saying need find solutions look integrated way solve climate change feed population likely reach nine ten
BBCNEWS,BBC News at One,defences built spokesman said people would protected climate change roger harrabin bbc news time 1 16 top story lunchtime criticism labour peer
BBCNEWS,Afternoon Live,coming light today critical report climate change reaction co leader green party sport afternoon live holly hamilton
BBCNEWS,Afternoon Live,climate change calling rise earth temperature since industrial age limited 1 5 degrees celsius nowjoined byjonathan bartley co leader green party
BBCNEWS,BBC News at One,climate system unprecedented scale changes humans would implement order keep climate change control unprecedented challenge human civilisation
BBCNEWS,BBC Newsroom Live,climate change says governments must phase coal individuals need embrace changes eating less meat driving electric cars china confirmed chinese former head
BBCNEWS,Victoria Derbyshire,climate change studio labour mp mary creagh chair environmental audit committee thank forjoining us tell us why1 5 degrees rather two
BBCNEWS,Newsday,round presidential election tackling climate change scientists may finally answer report south korea landmark report set release live studios singapore
BBCNEWS,BBC News,increasing 1 5 celsius century intergovernmental panel climate change expected warn threshold breached year 20110 unless rapid action taken
BBCNEWS,BBC News at One,commons environmental audit committee says clothing industry fuels climate change spreads microplastics oceans fills landfill sites environment analyst roger harrabin reports fashion worth £28 billion
BBCNEWS,BBC News,nhs medical waste piles disposal company fails incinerate government takes emergency action advance major climate change report vietnam millions
BBCNEWS,BBC News,report un panel climate change urged countries stop using coal 2050 avoid increasing global temperatures australia deputy prime minister says coal plays important part
BBCNEWS,The Papers,change terrific image playing shredding ba nksy banksy work art brexit climate change yeah need declare interest
BBCNEWS,Breakfast,moment lot could done fill gaps addressing climate change talking government level also things businesses
BBCNEWS,BBC News at Five,actually long term climate commitments due diverse country pass climate change act hit budget cut emissions almost 60
BBCNEWS,BBC News at Five,scientists issue starkest warning yet dangers climate change saying rapid unprecedented saying rapid unprecedented changes needed avoid catastrophe family second customer
BBCNEWS,BBC News,population rapidly declining conservationsists say habitat hit rising tides caused climate change campaigners looking new ways protect birds eliza philippidis reports
BBCNEWS,Outside Source,focused trade jobs bread butter talked climate change saying hoax perpetrated countries like china
BBCNEWS,Outside Source,split constantinople canonical church moscow losing battle ukrainian souls remember un report climate change last week says one way help
BBCNEWS,Inside Out,climate change loss habitat hunting really multiplying pressure also see mammoth gone gone
BBCNEWS,Breakfast,feel passionately report international climate change co nfe nce conference week saying need reduce dependency oil
BBCNEWS,Climate Change,going work get rid carbon dioxide without dumping atmosphere avoid damaging global warming scientists call much renewable energy development transport uses less fuel new ways take carbon dioxide atmosphere happening
BBCNEWS,Newsday,rising sea levels punishing droughts life threatening heatwaves potential impacts global warming many world vulnerable countries say world must limit average rise global temperatures one vietnam science editor david shukman reports painful sight homes lost waves
