Station,Show,Snippet
BBCNEWS,BBC News,beena part airline industry part move reduce carbon teal last year teal agreed deal curb greenhouse gases sol
BBCNEWS,BBC News,beaten 0 1 0 12 degrees celsius seem like lot terms yearly variations actually huge part rise caused el nino event warm ocean current disrupts world weather scientists say greenhouse gases
BBCNEWS,Outside Source,contact expected co nta ct le ns expected contact lens come eye good catch terms policy already pushback global warming interesting see backdrop president trump coming oval office saying things like climate change something
BBCNEWS,Outside Source,every time marketplace closed another appears replace inafew minutes going talking global warming
BBCNEWS,BBC News,applause climate change controversial issue seen odds incoming president next speech agenda take challenge climate change
BBCNEWS,BBC News,mr trump thinking former attorney general interesting pic given actually climate change nye many people climate change
BBCNEWS,Newsnight,problems facing today europe climate change
BBCNEWS,Outside Source,agreement global deal came force last year carbon dioxide record levels scientists say temperature threshold course surpass tackle global warming
BBCNEWS,BBC News,patrol far side meanwhile italy christmas card scenes little event years ago images commonplace january across europe five years global warming
BBCNEWS,BBC News,set paris climate agreement global deal came force last year carbon dioxide record levels scientists say temperature threshold course surpass tackle global warming
BBCNEWS,BBC News at One,sheu shelf could flow faster contribute sea level rise next decades new icebergs one biggest recorded around 50 times size manhattan island despite concerns global warming
BBCNEWS,BBC News,barack obama reminded donald trump message back learn climate change
BBCNEWS,Reporters,big business brazilian government defending plans build dozens hydroelectric dams say vital meet country energy needs environmentalists say plans disaster amazon result deforestation global warming
BBCNEWS,Monday in Parliament,brazil government defending plan build dozens huge hydro electric dams argues project boost economy provide clean energy environmentalists say plan disaster amazon actually result deforestation global warming
BBCNEWS,Breakfast,immigration policy suggesting prince charles donald trump could go head head row climate change president take lecture prince said course prince charles active vocal field climate change
BBCNEWS,BBC News,mps queued offer issues could take new president must abide withdraw paris climate change treaty
BBCNEWS,BBC News at Five,payments united nations climate change programmes 2017 eyes donald trump global warming tweeted climate change hoax election said pull
BBCNEWS,BBC News,brazil government defending plan build dozens huge hydro electric dams amazon argues project boost economy harness country natural resources provide clean energy environmentalists say plan disaster amazon actually result deforestation global warming
BBCNEWS,BBC Newsroom Live,estimated 12 million people fingers crossed clear skies gonna cancel billions payments united nations climate change programmes 2017 eyes donald trump global warming tweeted climate change hoax
BBCNEWS,BBC Newsroom Live,children commissioner england anne longfield warned children often parents idea signing social media sites pupils young four taught internet safety school fresh doubt thrown theory slowdown global warming
BBCNEWS,100 Days,send feds chicago end gun violence bison part internal protest national park service part message climate change
BBCNEWS,BBC Newsroom Live,acutely affects primate relatives destroying habitat something scientists say cannot afford forests provide essential services people help mitigate climate change
BBCNEWS,BBC Newsroom Live,uncertainty donald trump plans climate change patient alarmed wa nts wants kill president obama plan kill greenhouse gas emissions usa let us find environment
BBCNEWS,Outside Source,met concerns something put j wanted play another clip mr taylor said mr tillerson also asked exxon mobil policies climate change iam
BBCNEWS,Newsnight,two worry 15 countries renegotiate make things work direction taking isolationism right one big issue paris agreement climate change
BBCNEWS,BBC News,also highlighting mr trump new six issue agenda energy foreign policy jobs growth military law enforcement trade deals observers point makes mention civil rights health care climate change
BBCNEWS,BBC News at One,campaigns rules protecting air water energy secretary board oil pipeline firm secretary state oilman firm accused hiding proof climate change
BBCNEWS,BBC Newsroom Live,gonna cancel billions payments united nations climate change programmes 2017 eyes donald trump global warming tweeted climate change hoax election said pull paris climate deal
BBCNEWS,Newsday,cuba brought world edge nuclear war diplomatic relations restored extraordinary transformation leaves office largely admired popular around world least role global climate change deal
BBCNEWS,Newsnight,took decades get president treating like children home work tear throw away generation moving climate change world
BBCNEWS,BBC News at Five,phenomenon global warming oi climate change say certain lay grand event certainly grand event context changes
BBCNEWS,BBC News,manhattan island despite concerns global warming researchers said evidence climate change playing significant role new iceberg formation dr mark brandon reader
BBCNEWS,BBC News,otherwise take cleaners appealing better nature going come think futile attempt think listen things people said must tell climate change
BBCNEWS,Newsnight,left philadelphia politicians stripes queuing offer advice walk tightrope listened majority would list grievances briefcase everything human rights climate change misogyny
BBCNEWS,BBC Newsroom Live,administration takes tough line china bring get week bbc news focusing big global stories might 2017 today look science donald trump presidency mean battle climate change
BBCNEWS,BBC News,changing policies signing executive order targets obamacare much says wishes abolish revamped white house website also highlighting mr trump new six issue agenda energy foreign policy jobs growth military law enforcement trade deals observers point makes mention civil rights health care climate change
BBCNEWS,BBC Newsroom Live,responsibility half country whole international community tone sets ask reassure us sets ask reassure us say president must abide withdraw paris mid change treaty climate change
BBCNEWS,BBC News,creator greenhouse gases 540 million rolled apparently earth excavation china figuring
BBCNEWS,Talking Business,future words predicting concerns way wells war worlds reflecting late victorian angst imperialism colonialism damage colonial conscience one thing think could look metaphor climate change
BBCNEWS,BBC News at Six,average global temperatures edged ahead 2015 1 1 degrees higher pre industrial levels fact third consecutive year record broken nasa say scientists believe el nino weather phenomenon played role increasing levels greenhouse
BBCNEWS,Review 2016,world countries plan cut greenhouse gases became international law groundwork laid climate summit paris last year
BBCNEWS,BBC Newsroom Live,away geographical event thought anything global warming certainly evidence say climate change made difference something going many decades come surface sure others
BBCNEWS,Newsday,warm ocean current disrupts world weather scientists say greenhouse gases main driver shows global temperatures increased since industrial revolution
BBCNEWS,Review 2016,way rising seas reliance fossil fuels like coal united states second biggest emitter greenhouse gases participation global
BBCNEWS,BBC News,scientists say greenhouse gases main driver shows global temperatures increased since industrial revolution bigger circle hotter year latest data
BBCNEWS,Newsday,says hopes switch bio fuels reduce amount greenhouse gases generates eighty longer flights philippines inquirer
BBCNEWS,Outside Source,el nino weather phenomenon played role increasing levels greenhouse gases main factor rebecca morelle planet warming fast latest data suggests
BBCNEWS,Newsday,levels greenhouse gases mostly blame science correspondent rebecca morelle planet warming fast latest data suggests 2016 record breaking year
BBCNEWS,Review 2016,move entire communities way rising seas reliance fossil fuels like coal united states second biggest emitter greenhouse gases participation global
BBCNEWS,Outside Source,also entails classical propaganda disinformation fake news news recent years many scientists saying slowdown global
BBCNEWS,Review 2016,year planet united least world countries plan cut greenhouse gases became international law groundwork laid climate summit paris last year years negotiations historic global agreement
BBCNEWS,BBC News at Six,part rise caused el nino event warm ocean current disrupts world weather scientists say greenhouse gases main driver shows global temperatures increased since industrial revolution
BBCNEWS,Outside Source,terms yearly variations actually huge part rise caused el nino event warm ocean current disrupts world weather scientists say greenhouse gases main driver
BBCNEWS,BBC News,terms yearly variations actually huge part rise caused el nino event warm ocean current disrupts world weather scientists say greenhouse gases main driver
BBCNEWS,BBC News,pre industrial levels fact third consecutive year record broken nasa say scientists believe el nino weather phenomenon played role increasing levels greenhouse gases main factor driving temperatures
BBCNEWS,BBC News at Ten,weather phenomenon played role increasing levels greenhouse gases main factor driving temperatures science correspondent rebecca morelle explains planet warming fast latest data suggests 2016 record breaking year
BBCNEWS,BBC News at Ten,terms yearly variations actually huge part rise caused el nino event warm ocean current disrupts world weather scientists say greenhouse gases main driver shows global temperatures increased
BBCNEWS,BBC News,year record broken scientists believe el nino weather phenomenon played role increasing levels greenhouse gases main factor driving temperatures science correspondent rebecca morelle planet warming fast
BBCNEWS,BBC News,big chungy steak category makes 14 population point well better health better environment extensive rearing cattle methane produce greenhouse gases decided
BBCNEWS,BBC News,teal agreed deal curb greenhouse gases think see industry already moving direction new dreamliner using massively less fuel much lighter much quieter industry moving direction huge
BBCNEWS,BBC News,century ago average global temperatures edged ahead 2015 1 1 degrees higher pre industrial levels third consecutive year record broken according nasa scientists believe el nino weather phenomenon played role increasing levels greenhouse gases main factor
BBCNEWS,Newsday,greenhouse gases generates 80 longer flights philippines inquirer leads miss universe beauty pageant title taken france iris mittenaire reason spot page one perhaps woman handing crown last year champion
BBCNEWS,BBC News,provide clean energy environmentalists say plan disaster amazon actually result deforestation global warming time hardtalk
BBCNEWS,BBC News,child anywhere would feel less statements made power makes heartsick strongest message today women rights continuing reproductive rights climate
BBCNEWS,Newsday,one hand biggest contributor greenhouse gas emissions also time biggest contributor planet solution mean building huge windfarms solar
BBCNEWS,HARDtalk,greenhouse gas emissions simply pledge best set standards imposed fully consistent american sovereignty hoping trump administration comes
BBCNEWS,BBC News at One,president obama plan cut greenhouse gas emissions usa environment analyst roger harrabin assesses may others already moving block ice melting world temperatures hit new records
BBCNEWS,BBC News,times get gun control climate change well first president pushed climate change legislation congress ended watered legacy climate control away legislative
BBCNEWS,BBC News,president barack obama calls donald trump administration lead example prevent big countries bullying smaller ones scientists declare 2016 warmest year record man made climate
BBCNEWS,BBC Newsroom Live,basis prosperity also best way cement multilateral partnerships cooperation help build better world challenges face like terrorism climate
BBCNEWS,The Papers,quite puzzling prince charles somehow advocacy climate change somehow problematic going disrupt visit let face climate change threat future organised life planet earth
BBCNEWS,Breakfast,another man woman treated hospitalfor smoke inhalation following blaze milngavie police say fire targeted wilful america former environment chief says concerned future climate
BBCNEWS,BBC Newsroom Live,administration obviously signed paris climate change agreement done would hope parties would continue ensure climate change agreement put practice order ed miliband asking last question
BBCNEWS,Wednesday in Parliament,energy 0bama administration obviously signed paris climate change agreement done would hope parties would continue ensure climate change agreement put practice gibraltar chief minister
BBCNEWS,Click,affordable healthca plan mr trump signed first executive order forcing government offices minimise cost reforms overturned white house also signalled intention remove called harmful unnecessary climate
BBCNEWS,BBC News,indicates shift massive shift united states role world described decades idea united states could step away commitment leading globally things like climate
BBCNEWS,HARDtalk,model international agreement countries retain ability decide want want comes greenhouse gas emissions simply pledge best set standards
BBCNEWS,Victoria Derbyshire,rows matt iare rows matt agreed many issues like women rights climate change ifind women rights climate change find terrifying hope theresa may strong
BBCNEWS,BBC Newsroom Live,firm secretary state oilman firm accused hiding proof climate change striking careful tone risk climate change exist consequences could serious enough action
BBCNEWS,BBC News,provide clean energy environmentalists say plan disaster amazon actually result deforestation global warming time
BBCNEWS,Outside Source,propaganda disinformation fake news recent years many scientists saying slowdown global warming new data suggests full false
BBCNEWS,BBC News,injust eight take challenge climate change eight years halved take challenge climate change injust eight years halved dependence foreign oil doubled renewable energy lead world agreement promise save planet
BBCNEWS,Wednesday in Parliament,issue climate change hope recognises commitment government shown issue climate change legislation put changes brought terms energy sector uses different forms
BBCNEWS,The Papers,charles somehow causing problem otherwise would wonderful visit think tone think lays argument clearly straightforward reporting one paragraph says trump repeatedly branded climate
BBCNEWS,BBC News,years ago images commonplace january across europe five years global warming many people forgotten hard real winter
BBCNEWS,Newsday,carbon dioxide record levels scientists say temperature threshold course surpass tackle global warming world urged move
BBCNEWS,BBC News at Six,force last year carbon dioxide record levels scientists say temperature threshold course surpass tackle global warming world urged
BBCNEWS,BBC News,actually result deforestation global warming wyre davies visited first mega dams called belo monte reports potential impact heart planet
BBCNEWS,BBC News,technology car sharing apps also mean electric cars global warming pollution two reasons many established players focusing investments area
BBCNEWS,BBC Business Live,technology car sharing apps also mean electric cars global warming pollution two reasons many established players focusing investments area
BBCNEWS,BBC News,responded twitter urging future president bit careful future put word global warming nick miller forecast
BBCNEWS,BBC News,temperature threshold course surpass tackle global warming world urged move away fossil fuels like coal us donald trump said
BBCNEWS,Newsday,london standing imperiously oval office place suit tan course flowing hairstyle grab selfie threat global warming getting ever real
BBCNEWS,Breakfast,police say fire targeted wilful america former environment chief says concerned future climate change donald trump white house christine todd whitman boss environment protection agency george bush president says president elect trump ignoring science climate change failing take
BBCNEWS,Newsday,oneself dark room wind rain may kept outside light lightand air light air one emerges winner ina light air one emerges winner trade war also said countries redouble commitment paris climate
BBCNEWS,HARDtalk,united states actually pull paris hope pull paris indeed paris agreement model international agreement countries retain ability decide want want comes greenhouse gas emissions simply pledge
BBCNEWS,BBC News,five years global warming many people forgotten hard real winter nick thorpe bbc news explain caused icy blast look forecast
BBCNEWS,HARDtalk,argues project boost economy provide clean energy environmentalists say plan disaster amazon actually result deforestation global warming time hardtalk
BBCNEWS,Review 2016,campaign said would going cancel paris climate agreement stop payments united states tax dollars un global warming programmes island nations affected
BBCNEWS,BBC News at Ten,global deal came force last year carbon dioxide record levels scientists say temperature threshold course surpass tackle global warming world urged
BBCNEWS,Outside Source,often stated speed global warming slowing new data suggests get uk service sector grew fastest pace 17 months december
BBCNEWS,BBC News,huge hydro electric dams argues project boost economy provide clean energy environmentalists say plan disaster amazon actually result deforestation global warming stay us
BBCNEWS,Reporters,huge hydro electric dams argues project boost economy provide clean energy environmentalists say plan disaster amazon actually result deforestation global warming stay us
BBCNEWS,Review 2016,campaign said would going cancel paris climate agreement stop payments united states tax dollars un global warming programmes island nations affected rising
BBCNEWS,Outside Source,new information global warming century many scientists argued rate slowed recent years interesting rate c02 co2 emission certainly slowed gone
BBCNEWS,BBC News,redouble commitment paris climate change agreement mr trump threatened quit
BBCNEWS,Newsday,meanwhile italy christmas card sent little event 0nly christmas card sent little event years ago images commonplace five years global warming many people forgotten hard
BBCNEWS,BBC News,deforestation global warming wyre davies visited first mega dams called belo monte reports potential impact heart planet greatest rainforest emerges one world biggest civil engineering projects monolithic monument progress
BBCNEWS,Outside Source,question whole bunch global warming data collecting decades put something question looking ocean warming 50 years ago people ta ke take bucket would take
BBCNEWS,Victoria Derbyshire,international treaty global warming wreck treaties got nuclear arms want give nuclear arms small states imperilling world going change address american embassy tel aviv tojerusalem
BBCNEWS,Reporters,environmentalists say plans disaster amazon result deforestation global warming wyre davies belo monte site first new called mega dams
BBCNEWS,Reporters,country energy needs environmentalists say plans disaster amazon result deforestation global warming wyre davies belo monte site first new called mega dams assess impact
BBCNEWS,Breakfast,protecting additional 300000 homes climate change told expect heavy rain increasing flood risk
BBCNEWS,BBC News,additional 300000 homes climate change told expect heavy rain increasing flood risk
BBCNEWS,BBC News at One,climate change calling natural event cnvironment correspondent matt mcgrath stretching around 100 miles
BBCNEWS,Breakfast,services people help mitigating climate change carbon stocks help providing clear water people
BBCNEWS,Reporters,brazilian government defending plans build dozens huge hydroelectric dams say vital meet country energy needs environmentalists say plans disaster amazon result deforestation global warming wyre davies belo monte
BBCNEWS,World Business Report,global warming pollution two reasons many established players focusing investments area particular concerns regarding diesel engines cities including paris mexico city madrid athens planning introduce kind ban next decade
BBCNEWS,Meet the Author,solve global warming healthcare crisis whatever individual get kids homes reading mostly help local school help local libraries libraries big issue right get funded
BBCNEWS,BBC News,twitter page mistake viral responded urging future president little bit careful future put ina put word problem global warming little scared
BBCNEWS,BBC News,want reconsider using facts hearsay listening experts specifically climate change pretty much
BBCNEWS,Reporters,birds adapting climate change america grip heroine pain killer epidemic thousands dying drug
BBCNEWS,BBC News,also hour record breaking temperatures third year row scientists say due climate change blame
BBCNEWS,Newsday,patrol far side meanwhile italy christmas card scenes little event years ago images commonplace january across europe five years global warming many people forgotten hard real winter also making news today
BBCNEWS,BBC News,environmental campaigners say plan disaster amazon region lead deforestation global warming 0ur brazil correspondent wyre davies visited first mega dams called belo monte spent time indigenous communities whose lands villages threatened dam
BBCNEWS,BBC News,set paris climate agreement global deal came force last year carbon dioxide record levels scientists say temperature threshold course surpass tackle global warming world urged move away fossil fuels like coal
BBCNEWS,BBC Newsroom Live,believe warming earth could speeding direct evidence global warming impact concerns though might evidence large blocks ice like break create huge icebergs
BBCNEWS,BBC News Special,without bolder action children time debate existence climate change busy dealing effects environmental
BBCNEWS,Review 2016,much planet 2016 declared hottest year record putting climate change tackle spotlight
BBCNEWS,BBC News,strongest message today women rights continuing reproductive rights climate change science real one big messages today
BBCNEWS,Sportsday,antarctic track birds adapting climate change america grip heroin prescription painkiller epidemic
BBCNEWS,World News Today,scientists monitoring break months say climate change blame stretching around 100 miles length
BBCNEWS,Newsnight,investment people communities way green movement conceives climate change joint responsibility species whose interests intertwined
BBCNEWS,Review 2016,donald trump elected us president called climate change hoax 2012 tweeted invented chinese harm us businesses
BBCNEWS,BBC News,pressing global challenges including climate change ramifications donald trump orders health issues limited us kenya doctors grapping
BBCNEWS,BBC Newsroom Live,series tweets climate change twitter account badlands national park south dakota deleted let speak two people closely
BBCNEWS,Outside Source,role america responds must understand epa played crucial role president obama climate change supreme court judge judged carbon dioxide
BBCNEWS,Review 2016,continent charismatic animals penguins started nesting ten years ago thought may moved climate change scientists
BBCNEWS,Breakfast,services people help mitigating climate change carbon stocks help providing clear water people pollinations people grow crops
BBCNEWS,BBC Newsroom Live,destroying habitat something scientists say cannot afford forests provide essential services people help mitigate climate change carbon stops
BBCNEWS,Breakfast,government investing £2 5 billion building flood defence schemes across country protecting additional 300000 homes climate change told expect heavy
BBCNEWS,BBC Newsroom Live,theory slowdown global warming first years century new study found ocean temperatures fact risen twice rate previously estimated concluded old data suggested slowdown rises based faulty interpretation temperature readings ships
BBCNEWS,Outside Source,underline fact global warming gone away going away consistent pause top broadcaster even contact pause top broadcaster even co nta ct le ns pause top broadcaster even contact lens coming eye put stride coming life coming
BBCNEWS,BBC News,pressure resonated people also brought better understanding concept climate change public underworld us became leader lagging
BBCNEWS,Newsnight,international community set protecting future climate change meet come best effort
BBCNEWS,BBC News,climate change calling natural event environment correspondent matt mcgrath stretching around 100 miles rift ice shelf grown rich rapidly weeks
BBCNEWS,Review 2016,continent charismatic animals penguins started nesting ten years ago thought may moved climate change scientists set network
BBCNEWS,BBC News,believes climate change real made worse human beings already condemned torture condemn torture wants keep tools
BBCNEWS,Sportsday,look even liberal left willing look actual facts empirical evidence obviously social scientist climate change table
BBCNEWS,Breakfast,instance also climate change first stop philadelphia away day republican politicians party president see prime minister emphasised sees
