Station,Show,Snippet
BBCNEWS,BBC News,climate change minister claire perry told bbc politicians telling people eat less meat smacks worst kind nanny state advice environment analystm roger harrabin burping farm animals major source greenhouse gas emissions
BBCNEWS,BBC News,much come bbc news including extreme weather events climate change take toll hear us president thinks global warming could reverse
BBCNEWS,The Briefing,harassment assault bbc website uk taking tentative step towards radical green future zero emissions greenhouse gases follows last week un report warning time running limit climate change catastrophe
BBCNEWS,The Travel Show,hands government climate change minister claire perry told bbc politicians telling people eat less meat smacks worst kind nanny state advice environment analyst roger harrabin burping farm animals major source greenhouse gas emissions
BBCNEWS,BBC News at Six,substantial reductions carbon dioxide emissions next decade really making challenging impossible keep warming 1 5 degrees report spells greenhouse gases must
BBCNEWS,BBC News,warming countries need ambition get moving climate change action going beat 1 5 degrees would study showed happens global warming continues
BBCNEWS,Monday in Parliament,strength changes strategy sets parts need ta ke take pleased responding news today written committee climate change asking advice setting date achieving net zero greenhouse gas emissions however
BBCNEWS,BBC News,environment analyst roger harrabin burping farm animals major source greenhouse gas emissions
BBCNEWS,BBC News,act substantial reductions carbon dioxide emissions next decade really making challenging impossible keep warming 1 5 degrees report spells greenhouse gases must
BBCNEWS,Afternoon Live,bearin could turn little stormy bear mind towards end week could turn stormy side hello watching afternoon live rebecca jones today 3 planet peril scientists issue starkest warning yet dangers climate change tough challenge ahead global warming
BBCNEWS,Newsday,quite unusual well lots expressing sadness governments across world face renewed calls dramatic action tackle global warming following major report climate scientists published hours time intergovernmental panel climate change release
BBCNEWS,BBC News,climate change
BBCNEWS,Afternoon Live,footprint climate change strong everyone see super hurricanes happening around world happening reduction greenhouse gases impact climate change daily
BBCNEWS,BBC News,scientists representatives nearly 200 governments meeting south korea week try agree new report urging ambitious global warming targets
BBCNEWS,BBC Newsroom Live,kind backlash science something historically know goal know levers said stopping burning coal globally would huge advantage investing potentially greenhouse gas removal
BBCNEWS,BBC Newsroom Live,find ways learn stop worst impacts waiting report climate panel looking indications trying limit global warming
BBCNEWS,BBC Business Live,temperatures control according new report intergovernmental panel climate change countries need ambition get moving climate change action
BBCNEWS,Victoria Derbyshire,well two degrees warming pursue efforts towards 1 5 invite intergovernmental panel produce report spelt impacts global warming 1 5
BBCNEWS,BBC News at One,intimate personal issues ronaldo kept head left training turin caroline rigby bbc news leading scientists meeting south korea discuss rise global warming
BBCNEWS,BBC News,report limiting global temperature rises 1 5 degrees finalised report due published monday sound warning speed scale measures required protect countries vulnerable global warming
BBCNEWS,BBC News at Six,going affect grandchildren stop pamela sloan taught geography locally a0 years spent many days kids lancashire adults know global warming
BBCNEWS,BBC Newsroom Live,newsroom live today main stories scientists issue strongest warning yet climate change
BBCNEWS,Afternoon Live,afternoon live scientists issued starkest warning yet danger climate change
BBCNEWS,Afternoon Live,afternoon live scientists issued starkest warning yet danger climate change
BBCNEWS,Victoria Derbyshire,committee climate change advises government says need realistic many coastal towns villages one day become uninhabitable professorjim hall committee climate change
BBCNEWS,BBC News,interview bbc newsnight programme broadcaster said doubted extent usa would withdraw global agreements climate change reflected global reaction climate change
BBCNEWS,Afternoon Live,change needed right summer heat wave must wake call climate change front page every newspaper every day conference debate climate change deniers
BBCNEWS,Outside Source,mccain said climate change real climate shifted last tenuous talking missing saudi journalist donald trump said refers trade also talked climate change
BBCNEWS,BBC News at Five,focus protecting assets well saving people homes take seriously inevitability sea level rise campaigners coastal communities say shared problem rising sea levels direct result global warming
BBCNEWS,Afternoon Live,changes start victoria gill bbc news well today report described global wake call planet governments individuals around world need limit global warming
BBCNEWS,Climate Change,things thinking changing way live asked shoppers oxford street central london today adapted lifestyle face global warming
BBCNEWS,BBC Business Live,eat eat told simon promised divulge diet let talk flexitarian diets seen key help problem global warming think
BBCNEWS,BBC News at Five,happening right 2018 future far date century exactly european heatwaves hurricane florence hurricane harvey dub incredible amount water global warming
BBCNEWS,Afternoon Live,scientists confident ever impacts climate change playing severity frequency droughts storms extreme weather events gathered south korean city incheon past week climate change researchers
BBCNEWS,The Papers,report week could reaching tipping point climate change 12 years piece written looking sort prism brexit uk perhaps less quick tackle climate change
BBCNEWS,The Briefing,scientists confident ever impacts climate change playing severity frequency droughts storms extreme weather events gathered south korean city injury past week climate change
BBCNEWS,BBC Newsroom Live,welcome bbc newsroom live carol walker scientists given one starkest warnings yet changes needed tackle climate change
BBCNEWS,BBC News at Five,different think imagined first extraordinary positive piece urban realm today discussing climate change report
BBCNEWS,BBC News,dangers climate change battle limit global warming countries need ambition
BBCNEWS,Breakfast,greenhouse gases fall zero government seeking guidance advisors climate change committee leap made happens would mark dramatic change economy built burning fossil fuels environment
BBCNEWS,Beyond 100 Days,pret manger baguette bought heathrow airport inquest herfamily welcomed heathrow airport inquest family welcomed pret manger decision change labelling food given stark warning today need take decisive action limit global warming
BBCNEWS,Politics Live,government passed climate change act world leading legislation reduce greenhouse gas emissionings 80 2050 government target clean energy investment
BBCNEWS,The Briefing,written uk leading fashion retailiers urging protect environment group politicians say industry fuelling climate change spreading
BBCNEWS,Breakfast,ireland cloudy wet windy day ahead monday october 8th top story scientists given one starkest warnings yet changes needed tackle climate change
BBCNEWS,Beyond 100 Days,diplomatic pressure increases saudi leaders explain happened missing journalist jamal khashoggi scientists warned last week potentially devastating effects climate change
BBCNEWS,BBC News,diplomatic pressure increases saudi leaders explain happened missing journalist jamal khashoggi scientists warned last week potentially devastating effects climate change
BBCNEWS,BBC News at Six,good signal government considering much tougher target cutting greenhouse gases heard also reducing subsidies electric cars allowing fracking start shale gas tackling climate change never going easy david shukman bbc news
BBCNEWS,BBC News,target cutting greenhouse gases heard also reducing subsidies electric ca rs cars allowing fracking start shale gas tackling climate change never going easy time look weather darren bett
BBCNEWS,The Papers,leaving european emissions trading scheme access europeanjustice courts european justice courts climate change issues say two things conflated isjust something something consider isjust something consider think climate change issue
BBCNEWS,BBC News,prompting deadliest flooding years president trump said climate change could reverse tv interview also said think hoax though know man made comes less week dire warning dangers climate change
BBCNEWS,BBC News,work benefits providing fair system taxpayer every turn facing criticism universal credit way implemented scientists representatives nearly 200 governments meeting south korea week try agree new report urging ambitious global warming targets
BBCNEWS,Victoria Derbyshire,electric cars mps calling ban petrol diesel cars brought forward eight years hear editor auto express r climate change expert
BBCNEWS,Beyond 100 Days,government planning tougher target heard also reducing subsidies electric cars allowing fracking start shale gas tackling climate change never
BBCNEWS,Afternoon Live,eye storm dawlish devon 2014 battered waves train tracks destroyed today report says happen sea levels pushed higher man made climate change
BBCNEWS,Afternoon Live,funding come centrally bear equal portion cost government says sea defences built spokesman said people would protected climate change
BBCNEWS,Afternoon Live,prevented scale changes experiencing climate system unprecedented scale changes humans would implement order keep climate change
BBCNEWS,BBC News at One,great transitions across economy change way behave eating less red meat vegetables backdrop president trump taking us climate change
BBCNEWS,Afternoon Live,also record temperatures july 41 celsius recorded highest temperature ever seenin seen japan japanese meteorological society attributed one causes flooding heatwave climate change
BBCNEWS,BBC News at Six,people work solar power coal industry clean energy creating jobs comes climate scientists say urgently needed donald trump saying climate change flies
BBCNEWS,Victoria Derbyshire,personally frustrating government tackle climate change example ipcc special report on1 5 example ipcc special report 1 5 degrees example ipcc special report on1 5 degrees warming example ipcc special report 1 5 degrees warming said tackle climate change keep
BBCNEWS,BBC Newsroom Live,greenhouse gases fall zero government seeking guidance advisors climate change committee leap made happens would mark dramatic change economy built burning fossil fuels environment analyst roger harrabin big shift away coal fired
BBCNEWS,BBC Newsroom Live,greenhouse gases fall zero government seeking guidance advisors climate change committee leap made happens would mark dramatic change economy built burning fossil fuels environment analyst roger harrabin big shift away coal fired
BBCNEWS,Afternoon Live,also asked independent advisory body committee climate change guidance eliminate country emissions greenhouse gases completely heard earlier fracking produce shale gas today restarted lancashire square today launch environment analyst roger harrabin reports coal burning climate minimi
BBCNEWS,BBC News,rules changing adverse way something change certainly highlighted recent report came day latest report intergovernmental panel climate change demonstrating
BBCNEWS,Breakfast,good morning welcome breakfast dan walker louise minchin headlines today warning world scientists say make drastic changes way live tackle climate change
BBCNEWS,Beyond 100 Days,isa huge state massive economy politics huge florida really important nation debate last night lot conversation climate change important
BBCNEWS,Business Briefing,risks climate change business exxon allegedly downplayed potential costs new greenhouse gas regulations despite assuring investors accounted risks company pledged fight allegations court shares cathay pacific airways
BBCNEWS,BBC News at Ten,climate change one way scientists point think much carbon dioxide prevalent greenhouse gas atmosphere emitted production food eat something shoppers adding list concerns
BBCNEWS,Afternoon Live,limit global warming countries need ambition get moving climate change action four sisters feared dead limousine crash america killed twenty people
BBCNEWS,BBC News,kids lancashire adults know global warming climate change real part got keep fossil fuels ground
BBCNEWS,Breakfast,roger harrabin details eye storm dawlish devon 2014 battered waves train tracks destroyed today report says happen sea levels pushed higher man made climate change
BBCNEWS,BBC Newsroom Live,nationally globally somebody take lead think isa take lead think real call arms piece heard lot example climate change
BBCNEWS,Victoria Derbyshire,paris agreement report named input negotiations going held report important really next step world efforts deal climate change mary
BBCNEWS,Beyond 100 Days,much french cabinet meeting prospects happens deal brexit emergency meeting going french cabinet sir david attenborough told bbc president trump view climate change
BBCNEWS,BBC News,rising sea levels expected prompt calls urgent steps cut greenhouse emissions zero 2050 bring full details report special coverage intergovernmental panel climate change monday
BBCNEWS,The Briefing,proposals oblige bosses show much employees ethnic minorities paid compared white counterparts finally bbc website several today papers beef consumption west needs fall 90 avoid dangerous climate change
BBCNEWS,Victoria Derbyshire,communities adapting comes funding must remember rising sea levels direct result global warming climate change causing serious effects contribute
BBCNEWS,Newswatch,made around global warming climate change offered guidance training well make sure staff making informed decisions important issue
BBCNEWS,BBC News,midst issue truly global one us make choices help urgent fight climate change one way scientists point think much carbon dioxide prevalent greenhouse gas atmosphere
BBCNEWS,BBC News at Six,midst issue truly global one us make choices help urgent fight climate change one way scientists point think much carbon dioxide prevalent greenhouse gas atmosphere
BBCNEWS,Afternoon Live,issue starkest warning yet dangers climate change tough challenge ahead global warming un report says temperature rises limited 1 5 degrees celsius half increase
BBCNEWS,Beyond 100 Days,lancashire adults know global warming climate change real part got keep fossil fuels ground within site deep underground drilling pumping
BBCNEWS,Outside Source,make sure climate action runs faster climate change heard president trump say could go back referring global warming offered proof back appears none
BBCNEWS,BBC Newsroom Live,brazil presidential election far right candidate took 55 percent run vote victory speech mr bolsonaro said would protect freedoms democracy promised change destiny brazil concerns raised policies climate change deforestation
BBCNEWS,BBC Newsroom Live,low pressure low pressure could sweep bringing spell strong winds potentially disruptive winds therein end week could turn little stormy planet peril scientists issue starkest warning yet dangers climate change
BBCNEWS,Victoria Derbyshire,damaging environment mps said asking britain top fashion retailers including marks spencer next primark plan reduce environmental social impact clothes sell environmental audit committee says fashion industry fuels climate change spreads microplastics
BBCNEWS,BBC News,withstand kind salt pollution current system agriculture change dramatically order able continue try end positive note done us need limit climate change
BBCNEWS,Breakfast,natural world see people poverty see people going hungry see livelihoods many parts developing world threatened impacts agricultural systems ecosystems crops substantial costs acting climate change
BBCNEWS,BBC News,climate change minister claire perry told bbc politicians telling people eat less meat smacks worst kind nanny state advice environment analyst roger harrabin environment analyst roger harrabin burping farm animals major source greenhouse gas emissions cutting meat one
BBCNEWS,BBC News at Ten,way minimising global warming see everyone makes individuals help fight climate change 0ur science correspondent victoria gill looking small changes could make big difference
BBCNEWS,BBC News at Ten,know global warming climate change real part keep fossil fuels ground within site deep underground drilling pumping gas way
BBCNEWS,The Travel Show,kids lancashire adults know global warming climate change real part keep fossil fuels ground within site deep underground drilling pumping
BBCNEWS,Breakfast,misconceptions made around global warming climate change offered guidance training well make sure staff making informed decisions important issue
BBCNEWS,Afternoon Live,record temperature recorded japan recorded 41 celsius massive floods injuly japan recorded 41 celsius massive floods july record temperatures injuly massive floods july record temperatures july linked japanese meteorology agency climate change said
BBCNEWS,BBC News at One,also lunchtime criminal investigation launched environment agency emerged tonnes medical waste including body parts stockpiled nhs contractor political leaders northern ireland meet eu brexit negotiator brussels discuss possible solutions irish border question fuelling climate change
BBCNEWS,Britains Best New Building,centre much brighter area also means social space whilst studying well really nice balance sultan nazrin shah centre beautiful historic landscape sustainability credentials really important us also resilience climate change
BBCNEWS,Victoria Derbyshire,ta ke reduced need take steps reduce causes climate change sea level rise things like greenhouse gas emissions carbon dioxide going atmosphere inevitable inevitable see sea level rise
BBCNEWS,BBC News,un climate change scientists meeting week south korea decide done limit global warming report due monday many countries agreed take steps limit rise average temperatures
BBCNEWS,BBC News,exacerbated impact human caused climate change say michael would occurred absence global warming mean impact storm material way made substantially worse
BBCNEWS,Breakfast,global warming follows major report climate scientists published south korea overnight let take look means us special report breakfast environmental scientist angela terry climate change biggest
BBCNEWS,Asia Business Report,war infull swing rising oil prices trade war full swing inflation rising around world got slew economic reports week us china give us clues asia produces 90 world rice look climate change disrupting
BBCNEWS,BBC News,climate change minister claire perry told bbc politicians telling people eat less meat smacks worst kind nanny state advice environment analyst roger harrabin burping farm animals major source greenhouse gas emissions cutting meat one simplest things protect climate
BBCNEWS,BBC News,nearly 200 governments meeting south korea agree new report urging ambitious global warming targets released intergovernmental panel climate change says increases temperatures capped 1 5 degrees celsius
BBCNEWS,BBC News,locally a0 years spent many days kids lancashire adults know global warming climate change real part got keep fossil fuels ground within site deep underground
BBCNEWS,BBC News,considering much tougher target cutting greenhouse gases heard also reducing
BBCNEWS,Victoria Derbyshire,climate scientists meeting south korea given one starkest warnings yet scale challenge involved tackling global warming saying society undergo rapid far reaching change report intergovernmental panel climate change urges limiting temperature rises
BBCNEWS,BBC News,governments across world face renewed calls dramatic action tackle global warming following major report climate scientists published tomorrow intergovernmental panel climate change release latest assessment south korea science editor david shukman seoul scientists meeting
BBCNEWS,BBC News,eat less meat help tackle global warming seems sunday roasts steak dinners safe hands government climate change minister claire perry told bbc politicians telling people eat less meat smacks worst kind nanny state advice
BBCNEWS,BBC News,eat less meat help tackle global warming seems sunday roasts steak dinners safe hands government climate change minister claire perry told bbc politicians telling people eat less meat smacks worst kind nanny state advice
BBCNEWS,Asia Business Report,affect grandchildren stop pamela sloane taught geography locally 40 years spent many days kids lancashire adults know global warming climate change real part keep fossil
BBCNEWS,Breakfast,gathered south korean city incheon past week climate change researchers government delegates hammered final details dramatic report outlining consequences global temperature rise 1 5 degrees plan precisely prevented countries need ambition get moving climate
BBCNEWS,Breakfast,analyst roger harrabin government taking step towards eventually cutting britain net greenhouse gas emissions zero formally seeking guidance official advisors climate change committee could achieved opposition parties accused ministers hypocrisy saying recently weakened green policies environment analyst roger harrabin big shift away coal fired power
BBCNEWS,BBC News,expected saturday un climate change scientists meeting week south korea decide done limit global warming report due monday many countries agreed take steps limit rise average temperatures 2 degrees scientists concerned
BBCNEWS,BBC News,told eat less meat help tackle global warming seems sunday roasts steak dinners safe hands government climate change minister claire perry told bbc politicians telling people eat less meat smacks worst kind nanny state advice
BBCNEWS,BBC News,governments across world face renewed calls dramatic action tackle global warming following major report climate scientists published tomorrow intergovernmental panel climate change release latest assessment south korea science editor david shukman sent report seoul scientists meeting south korea
BBCNEWS,BBC News,already talking new marches coming weeks scientists representatives nearly 200 governments meeting south korea agree new report urging ambitious global warming targets released intergovernmental panel climate change says increases temperatures capped 1 5 degrees celsius
BBCNEWS,BBC News,speed scientists representatives nearly 200 governments meeting south korea agree new report urging ambitious global warming targets released intergovernmental panel climate change says increases temperatures capped 1 5 degrees celsius pre industrial levels warn countries existing target 2 degrees adopted
BBCNEWS,Newsday,ribeiro thank much pro governments across world face renewed calls dramatic action tackle global warming following major report climate scientists published hours time intergovernmental panel climate change release latest assessment south korea 0ur science editor david shukman reports seoul scientists meeting south korea
BBCNEWS,BBC News,next decade really making challenging impossible keep warming 1 5 degrees report spells greenhouse gases must fall 45 2030
BBCNEWS,Climate Change,make disaster reading feasible figure actually first thing understand stop planet warming level omissions carbon greenhouse gases brought
BBCNEWS,BBC News at Ten,really making challenging impossible keep warming 1 5 degrees report spells greenhouse gases must fall 45 2030 decade away says 2035
BBCNEWS,BBC News,lagging behind see society moving faster thatis good signal government considering much tougher target cutting greenhouse gases also reducing subsidies electric
BBCNEWS,BBC Newsroom Live,scientists issued strongest warming yet climate
BBCNEWS,Breakfast,said one production clothes transporting around world greenhouse gases produced discarding landfill incinerator sites
BBCNEWS,Breakfast,mentioned earlier germany italy weigh less clothes bought retail industry think something done ends process production greenhouse gases used making clothes
BBCNEWS,BBC Business Live,environmental impact coming transport waste put awful lot greenhouse gases come quite intensive farming particularly production meat methane production also quite intensive use water actually
BBCNEWS,HARDtalk,stations whole world found world polluted blackspot terms nitrogen dioxide one key greenhouse gases country transition away coal going
BBCNEWS,BBC News at Five,burning fossil fuels continues greenhouse gases still increasing decreasing 2015 paris agreement “ increasing decreasing 2015 paris agreement even close ofa lack political public
BBCNEWS,BBC News,say dramatic changes need made quickly lifestyles avoid catastrophic climate
BBCNEWS,BBC News at Five,fossil fuels first thing crazy carry mining coal oil gas point also need learn something calling climate repair take greenhouse gases atmosphere return climate safe level
BBCNEWS,Breakfast,rest gang yes talking fast fashion turning latest catwalk creations outfits like breakfast team brought mps say process major source greenhouse gases huge amount landfill
BBCNEWS,Climate Change,still leading every chinese think emits half greenhouse gas emissions west correct see countries
BBCNEWS,BBC News,intergovernmental panel climate change demonstrating still possible limit warming planet two celsius think worst impacts climate change irreversible impacts climate change commit warm
