Station,Show,Snippet
CNN,Fareed Zakaria GPS,business usual strikes scientific case global warming happening caused greenhouse gas emissio emissions greenhouse gas emissions determine hot
CNN,American Morning,consumers better informed much mileage actually getting gallon 2012 posting new stickers use letter grade plus rate vehicle fuel economy also level greenhouse gas emissions
CNN,American Morning,warming climate change far every day weather circulations longer term oscillations really control every day weather remember last summer started really cold past winter pretty harsh well climate change
CNN,State of the Union,much trying explain weather us bear look dot com sight climate nasa gov top hour fareed zakaria discussion global warming
CNN,Fareed Zakaria GPS,make society either reduce carbon emissions carry business usual strikes scientific case global warming happening caused greenhouse gas emissions
CNN,CNN Newsroom,money choice meineke time mission possible got meet cat drawn attention global
CNN,John King USA,murkowski like proposal time got around said teams right end oppose regulating greenhouse gases vote failed come
CNN,Fareed Zakaria GPS,winter time pointing upwards upward rise mean temperature rising right think increases greenhouse gases industrial civilization agriculture put atmosphere anticipate continuing add
CNN,American Morning,air complex system complicated layers layers layers feedback systems certainly warm polar regions probably worst feedback system comes global
CNN,Fareed Zakaria GPS,politicizes technologies worse nothing actually impairing ability respond long run major concern along carbon tax gas tax put carbon tax would reduce
CNN,Fareed Zakaria GPS,amount variability one summer next summer even one winter next winter time pointing upwards upward rise mean temperature rising right think increases greenhouse gases industrial civilization agriculture put atmosphere
CNN,Fareed Zakaria GPS,actually impairing ability respond long run major concern along carbon tax gas tax put carbon tax would reduce consumption tax get less
CNN,American Morning,economy also level greenhouse gas emissions stickers also inform buyers much money save five years comparing hybrids gas powered vehicles food drug administration uncovered host serious safety
CNN,Fareed Zakaria GPS,effectively know reduce greenhouse gas emissions stop using fuels emit may economically pleasant different know replacement technology right well
CNN,CNN Newsroom,want listen two people talking first one ed marquis chairman energy independence global warming hear response doug subtles
CNN,Fareed Zakaria GPS,many important ways extremely interdependent economies even issues like global warming nuclear proliferation tied together buy niall china thoroughly
CNN,CNN Newsroom,freezing water high altitude puts health risk highlight risk global warming talk louis pew next mission possible subaru saved life ever forget
CNN,Fareed Zakaria GPS,attribute one single event even group disparate events something kind slow acting pervasive like global warming know planet warming decade warmest
CNN,Fareed Zakaria GPS,attribute one single event even group disparate events something kind slow acting pervasive like global warming know planet warming decade warmest
CNN,State of the Union,wave russia specifically caused global warming takes benefit hindsight know happening ten years yeah multiple lines evidence tell us
CNN,Fareed Zakaria GPS,spending large amounts capital would dissipated could invested future technologies frankly even know mean effectively know reduce greenhouse gas emissions stop using fuels emit
CNN,Fareed Zakaria GPS,greenhouse gas emissions determine hot planet gets anything disagree clear planet warmer people something concerned magnitude rate warming think quite
CNN,Fareed Zakaria GPS,water fires burning control russia floods europe another summer planet earth apocalypse global warming whatever affect us
CNN,Fareed Zakaria GPS,floods europe another summer planet earth apocalypse global warming whatever affect us economies help answer
CNN,Fareed Zakaria GPS,world evidence global warming wanted know brought together great panel jeff sachs two climate scientists tell seeing islam especially islam america
CNN,CNN Newsroom,discussion global warming affecting entire planet need time turn doctor medical expertise right expert comes body
CNN,CNN Newsroom,goodness well karen thanks much appreciate wish could get relief speaking hot temperatures folks concerned global warming lots world
CNN,Fareed Zakaria GPS,really race one winner see going biggest economy many important ways extremely interdependent economies even issues like global warming nuclear proliferation tied together
CNN,Fareed Zakaria GPS,next wild weather around world evidence global warming wanted know brought together great panel jeff sachs two climate scientists tell seeing islam especially islam america
CNN,The Situation Room With Wolf Blitzer,believe multi billion dollar improvements complete new orleans remains place risk city surround water sides people literally like living bowl ground slowly sinking add global warming causing sea levels rise
CNN,American Morning,one specific event say cause event definitely global warming kind get edge research take look combined global land ocean average surface temperature june 2010 warmest record
CNN,CNN Newsroom,new orleans remains place risk city surrounded water sides people literally like living bowl ground slowly sinking adding global warming causing sea levels rise louisiana losing little bit land every day
CNN,Fareed Zakaria GPS,floods intense heat much world seeing global warming gasoline 4 gallon reduced consumption grand total 4 really serious atmospheric carbon dioxide got reduce 80
CNN,State of the Union,us 2010 already track warmest year time okay really look like warming terms saying heat wave russia specifically caused global warming takes benefit hindsight know
CNN,State of the Union,dotcom site climate nasa gov appreciate top hour fareed zakaria full discussion global warming implications next check top stories fun fight 30000 feet cabin attendants passengers
CNN,Fareed Zakaria GPS,terrorism work together food security work together north korea although well lately huge imbalances yet global warming china work together sunk right take break right back lots discuss
CNN,The Situation Room With Wolf Blitzer,dollar improvements complete new orleans remains place risk city surrounded water sides people literally like living bowl ground slowly sinking add global warming causing sea levels rise louisiana losing little bit
CNN,Fareed Zakaria GPS,missing jeff stay right back moment talk fires floods intense heat much world seeing global warming gasoline 4 gallon reduced consumption grand total 4
CNN,Fareed Zakaria GPS,huge imbalances yet global warming china work together sunk right take break right back lots discuss political problems china political problems united states coming question
CNN,Your Money,restaurant savings minimal save big long hall make money right thing fighting climate change supporting clean energy growing business going alone
CNN,Your Money,another three years going green restaurant savings minimal save big long haul make money right thing fighting climate change supporting clean energy growing business
CNN,Fareed Zakaria GPS,economies tep answer questions jeff sachs course earth institute columbia gavin schmidt nasa scientist studies climate change pat michaels scientist works cato
CNN,John King USA,maybe president live principles good progressive politics ending war afghanistan concerned climate change working towards public option maybe even universal health care
CNN,John King USA,al gore turning heat congress gore calling major public protests inaction climate change legislation senator patty murray expected easily win tonight primary washington face republican dino
CNN,American Morning,anymore joined carol browner assistant president obama energy climate change thanks us morning joining us white house briefing room good news bp announced overnight static kill
CNN,John King USA,move forward looking aspects said repeatedly talking climate change legislation need make sure options table fair senator
CNN,Fareed Zakaria GPS,questions jeff sachs course earth institute columbia gavin schmidt nasa scientist studies climate change pat michaels scientist works cato institute libertarian think tank strongly opposes caps
CNN,The Situation Room With Wolf Blitzer,say park declining factors include mining aircraft flyovers upriver management colorado river climate change report recommends increased federal financial support maintain park experience plan park future
CNN,Fareed Zakaria GPS,everything even legitimate effort try work decent energy bill night announced 60 votes something serious global climate change china announced going price
CNN,Fareed Zakaria GPS,even legitimate effort try work decent energy bill night announced 60 votes something serious global climate change china announced going price carbon china going price carbon
CNN,CNN Newsroom,think able put stop climate change glaciers melt away therefore constant water supply farmers factories ordinary people downstream think going conflict region
CNN,Reliable Sources,right way americans making water policy 21st century water people talk climate change tell us going key issue last question film slated one day release selected
CNN,American Morning,hear white house latest developments deals oil spill static kill operation carol browner assistant president obama energy climate change joining us live blistering heat wave going away time soon across
CNN,American Morning,dollar questions right climate change one things think planet going change deal example look satellite studies ice around antiashth ka greenland
CNN,The Situation Room With Wolf Blitzer,climate change mccain used leader issue pretty much steering clear period kind sad actually john mccain used stand thought right remember age 73 another
CNN,American Morning,joining us morning appreciate quickly want bring rob marciano well know done lot stories climate change covered share individual events take look earth know dynamic know gone natural
CNN,Fareed Zakaria GPS,may last thing macro economy put everything going happen really need get energy system really need get tthe climate change say well said got
CNN,Reliable Sources,want deal border want deal climate change issues know borders know ideologies forget room kind discussion also time extreme rage parties actually think less media causing rage
CNN,Fareed Zakaria GPS,put everything going happen really need get energy system really need get climate change say well said got act got act right desperate think
