Station,Show,Snippet
CNN,Early Start With John Berman and Christine Romans,fund instead fund thousand community health center provide service without performing abortion obama administration announce climate change plan reduce greenhouse gas
CNN,Early Start With John Berman and Christine Romans,halt federal funding planned parenthood democrat confident get vote needed republican calling government shutdown obama administration announce climate change reduce greenhouse gas
CNN,The Lead With Jake Tapper,welcome back lead president obama afternoon announcing controversial plan try slow harmful effect climate change new proposal would require every state reduce nearly third greenhouse gas
CNN,Early Start With John Berman and Christine Romans,washington expect better reporter president warned severe weather event triggered climate change mr obama return issue next week travel alaska see effect global warming first hand
CNN,Situation Room With Wolf Blitzer,historic trip alaska debate global warming
CNN,CNN Newsroom Live,show took least tweet context need global warming reporter donald tweeted frooesz freezing snowing new york need global warming
CNN,CNN Newsroom With Carol Costello,california torched yet hell broke loose everyone house ash dry windy condition feeting flame firefighter stop also president ready toy crack greenhouse gas
CNN,CNN Newsroom With Brooke Baldwin,country change warming planet today america leading way country representing 70 carbon pollution world energy sector announced plan cut greenhouse gas emission
CNN,CNN Newsroom With Brooke Baldwin,think headed catastrophic warming climate model project heading towards importantly think regulation going make dent overall global amount greenhouse gas emission
CNN,CNN Newsroom Live,actually government consulate climate change people probably way person called said carmen thought climate change refugee
CNN,CNN Newsroom Live,2015 world hottest year ever recorded allison said past july also set heat record scientist point statistic like support argument global warming
CNN,CNN Newsroom Live,turmoil political upheaval greece fire rage across western united state 2015 go wrltd hottest year recorded history scientist say even proof global warming real
CNN,CNN Newsroom Live,government leading scientist curve grown house gas emission limit minimize effect climate change leading conference cnn covering climate change
CNN,CNN Newsroom Live,10000 marshallese actually live actually government consulate climate change people probably way one person called said carmen thought climate change refugee
CNN,CNN Newsroom Live,springdale 10000 already live area many government consulate climate change people probably way person call said carmen thought climate change refugee
CNN,The Lead With Jake Tapper,talking pop later year climate summit parris something obviously democrat like talk something public ready severe weather event triggered global warming
CNN,CNN Newsroom Live,cnn unable get comment officer video anyone meeting representing short break often cnn come back president obama call new climate plan major step fight global warming
CNN,CNN Newsroom With Brooke Baldwin,tackling climate change well announced today end result month year work regulation series step taken executive authority get climate change
CNN,Situation Room With Wolf Blitzer,detail jim president obama touting climate change plan major step step global warming pointing wildfire drought
CNN,New Day,steph watching take care several political show down brewing capitol hill morning republican threatening legal action block president obama new plan combat climate change
CNN,Fareed Zakaria GPS,exactly kind solution need woken reality idea talking cannot happen address rigged system first climate change legislation
CNN,Situation Room With Wolf Blitzer,first city commander chief visit alaskan arctic renaming tallest mountain u changing mount mckenley denali known locally president focusing climate change
CNN,CNN Newsroom Live,global warming heat event rain event strong evidence tieing climate change talked thing like tornado tropical cyclone weakest evidence
CNN,CNN Newsroom Live,climate catastrophe hoped come plan combat global warming 2009 similar conference failed climate change caused country world
CNN,New Day,afternoon white house unveils climate change initiative president obama say biggest important step ever taken combat global warming call 32 reduction
CNN,New Day,talking know issue know going go away know however something opponent going go crazy people get distracted lot stuff going climate change sex scandal
CNN,CNN Newsroom With Carol Costello,payment adding puerto rico woe island suffering severe water shortage many resident going day without tap water woman feel like freezing office reason study nature climate change
CNN,Early Start With John Berman and Christine Romans,rival new number president obama moving climate change top agenda heading alaska new warning global warming thousand marching
CNN,Early Start With John Berman and Christine Romans,president obama change name united state highest peak climate change agenda go alaska brings new warning global warming tension rising houston
CNN,Early Start With John Berman and Christine Romans,hillary clinton iowa new number ahead president obama taking climate change morning heading alaska new warning global warming thousand marching houston execution style murder sheriff deputy
CNN,The Lead With Jake Tapper,everything admin trafl diplomatically donald trump ted cruz others running president doubt global warming sat john kerry ahead conference climate change alaska
CNN,The Lead With Jake Tapper,hurricane katrina getting back subject climate change john something hearing president consistently coming week next week travel alaska see effect global warming firsthand talking today
CNN,CNN Newsroom Live,new warning global warming thousand marching execution style murder
CNN,Erin Burnett OutFront,trump context need global warming actually donald tweeted freezing snowing new york need global warming nothing warmer donald regard
CNN,CNN Newsroom With Poppy Harlow,climate change real climate change caused human activity climate change already causing devastating problem country around world
CNN,CNN Newsroom With Carol Costello,florida electric bill go 30 month cat trofblg catastrophic look satellite data last 18 year zero recorded warming saying global
CNN,CNN Newsroom Live,significance taking place climate change go pedram javaheri join u mean pretty amazing part world think said ground zero climate change talk climate change look
CNN,CNN Newsroom Live,private company also taking stand delta american airls say longer transport certain big game animal trophy doubt climate
CNN,New Day,powerplants reduce greenhouse gas emission year 2030 faa confirmed close call unmanned drone third sighting one nation busiest airport
CNN,CNN Newsroom Live,john sutter see marshall island website go cnn com twodegrees see video story relates climate
CNN,CNN Newsroom With Brooke Baldwin,right pentagon say climate change pose immediate risk national security say single weather event entirely caused climate change seen stronger storm deeper
CNN,CNN Newsroom Live,lasting solution paris december meteorologist derek van dam explores evidence profprof prof climate change real come climate change public opinion 50 50
CNN,CNN Newsroom Live,chart well ipcc say warming plan set unequivocal happening human causing temperature rise burning fossil fuel greenhouse gas emegss specifically co2 reaching level never
CNN,Early Start With John Berman and Christine Romans,climate change agenda go alaska brings new warning global
CNN,CNN Newsroom Live,arctic circle part world see climate change work ground zero climate change often talk alaska home 75 national park 90
CNN,CNN Newsroom Live,action climate change proposal set new standard power plant cut emission 32 next 15 year breaking point climate change expert say could 2 degree celsius le
CNN,New Day,global warming thought metaphore clever appreciate know vancouver planned parenthood denier
CNN,CNN Newsroom Live,climate change selling new plan american people monday explained work time action first generation feel impact climate change last generation
CNN,CNN Newsroom Live,reporter truth told jimmy kimmel show took least one trump comment context need global warming reporter nothing
CNN,CNN Newsroom Live,greenhouse gas emitter world come together starting happen year ago agreement president obama president china two coming together work problem
CNN,Situation Room With Wolf Blitzer,global warming week long calling attention alaska can alaskan experiencing deliver speech russia arctic nation
CNN,Fareed Zakaria GPS,responsiveness official fired discussed last week show major reform proposed leader world would wise witness pay heed happened iraq something mitigate effect climate
CNN,CNN Newsroom Live,known denali nod region native population president said threatened global warming let get
CNN,CNN Newsroom Live,climate capacity stay mark may able avoid worst aspect global warming burn gas car
CNN,CNN Newsroom With Brooke Baldwin,speak candidate think obvious greenhouse gas emission contributing warming seen temperature warming last 18 year yes warming yes emission playing part
CNN,CNN Newsroom Live,president announced plan curb greenhouse gas emission u acting alone good people invested climate take end year paris say without united state china extent
CNN,CNN Newsroom Live,diversifying reduced amount snow one cause global warming pollution next santiago super polluted contaminated city
CNN,Early Start With John Berman and Christine Romans,effect global warming first hand alison dow setting record thursday think stock stabilize wait hear coming next
CNN,CNN Newsroom With Carol Costello,reporter donald trump tweeted freezing snowing new york need global warming nothing tweeted q one
CNN,Early Start With John Berman and Christine Romans,global warming first hand alison wild week wall street incredible amazing market around world recovering watched crash dow set new record
CNN,CNN Newsroom Live,republican cliemts denier would say notable change recent time reporter last year donald trump tweeted expensive global warming bull got stop
CNN,CNN Newsroom Live,relentless fire weather condition important report cnn affiliate komo seattle le 100 day world leader meet discus global warming
CNN,CNN Newsroom Live,island trying earn enough money bring far ocean would come live global warming make flood worst
CNN,CNN Newsroom Live,catastrophe meeting matter hope produce first ever legally binding universally applicable plan combat global warming agreement would especially comprehensive legally
CNN,CNN Newsroom Live,matter p hope produce first ever legally binding universally applicable plan combat global warming agreement would legally enforced successor kyoto protocol
CNN,CNN Newsroom Live,combat modern day slavery president obama call new climate plan major step fight global warming critic calling clean power grab mexican journalist working
CNN,New Day,president obama say done something global warming interact global community get conference say political move boxing republican
CNN,Fareed Zakaria GPS,government baghdad responsiveness tom friedman pointed official fired discussed last week show major reform proposed leader world would wise witness pay heed happened iraq something mitigate effect climate
CNN,The Lead With Jake Tapper,way president moving message global warming arrives later touring glacier heading northern alaska become first sitting president
CNN,Early Start With John Berman and Christine Romans,global warming first hand alison dow setting new record thursday following wild week market around world stock stabilized live break look like wild week
CNN,CNN Newsroom Live,bring child would come live global warming make flood worse long run marshall island disappear reporter live three bedroom apartment
CNN,Early Start With John Berman and Christine Romans,shell brought equipment prevent possible oil blowout environmental group oppose shore drilling say harm wildlife already threatened global warming arctic home estimated 20
CNN,CNN Newsroom With Brooke Baldwin,deny global warming go one specific competitor stage go jeb bush detail hectic weekend trump trying explain many consider sexist comment made fox news anchor
CNN,Early Start With John Berman and Christine Romans,dramatic alaska global warming president plan make case international pact cut carbon emission time early start money stock future lower right ahead final trading
CNN,Situation Room With Wolf Blitzer,issue donald trump said global warming b ted cruz said data fact support take issue side agree one reason alaska
CNN,CNN Newsroom Live,global warming bull got stop kind opposition white house bracing legal challenge could last year doubt special interest politician pocket
CNN,CNN Newsroom Live,greatly odds newly worsening claim stay mark may able avoid worst aspect global warming super drought extension sea level ride hit coastal city
CNN,CNN Newsroom Live,plan hit slope may luck snow ground blame global warming bad winter reporter snow capped mountain breath taking landscape elevation
CNN,CNN Newsroom Live,index starting see extreme result global warming yes covered weather extreme though one side world massive flooding excessive drought people understand know exactly
CNN,Early Start With John Berman and Christine Romans,next two week according washington post president obama head anchorage alaska highlighting climate change rename mckinley
CNN,Situation Room With Wolf Blitzer,star bear gryls test president survival skill talk global warming later travel northern alaska become first president visit arctic hear fisherman seeing livelihood threatened word whether
CNN,CNN Newsroom Live,planning unveil major climate change proposal today put restriction pollution level mr obama released announcement social medium
CNN,CNN Newsroom With Brooke Baldwin,may able adapt sufficiently thing late come climate change applause
CNN,New Day,honesty want leader future grabbed idea getting scientific consensus global warming thing question matter going planned parenthood going
CNN,CNN Newsroom Live,u president barack obama unveiling plan fight climate change monday aim reduce emission coal burning power plant 4332
CNN,CNN Newsroom Live,climate change could start forcing people probably population explosion reporter word springdale arkansas could become newmar shall island
CNN,CNN Newsroom Live,change u president barack obama head alaska raise awareness climate change announce mt mckinley known denali
CNN,CNN Newsroom Live,example heading arctic circumstance week new frontier energy exploration u president hoping highlight climate change approving drilling location
CNN,CNN Newsroom With Brooke Baldwin,home generation heal climate change last generation something get one home get one planet
CNN,CNN Newsroom With Brooke Baldwin,kid let make opportunity thank everybody god bless thank one obama legacy climate change president speaking
CNN,Early Start With John Berman and Christine Romans,repungnant fund today white house reveal climate change plan president obama plan call 32 reduction power sector
CNN,CNN Newsroom Live,climate change past 15 year 14 warmest republican argue increase energy cost destroy job going sit
CNN,Early Start With John Berman and Christine Romans,announce climate change plan designed dramatically reduce greenhouse gas emission goal burning plant plan call 32 reduction power sector carbon
CNN,CNN Newsroom Live,child behind ooinds trying earn enough money bring far ocean would come live global warming keep making flood worst long run marshall island disappear reporter cynthia mark live three bedroom
CNN,State of the Union With Jake Tapper,dependent upon super pac billionaire money people want deal climate change make college affordable issue generating enormous enthusiasm talking taking
CNN,State of the Union With Jake Tapper,scientist climate change threatening planet horrendous way aggressive transforming energy system away possible fuel defeat key
CNN,CNN Newsroom With Brooke Baldwin,since soviet union broke apart past three decade nationwide asthma rate doubled climate change put american greater risk landing
CNN,CNN Newsroom With Brooke Baldwin,climate change dan pfeiffer political commentator nick morris economist focus energy issue gentleman welcome dan pfeiffer let talk
CNN,Situation Room With Wolf Blitzer,going increasingly important going see extreme weather event result climate change deeper drought deadlier wildfire stronger storm addition thing
CNN,CNN Newsroom Live,cnn climate change coverage log get information two degree celsius cnn com groeg majority american say iran nuclear deal
CNN,CNN Newsroom Live,monday administration release final version america clean power plan biggest important step ever taken combat climate change power plant single
CNN,CNN Newsroom With Poppy Harlow,ever taken combat climate change many group dispute benefit white house touting many critic saying could potentially increase electricity price
CNN,New Day,look pretty wild biggest important step taken combat climate change think disaster vice president joe biden getting ready challenge
CNN,CNN Newsroom Live,donald trump state emergency california crew struggle contain dozen wildfire thousand forced home climate change breaking point small temperature sign
CNN,CNN Newsroom Live,two scientist say country vanish process information would go climate change washed country map marshallese
CNN,CNN Newsroom With Fredricka Whitfield,billionaire money people want u deal climate change make college affordable issue generating enormous enthusiasm one end country another
CNN,CNN Newsroom Live,north america tallest mountain getting name change u president barack obama head alaska monday raise awareness climate change announce mt mckinley
CNN,Early Start With John Berman and Christine Romans,want dramatic reduction 40 45 next decade move epa part pre president climate change agenda want cut carbon emission 32
CNN,CNN Newsroom Live,year u president plan announce ambitious climate change program monday also facing financial crisis unusual limitation coming set puerto rico apart
CNN,CNN Newsroom Live,welcome back u president barack obama launching major climate change plan taking aim nation coal burning power plant proposal set first ever standard
CNN,CNN Newsroom With Brooke Baldwin,generate combined pollution contributes climate change degrades air kid breathe never federal limit amount carbon power plant dump
CNN,CNN Newsroom Live,failed eye cop 21 lasting solution come climate change scientist stressing importance one number two degree celsius two degree celsius
CNN,CNN Newsroom Live,even climate change came debate analyst say stand yuts happy hour debate called former hul et packard ceo carly fiorina
CNN,CNN Newsroom With Brooke Baldwin,hospital one america governor said first generation feel impact climate change last generation something committed
CNN,CNN Newsroom With Brooke Baldwin,actually claiming harm minority low income community even though climate change hurt american vulnerable today african american child twice likely
CNN,CNN Newsroom With Brooke Baldwin,applause want want fool going hard dealing climate change entirety challenging single action single
CNN,CNN Newsroom Live,industry limit carbon pollution seek reduce emission 32 next five year climate change problem another generation monday
CNN,CNN Newsroom Live,administration release final version america clean power plan biggest important step ever taken combat climate change move likely face lot resistance
CNN,Situation Room With Wolf Blitzer,extended require state coercive way democrat sense potent issue labeling gop candidate climate change denier look last 15 20 year think
CNN,CNN Newsroom Live,neighboring bangladesh last week president obama unveiling plan fight climate change taking aim coal burning fire plant jim acosta show u already facing uphill battle
CNN,CNN Newsroom Live,struggle survive summer economic crisis get detail stock market opening coming next also u president barack obama ambitious climate change plan face uphill battle
CNN,CNN Newsroom With Brooke Baldwin,going talk world need together prevent worst impact climate change late today announce america clean power plan
CNN,CNN Newsroom With Brooke Baldwin,plan two year making single important step america ever taken fight global climate change applause n pollution car airplane home
CNN,New Day,brewing washington republican threatening go court fight climate change plan crack power plant senate set vote bill defund planned
CNN,New Day,medium power plant biggest source pollution contributes climate change limit pollution dump air believe like
CNN,New Day,much glove capitol hill president obama unveils new climate change plan republican threatening fight court senate vote bill
CNN,New Day,fixable share message friend family yes pushback started republican candidate climate change doubter denier certain state planning taking administration court
CNN,CNN Newsroom Live,associated climate change could start forcing people impact would probably population explosion reporter springdale could become new marshall island starting build
CNN,CNN Newsroom With Carol Costello,hopeful blasting president obama ambitious plan combat climate change threatening go court block even officially unveiled yet think disaster taking typical
CNN,CNN Newsroom Live,way room debate climate change real people see happening house water came looked window
CNN,Early Start With John Berman and Christine Romans,rival president obama taking climate change renaming mountain thousand marching houston execution style murder sheriff deputy suspect court morning detail ahead welcome back early start
CNN,Early Start With John Berman and Christine Romans,imposed decision expected within next two week according washington post president obama go alaska three day visit highlighting climate change announce government
CNN,CNN Newsroom Live,commercially safely gas fossil fuel contributes climate change cleaner coal egypt look importing coal may able scrap
CNN,CNN Newsroom Live,bernie sander donald trump surging front rival new number president obama moving climate change top agenda heading alaska
CNN,CNN Newsroom With Fredricka Whitfield,united campaign finance system become corrupt depended upon super pac billionaire money people want u deal climate change make college affordable issue talking
CNN,Early Start With John Berman and Christine Romans,attack war crime president obama head anchorage alaska today highlighting climate change scheduled meet native american tonight announcing government renaming mt mckinley highest peak north
CNN,CNN Newsroom With Fredricka Whitfield,need fight climate change defend decision let let oil company drill arctic ocean environmental group say two message contradict president hike
CNN,CNN Newsroom Live,shell balance climate change energy developing developed country around world look natural gas seeing giant discovery around world mediterranean east africa
CNN,State of the Union With Jake Tapper,francis almost scientist climate change threatening planet horrendous way aggressive transforming energy system away fossil fuel defeat defeat
CNN,Early Start With John Berman and Christine Romans,emission coal burning plant biggest important step combat climate change plan call 32 reduction carbon pollution 2030 aggressive transition solar
CNN,Early Start With John Berman and Christine Romans,emission president call biggest important step ever battle climate change see web site launched saying word looking 32 reduction power sector carbon pollution
CNN,CNN Newsroom With Brooke Baldwin,u today tonya brown wave go ahead tonya tonya brown joined mom across america spread word danger climate change pose health child
CNN,CNN Newsroom With Brooke Baldwin,former bos legacy issue even president started speaking talking economy bringing troop home diplomacy course climate change question
CNN,Early Start With John Berman and Christine Romans,washington expect better reporter president warned severe weather event triggered climate change mr obama return issue next week travel alaska see effect
CNN,Situation Room With Wolf Blitzer,sat john kerry asked fact white house agenda climate change almost zero support among republican congress support president
CNN,CNN Newsroom With Carol Costello,make point climate change real happening according administration going visiting community talking local people announcing new initiative environment helping local people yeah
CNN,CNN Newsroom Live,termings tying climate change rather large el nino year far double trouble western pacific right two typhoon
CNN,CNN Newsroom Live,good thank read el nino website check climate change story beginning cnn initiative 2 degree
CNN,CNN Newsroom Live,ocean u president barack obama poised unveil climate change plan heavy rain myanmar killed least 47 people errol barnett solo next two hour
CNN,CNN Newsroom Live,supply also brought heavy rain strong wind forecast next day unmcaleenan clear topic connected climate change u president barack obama
CNN,CNN Newsroom With Poppy Harlow,white house overnight already pushing benefit climate change problem another generation anymore monday administration release version clean power plant biggest important step
CNN,CNN Newsroom Live,candidate climate change denier look last 15 20 year scientist say noticeable change recent time reporter donald trump tweeted bull got
CNN,CNN Newsroom Live,opinion thing late address climate change people wonder breaking point say could two degree celsius warms
CNN,CNN Newsroom Live,sea rise meter two scientist say country vanish process information would go climate change wiped country map surprising answer
