Station,Show,Snippet
CNN,State of the Union With Jake Tapper,factory much competitive saying friendly certainly environmentally friendly huge believer clean air huge believer global warming phenomenon
CNN,CNN Newsroom Live,robert special adviser u n secretary general climate change dean university maryland join u new york thank much time pope francis expected make climate change essentially
CNN,CNN Newsroom With Fredricka Whitfield,american create million job countly new business lead global fight climate change
CNN,CNN Newsroom With Carol Costello,pope document understand economic document moral document pope moral authority speak issue climate change
CNN,CNN Newsroom With Fredricka Whitfield,pog call russian aggression far summit thousand protester marching facing police demonstrator expressing concern political economic issue including poverty capitalism climate change
CNN,The Lead With Jake Tapper,74 american without college degree want live american dream like everybody else focus asked philadelphia radio host pope francis expected encyclical climate change
CNN,New Day,canada another western country belief say left hamas behind left west bank right well first pope fed sounding alarm danger climate change
CNN,CNN Newsroom With Fredricka Whitfield,decision proudly defend unborn agree abortion let talk tax literally together long shot presidential candidate took party issue climate change
CNN,Wolf,warning safeguard creation destroy creation creation destroy u pope francis expected call action halt climate change set catholic church position global warming view revealed
CNN,New Day,backing pope francis position global warming apa administrator helped craft pontiff climate change going live new day coming okay guy got two car going start watching movie chevy malibu
CNN,New Day,policy question becomes pope saying leader catholic church saying climate change manmade global warming something deal addressing deal fossil fuel saying disagree pope head krour
CNN,CNN Newsroom With Poppy Harlow,literally together interview graham longshot presidential candidate also took party issue climate change told course belief global warming real manmade republican party need come term also come
CNN,Fareed Zakaria GPS,supported many free marketer like carbon tax puttinga price encourage
CNN,State of the Union,carbon target believe climate change real want business solution man made climate change yes 90 doctor tell problem listen one
CNN,Reliable Sources,emily list highlight quote mentioned share facebook think progress highlighted comment climate change going gop climate change look twitter feed
CNN,CNN Newsroom Live,might explain stance climate change since likely impact poorest people planet fact think genesis deep concern climate change
CNN,State of the Union,going use fossil fuel fire long time come okay set lower carbon target believe climate change real want business solution problem manmade climate change yes absolutely 90 doctor tell
CNN,State of the Union With Jake Tapper,quote con set global warming created chinese order make u manufacturing noncompetitive course sarcas c sarcastic taken
CNN,State of the Union With Jake Tapper,much competitive saying friendly certainly environmentally friendly huge believer clean air huge believer global warming phenomenon overwhelming majority
CNN,State of the Union With Jake Tapper,environmentally friendly huge believer clean air huge believer global warming phenomenon overwhelming majority scientist say real manmade thing
CNN,New Day Sunday,combating threat violent extremism climate change grateful leadership chancellor
CNN,CNN Newsroom With Victor Blackwell and Christi Paul,different stripe anarchist simply concerned citizen want tougher action global warming others want end refugee cry want tougher measure combat division rich poor world many idea motivating
CNN,State of the Union With Jake Tapper,let manipulate currency back 2012 tweeted quote concept global warming created chinese order make u manufacturing noncompetitive well course sarcastic know
CNN,CNN Newsroom With Fredricka Whitfield,telling belief global warming real man made republican party need come term come comprehensive plan address environment dana bash thank much pope francis meet vladimir putin week
CNN,CNN Newsroom Live,expected challenge skeptic believe man made global warming visit vatican wednesday pope said planet ruined everyone duty protect place call home joining talk
CNN,State of the Union With Jake Tapper,good deal let let manipulate currency back 2012 tweeted quote concept global warming created chinese order make u manufacturing noncompetitive
CNN,New Day,passat tdi clean diesel 814 hwy mile per tank hurry get 0 apr plus one thousand dollar volkswagen credit bonus 2015 passat tdi clean diesel model first pope call action global warming pontiff delivering plea
CNN,CNN International,also greece debt crisis climate change top agenda world richest nation meet j 7 summit barcelona party like tomorrow
CNN,CNN Newsroom With Brooke Baldwin,climate change continue take time effort learning innovative way podcast
CNN,New Day,pope say world leader forgot business dealing climate change jeb bush agree pope get economic policy
CNN,CNN Newsroom With Carol Costello,papal document anticipated brazilian climate change group even created epic theatrical trailer pope word destroy creation creation destroy u
CNN,CNN International,demanding immediate policy climate change trying push chancellor angela merkel getting commitment country cut carbon emission cut reliance coal
CNN,CNN International,partnership across atlantic standing russian aggression ukraine combatting threat violent extremism climate change issue grateful partnership
CNN,New Day,south carolina another 15 ten official candidate lindsey graham say yes climate change listen state union yes absolutely
CNN,New Day Sunday,russian aggression ukraine combating threat violent extremism climate change issue grateful partnership leadership chancellor angela merkel
CNN,New Day Sunday,russian aggression ukraine combating threat violent extremism climate change issue grateful partner leadership chancellor aamerica el
CNN,New Day,come listening pope loyalty issue problem pope francis hugely popular worldwide climate change issue voter care millenials hispanic
CNN,CNN Newsroom With Carol Costello,pope francis revealing position climate change affecting gop candidate talk next heartburn come creeping fight back relief smooth
CNN,New Day,climate change released blame human activity call people reduce environmental impact response vatican say draft final version
CNN,New Day,convince somebody say climate change made people street ask u
CNN,CNN Newsroom With Fredricka Whitfield,president obama urging several world leader stand aggression ukraine leader discussing crisis ukraine terrorism climate change issue thousand demonstrating
CNN,CNN International,climate change russia noticeably absent event world leader excluded country second year conflict ukraine first time since investigation began top fifa
CNN,CNN International,international trade climate change american red cross rejecting accusation squandered donation 2010 earthquake haiti republican news organization national public radio reported charity raised half
CNN,Wolf,listen called praised care common home pope francis encyclical moral aspect climate change protecting environment church leader say
CNN,Wolf,first time release papal encyclical anticipated brazilian climate change group even created epic theatrical trailer pope word destroy creation creation destroy u
CNN,Early Start With John Berman and Christine Romans,discussion yesterday today expect hear climate change session happening right situation iraq mentioned president obama meet iraqi prime minister al abadi
CNN,New Day,nothing trade instance thing climate change thing immigration expanding market fish seafood shellfish know believe link
CNN,The Situation Room,promised regulate carbon dioxide climate change pollutant promise broken early day administration sadly lie never stopped administration
CNN,CNN International,stone g7 agenda climate change germany forefront cut carbon emission getting country commit pledge emission 2020 course u n deal expected signed
CNN,The Lead With Jake Tapper,32 president obama handling isi 36 immigration 36 climate change white house responded acknowledging work done though progress number area
CNN,Early Start With John Berman and Christine Romans,voting probably like answer santorum seems shift position climate change saying open idea human factor santorum guy go
CNN,New Day,catholic leader climate change ahead inside politics world today could use smile cricket wireless think price plan tax fee included
CNN,New Day,economic advice pope issue something climate change punted one easy say listen getting advice pope certainly economic
CNN,CNN Newsroom With Carol Costello,pope francis new message world time environment damage done climate change see pope greeting crowd vatican city papal document
CNN,CNN Newsroom With Fredricka Whitfield,isi even climate change much tap jim acosta reporter president obama hoping keep economic pressure vladimir putin russia muddling ukraine white house said russia
CNN,CNN Newsroom Live,say climate change disproportionately impact poor credibility say know pope particular speaks people listen important message wait see exactly
CNN,CNN Newsroom With Carol Costello,conservative fear seen endorsement liberal agenda climate change bad news big business oil first pope developing world pope francis
CNN,CNN International,well second final day g 7 summit underway germany world leader sat done morning session expected tackle climate change climate issue morning session
CNN,State of the Union With Jake Tapper,good know immigration climate change broad issue issue matter know better anybody base issue believe would voted
CNN,Early Start With John Berman and Christine Romans,voting santorum discussed climate change saying open idea human contributing factor hillary clinton hold first major rally since entering presidential race new york roosevelt island
CNN,Fareed Zakaria GPS,relationship prime minister joined g 7 leader set new goal end fossil fuel usage end century climate change agenda pope prince
CNN,The Situation Room,change climate change shift think issue capacity change feel sense urgency people got
CNN,At This Hour With Berman and Bolduan,see justice justice department pushing envelope sex marriage know bailout chrysler climate change negotiation president day day legislating
CNN,CNN Newsroom Live,potential nuclear deal north korea arsenal nuclear weapon climate change three area china u common ground issue hacking issue south china sea
CNN,New Day Sunday,climate change right president obama joining world leader germany talking tough issue threatening global security plus get look two men convicted killer broke prison talking shaw shank style
CNN,CNN Newsroom Live,issuing encyclical raise stake tremendously fact climate change moral issue many said many know pope come formal sense encyclical said
CNN,CNN Newsroom With Carol Costello,priest back home get economic policy bishop cardinal pope like see say relates climate change connects deeper issue pas
CNN,CNN Newsroom With Carol Costello,particular teaching republican say still think encyclical released tomorrow still large ability change politics climate change see eagerly await release
CNN,New Day,world 1 2 billion catholic protect earth climate change morning new report epa sounding similar warning take action wild fire extreme temperature change storm surge well could become norm
CNN,CNN International,kind expenditure obscene money dedicated core global issue like fighting poverty division rich poor fighting climate change helping world refugee crisis cutting military spending myriad opinion
CNN,CNN Newsroom Live,environment stem deep love poor people pope spent year decade working poor poor poor heavily impacted climate change fact link
CNN,CNN Newsroom With Carol Costello,emphasis connection destruction earth resource impact poor timing document release also significant coming year united nation climate change conference paris december
CNN,Fareed Zakaria GPS,second one far powerful letter people world climate change expected great call action pope named patron saint ecology news prompted rick santorum
CNN,Fareed Zakaria GPS,child poverty contraception disarmament cuban missile crisis come key moment climate policy washington post point possibility ambitious climate change agreement horizon year
CNN,CNN International,issue discussed climate change ebola political financial crisis happening around globe lot get begin chancellor merkel president obama today village kreun
CNN,CNN Newsroom With Carol Costello,totally inappropriate right ed davis former police commissioner boston thank much insight coming world leader tackling major issue like isi climate change president say hearing next
CNN,Early Start With John Berman and Christine Romans,never ask anyone voting probably like answer santorum shifting position climate change saying open idea human contributing factor big weekend politics hillary clinton hold
CNN,New Day,world child shape proud climate change belief system fact science epa putting science table providing information showing fact
CNN,CNN Newsroom With Fredricka Whitfield,taxing wellalthy er rule make worse heard tune know turn ask many candidate climate change one threat time
CNN,Fareed Zakaria GPS,website last look next week pope francis something historic issue encyclical second one far powerful letter people world climate change expected great call
CNN,New Day,20 flavor help see splitting along different line important listen policy difference big big another issue hear republican talking climate change listen lindsey graham
CNN,CNN Newsroom With Carol Costello,summit address issue like climate change trade fight isi huge issue summit cnn covering global domestic impact meeting angle colleague chief washington correspondent jake tapper joining
CNN,State of the Union,republican environmental policy republican policy asked question get blank stare environmental policy energy policy president united state going address climate change going find oil gas
CNN,CNN Newsroom With Poppy Harlow,human made climate change right said would work across aisle think history close relationship john mccain joe lieberman democrat lindsey graham running mainstream candidate well
CNN,Wolf,pope upcoming message climate change sort comment reminiscent john f kennedy said take order vatican praised pope strong leader said would take order
CNN,New Day,going impact policy chooses implement domestically think look people feeling today pope two year ago stood said climate change moral responsibility take action said domestically going
CNN,Wolf,reporter move worried conservative seen endorsement liberal agenda climate change population control bad news big business oil first pope developing world pope francis emphasis connection
CNN,CNN Newsroom Live,u move another big story following pope francis taking climate change matter hour fact pontiff release long awaited highly controversial public letter called encyclical document pope
CNN,Fareed Zakaria GPS,relationship prime minister joined g 7 leader set new goal week end fossil fuel usage end century whether mr santorum agrees holiness royal highness climate change agenda pope
CNN,New Day,epa put today take look unmitigated climate change result term impact u take look global action mean term benefit human life property safety
CNN,State of the Union With Jake Tapper,people want realtime response going leisure substance sound bite heard republican sound bite make feel good end day know position immigration climate change big broad
