Station,Show,Snippet
FOXNEWS,Tucker Carlson Tonight,tucker past two decade polar bear ceased near animal talisman living symbol man kind global warming trend
FOXNEWS,Tucker Carlson Tonight,think lot people left think people calling fascist believe global warming
FOXNEWS,Hannity,sean exactly watching learning first new ice age coming world going burn hot cold rain rain stone know banner global warming political
FOXNEWS,The Daily Briefing With Dana Perino,chewing important campaign issue reverend al sharpton kamala harris back february year beto rourke going big climate change floating 5 trillion plan fight global
FOXNEWS,Tucker Carlson Tonight,wheel donald trump whg ultimately talking climate change going take people funded politician represent people bank tucker okay using climate change
FOXNEWS,The Five,discussion climate change global warming kennedy climate change juan element kennedy free college medicare green new deal green new deal
FOXNEWS,Hannity,chinese national crossing near texas rio grande lawrence jones border patrol democrat fuelling insane climate change hysteria
FOXNEWS,Tucker Carlson Tonight,ilhan omar rasheda tlaib co ro khanna handing wheel donald trump ultimately talking solving climate change
FOXNEWS,Fox and Friends First,bremmer say test faith christian law enforcement prevail next doubt cow fart making climate change
FOXNEWS,Fox News  Night With Shannon Bream,wildfire alberta hurricane puerto rico climate change one reason many u forced leave home search safer place live ocasio cortez ally like john kerry praised push climate change action
FOXNEWS,The Story With Martha MacCallum,keep see martha course laughter leak orama martha breaking news president tax return climate change behind
FOXNEWS,Hannity,villain day former secretary state yes loser john kerry win presidency praising congresswoman ocasio cortez effort combat climate change
FOXNEWS,Tucker Carlson Tonight,city like new york 10 year city like new york tucker website 8 9 scientist www google com scientist understand climate change
FOXNEWS,Hannity,existential threat least western democracy nazi germany allow farmer make profit allow continue fair share combating climate change byuf
FOXNEWS,Fox News  Night With Shannon Bream,leave home search safer place live ocasio cortez heather ally like john kerry praid push climate change change
FOXNEWS,Outnumbered,similar ban writing blog post serious effort address climate change must address public land responsible nearly quarter greenhouse gas submission president trump pushed
FOXNEWS,Cavuto Live,socialist country way fan david record green new deal alternate offered called climate change
FOXNEWS,Americas Newsroom With Bill Hemmer and Sandra Smith,world grown economy simultaneously reducing total amount greenhouse gas put since 2007 downward slide amount greenhouse gas put putting le
FOXNEWS,Your World With Neil Cavuto,break kimberly reasonable factor impressed robert mention gaining traction capitol hill know think seek asylum protecting climate change
FOXNEWS,Fox News  Night With Shannon Bream,conservative stance immigration coding ever notice never talk causing people perhaps would forced confront major factor climate change
FOXNEWS,Fox and Friends First,solve wreck economy want come anymore response tweet ocasio cortez said people fleeing home escape climate change
FOXNEWS,Americas Newsroom With Bill Hemmer and Sandra Smith,grow dr siegel city bill story grows day congresswoman ocasio cortez theory behind border crisis blame climate change
FOXNEWS,Americas News HQ,way package arthel also millennial probably get young vote probably let pick head face might greatest security issue time climate change climate
FOXNEWS,The Ingraham Angle,american people laura american people new fox news poll came immigration top issue american 21 know hit pocketbook economy 10 health care 9 climate change sorry beto
FOXNEWS,The Ingraham Angle,american people laura american people new fox news poll came immigration top issue american 21 know hit pocketbook economy 10 health care 9 climate change sorry beto
FOXNEWS,FOX  Friends,immigrant ever noticed never talk causing people flee home first place perhaps would forced confront one major factor fueling global migration climate change brian exactly
FOXNEWS,Special Report With Bret Baier,basically blue cross blue shield would reduced nose job something like peter plan refers nose job coming day find whether medicare support senate climate change
FOXNEWS,The Five,seize problem someone else problem solvable people left right stewart brand world bill gate world believe solve climate change
FOXNEWS,Americas News HQ,big idea hearing progressive trail moderate place think voter looking get thing done think right plan deal climate change
FOXNEWS,Your World With Neil Cavuto,ran democrat absolutely mean say caricature democrat congress talking shoring health care thing gun violence addressing climate change
FOXNEWS,FOX  Friends,even democrat believe starting see seeing even obama era official saying immigration problem pile excuse illegal immigrant coming country due climate change
FOXNEWS,The Story With Martha MacCallum,quality helping people lower rung get get training make successful ticket tearing wealthy martha interesting want play sound bite alexandria ocasio cortez talking climate change
FOXNEWS,Outnumbered Overtime With Harris Faulkner,dealing honestly people telling thing achieved time frame want achieve give credit one thing somebody jump start process congress good lord climate change
FOXNEWS,FOX  Friends,version green new deal price tag whopping 5 trillion expect beto get way weigh morning morano editor climate depot com author politically incorrect guide climate change
FOXNEWS,FOX  Friends,york city steve contributes global warming ainsley talking earth day press conference announced plan fight climate change say want eliminate glass steel skyscraper basically love people fighting back
FOXNEWS,The Daily Briefing With Dana Perino,dana think talking green deal first put sort thing including job guarantee green new deal god send republican party republican need sharpen message climate change
FOXNEWS,The Story With Martha MacCallum,stupid statement martha richard think aoc wave overstating thing think case actually lot truth underlying point trying make look first public united state belief climate change
FOXNEWS,The Story With Martha MacCallum,going go another 30 year think something look kind air quality maybe exception beat greenland iceland beat european country criticizing u climate change
FOXNEWS,The Five,fight something like global warming declare victory one know one keep count winning losing global warming something need fight something even
FOXNEWS,Tucker Carlson Tonight,global warming open boarder drive crisis melissa francis one favorite global warming driving illegal immigration think perfect finally environmental crisis causing war causing bloodshed started last
FOXNEWS,Tucker Carlson Tonight,global warming sin 2017 viral video starving polar bear reached hundred million around world message simple global warming driving polar bear extinction way stop give left total control global
FOXNEWS,Tucker Carlson Tonight,glad going extinct would think people would happy would think would happy turn whole idea could blame polar bear decline global
FOXNEWS,Tucker Carlson Tonight,actually look scientist telling u telling u global warming problem also moderate one tell u end century global warming cost somewhere 2 4 global gdp remember
FOXNEWS,Tucker Carlson Tonight,estimate half million people died around world quadrupled population yet number dropped like stone 95 reduced 20000 people die every year global
FOXNEWS,Tucker Carlson Tonight,top thing came end number 16 16 priority came global warming surprising poor rich well meaning one thing start worrying look global warming real problem
FOXNEWS,Your World With Neil Cavuto,climate change ridiculous statement robert caught box wall break glass come climate change going say climate change main factor
FOXNEWS,Americas Newsroom With Bill Hemmer and Sandra Smith,greenhouse gas emission share emission worldwide u share declining true major industrialized country world need applaud keep nutty idea
FOXNEWS,Hannity,economy reducing absolute level greenhouse gas emission peaked u 6 million ton 2007 5 5 billion pound one india china
FOXNEWS,Tucker Carlson Tonight,net zero greenhouse gas emission year 2050 tucker wait second 2050 keeping track want let know alexandria
FOXNEWS,Tucker Carlson Tonight,ambitious climate plan history united state ensure net zero greenhouse gas emission year 2050 tucker wait second 2050 keeping track
FOXNEWS,Fox and Friends First,migration climate change aoc say u would blood attentive climate change legislation like green new deal past violence central america
FOXNEWS,Hannity,economy reducing level greenhouse gas emission peaked u six million ton 2007 5 5 million ton one india china sean never join u
FOXNEWS,FOX  Friends,announcing ambitious climate plan history united state ensure net zero greenhouse gas emission year 2050 jedediah 2020 democratic presidential candidate beto rourke rolling
FOXNEWS,Fox News  Night With Shannon Bream,climate change every immigrant different reason wanting come across certainly climate change four european professor three country interviewed 3500
FOXNEWS,FOX  Friends,need focused steve made clear climate change top list brian beto rourke rolled climate change plan see 20 plus
FOXNEWS,Tucker Carlson Tonight,becoming extinct threatened extinction back 2007 polar bear raised used icon global warming became
FOXNEWS,Tucker Carlson Tonight,threatened extinction back 2007 polar bear raised used icon global warming tucker right became important
FOXNEWS,Americas Newsroom With Bill Hemmer and Sandra Smith,classic skyscraper contribute making case global warming new york post warning climate crusade could send city back stone age
FOXNEWS,Your World With Neil Cavuto,migration climate change sort conflating illegal immigration immigration making global problem climate change news know green new deal would solve border crisis
FOXNEWS,Your World With Neil Cavuto,due climate change every immigrant come across different reason coming come across climate change ridiculous statement gone point
FOXNEWS,Fox and Friends First,dan crenshaw slamming alexandria ocasio cortez linking border crisis climate change every immigrant different reason wanting come across certainly climate change green new deal going
FOXNEWS,Outnumbered Overtime With Harris Faulkner,voter want look aspirational part green new deal think american democrat would agree anybody got half brain agrees climate
FOXNEWS,FOX Report With Jon Scott,left think people free mistrust people color police reproductive right restricted male politician organize labor cannot fair day pay say marry also climate
FOXNEWS,Hannity,rain snow snow banner global warming based idea man pillaging planet
FOXNEWS,Town Hall America with Harris Faulkner,climate change democrat longer lane care planet requested world care try pay getting involved combating climate change florida
FOXNEWS,Tucker Carlson Tonight,global warming paper argues environmentally conscious stereotypical feminine trait men response assert masculinity destroying environment hog remote
FOXNEWS,The Daily Briefing With Dana Perino,freshness notice week week try febreze plug dana possible global warming democrat facing fire pete buttigieg making stop harlem dining soul food
FOXNEWS,Fox News  Night With Shannon Bream,beto rourke visited yosemite valley announced plan reach net zero carbon emission 2050 overlook idea come 5 trillion price tag paid mostly new tax corporation rich american wait see climate
FOXNEWS,The Five,person one vote jesse dana list concern among american citizen think abolishing electoral college probably global warming dana wrote economy following
FOXNEWS,Special Report With Bret Baier,climate change mitch yeah believe climate change certainly happened ought addressed technology government shut economy cause u lose incredible number job bret speaking shutdown another
FOXNEWS,Tucker Carlson Tonight,bear decline global warming saved career polar bear specialist best interest make sure concept stay public limelight even though lie
FOXNEWS,Tucker Carlson Tonight,tucker wave water tucker okay thank author book cool skeptical environmental guide global warming enjoys u tonight mr lom lomborg thank
FOXNEWS,Tucker Carlson Tonight,acutely sensitive effect global warming turned bear much flexible resourceful given credit one much reason
FOXNEWS,Tucker Carlson Tonight,make uncomfortable economist actually look scientist telling u global warming problem also moderate one end century
FOXNEWS,Your World With Neil Cavuto,ocasio cortez claim climate change causing crisis border take listen clear taking seriously number speak due climate change every immigrant come across different reason coming across
FOXNEWS,FOX  Friends,climate change second green new deal green new scam must stay away know worried climate change needed talk mother nature right earth rotating 1000 mile per hour
FOXNEWS,Fox News  Night With Shannon Bream,really think anyone talking black voter talking climate change understand talking climate change way impact black community lead poisoning happened flint michigan talk economy
FOXNEWS,FOX  Friends,war ii end day economy suffering pay todd agree sentiment big deal climate change world war ii little 400000 killed climate change killing 150000 people
FOXNEWS,Tucker Carlson Tonight,concerned global warming patriarch call hosted town hall event alexandria ocasio cortez designed promote green new deal apparently seemed like wise idea executive msnbc
FOXNEWS,The Ingraham Angle,president reading apostle creed believe god california jerry brown said trump global warming therefore fear god wrath
FOXNEWS,The Ingraham Angle,apostle creed believe god california jerry brown said trump global warming therefore fear god wrath god laura new
FOXNEWS,Tucker Carlson Tonight,global warming patriarchal system control hosted town hall event alexandria ocasio cortez designed promote green new deal apparently seems like wise idea executive
FOXNEWS,Tucker Carlson Tonight,opportunity technology thing make much richer 12100 come around better able tackle global warming challenge alzheimer cancer
FOXNEWS,The Story With Martha MacCallum,making music alien think many people think global warming real thing stupid ed lady night take hollywood next
FOXNEWS,Tucker Carlson Tonight,global warming driving illegal immigration think perfect finally environmental crisis causing war causing bloodshed started last minute straight started secretary state
FOXNEWS,Tucker Carlson Tonight,starving polar bear video reached hundred around world global warming driving polar bear distinction way stop give left total control global economy turn polar bear dying
FOXNEWS,Tucker Carlson Tonight,one thing happened back 2007 told polar bear acutely sensitive effect global warming turned bear much flexible resourceful given
FOXNEWS,Tucker Carlson Tonight,focus told u perhaps surprisingly worry health care food education top thing came end number 16 global warming nott surprisingly
FOXNEWS,Tucker Carlson Tonight,global warming cost somewhere 2 4 global gdp ten time richer per person 1000 richer pay 2 4 problem end world
FOXNEWS,The Story With Martha MacCallum,balloon really racked lot win try fight global warming think platform tried get rid skyscraper air travel amazon job cave man going backwards
FOXNEWS,The Five,global warming constitutional crisis every turn social medium aspect one go outdoors anymore go outside walk waterfall something like see rainbow yoga drink take girl
FOXNEWS,Americas News HQ,say plenty room need someone like among voter think voter looking actually get thing done right care deeply climate change right plan deal climate change think incredibly important every american health care country
FOXNEWS,Fox and Friends First,climate change fuel global migration tweet say far right love drum resistance immigrant noticed never talk causing people flee home first place forced confront one major factor fueling global migration climate change stage difficult one
FOXNEWS,Tucker Carlson Tonight,next tucker congresswoman alexandria ocasio cortez say government given power fight global warming disagree even hesitate integrating immediately complicit murderer think laid
FOXNEWS,Tucker Carlson Tonight,number dropped like stone 95 reduced 20000 people die every year global warming simply getting richer mean stop trouble weather bad
FOXNEWS,Tucker Carlson Tonight,2100 come around better able tackle global warming also challenge alzheimer cancer problem talking tucker man talk science fluent term
FOXNEWS,Tucker Carlson Tonight,tucker bad running adjective blame world ending cataclysm well new research paper answer going surprised toxic masculinity causing global warming paper argues
FOXNEWS,Tucker Carlson Tonight,rich well meaning one thing start worrying global warming real problem anywhere near size people lead believe tucker maybe easy problem richest
FOXNEWS,Americas Newsroom With Bill Hemmer and Sandra Smith,bill think make case phantom move market support green new deal correct medicare hearing today house waiting support carbon tax support free drastically
FOXNEWS,Hannity,know climate change qh come back tire exchange congress
FOXNEWS,Hannity,coalition going probably defeat cause civil war democratic party love hate scared global warming point sean someone came street said going die 12 year unless
FOXNEWS,Charles Krauthammer Making His Point,bearing 110000 signature delivered washington post demanding band article questioning global warming petition arrived day publication column consisted precisely heresy column ran usual gratified show
FOXNEWS,Charles Krauthammer Making His Point,thought police patrol april 11 2014 two month ago petition bearing 110000 signature delivered washington post demanding band article questioning global warming petition arrived day publication column consisted precisely
FOXNEWS,Fox News  Night With Shannon Bream,john delaney represents fact wide view congressman delaney come green new deal instead need carbon tax come saying need universal health care instead getting rid private insurance plan keep private insurance
FOXNEWS,Outnumbered Overtime With Harris Faulkner,global warming see every day weather pattern much different kid trouble got something get discussion going give great deal credit real plan
FOXNEWS,The Five,dana another 2020 candidate putting massive climate change proposal tune 5 trillion fill next
FOXNEWS,Americas Newsroom With Bill Hemmer and Sandra Smith,technology need solve global warming issue give lot work kind fun enjoy watching hope stay congress long time sandra stage said embracing somebody lot energy
FOXNEWS,Fox and Friends First,cortez solve immigration crisis trying tie climate change explain coming action booker
FOXNEWS,Hannity,insane climate change legislation watch think neglecting address threat could contribute loss american life yes
FOXNEWS,Watters World,interesting freshman saying advocate believe need address climate change legal organization
FOXNEWS,Fox and Friends First,candidate since richard nixon well climate change causing heated debate iowa town hall harris faulkner kayleigh mcenany
FOXNEWS,Fox and Friends First,world care china get involved climate change real look heather least 12 democratic presidential candidate support green new
FOXNEWS,Watters World,interesting freshman saying advocate believe need address climate change legal organization
FOXNEWS,Watters World,interesting freshman saying advocate believe need address climate change legal organization
FOXNEWS,Fox and Friends First,speaking going viral alexandria ocasio cortez likens climate change fought civil right take listen people hide fact
FOXNEWS,Americas Newsroom With Bill Hemmer and Sandra Smith,denial assault climate climate crisis health issue national security issue economic job issue moral issue pas planet onto next generation responsible way
FOXNEWS,Hannity,congresswoman alexandria oocasio cortez tez climate change hysteria yesterday suggested u would quote blood hand pas
FOXNEWS,Fox News  Night With Shannon Bream,certainly climate change late last year four european professor three country interviewed 3500 grant worldwide study published washington post concluded climate induced
FOXNEWS,The Greg Gutfeld Show,image 25 different camera cannot image think totally made greg wonder climate change fault laughter
FOXNEWS,The Greg Gutfeld Show,image 25 different camera cannot image think totally made greg wonder climate change fault
FOXNEWS,The Greg Gutfeld Show,image 25 different camera cannot image think totally made greg wonder climate change fault laughter
FOXNEWS,The Greg Gutfeld Show,image 25 different camera cannot image think totally made greg wonder climate change fault laughter
FOXNEWS,Town Hall America with Harris Faulkner,interested essential threat climate change bringing harris kaylee take first big problem global issue china mentioned
FOXNEWS,Hannity,given congresswoman compared climate change world war ii 9 11 hurricane katrina action karl rove fox news contributor let start
FOXNEWS,Fox News  Night With Shannon Bream,climate change lot people trying leave country come country illegally say people fleeing country
FOXNEWS,Hannity,praising congresswoman ocasio cortez effort combat climate change plan abolish fossil fuel car plane cow take look congresswoman ocasio cortez
FOXNEWS,The Story With Martha MacCallum,flefleetheir home first place would confront one major factor fueling global migration climate change link voidio watch wildfire alberta
FOXNEWS,Hannity,suggesting u would blood hand pas insane climate change legislation watch think neglecting address threat
FOXNEWS,Fox and Friends First,climate change real reason victor davis hanson senior fellow tube institution new crop democrat stand out pushing identity politics next level
FOXNEWS,The Story With Martha MacCallum,let play one thing cannot rebuke one thing cannot deny climate change problem market failure extra naltiess
FOXNEWS,FOX  Friends,curvy couch pete climate change religion end totally ridiculous thing ainsley religion pete apparently
FOXNEWS,Tucker Carlson Tonight,perfect reminder climate change essentially boutique issue almost like accessory western liberal politician flaunt much care actually nothing
FOXNEWS,Americas News HQ,climate protest started last month part shut part great britain capital urging british government make fighting climate change top priority
FOXNEWS,Fox News  Night With Shannon Bream,saying need carbon tax saying need universal healthcare instead getting rid private insurance plane keep private insurance big party democrat want thing certainly moderate like congressman trying offer different perspective show interesting conversation never 20 people mix issue joe biden
FOXNEWS,Fox News  Night With Shannon Bream,congresswoman alexandria ocasio cortez say climate change major factor illegal immigration crisis sign green new deal big part problem
FOXNEWS,Fox and Friends Sunday,assange arrested thursday ecuadorian president withdrew asylum president east african nation speaks climate change 400 foot water watch
FOXNEWS,Watters World,canada believe forcing people leave home climate change many issue know global perspective regional perspective jesse thinking
FOXNEWS,The Daily Briefing With Dana Perino,dana good line ty wonder think republican missing anything green new deal missing climate change real republican party even going
FOXNEWS,FOX  Friends,stop climate change getting rid skyscraper course going ban classic glass steel skyscraper pete happen empire state building building
FOXNEWS,Fox and Friends First,doubt cow fart making climate change socialism short social medium know jillian bind sized impersonator going viral introduce little
FOXNEWS,Fox News  Night With Shannon Bream,arrested mass climate change protest big apple become green apple new plan bill diblasio say city may ban steel glass skyscraper
FOXNEWS,Fox News  Night With Shannon Bream,adding 1 surcharge diner bill say help fight climate change supporting environmentally friendly practice one prominent owner month adding shopping organic
FOXNEWS,Americas Newsroom With Bill Hemmer and Sandra Smith,big issue climate change jon bernie espouses young people love much idea equality socialism embraced medicare free student
FOXNEWS,Your World With Neil Cavuto,factor asylum process well going get defend aoc often republican take issue climate change seriously accepting
FOXNEWS,The Five,perhaps forced confront one major factor global migration climate change aoc climate hysteria end also said think laid
FOXNEWS,Hannity,fueling yes insane climate change hysteria 94 trillion think going green new dea deal robert francis beto bozo rourke actually telling american farmer
FOXNEWS,FOX Report With Jon Scott,democratic presidential candidate cory booker booker launching two week cross country justice tour fighting nra climate change criminal justice reform among theme bryan llenas live
FOXNEWS,Watters World,canada believe forcing people leave home climate change many issue know looking global perspective regional perspective
FOXNEWS,FOX Report With Jon Scott,democratic presidential candidate cory booker booker launching two week cross country justice tour fighting nra climate change criminal justice reform among theme bryan llenas live
FOXNEWS,Fox and Friends First,proposal combat climate change president speaking national congressional republican committee dinner green new deal done young bartender 29 year ago first time heard
FOXNEWS,Hannity,taking bold action climate change sean congressman previously told u might stop kid altogether worried grand kid little confused
