Station,Show,Snippet
FOXNEWS,The OReilly Factor,year shows slight rise temperature planet earth right good serious climatologist concerned man going make worse greenhouse gas production even certain hear left
FOXNEWS,Stossel,agree atmosphere used 250 parts per million 4 million greenhouse gas ice ages 200 8000 parts per million similar temperatures 20 times co2 levels
FOXNEWS,The OReilly Factor,worldwide temperatures every year shows slight rise temperature planet earth right good serious climatologist concerned man going make worse greenhouse gas production even certain
FOXNEWS,The Five,global warming habitat look cute come almost buddy going backwards play eye tiger focus right yelling
FOXNEWS,Hannity,signing global warming petition coldest day 20 years great great american panel react straight ahead male announcer different eating
FOXNEWS,Happening Now,extracted situation bit tired researchers studying global warming lot talk tractors saying
FOXNEWS,Stossel,whether gore like global warming matter already pay win war happy ending search show tonight
FOXNEWS,Stossel,terrible tornadoes oklahoma horrible carbon could cost us planet senator barbara boxer day oklahoma tornadoes global warming going cost us planet
FOXNEWS,Stossel,pollution global warming even within sight empire state building short distance millions people flushing willing low prices
FOXNEWS,Stossel,many rules need micro management epa needless let chill global warming free people create better world
FOXNEWS,The Five,comes global warming problem exciting enough problem watched many people left doctors engineers
FOXNEWS,The Five,trapped old ice iceberg broke ages less ice proves global warming ice say antarctica ice
FOXNEWS,The Five,cause bob says global warming definitely quer media get story unless push panic pushing panic fair
FOXNEWS,Stossel,even believe theory man caused global warming seems ludicrous john keystone pipeline actors made short film makes seem like
FOXNEWS,Red Eye,case point climate cheech says communist tops fighting global warming claims america political differences prevents passing laws fight rising temperatures commie china
FOXNEWS,On the Record With Greta Van Susteren,night red eye coming red eye extreme pogo sticking evidence suggesting pudding sport could responsible global warming president people working
FOXNEWS,Red Eye,night red eye coming red eye extreme pogo sticking evidence suggesting pudding sport could responsible global warming president people working
FOXNEWS,Forbes on FOX,dollars wrong forecasts steal line steve forbes global warming massive human delusion left wing hubris worst solyndra would booming today
FOXNEWS,The Five,add back work force unemployment rate would well 11 argument like global warming jobs come back
FOXNEWS,Stossel,john stossel titled program chill researched global warming scare conclusion ought chill government chilling
FOXNEWS,Stossel,yes years told viewers beware call global warming globe getting warm something careful otherwise things could get
FOXNEWS,The OReilly Factor,thursday evening fox business channel john stossel analyze global warming controversy headline show say
FOXNEWS,The OReilly Factor,temperatures record flooding super storm sandy right thursday evening fox business channel john stossel analyze global warming controversy
FOXNEWS,Stossel,prevent tornadoes witchcraft john deceives every time tuesday extreme cause man made global warming tomorrow face normal temperatures global change
FOXNEWS,Stossel,money want government grant get global warming go government fund anything sun predominant
FOXNEWS,Stossel,prevent tornadoes witchcraft john deceives every time tuesday extreme cause man made global warming tomorrow face normal temperatures global change
FOXNEWS,Stossel,knowledge fielded questions skeptical reporters many claims movie example world best scientists unanimous must act global warming 3000 scientist
FOXNEWS,Stossel,money want government grant get global warming go government fund anything sun predominant
FOXNEWS,FOX and Friends First,whatsoever romney son wife adopted little boy lahrs fast fall talk inconvenient truth al gore showing price book global warming prices melted
FOXNEWS,The Journal Editorial Report,young kim korea troubling predict castros fall year say optimist bring us earth please global warming think
FOXNEWS,Hannity,northeast get gear ready frigid temperatures expected tomorrow wonder global warming alarmists say explosive allegation rocking nfl former vikings player says
FOXNEWS,Hannity,test snow totals double digits temperatures eastern half america shatter decades old records get global warming scientologist removed
FOXNEWS,The Five,iceberg broke ages less ice proves global warming ice say antarctica ice lessening 1992 98
FOXNEWS,Americas Newsroom,success another snag ironically researching global warming got stuck ice christmas eve amy kellogg london tell us latest setbacks
FOXNEWS,FOX and Friends,going talk inconvenient truth big trouble former vice president al gore book global warming crisis could answer new year fitness resolution
FOXNEWS,Hannity,see get 7 billion tax dollars global warming alarmist want head antarctica prove ice melt
FOXNEWS,Stossel,would elected president want build coal power plant bankrupt going charged huge sum greenhouse gas ee meted happened
FOXNEWS,The OReilly Factor,believe yaghtd take n express oxygen blowing greenhouse gas punishing american taxpayer federal government know across pacific ocean whatever going offset
FOXNEWS,The OReilly Factor,believe yaghtd take n express oxygen blowing greenhouse gas punishing american taxpayer federal government know across pacific ocean whatever going offset
FOXNEWS,FOX and Friends,prove needs wheelchair believe abbott fires back next man says created internet way fight global warming al gore calling fertility
FOXNEWS,Happening Now,global warming stuck ice saying ice old ice broke free tip antarctica rescue operation expensive complicated
FOXNEWS,Americas News Headquarters,42 believe effects kick future point never similar share americans 41 believe seriousness global warming exaggerate bid media saying seriousness
FOXNEWS,Hannity,2010 warmest year record right australia breaking kinds heat records 122 degree day always global warming al gore warm getting
FOXNEWS,Special Report With Bret Baier,1 trillion told needed 2030 order keep global warming reaching dangerous threshold worldwide investment green technology currently 300 billion year
FOXNEWS,Stossel,stop global warming promising people free stuff got free golf cart totally free well free taxpayers pay comes good nutrition expert
FOXNEWS,The Five,global warming think racism piece shuts discussion called racist really hurtful actually disagree nationalization health care called racist
FOXNEWS,The OReilly Factor,combat global warming may know americans even believe taking place left driving debate scientific consensus absolutely clear debatable
FOXNEWS,Hannity,hannity continue great great american panel white house spending money global warming always want indoctrinated watch hearing
FOXNEWS,Hannity,many millions spent solyndra key stone pipeline spent 4 7 billion countries help global warming maybe poor people america could use 7 45
FOXNEWS,Your World With Neil Cavuto,seeing warmer winters remember told global warming encompasses manifestations dismiss fact global temperatures risen debate whether man sole
FOXNEWS,FOX and Friends,america right come going ask biggest problem well inequality global warming feel toes right perfect example
FOXNEWS,Stossel,view think asking president says stop global warming agree president worldwatch institute need subsidies
FOXNEWS,Forbes on FOX,reduce greenhouse gas pollution 17 2020 one things may executive order conceited think good way create policy things especially energy domain president could use
FOXNEWS,Special Report With Bret Baier,term flash frozen norway pushed u n reforms address global warming days ago got cold fash fish frozen place norwegian broadcasting
FOXNEWS,Red Eye,tripped uh attributed communism communism good terms global warming fewer humans eat cattle less methane really think
FOXNEWS,FOX and Friends,normal nuts dr keith ablow diagnosis john stossel jumping river message spending dollars combat global warming waste coming
FOXNEWS,FOX and Friends First,rules religious apparel troops wear uniform meaning turbans beards allowed good idea yes going pay billions global warming exactly
FOXNEWS,Your World With Neil Cavuto,single digit temps rule mission much next week global warming going push fixing pick whichs could weather conditions say
FOXNEWS,Your World With Neil Cavuto,weather saying increase crime prostitution trying throw everytng mix saying get worse global warming academics real study ceased become
FOXNEWS,Cashin In,say global warming changing called weather go ahead talk stay thepedia whether lawmakers general petitioning media story agenda would rather
FOXNEWS,FOX and Friends,global warming 2014 red blue literally split middle think disparity rich poor continues instead taking really wealthy
FOXNEWS,Hannity,like bringing things people believe global warming thanks watching cold weather throughout country going cold
FOXNEWS,The OReilly Factor,okay critical point see need america gateway drug cherry picking like global warming studies show opposite
FOXNEWS,Hannity,come back weighing latest rant later propaganda global warming weighing hannity continues tonight open ambition open boldids n york new plan
FOXNEWS,FOX and Friends,francisco wants put stickers gas pumps remind people filling car lead wait global warming group says proposed stickers similar putting warning labels tobacco products
FOXNEWS,The Five,al gore wedged man hole thankful rescued negligented say scientists study global warming ship got stuck ice middle
FOXNEWS,Hannity,supposed 0 let preet high 0 degrees reported could coldest game history nfl hard time understanding global warming alarmists still
FOXNEWS,The Five,date mention mission fit story worries stuck ship still proved global warming experts say trapped old ice
FOXNEWS,Hannity,20 years stop americans signing global warming petition want hear log special companion site happenty com much join us twitter
FOXNEWS,Hannity,pipeline spent 4 7 billion countries help global warming maybe poor people america could use 7 45 billion coats horrible clash science politics
FOXNEWS,Hannity,new political correctness damaging damaging come back youtube video tax dollars spent global warming propaganda video coming break
FOXNEWS,Hannity,billion coats horrible clash science politics need leave scientists course understand global warming issue affecting citizen lives
FOXNEWS,The Five,oh take steps global warming away habitat comes cute come almost buddy going backwards play eye tiger focus
FOXNEWS,The Five,issue nobody really answer question dana nobody answer question know answer yes answer cliempt change yes global warming yes money yes
FOXNEWS,The OReilly Factor,like global warming studies show opposite neutralizing get one study get another forget studies forget studies juncture
FOXNEWS,The Kelly File,political activities put billboard saying global warming death time congress considering new taxes carbon emission political speech
FOXNEWS,The OReilly Factor,spiny moray eel give one global warming world america world going end july 211st going start back july 22nd paying gutfeld
FOXNEWS,Hannity,coldest game history nfl hard time understanding global warming alarmists still trying push radical position alas found one joining mr dan weiss
FOXNEWS,Stossel,expensive get billions subsidies view think asking president says stop global warming agree president
FOXNEWS,The Kelly File,said global warming death time congress considering new taxes carbon emission political speech well point conservative groups talking
FOXNEWS,Stossel,followers others celebrity like george clooney recently spouted global warming says something goats global unlike noncelebrity get word quite
FOXNEWS,The Journal Editorial Report,castros fidel raul paul year crazy crazy optimist bring us earth dan please may like one global warming phrase familiar think
FOXNEWS,Hannity,wrong lot scientists made lot phony data explain 7 billion spent countries global warming find astonishing shawn total hypocrisy
FOXNEWS,The Five,passengers keep world date mention mission fit story worries stuck ship still proved global warming experts say
FOXNEWS,Hannity,like cold temperatures snow like global warming scientists geth stuck arctic cold say okay cold getting colder well first thank scientists
FOXNEWS,Hannity,snow totals double digits temperatures eastern half america shatter decades old records get global warming scientologist removed frozen vehicle days trapped
FOXNEWS,Hannity,poetic justice still us great american panel k g tell wrote love tell us temperatures read guy global warming science guy trapped car
FOXNEWS,The Five,thankful rescued negligented say scientists study global warming ship got stuck ice middle blizzard tour
FOXNEWS,The Five,see b block cold turn global warming switch would wish right want see braving cold home
FOXNEWS,Hannity,happy new year happy new year get low temperatures favorite story got bunch global warming alarmists want head antarctica prove ice
FOXNEWS,Hannity,republicans heartless cruel yeah heartless cruel end left wing lunatic goes blame cold weather cold weather nothing else global warming analysis
FOXNEWS,Hannity,republicans heartless cruel yeah heartless cruel end left wing lunatic goes blame cold weather cold weather nothing else global warming analysis
FOXNEWS,Stossel,entire premise united nations tweet commissions alter weather patterns barbara boxer actually went floor applied carbon tax thinking would help
FOXNEWS,Stossel,entire premise united nations tweet commissions alter weather patterns barbara boxer actually went floor applied carbon tax thinking would help
FOXNEWS,State of the Union 2014,recap second term agenda calling action climate change health care plan wrap ups special report thank watching special report bret baier washington
FOXNEWS,The Kelly File,debate settled climate change fact thoughts karl depends means
FOXNEWS,The Kelly File,debate settled climate change fact thoughts karl depends means
FOXNEWS,Hannity,dental care get right got go thank us coming next tonight right hannity global warming least hear
FOXNEWS,Hannity,expressw sparring every day got see wonderful see break room oh course never worked okay clueless ameri n americans signing global warming petition coldest
FOXNEWS,FOX and Friends,scrapping movie wants hunt whoever leaked take johnny elisabeth thank battle global warming costing according new report u government spend
FOXNEWS,Your World With Neil Cavuto,global lyric united states problem fancy way saying global warming least 15 years arguing hundredels degree silly argument
FOXNEWS,Cavuto on Business,company report united nations saying rich nations fuel close global warming argument producing gdz developing country compounding sins charles payne think means blaming pos
FOXNEWS,Your World With Neil Cavuto,recuduceing size government also believed global warming things tea party fiscally responsible issues problem quite bluntly lot us enjoying watching
FOXNEWS,Hannity,always want indoctrinated watch hearing extreme cold spells like one united states disproves global warming believe believe odds
FOXNEWS,Hannity,expect result global warming see pattern extreme cold mid latitudes extreme warmth far north sorry hoax believe fix data
FOXNEWS,Forbes on FOX,resolutions though massive snowstorms record low temperatures global warming scientists save us male announr story lile room pizza place 315 cnut street modest first floor bedroom talln tonia
FOXNEWS,Forbes on FOX,final forbess new year resolution rescue tax dollars resolve put global warming agenda ice large swath nation thaws brutal temperatures report showing first time 20 years
FOXNEWS,The Five,put emphasis scientists believe global warming scientists said normal fluctuations temperature story reason get billions upon
FOXNEWS,Hannity,dental care get right got go thank us coming next tonight right hannity global warming least hear
FOXNEWS,Hannity,sparring every day got see wonderful see break room oh course never worked okay clueless ameri n americans signing global warming petition coldest day 20 years
FOXNEWS,The Five,global warming think racism piece shuts discussion called racist really hurtful actually disagree nationalization health care called racist tend maybe keep
FOXNEWS,Cavuto on Business,network hear speech watching anything else wake right next next forgive week snowstorm bundle latest snow job global warming united nations guess
FOXNEWS,Stossel,pay billions try fix global warming year hill washington newspaper covers congress says climate political battle 2014 big money spent convince americans
FOXNEWS,Stossel,insulting see skeptical scientists like tobacco temperatures height arrogance look actual data global warming scientists government grants foundation media empowerments full advantage government money foundation
FOXNEWS,Stossel,driving global warming put cart horse many u n scientists turned swedish scientist said notice warming 20th century modern hockey stick
FOXNEWS,Stossel,think subsidies scam need oh help global warming robert say need subsidies might better ways accomplishing president obama trying given
FOXNEWS,The OReilly Factor,true assuming man nothing let walk truth global warming climate changes always always know globe warming last 15 years
FOXNEWS,The Five,answer question issue nobody really answer question dana nobody answer question know answer yes answer cliempt change yes global warming yes money
FOXNEWS,Hannity,69 year 67 like bringing things people believe global warming thanks watching cold weather throughout country going cold
FOXNEWS,Stossel,find politicians pretend stop global warming got free golf cart announcer story dusty basement 06 35th street old dining table 25th hoffman
FOXNEWS,The Five,amount sense today may first time global warming debate think two got dressed together morning red white sweater like times watch
FOXNEWS,The Five,block cold turn global warming switch would wish right right want see braving cold home tweet us best polar vortex snapshots thefive
FOXNEWS,Hannity,admit pretty funny global warming people got stuck ice well quite work way think sean problem changing climate
FOXNEWS,Hannity,lot scientists made lot phoney data dana explain 7 billion spent countries global warming well would love know answer well find astonishing
FOXNEWS,Hannity,made facts scientists actually lie us got admit global warming people got stuck ice well quite work way think shawn problem
FOXNEWS,The Five,global warming right helicopters answer going planting trees elsewhere set carbon footprint rescue helicopter joke believe carbon
FOXNEWS,The Five,obvious obvious thing 15 pounds right one magazine fall fashion kidding think global warming effects talking let ask know big strong
FOXNEWS,Forbes on FOX,fracking less explain yes frack away fair federal government block people getting cheaper heating beyond think insert common sense climate debate global warming really
FOXNEWS,Stossel,carbon tax would help prevent future foreitornado breaks medieval witchcraft every time weather extreme say cause man made global rm aing tomorrow morning 90 percent country face normal temperatures
FOXNEWS,Hannity,referencing wow say obamacare front nancy pelosi show rest remarks well know today cold global warming frozen good grief make
FOXNEWS,Red Eye,communism related 100 million deaths 20th century anything wrong 65 million china alone global warming important beauty unlimited power state lot things
FOXNEWS,FOX and Friends First,important global warming feel toes right perfect example guy mo means right thing heart right place schemer
FOXNEWS,Americas News Headquarters,overcome republicans want work democrats want work unpopular issues president said would tackling second term global warming gun control
FOXNEWS,FOX and Friends,coming man says created internet way fight global warming al gore calling get fertility management moon meat loaf something say study saying wives
FOXNEWS,The Kelly File,allowed fewer fewer tea party groups going able engage political activity put billboard said global warming death time congress considering new taxes carbon
FOXNEWS,The OReilly Factor,headline show say true assuming man nothing let walk truth global warming climate changes always always know globe
FOXNEWS,The Kelly File,allowed fewer fewer tea party groups going able engage political activity put billboard said global warming death time congress considering new taxes carbon
FOXNEWS,The OReilly Factor,pot global warming going kill freezing death might start smoking joint polar bears penguins know yeah listen life tough wear cup right pot know worried
FOXNEWS,The Five,years put emphasis scientists believe global warming scientists said normaltions temperature story reason get billions upon
FOXNEWS,Forbes on FOX,record low temperatures record highs u last year see scientists looking document melting ice antarctic getting stuck massive ice steve time put global warming hysteria ice
FOXNEWS,Hannity,favorably affected increase minimum wanl thank much coming live northeast get gear ready frigid temperatures expected tomorrow wonder global warming alarmists say
FOXNEWS,The Five,get happy saved helicopters adding global warming right helicopters answer going planting trees elsewhere set
FOXNEWS,FOX and Friends,21 minutes top hour next talk inconvenient truth big trouble former vice president al gore book global warming recognize voice world one man heard radio tv
FOXNEWS,FOX and Friends Saturday,global warming blaming money make cost freedom w hear beat campbell healthy request soup lets hear heart basketball bouncing heart healthy great taste tapping sounds good campbell healthy request
FOXNEWS,Stossel,people making tons money want get government grant blabl global warming get government grant government going fund things says sun found
FOXNEWS,Stossel,every week years know whether global warming threat possibly crushed economy soup regulation invent good enough technology something
FOXNEWS,FOX and Friends,skip process 37 states already offer keep posted al gore story al gore suggesting fertility management key fight global warming promote economic development poor countries world economic forum
FOXNEWS,Special Report With Bret Baier,consider impact global warming part decision build pipeline though report suggests without sharp decline price oil increase cost transporting canadian oil likely extracted one
FOXNEWS,Hannity,damaging come back youtube video tax dollars spent global warming propaganda video coming break also tonight maybe word welfare changed something
FOXNEWS,The OReilly Factor,temperature freezing going start pot global warming going kill freezing death might start smoking joint polar bears penguins know yeah listen life tough
FOXNEWS,Hannity,reported could coldest game history nfl hard time understanding global warming alarmists still trying push radical position alas found one joining mr dan weiss
FOXNEWS,Americas Newsroom,bill investigating global warming stuck longer time thought home least two weeks told patti ann keeping good spirits hardy crew bill singing carols one democrat plan party
FOXNEWS,FOX and Friends,coal coal big business china redoing factories longer competitive environmentally certain way whole global warming hoax one great things notice call
FOXNEWS,FOX and Friends,impulse controls make people smarter talk inconvenient truth former vice president al gore picture circulating twitter shows price book called global warming crisis melted
FOXNEWS,The Five,going 2100 years whole global warming thing going affect even carbon emitting dioxide emitting manmade much
FOXNEWS,The Five,forces keep reading listening credible scientists say want proven wrong makes position stronger everybody skeptical global warming activists want proven wrong
FOXNEWS,The Five,lose credibility think greg made enormous amount sense may first time global warming debate think got dressed together morning sweater like agree
FOXNEWS,Hannity,good speak get cold air masses come whole change game however things start add like cold temperatures snow like global warming scientists geth stuck arctic
FOXNEWS,The OReilly Factor,environmental activist believe fossil fuels causing global warming switch energy sources throughout world also executive producer documentary called greedy lying bastards basically attacks fossil fuel industry want know though
FOXNEWS,Stossel,things poujd r poumare pointless act climate change make measurable difference
FOXNEWS,Stossel,government funded advertisement act climate change allow make difference retirement live chivas
FOXNEWS,Stossel,government funded advertisement act climate change allow make difference retirement live chivas
FOXNEWS,Special Report With Bret Baier,area ethnic fighting continues preliminary peace talks began today australian ice breaker carrying climate change scientists stranded antarctica told
FOXNEWS,Justice With Judge Jeanine,try snapshot today pressure good night cold blood killer climate change said
FOXNEWS,Stossel,dead moment hear bill swearing climate change first let set terms people say
FOXNEWS,Stossel,dead moment hear bill swearing climate change first let set terms people say
FOXNEWS,Americas News Headquarters,several weeks australian ice breaker makes ice breaker studying climate change claim
FOXNEWS,Hannity,dollars used study climate change countries emotional times peacock network yet another called journalist offers
FOXNEWS,The Five,misogyny usually people cherry pick results thing correlation cause cause b b happened time could blame global warming guess abortion want allow allow abortion
