Station,Show,Snippet
FOXNEWS,The Five,democratic senators election purple states nervous going global warming arguably coldest day seen long time issues like obamacare want talk policy failure time
FOXNEWS,Cashin In,turn msnbc cnn every day talking global warming november coincidence every day viewer ship gets smaller smaller miles per hours tired hearing americans tired hearing liberals like jaumu
FOXNEWS,The OReilly Factor,difficult humanly possible ever went south butt would first one private plane getting money switzerland plenty ahead factor moves along evening stossel global warming much spending
FOXNEWS,The Kelly File,toll cold make fun global warming people talking talking guns abortion catholics already coming saying mean mother teresa lived new york state
FOXNEWS,The Kelly File,new york conservation voters education fund walk around cam toll cold make fun global warming people talking talking guns abortion catholics already coming saying mean
FOXNEWS,The Five,real scientists want proven wrong look stuff proves assumption scary part global warming activism said science would settle scientist ever said want wrong want prove wrong
FOXNEWS,The Five,forces reading listening real scientists say want proven wrong makes position stronger everybody skeptical global warming activists want proven wrong think reach
FOXNEWS,The Five,agreement except one thing ask lots scientists believe global warming real scientists bona fide scientists think perpetuating scam think think became ideology think legitimate
FOXNEWS,The Five,midpoint real scientists want proven wrong look stuff proves assumption scary part global warming activism said science settled scientist ever says want wrong want prove wrong
FOXNEWS,Red Eye,unemployment severe income disparity failure climate change mitigation adaptation extreme weather events profound social instability world economic forum missed several looming
FOXNEWS,On the Record With Greta Van Susteren,talking climate change devoted three sentences 45 words economy one sentence 19 words deficit reduction 155 words sphwittlements
FOXNEWS,Hannity,addressing climate change costing americans lots money know warm ocean thousands years ago techniques carbon
FOXNEWS,Hannity,ocean warmest thousands years addressing climate change costing americans lots money know warm
FOXNEWS,The Kelly File,kennedy good night cold blood killer climate change said need act
FOXNEWS,FOX and Friends First,president address recap second term agenda calling action climate change health care plan wrap ups
FOXNEWS,State of the Union 2014,recap second term agenda calling action climate change health care plan wrap ups president obama touting 29th
FOXNEWS,Stossel,good night cold blood killer climate change said need act dramatic weather
FOXNEWS,Red Eye,unemployment severe income disparity failure climate change mitigation adaptation extreme weather events profound social instability world economic forum missed several looming
FOXNEWS,Hannity,hard earned tax dollars used study climate change countries one things emotional times peacock network another
FOXNEWS,Hannity,addressing climate change costing americans lots money know warm ocean thousands years ago techniques carbon
FOXNEWS,Stossel,celebrity hy climate change causing see levels rise happen lifetime lusby demand readers invest green technology
FOXNEWS,The OReilly Factor,plenty ahead factor moves along evening stossel global warming much spending combat police southern california give justin bieber pop star big break illegal drugs house legal investigating hope stay tuned
FOXNEWS,The Five,warming debate reverse global warming liberals say really bad trust us stats back trust us gun debate stats want trust stats cases
FOXNEWS,The Five,think reach agreement except one thing ask lots lots scientists believe global warming right real scientists bona fide scientists think perpetuating scam mean think think became
FOXNEWS,The Five,times watch certainly people talk like charlie rose global warming say makes scientist read data see much conflicting data new york times saying numbers kind funny stuff think public believes
FOXNEWS,The Kelly File,cheers remarks vets women drew skepticism discussing climate change unemployment picture begin real americans outside beltway
FOXNEWS,The Kelly File,cheers remarks vets women drew skepticism discussing climate change unemployment picture begin real americans outside beltway
FOXNEWS,Cashin In,look kim kardashian fake boob osar change boobs climate change fake science agree jehmu kim kardashian enough
FOXNEWS,Stossel,good night cold blood killer climate change said need act dramatic weather fault
FOXNEWS,Hannity,studies 7 billion b wasted climate change studies countries make administration willingness waste money
FOXNEWS,Hannity,climate change sudden comes hey cold obviously chris look years patterns
FOXNEWS,Hannity,climate change sudden comes hey cold obviously chris look years patterns
FOXNEWS,Cashin In,climate change stories government tell tv network news chilling censorship private viewers writing fox news com
FOXNEWS,Hannity,oochl think scientists wacky nice boats well equiped got ten seconds well climate change rule cold
FOXNEWS,Hannity,much money would turning important note climate change measured every decade zeros warmer 90s 90s warmer 80s
FOXNEWS,FOX and Friends,havana talks touched climate change troubles syria nuclear proliferation former president jimmy carter heading new book women rights call action women
FOXNEWS,Red Eye,changed climate change dot liberals know suddenly talking equality really cared income equality main driving force single motherhood
FOXNEWS,Hannity,got ten seconds well climate change rule cold snap prove anything past year fourth warmest record oh boy old fun
FOXNEWS,Hannity,oochl think scientists wacky nice boats well equiped got ten seconds well climate change rule cold
FOXNEWS,FOX and Friends,john stossel joins us say huge waste money keep throwing money global warming fixed know pointless may real danger mean discount lot serious climatologists
FOXNEWS,Your World With Neil Cavuto,like lot think today makes good case global warming new theory kind weather make case hot cold cake eat ways warming
FOXNEWS,The Five,engineers remember going design solar panel sudden bob beckel scientist reason get angry global warming push done control lives convince american public happening control every aspect using taxpayer
FOXNEWS,The Five,charlie rose global warming say makes scientist none us scientists read data say much conflicting data new york times coming saying numbers kind funny stuff think public believes something happening becomes crisis
FOXNEWS,The Kelly File,frank luntz focus group back tonight surprise president message world dean yat settled climate change fact z
FOXNEWS,State of the Union 2014,thanks bret president address recap second term agenda calling action climate change health care plan ecececececial report thank watching special report
FOXNEWS,The Kelly File,frank luntz focus group back tonight surprise president message world dean yat settled climate change fact z
FOXNEWS,The Kelly File,dealing job bills immigration important step issues like climate change discrimination system set adversarial many
FOXNEWS,The Kelly File,dealing job bills immigration important step issues like climate change discrimination system set adversarial many
FOXNEWS,Hannity,atmosphere point climate change making weather extreme higher highs lower lows 97 scientists believe 97 crock
FOXNEWS,Hannity,atmosphere point climate change making weather extreme higher highs lower lows 97 scientists believe 97 crock
FOXNEWS,Forbes on FOX,leave alternative cancel christmas well liberal lawmakers jumping bed greenie pressure networks cover climate change stories pull plug
FOXNEWS,On the Record With Greta Van Susteren,inaugural address spent time talking climate change devoted three sentences 45 words economy one sentence 19 words deficit reduction
FOXNEWS,Americas Newsroom,carbon emissions limit climate change two hurt comes main issue people care jobs bill 68 wall street journal place say country
FOXNEWS,The Kelly File,president address recap second term agenda calling action climate change health care plan ecececececial report thank watching special report bret baier washington
FOXNEWS,State of the Union 2014,one reasons natural gas extracted safely bridge fuel power economy less carbon pollution produces climate change businesses plan invest almost
FOXNEWS,State of the Union 2014,one reasons natural gas extracted safely bridge fuel power economy less carbon pollution produces climate change businesses plan invest almost
FOXNEWS,State of the Union 2014,one reasons natural gas extracted safely bridge fuel power economy less carbon pollution produces climate change businesses plan invest almost
FOXNEWS,Cashin In,climate change kim kardashian lawmakers every day send press releases ask us cover things every day make sense cover issue makes new york
FOXNEWS,Hannity,eric past november month ago warmest november record year likely fourth warmest year record climate change studied problem ever
FOXNEWS,Hannity,turning important note climate change measured every decade zeros warmer 90s 90s warmer 80s ocean warmest thousands years
FOXNEWS,Happening Now,conservatives supporting broad range investment new energy technologies applied basic whatever happens ready comment whatever happens reference climate change based upon
FOXNEWS,Hannity,atmosphere point climate change making weather extreme higher highs lower lows 97 scientists believe 97 crock
FOXNEWS,The Five,missing polar bears back let bring vanishing ice longer vanishing unlike vessel stuck ice think climate change shift sailed
FOXNEWS,Americas Newsroom,economic growth giving people security need tackle things like climate change bill kinds buzz words clinton pushing idea eve quality inequality seemed buzz
FOXNEWS,Hannity,eric past november month ago warmest november record year likely fourth warmest year record climate change studied problem ever
FOXNEWS,Hannity,turning important note climate change measured every decade zeros warmer 90s 90s warmer 80s ocean warmest thousands years
FOXNEWS,The Kelly File,climate change american say need act dramatic weather fault oh god terrible tornadoeses n
FOXNEWS,Hannity,issues like writing health care laws told expect lot executive action climate change energy frustrate republicans hill
FOXNEWS,Special Report With Bret Baier,climate change course obamacare unilaterally altered lawlessly least 15 times next syria chemical weapons moved country told ya could
FOXNEWS,The Kelly File,fact temperatures risen modesty yes dangerous level theorys climate change borne reality president one example president get democrats
FOXNEWS,The Kelly File,60 members united states senate 240 odd numbers house could pass president climate change agenda four years later president going attempt executive order
FOXNEWS,The Kelly File,fact temperatures risen modesty yes dangerous level theorys climate change borne reality president one example president get democrats
FOXNEWS,The Kelly File,60 members united states senate 240 odd numbers house could pass president climate change agenda four years later president going attempt executive order
FOXNEWS,Happening Now,karl yeah jon think right lot speech old old familiar themes minimum wage unemployment benefits immigration climate change designed two things one give democrats
FOXNEWS,Red Eye,actually went back looked years done report climate change economic social inequality apparently supposed bunch pandemics last year pandemics high 2013
FOXNEWS,The Kelly File,progressive agenda health care climate change immigration reform basically gotten major victories issues part pinned implementing health
FOXNEWS,Hannity,stands radical climate change position right back welcome back 90 year old man gave would robber shock life surveillance footage shows eld erly owner ohio
FOXNEWS,Hannity,fourth warmest year record climate change studied problem ever let finish billions tens billions funneled tax payers around globe
FOXNEWS,FOX News Obama Breakdown,technology enabled world adjusting climate change period time people say right 100 years americans lusting create national health care system charles kessler author
FOXNEWS,Stossel,cold killer climate change american say need act dramatic weather fault
FOXNEWS,Stossel,weird bill nye joins us along climate change sceptic mark morano scared able look predictions made 80s start see fail
FOXNEWS,FOX and Friends,well changed deportation policy illegal immigrants dreamer thing direct government prepare climate change changing deportation policy whatever think legal rights immigrants changes profound
FOXNEWS,Hannity,privately expect lot executive actions regarding epa climate change going frustrate republicans hill confrontational able make changes law
FOXNEWS,Americas Newsroom,continues come increasing pressure environmentalist earlier week head greenpeace movement said president undermining climate change plan said quote adding insult injury fossil fuel industry
FOXNEWS,The OReilly Factor,spiriva helps breathe better breathing copd weigh wait ask doctor spiriva stossel matter segment tonight climate change federal government spent 100 billion taxpayer dollars trying
FOXNEWS,Cashin In,lawmakers want hear climate change stories respond gun head end free speech country michelle one smartest people know building
FOXNEWS,The Five,emit water vapor climate change e cigarettes see difference e cigarette desk vaporizer maybe tea tea little different
FOXNEWS,Red Eye,going possible actually went back looked years done report climate change economic social inequality apparently supposed bunch pandemics last year
FOXNEWS,Special Report With Bret Baier,overnight tomorrow governor patrick says spots could see two feet snow live boston stay warm molly speaking weather may noted group climate change scientists stuck
FOXNEWS,The Five,ice longer vanishing unlike vessel stuck ice think climate change shift sailed blame ideology put real ice ice
FOXNEWS,Your World With Neil Cavuto,atlanta anything hot lanta lately michael moore turning heat director tweeting georgia ice climate change deniers jason fired author hollywood
FOXNEWS,Stossel,climate change causing ice melt sea levels rise happen lifetime lifetime unless demand leaders invest green technologies green jobs right
FOXNEWS,Stossel,work hollywood carry obamacare affect john biggest cause saving earth climate change commercial done harrison ford rainforest
FOXNEWS,Special Report With Bret Baier,conservatives supporting broad range investment new energy technologies applied basic whatever happens ready reference climate change impetus behind green car push increasing skepticism
FOXNEWS,State of the Union 2014,keep faith men women uniform president talked supporting veterans big slips tonight one drastic came president said quote debate settled climate change fact republican approval dove
FOXNEWS,State of the Union 2014,keep faith men women uniform president talked supporting veterans big slips tonight one drastic came president said quote debate settled climate change fact republican approval dove
FOXNEWS,The Kelly File,president address recap second term agenda calling action climate change health care plan wrap ups special report thank watching special report bret baier washington
FOXNEWS,The Kelly File,one sound bytes making lot hey twitter tonight climate change let play shift cleaner energy economy happen overnight require tough choices along way
FOXNEWS,The OReilly Factor,exhaling blame al gore goofus chance pick word climate change always look brighter everybody else come covering things
FOXNEWS,Americas News Headquarters,helicopter carrying australian icebreakers researchers study climate change going james rosen love silver thread last store ice made
FOXNEWS,Happening Now,purchasing habits american car buyers buying catastrophic scenarios climate change jenna doug member elle way mckelway thank jon could turn nightmare fantasy maybe fly distant planet
FOXNEWS,Stossel,climate change burning pfossil fuel largest toronto ever recorded earth fastest hurricane ever recorded earth hit within 6 months
FOXNEWS,The Kelly File,one sound bytes making lot hey twitter tonight climate change let play shift cleaner energy economy happen overnight require tough choices along way
FOXNEWS,State of the Union 2014,keep faith men women uniform president talked supporting veterans big slips tonight one drastic came president said quote debate settled climate change fact republican approval dove
FOXNEWS,Cashin In,climate change debate goes going get technical part part jonathan raises scares bernie sanders guy outrageously individual talking
FOXNEWS,The Five,love climate change next five awkward today show moment since matt lauer ate squirrel show happened kate gosselin sat interview twins
FOXNEWS,The Five,thinking think going hard time saying people emit water vapor climate change e cigarettes see difference e cigarette
FOXNEWS,Americas Newsroom,convince people bill byron york chief political correspondent washington examiner fox news contributor good morning bill bill climate change immigration income inequality tick exactly president want whole initiative
FOXNEWS,Americas Newsroom,action unilaterally environmental climate change last year republicans done anything president took action immigration reform illegal immigrants came country children done things republicans tried
FOXNEWS,The OReilly Factor,got burr saddle pot looks like everybody exhaling blame al gore goofus chance pick word climate change always look
FOXNEWS,Stossel,messaging promote affect biggest cause hollywood saving earth know climate change commercial done ape fine actor harrison ford rain forests get slashed burned
FOXNEWS,State of the Union 2014,happen nobody really knows extent able pin seem fairly minor terms setting sort working route look climate change something like
FOXNEWS,Happening Now,president obama plans move forward plan address climate change unfortunately administration comets undermine plan encouraging extraction coal oil gas public lands waters unlocking huge quantities carbon pollution
FOXNEWS,The Kelly File,blaming grid lock washington fox news rush limbaugh least blaming climate change george w bush look rather unseemly commander chief leader free world
FOXNEWS,Americas Newsroom,reporter exactly right president made clear approval keystone xl pipeline based environmental impact specifically carbon pollution big climate change speech last summer national interest
FOXNEWS,State of the Union 2014,kirstin climate change one things president talked dealing executive action get congress well question remains really talking white house hinting even leading u
FOXNEWS,The Five,says money funding comes government doingfo keep funding sources alive expert spent entire career studying climate change yes bob thing
FOXNEWS,Cashin In,cover climate change stories pull plug lefties dictate news hard know hard make stronger quit going get stronger new tough love show
FOXNEWS,Cashin In,commenting see tv government writing private broadcasters saying want see stories climate change television think regulates broadcasters bernie sanders democrat government force broadcasters
FOXNEWS,The Five,ever bob said huge lie climate change predictions wildly exaggerated want show shot epa administrator say going interviewed jeff sessions believe name
FOXNEWS,Red Eye,third television show definitely feel like barack obama wrote list income inequality climate change feel like involved way wondering left terrorism anyone terrorism islamic extremism killing us kind
FOXNEWS,The Five,ever bob said huge lie climate change predictions wildly exaggerated want show shot epa administrator say going interviewed jeff sessions believe name
FOXNEWS,The Kelly File,hope problem president one year ago today spoke lot aggressive progressive agenda health care grand bargain budget deal climate change immigration reform
FOXNEWS,The Five,pick topic told love climate change next five awkward today show moment since matt lauer ate squirrel show happened kate gosselin sat
FOXNEWS,Red Eye,third television show definitely feel like barack obama wrote list income inequality climate change feel like involved way wondering left terrorism anyone terrorism islamic extremism killing us kind
FOXNEWS,Stossel,would confront actors things like spring one mr ford plans get chest waxed bring awareness climate change still flying get cheeseburger guess driving honda
FOXNEWS,Forbes on FOX,climate change issues lot pollution world terrible china consumes coal countries combined think utilities continuing methane carbon capture great thing stop pollution world
FOXNEWS,Your World With Neil Cavuto,win something public opinion everytime severe weather event blame climate change argument lose weather event negative along come say climbed change winning court
FOXNEWS,Hannity,cold snap climate change aftermath seen happen environment call could one years cyclical sometimes go back history think 15 20 years ago
FOXNEWS,Hannity,cold snap climate change aftermath seen happen environment call could one years cyclical sometimes go back history think 15 20 years ago
FOXNEWS,State of the Union 2014,debate settled climate change fact children children look us eye ask could leave safer stable world new sources energy want us able say yes
FOXNEWS,Happening Now,pipelines many us see much larger movement something climate change trying responsible world live today reporter asked u state department would give us timetable decision keystone xl although
FOXNEWS,On the Record With Greta Van Susteren,go back beginning 2013 taken oath second term office big agenda gun control immigration reform climate change gun control nothing immigration reform nothing happened yet may happen year
FOXNEWS,State of the Union 2014,debate settled climate change fact children children look us eye ask could leave safer stable world new sources energy want us able say yes
FOXNEWS,State of the Union 2014,executive orders going happen nobody really knows extent able pin seem fairly minor terms setting sort working route look climate change something like
FOXNEWS,The Five,yes actually answer climate change energy issue communism private sector capitalism way grow lot economic growth companies governments enough
FOXNEWS,FOX and Friends,thought interesting settled climate change done deal also seemed ignore obamacare quite sometime also said enough try repeal law 40 times come another idea know senator
FOXNEWS,State of the Union 2014,executive orders going happen nobody really knows extent able pin seem fairly minor terms tting sort working route look climate change something like
FOXNEWS,On the Record With Greta Van Susteren,go back beginning 2013 taken oath second term office big agenda gun control immigration reform climate change gun control nothing immigration reform nothing happened yet may happen year
FOXNEWS,The Five,walk around h new fight right climate change e cigarettes see difference e cigarette yourtts desk vaporizer desk tea steam maybe tea cause tea
FOXNEWS,The Five,spent entire career studying climate change bob thing debate us man impact temperature happen think problem exaggeration
FOXNEWS,Americas Newsroom,based president frustration go back year president delivered ambitious inaugural address pledged immigration reform pledged climate change gun control big issue none stuff happened president realize
FOXNEWS,The Journal Editorial Report,going die year environmental movement decides given kind incredible cold weather weekend going wrap phrase climate change means problem totally unsolvable able get grant money apocalypse
FOXNEWS,Hannity,prove prove climate change would like stick america video majority people asked sign video told guy take walk even guy saying know sign
FOXNEWS,The Kelly File,find blaming grid lock washington fox news rush limbaugh least blaming climate change george w bush look rather unseemly commander chief
FOXNEWS,State of the Union 2014,choices along way debate settled climate change fact children children look us eye ask could leave safer stable world new sources energy want us able say yes
FOXNEWS,The Five,agree force tos president obama said climate warmingut faster thas ever bob bob said huge lie h climate change predictions wildly exaggerated want show shot ofr epa administrator
FOXNEWS,Hannity,kind sudden first global chilling prove prove climate change would like stick america video majority people asked sign video told guy take walk
FOXNEWS,Hannity,kind sudden first global chilling prove prove climate change would like stick america video majority people asked sign video told guy take walk
FOXNEWS,State of the Union 2014,kirstin climate change one things president talked dealing executive action get congress well question remains really talking white house hinting even leading speech
FOXNEWS,Cashin In,way way good interesting story talk coming hide remote control liberal lawmakers pressuring tv networks cover climate change stories government decides news ven time reflect life biggest questions
FOXNEWS,The Five,actually answer climate change energy issue communism private sector capitalism way grow lot economic growth companies governments enough money treasury
FOXNEWS,On the Record With Greta Van Susteren,climate change used pen enacted number changes epa year think rick right one thing raise debt ceiling sometime next months fight lot
FOXNEWS,On the Record With Greta Van Susteren,climate change used pen enacted number changes epa year think rick right one thing raise debt ceiling sometime next months fight lot
