Station,Show,Snippet
FOXNEWS,Hannity,seen go back time magazine proclaiming next ice age coming become global warming seem backing talking climate change general snows global warming snow global warming
FOXNEWS,Forbes on FOX,yes david save us tens billions dollars changed global warming climate change weather change last 4 billion years global warming simply
FOXNEWS,Hannity,seen go back time magazine proclaiming next ice age coming become global warming seem backing talking climate change general snows global warming
FOXNEWS,Stossel,john take earth greenhouse gases global warming hear law even climate change discussion aside fact countries
FOXNEWS,Stossel,greenhouse gases global warming hear lot even put climate change discussion aside loo fact many countries like
FOXNEWS,Stossel,emerging market force john take earth greenhouse gases global warming hear law even climate change discussion aside fact countries
FOXNEWS,Hannity,today cold global warming oh give break say really really broke record temperatures lowest temperatures 118 years sean global warming climate change
FOXNEWS,Hannity,today cold global warming oh give break say really really broke record temperatures lowest temperatures 118 years sean global warming climate change
FOXNEWS,The Five,200 things killed kids guns last year choking hotdog probably one want ban hotdogs assume different situation gun debate kind like climate change global
FOXNEWS,Stossel,often spite government created wonderful natural gas lowered greenhouse gas ee maemission
FOXNEWS,Hannity,eve night earth getting warmer last 28 years november hottest month record facts certain degree laugh end day carbon pollution real greenhouse gases real
FOXNEWS,Stossel,believe global warming stupid question mean really question global warming yes
FOXNEWS,Stossel,believe global warming stupid question mean really question global warming yes
FOXNEWS,Hannity,facing country thanks guys got global warming
FOXNEWS,Stossel,little people another movie thanks oh al gore americans concerned global warming understand talking believe global warming yes believe global
FOXNEWS,Stossel,said industry analyst talking clinics believe global warming
FOXNEWS,Stossel,movie example says world best scientists thousands unanimous must act global warming
FOXNEWS,Special Report With Bret Baier,climate several days successful rescue recently chief washington correspondent tonight look study global warming
FOXNEWS,Stossel,chemicals pesticide plastic bottles power lines mad cow david doubters cigarettes mean global warming correct
FOXNEWS,Stossel,chemicals pesticide plastic bottles power lines mad cow david doubters cigarettes mean global warming correct
FOXNEWS,Your World With Neil Cavuto,wish experienceing globe warming beef michael moore able take twitter talk global warming could
FOXNEWS,Hannity,warming alarmists going antarctica vacation get caught ice tonight ask administration spent 7 million countries studying global warming
FOXNEWS,Your World With Neil Cavuto,u n could worst thing ever contain letters u n since untreated rabies case point climate cheech says communist tops fighting global warming
FOXNEWS,Cavuto on Business,basically go back 1940s live use smartphones 1950s someone walked studio third avenue global warming
FOXNEWS,The Five,u n could worst thing ever contain letters u n since untreated rabies case point climate cheech says communist tops fighting global warming
FOXNEWS,The Five,u n could worst thing ever contain letters u n since untreated rabies case point climate cheech says communist tops fighting global warming
FOXNEWS,Hannity,today cold global warming oh give break say really really broke record temperatures lowest temperatures 118 years sean global
FOXNEWS,Your World With Neil Cavuto,bail insurance companies well right spiral still john goodman still thank john think yes sir take look global warming
FOXNEWS,Your World With Neil Cavuto,anyones means fixing cleatsly eu client commissioner says right thing policy policy record cold proves one thing global warming
FOXNEWS,Special Report With Bret Baier,candidate 2008 told editors san francisco chronicle somebody wants build coal powered plant bankrupt charged huge sum greenhouse gas
FOXNEWS,Red Eye,would get rid things supports everything wants never heard phrase income equality 60 years ago september 9th like global warming
FOXNEWS,Hannity,male announcer campbell chunky soup male announcer fills right welcome back hannity continue great great american panel white house spending money global warming
FOXNEWS,Americas News Headquarters,2001 2012 wrong 14 warmest history record keeping terms terms globally average temperature according gallup polling 54 americans believe effect office 0 global warming begun
FOXNEWS,Stossel,plastic bod els killing people power lines mad cow disease going kill everybody example yeah doubters cigarettes one example mean global warming scare
FOXNEWS,Hannity,good speak get cold air masses come whole change game however things start add like cold temperatures snow like global warming scientists
FOXNEWS,Hannity,clear earth temperature seems political agenda wrong climate change must
FOXNEWS,Stossel,keep holding caues ya know make make keep holding climate change causing
FOXNEWS,Hannity,clear earth temperature seems political agenda wrong climate change must
FOXNEWS,Happening Now,paying attention nonheat related demand things like oil natural gas propane gone year year year lot refiners dealers took winter granted believed global warming
FOXNEWS,The Five,know picked classic example hate fashion obvious obvious thing 15 pounds right one magazine fall fashion kidding think global warming effects
FOXNEWS,The Five,claim like depictions promiscuity hip hop misogyny usually people cherry pick results thing correlation cause cause b b happened time could blame global warming
FOXNEWS,Hannity,warming climate change need understand hot global warming cold global warming told tsunamis earthquakes volcanic eruptions global warming correct lot warm air
FOXNEWS,Your World With Neil Cavuto,activists scientists willing basically say weather event consistent global warming changed terminology going go global warming make climate change new buzz word
FOXNEWS,Your World With Neil Cavuto,debate hot summer global warming cold winter gosh global warming use phrase climate change people atlanta
FOXNEWS,Hannity,warmer realize getting cold climate change global warming wrong climate change well first court denotes nasa reports 97
FOXNEWS,Hannity,climate change global warming wrong climate change well first court denotes nasa reports 97 climate scientists believe earth warming humans
FOXNEWS,Hannity,climate change global warming wrong climate change well first court denotes nasa reports 97 climate scientists believe earth warming humans
FOXNEWS,Stossel,guy goes tour carbon footprint third world nation idea going turn lights going make difference even believe theory man caused global warming
FOXNEWS,Your World With Neil Cavuto,blame global warming real humans almost certainly cause living climate change real time taking depth look problem global warming globe warming happening underway
FOXNEWS,The Five,want ban hotdogs assume different situation gun debate kind like climate change global warming debate reverse global warming liberals say really bad trust us
FOXNEWS,Stossel,warming one myths attack 3000 scientists intergovernmental panel important remember icpp intergovernmental climate change
FOXNEWS,Hannity,plus bob beckel tell us block buster new movie set record use f bomb northeast digging yesterday blizzard like conditions temperatures continue plunge coming go head head global warming alarmist
FOXNEWS,Stossel,conservationist policies harrison ford strangely got chest waxed know care owns seven airplanes would love seven airplanes please lecture rest us precipice global warming
FOXNEWS,The Kelly File,afford miss eve one coldest days ever investigate billions hard earned tax dollars used study climate change
FOXNEWS,The OReilly Factor,climate change say global warming 10 years gets cold people notice seems overbet hand far global warming come us cannot reach across aisle left country give us
FOXNEWS,The OReilly Factor,brighter everybody else come covering things climate change say global warming 10 years gets cold people notice seems overbet hand far global warming come
FOXNEWS,The Five,answer answer climate change cle yes global warming yes money yes actually answer climate change energy issuo communism private sector capitalism wayi grow
FOXNEWS,Americas News Headquarters,health passengers included numb climate change researches study concludes due formation fewer sun reflecting clouds development attributed greenhouse gas emissions global temperatures
FOXNEWS,State of the Union 2014,night constitution says presidential time time give congress information state union new epa director mccarthy walking right kirstin climate change
FOXNEWS,Red Eye,global warming democracy dud claim partisan divide u detrimental passing legislation combat climate change communist china want
FOXNEWS,Special Report With Bret Baier,gains tax congress rejects alition tax ortds irs collect people would arms would impeaching immigration climate change drug laws
FOXNEWS,Hannity,global warming propaganda crock 3 climate change deniers tornadoes actually 40 year low colder roman empire
FOXNEWS,Hannity,global warming propaganda crock 3 climate change deniers tornadoes actually 40 year low colder roman empire
FOXNEWS,The Five,catastrophic argument making look says money funding comes government keep funding sources alive expert spent entire career studying climate change
FOXNEWS,Hannity,white house spends hard earned tax dollars global warming propaganda fact center either prove disprove climate change great american panel tackles outrageous
FOXNEWS,Hannity,white house spends hard earned tax dollars global warming propaganda fact center either prove disprove climate change great american panel tackles outrageous
FOXNEWS,Hannity,global warming propaganda crock 3 climate change deniers tornadoes actually 40 year low colder roman empire even category 4 hurricanes
FOXNEWS,Your World With Neil Cavuto,second biggest polluter los angeles think though left environmentalists people believe passionately global warming climate change think point maybe
FOXNEWS,Hannity,snow global warming cold global warming hot global warming rains global warming rain global warming seems everything global warming better remain silent
FOXNEWS,Special Report With Bret Baier,agencies lot things wants unilaterally things like global warming climate change anti coal stuff hurt democrats terribly lot unilateral stuff wants obamacare
FOXNEWS,Hannity,administration wasting none global warming studies although record low temperatures across america 2010 2012 7 billion hard earned tax dollars wasted climate change studies
FOXNEWS,Hannity,cold global warming hot global warming rains global warming rain global warming seems everything global warming better remain silent every time jokes begin
FOXNEWS,The OReilly Factor,stossel matter segment tonight climate change federal government spent 100 billion taxpayer dollars trying combat global warming may know americans even believe taking place left driving debate
FOXNEWS,Forbes on FOX,sabrina go ahead think american people think serious issue anymore pew research center finds people always think global warming climate change bottom priorities year bottom 21 different policy priorities
FOXNEWS,Hannity,else coming easter splams large portion country brings frigid temperatures managed find outspoken global warming alarmist still thinks climate change happening go head head next heated debate stay us
FOXNEWS,Hannity,record use f bomb northeast digging yesterday blizzard like conditions temperatures continue plunge coming go head head global warming alarmist stands radical climate change position right back welcome back everything
FOXNEWS,Hannity,record use f bomb northeast digging yesterday blizzard like conditions temperatures continue plunge coming go head head global warming alarmist stands radical climate change position right back welcome back everything
FOXNEWS,Hannity,else coming easter splams large portion country brings frigid temperatures managed find outspoken global warming alarmist still thinks climate change happening go head head next heated debate stay us oh early
FOXNEWS,The Five,global warming global warming global warming really oh god gutfeld agrees shockingly member mainstream media charlie rose wondering
FOXNEWS,Hannity,raining global warming rain global warming 7 billion spent looking global warming lot better 24 billion republicans
FOXNEWS,Hannity,global warming least hear science something kind cold global warming man global warming talking right coldest day
FOXNEWS,Hannity,else coming easter splams large portion country brings frigid temperatures managed find outspoken global warming alarmist still thinks climate change happening go head head next heated debate stay us male announr story lile room pizza place
FOXNEWS,Hannity,science something kind cold global warming man global warming talking right coldest day 20 years stop americans signing global warming petition want hear
FOXNEWS,Hannity,science something kind cold global warming man global warming talking right coldest day 20 years stop americans signing global warming petition want hear
FOXNEWS,Hannity,global warming snows global warming snow global warming 7 billion spent looking dplorm lot better 24 billion republicans blew government shutdown
FOXNEWS,FOX and Friends,surrounded global warming scientists media saying calling tourists play well say global warming scientists going study global warming winter brutal
FOXNEWS,Hannity,need understand hot global warming cold global warming told tsunamis earthquakes volcanic eruptions global warming correct lot warm air
FOXNEWS,Hannity,need understand hot global warming cold global warming told tsunamis earthquakes volcanic eruptions global warming correct lot warm air
FOXNEWS,The Five,longer wants spread disease gorilla refuses eat bananas polar bear go inside chicago bear disgrace expecting know global warming global warming global warming reason
FOXNEWS,Hannity,signs looking forward could use global warming heard global warming mr beckel new year
FOXNEWS,Stossel,embrace technology extra greenhouse gases point human history best interest john one video idea politicians
FOXNEWS,Stossel,stop global warming go bill tnye science guy debate planet depot com stossel believe global warming
FOXNEWS,The Five,know scientist polar vortex cause global warming definitely connected global warming potentially connected potentially
FOXNEWS,Hannity,deal signs looking forward could use global warming heard global warming mr beckel new year
FOXNEWS,Cavuto on Business,instead intelligent conversation wait adam like california way reads though china emitting greenhouse gases coin problem deal
FOXNEWS,Stossel,everything cameras things probably picked silliest examples dgot believe global
FOXNEWS,The OReilly Factor,four people incredible miley cyrus tongue quarantined realize actually spiny moray eel give one global
FOXNEWS,Your World With Neil Cavuto,basically global warming causes less snow kept global warming causes snow causes less cold caused sold need 2011 barbara boxer dianne feinstein
FOXNEWS,Your World With Neil Cavuto,indicates new theory bundle global warming al gore says record snow continue global warming prior vice president former president said start
FOXNEWS,Stossel,embrace technology extra greenhouse gases point human history best interest john one video idea politicians fix climate strikes
FOXNEWS,FOX and Friends,historically cold weather rail global warming alarmists say government country right spending much money global warming spending tremendous amounts money
FOXNEWS,Stossel,sometimes find bodies river water clean enough swim three cheers anti pollution regulations carbon dioxide pollution environmental zell louts confuse people comparing greenhouse
FOXNEWS,Hannity,global warming talking although today day know today cold global warming pen working frozen
FOXNEWS,The Five,absolute baloney left explain weather hot global warming cold global warming care activists say skeptics say media push
FOXNEWS,The Five,global warming prove make mind models always inaccurate believe 2007 reduced snowfall going caused global warming every year snow
FOXNEWS,The Five,blaming global warming prove make mind believed 2007 reduced snowfall going caused global warming every year snow
FOXNEWS,Hannity,greenhouse gases real laughing laughing quoting 28 years earth millions years cooling cooling effect point simple
FOXNEWS,Stossel,innovations come emerging technologies come embracing technologies produce extra carbon dioxide extra greenhouse gases point man history best interest
FOXNEWS,Stossel,epa rules make opening new plant impossible may shut existing plants maybe good thing burning stuff makes third greenhouse gases previous gas said much less
FOXNEWS,Hannity,science something global warming talking although today day know today cold global warming pen working frozen
FOXNEWS,Stossel,bike feels green tough resist global warming propaganda hard see big picture affects people sides debate laughed weeks ago heard global warming activists trapped ice
FOXNEWS,Hannity,science something global warming talking although today day know today cold global warming pen working frozen
FOXNEWS,The OReilly Factor,important global warming feel toes right perfect example global warming like warm hugs 2014 red blue literally split middle think disparity
FOXNEWS,Your World With Neil Cavuto,took senate floor talked lack snow winter proof manmade global warming every heat wave proof global warming record cold east coast seeing one snowest deck
FOXNEWS,The OReilly Factor,important global warming feel toes right perfect example global warming like warm hugs 2014 red blue literally split middle think disparity
FOXNEWS,Stossel,greenhouse gases computer models suggest big problems many already turned wrong even models accurate zell louts want us ride bike work buy prius pay
FOXNEWS,Hannity,cold global warming frozen good grief make signing global warming petition coldest day 20 years great great american panel react straight ahead male announcer simple physics
FOXNEWS,The Five,unsupported assumptions cold snap push stuff cannot prove say bob let finish cold wave prove global warming cold wave prove global warming
FOXNEWS,Hannity,expressw sparring every day got see wonderful see break room oh course never worked okay clueless ameri n americans signing global
FOXNEWS,Hannity,frozen vehicle days trapped poetic justice still us great american panel k g tell wrote love tell us temperatures read guy global
FOXNEWS,Cavuto on Business,know problem instantly came yelling get god bless going thought report comical china biggest emitter world greenhouse gases need get near missions
FOXNEWS,Stossel,great deal carbon dioxide greenhouse gases existed come centuries ago speed changing trouble many large populations humans around world may heard
FOXNEWS,Hannity,extreme cold spells like one united states disproves global warming believe believe odds expect result global warming see pattern extreme cold
FOXNEWS,Hannity,cold global warming frozen good grief make signing global warming petition coldest day 20 years great great american panel react straight ahead male announcer different eating
FOXNEWS,The Five,increased said increased amount snow cause evidence global warming everything caused global warming science scam say wr bob reach midpoint
FOXNEWS,The Five,increased said okay increase amount snow cause evidence global warming everything caused global warming science scam say bob reached
FOXNEWS,Hannity,day 20 years make got tape watch trying sign global warming know everything getting warmer understanding reason cold today global warming least
FOXNEWS,Hannity,make got tape watch trying sign global warming know everything getting warmer understanding reason cold today global warming least science something
FOXNEWS,Hannity,warming petition coldest day 20 years make got tape watch trying sign global warming know everything getting warmer understanding reason cold today global warming least
FOXNEWS,Hannity,impact environment bad creating jobs critical issue facing country right guys good see one funniest moments saw vacation global
FOXNEWS,Americas Newsroom,going around brought former white house chief staff counselor pushed action whether climate
FOXNEWS,Stossel,warming wide understanding shallow cool thing right hip need know encourage critical thinking people need know believe believe consensus global
FOXNEWS,Your World With Neil Cavuto,public opinion think really assed many agenda many americans ask want congress tackle climate
FOXNEWS,Hannity,age shows global warming say proof warming
FOXNEWS,The OReilly Factor,scientific consensus absolutely clear debatable climate change real caused human activity united states evidence climate change really around us increasing
FOXNEWS,Hannity,ice age shows global warming say proof warming
FOXNEWS,The Kelly File,used study climate change countries one things emotional times peacock
FOXNEWS,Stossel,shot existing plants good thing burning produce one third greenhouse gas natural gas emits much less
FOXNEWS,The OReilly Factor,climate change real caused human activity united states evidence climate change really around us increasing temperatures record flooding super storm sandy right
FOXNEWS,Stossel,powerfully sway natalie followers like george clooney spotted global warming says something goes global
FOXNEWS,Stossel,new plan nearly impossible shot existing plants good thing burning produce one third greenhouse gas natural gas emits much less
FOXNEWS,The Five,could fix climate change issue climate change guess mind anorexic also environmental hero eating food truck travel food digest blow
FOXNEWS,Stossel,increased use lowered america greenhouse gas emission good people still hate hate fossil fuel immoral say make money putting carbon air
FOXNEWS,Stossel,warming yes believe global warming yes know ask hardest questions humans
FOXNEWS,Stossel,search al gore find politicians pretend stop global warming got free golf cart
FOXNEWS,Stossel,global warming yes train wreck ask hardest question humans read everything john come picked
FOXNEWS,Stossel,got relief global warming aden shallow soup echidnas said coolth saying briefly know
FOXNEWS,Special Report With Bret Baier,americans worrying global warming great deal americans believe effects already begun james thank day two colorado
FOXNEWS,The Five,climate change issue climate change guess mind anorexic also environmental hero cause rx eating food truck hae travel food yo digest blow hole ozone mit
FOXNEWS,The Five,people would go away would die could fix climate change issue climate change guess mind anorexic also environmental hero eating food truck travel
FOXNEWS,The Five,look take steps global warming ruins habitat almost buddy going backwards play eye tiger
FOXNEWS,The Five,force unemployment rate would well 11 argument like global warming jobs come back
FOXNEWS,Stossel,titled program chill researched global warming scare conclusion government chilling make
FOXNEWS,Stossel,yes yes yes told dealers aware global warming globe getting warm careful otherwise things
FOXNEWS,Stossel,global warming many scientists turned swedish scientists said would even noticed modern instrumentation hockey stick absurd
FOXNEWS,Stossel,silliest examples got relief global warming aden shallow soup echidnas said coolth saying briefly know
FOXNEWS,Stossel,titled program chill researched global warming scare conclusion government chilling make
FOXNEWS,Stossel,global warming many scientists turned swedish scientists said would even noticed modern instrumentation hockey stick absurd
FOXNEWS,Stossel,yes yes yes told dealers aware global warming globe getting warm careful otherwise things
FOXNEWS,FOX and Friends,controversial statement climate change take listen debate settled climate change fact children children look eye ask could leave safer stable world new sources enjoy want us
FOXNEWS,Red Eye,buy idea become communists cut smog smog global warming gets blood boiling host dinner parties
FOXNEWS,Red Eye,want em badly stop back justin bieber please thing eat eat global warming taking away habitat
FOXNEWS,Red Eye,want em badly stop back justin bieber please thing eat eat global warming taking away habitat
FOXNEWS,Huckabee,let chill global warming free people create better world show see next week kick huckabee
FOXNEWS,The Kelly File,tornadoes oklahoma makes want ask al gore whether gore like global warming matter already pay
FOXNEWS,Stossel,think stupid question mean say global warming mequestions globe warming well yes global temperatures risen
FOXNEWS,Stossel,global warming hysteria stuff pollutes air natural gas wind power solar power discourage nice
FOXNEWS,Stossel,west discientist thousands tm unanimous must global warming best world 113 countries issued four pun man nows reports saying
FOXNEWS,Stossel,ed fashioned th fact tt ice antarctica prove global warming foolish recent gold snap say either someone segmentuggested
FOXNEWS,Hannity,need leave scientists course understand global warming issue affecting citizen lives agree tax dollars
FOXNEWS,Stossel,billions fix global warming year hill said climate political battle 2014 big money spent convince americans stop
FOXNEWS,Stossel,billions fix global warming year hill said climate political battle 2014 big money spent convince americans stop
FOXNEWS,Hannity,heat records 122 degree day always global warming al gore warm getting warmer realize getting cold
FOXNEWS,Hannity,heat records 122 degree day always global warming al gore warm getting warmer realize getting cold
