Station,Show,Snippet
FOXNEWS,Americas News HQ,climate change husband traveled washington dc sunday dined family hotel immediate majority leader wife elaine chao named hud
FOXNEWS,Tucker Carlson Tonight,always said believes climate change real reporter ivanka husband jared kushner traveled washington c sunday dined family hotel
FOXNEWS,Outnumbered,going election ties vladimir putin pros cons irrespective climate change address personal opinion lot trouble mean
FOXNEWS,Special Report With Bret Baier,vladimir putin gop hawks far committed support tillerson til better understand relationship tillerson disagrees trump climate change believes real
FOXNEWS,Hannity,another deny happening overwhelming evidence climate changing part blame climate change threatens alter way live
FOXNEWS,Special Report With Bret Baier,sit climate change ivanka trump possibly bulk time president elect donald trump found extremely interesting conversation continued
FOXNEWS,Special Report With Bret Baier,al gore right hall fame interesting republicans conservatives climate change deal believe government interve intervene al gore literally making
FOXNEWS,The Five,climate models career done climate change exist irrational action linked climate models bad leo loves models wait donald trump picked fossil
FOXNEWS,Americas Newsroom With Bill Hemmer and Martha MacCallum,trump transition team cited pruitt role attacking epa describe epa war coal critics like vermont senator bernie sanders say pruitt climate change denier
FOXNEWS,Fox and Friends Sunday,governor mike huckabee react next instead preaching god priest starts talking climate change new guidelines issued catholic church christmas photos
FOXNEWS,Fox and Friends Sunday,president obama controversial nuclear agreement climate change permanent part catholic church pope releasing new guidelines forcing promote environmental issues father jonathan morris joins
FOXNEWS,Fox News Sunday With Chris Wallace,stands climate change big cabinet pick still make secretary state fox news sunday continues special coverage trump way cough
FOXNEWS,Happening Now,nominee said pruitt climate change denier aligned close fossil fuel industry lastly donald trump named head wwe linda
FOXNEWS,The Real Story,complicated climate change skeptic pushed renewable energy moment hard live wanted eliminate department energy
FOXNEWS,Americas News HQ,virginia north carolina regardless whether talking climate change think good idea shoutout another first daughter alice roosevelt
FOXNEWS,Outnumbered,essentially presided looting charitable program saddam hussein billion dollars look u n done dishonestly climate change alone
FOXNEWS,Red Eye With Tom Shillue,eisenhower al gore charizmatic puts americans sleep speaks person really charizmatic everything done climate change top positive things
FOXNEWS,Special Report With Bret Baier,sally jewell imploring sciences confront climate change deniers especially president elect donald trump tries sideline climate research make voices heard make relevant people
FOXNEWS,Special Report With Bret Baier,eight years accepting climate change science fact instead something debate kevin thank yahoo says believes hackers stole data one billion user accounts
FOXNEWS,Americas News HQ,many things take care many things like fighting terrorists like taking care climate change vermont electric company said detected mal wear
FOXNEWS,The Kelly File,eight years accepting climate change science fact instead something debate kevin thank yahoo says believes hackers stole data one billion user accounts
FOXNEWS,Hannity,alter way live way produce food live live debate settled climate change fact face pan tarn mj
FOXNEWS,Happening Now,administration climate change epa may one choose fight see ones may thanks pleasure
FOXNEWS,The Real Story,years climate change issues say alarmed questionnaire set trump transition team department energy seems names career civil servants worked climb change
FOXNEWS,Happening Now,comes climate change operate assumption want protect live could boisterous debate epa good country
FOXNEWS,The Journal Editorial Report,different human rights democratic party losing many levels government made climate change secular religion literally led lot
FOXNEWS,Sunday Morning Futures With Maria Bartiromo,election lot people talking transgender bathrooms police brutality climate change donald trump team talking jobs big missed opportunity take issue
FOXNEWS,Outnumbered,people worked campaign seen advocacy groups seen passionate issues like climate change conservation criminal justice reform something think well
FOXNEWS,Fox and Friends First,tillerson better understand relationship tillerson disagrees donald trump climate change believes real former marine general james mad dishas fans parties law requires
FOXNEWS,Special Report With Bret Baier,joe bthink would fit perfectl questions climate change exploration environment thinking steve talked mad dog reading lot state department maybe lap
FOXNEWS,Fox and Friends Saturday,finally 2 many inconvenient truth moves al forced america sit come 2017 follow 2006 climate change film premier next january sundance film festival
FOXNEWS,Special Report With Bret Baier,film talked reaching common ground image know climate change crowd cool crowd think donald trump supporters people got
FOXNEWS,Shepard Smith Reporting,impeccable trump wants keep adversaries guessing offbalance worth pointing climate change one despite tensions u china found common ground area
FOXNEWS,Happening Now,al gore climate change guy comes said serious positive discussion open areas common ground talking mitt romney possible cabinet job
FOXNEWS,Special Report With Bret Baier,climate change crowd cool crowd think donald trump supporters people got elected high list priorities interesting donald trump said
FOXNEWS,The Kelly File,believes climate change real reporter ivanka husband jared kushner traveled washington c sunday dined family hotel mitch mcconnell wife elaine chao trump pick transportation secretary
FOXNEWS,The Kelly File,sally jewell imploring sciences confront climate change deniers especially president elect donald trump tries sideline climate research make voices heard make relevant people talking
FOXNEWS,Special Report With Bret Baier,asking final push imploring scientists confront called climate change deniers trump transition team asked energy department epa staff see working efforts reduce
FOXNEWS,Special Report With Bret Baier,joe bthink would fit perfectl questions climate change exploration environment thinking steve talked mad dog reading lot state department maybe lap
FOXNEWS,Fox and Friends Sunday,picture instead preaching god priest talks climate change new guidelines issued catholic church favorite time year tis season pictures like awkward family
FOXNEWS,Fox and Friends Sunday,deals world around concern mean want climate change want renewable energy fossil fuel deals okay condemning saying world heading
FOXNEWS,Fox and Friends Sunday,us earlier science tells us climate change affecting people lives especially affecting poor course people religion us speaking
FOXNEWS,Fox and Friends Sunday,causing new guidelines comes heels ruling academy sciences climate change real caused human activity christmas joy peace love unless
FOXNEWS,The Kelly File,believes climate change real reporter ivanka husband jared kushner traveled washington c sunday dined family hotel mitch mcconnell wife elaine chao trump pick transportation secretary
FOXNEWS,Special Report With Bret Baier,variety pressing issues support iran nuclear deal climate change initiatives resettling refugees overwhelming feeling among members barack obama kind u president think
FOXNEWS,Special Report With Bret Baier,thinks earth getting hotter thinks dire predictions climate change way top respected intolerance side well steve trump met al
FOXNEWS,The Kelly File,thinks earth getting hotter thinks dire predictions climate change way top respected intolerance side well steve trump met al
FOXNEWS,Happening Now,support iran nuclear deal climate change initiatives resettling refugees overwhelming feeling among members barack obama kind u president think different reception
FOXNEWS,The Kelly File,kelly file anything want tell us stay tuned tomorrow check inbox fascinating want ask epa believe climate change basically going rewind undue
FOXNEWS,The Kelly File,debate think debate whether climate change versus causes obviously world continuously changing going make sure government get
FOXNEWS,The Real Story,climate change skeptic even pick employees concerned transition team donald j trump asked provide list every employee contractor worked energy drpt recent months
FOXNEWS,The Real Story,whether climate change something else said react side sincere search areas common ground meeting beforehand
FOXNEWS,Special Report With Bret Baier,thinks earth getting hotter thinks dire predictions climate change way top respected intolerance side well steve trump met al
FOXNEWS,Happening Now,climate change congressional leaders call investigations whether russia meddled election behalf donald trump also learning morning mr trump chosen critic energy department
FOXNEWS,Shepard Smith Reporting,edge meant investing clean energy created steady stream good jobs help america become world leader combatting climate change meant investing medical break throughs
FOXNEWS,Happening Now,centrist agenda deny climate change like said could mean wind industry alternative fuels industry prosper think interesting attractive prime candidate
FOXNEWS,Americas Newsroom With Bill Hemmer and Martha MacCallum,talked climate change president elect trump meeting group individuals issues affect african american community something passionate visited detroit inner dis
FOXNEWS,The Real Story,electoral college let talk areas commonality climate change make think one things trump team figure get current
FOXNEWS,Happening Now,look body gets one really knows hard fast said one really knows facts climate change mean
FOXNEWS,Fox and Friends Saturday,conservative populist bent father people love far reaching going person want reach interested universal decay passing legislation global warming going point contact
FOXNEWS,The Journal Editorial Report,epa oppose economic growth climate change debate going call denier say thinks happening never said said maybe science
FOXNEWS,Shepard Smith Reporting,long productive conversation wondering questioning maybe left hoping mr trump might take different pivot relates climate change senior source telling fox mr
FOXNEWS,Special Report With Bret Baier,night saying green party candidate jill stein eligible ask recount environmentalists would like recount could get one donald trump decision name noted climate change skeptic run environmental protection agency
FOXNEWS,Tucker Carlson Tonight,saw interview tucker selection oklahoma attorney general scott pruitt head epa skeptic issue climate change says settled science join coalition
FOXNEWS,Outnumbered,deserve deserve headline president divided america everything bringing establishment bringing democrats calling al gore climate change mean think
FOXNEWS,The Kelly File,night saying green party candidate jill stein eligible ask recount environmentalists would like recount could get one donald trump decision name noted climate change skeptic run environmental protection agency
FOXNEWS,The OReilly Factor,change electoral college far left going go point climate change happened well basically basically california know gave hillary clinton popular vote
FOXNEWS,Special Report With Bret Baier,environmentalists much colder climate correspondent kevin corke reports honolulu president successor may approve reporter president made fighting climate change one pillars presidency watershed moment joint agreement
FOXNEWS,The OReilly Factor,basically california know gave hillary clinton popular vote california right cusp climate change forefront environmental revolution know maybe went
FOXNEWS,The OReilly Factor,popular vote would better climate change better environment yes yes hillary clinton president yes bother washington post editorial board wanted democrat liberal people
FOXNEWS,Fox and Friends First,al gore meet ivanka trump climate change ended meeting elect well gore described sincere search areas common ground fascinating since two men
FOXNEWS,Happening Now,whether climate change whether support torture know prosecuting secretary hillary clinton take set aside look steps made terms going
FOXNEWS,Tucker Carlson Tonight,climate change turned long talk president elect details talk gore says going stay confidential bulk time president elect donald trump found extremely
FOXNEWS,The Kelly File,policy making guided science policymakers looking science inside outside government would hope wield still make case climate change real humans contributed
FOXNEWS,The Kelly File,choices months asking questions trump administration asking final push imploring scientists confront called climate change deniers trump transition team asked
FOXNEWS,The Kelly File,shocking argument say lot climate change stuff become something religion left religion within epa energy department think know
FOXNEWS,The Five,complaints people like amnesty international human rights records hear complaints people concerned fact know talk issues like climate change exxonmobil protecting profits interests long
FOXNEWS,The Five,trying downplay impacts climate change world hear republicans think everybody needs tune big push get condoleezza rice republican establishment endorse
FOXNEWS,Outnumbered,entirely different reasonable sensible sensitive less government dominated view environment sandra let get specifics pruitt views climate change says scientists continue disagree degree extent
FOXNEWS,Outnumbered,meghan help think al gore going visit donald trump week trump tower lot rumors ivanka trump main issue climate change right meghan help thinkm ivanka
FOXNEWS,Fox and Friends Sunday,imagine church sunday mass instead preaching god priest talked climate change father john react new guidelines released catholic church makes simple salad best simple salad ever
FOXNEWS,Fox and Friends Sunday,recognize earth taken care affects us human beings especially affects poor goes talks climate change mean people want go
FOXNEWS,Fox and Friends Sunday,political live turn political science tells us climate change affecting people lives scientists know
FOXNEWS,Special Report With Bret Baier,climate change something administration president perhaps jonathan think enough positive environmentalists going door one things well keenly aware
FOXNEWS,Hannity,pressed press years true earth warming even climate deniers world today climate change real urgent america take lead world addressing
FOXNEWS,Shepard Smith Reporting,change hoax said climate change made china al gore inconvenient truth guess maybe reason
FOXNEWS,Tucker Carlson Tonight,climate change turned long talk president elect details talk gore says going stay confidential bulk time president elect donald trump found extremely
FOXNEWS,The Kelly File,name person wants run environmental protection agency oklahoma attorney general scott pruitt pruitt somebody says sure signs climate change democrats tizzy
FOXNEWS,Happening Now,energy department involved climate change research yeah said give think kind mix know ways sort let wind industry
FOXNEWS,Americas Newsroom With Bill Hemmer and Martha MacCallum,state also making big news interview fox chris wallace comments russia election climate change get plus donald trump versus mainstream media terrifying flight accident onboard aircraft
FOXNEWS,Special Report With Bret Baier,night saying green party candidate jill stein eligible ask recount environmentalists would like recount could get one donald trump decision name noted climate change skeptic run environmental protection agency
FOXNEWS,The Kelly File,things obama administration done environment eight years office believe climate change think going regulation restrictions put business really
FOXNEWS,Tucker Carlson Tonight,night saying green party candidate jill stein eligible ask recount environmentalists would like recount could get one donald trump decision name noted climate change skeptic run environmental protection agency
FOXNEWS,Special Report With Bret Baier,environmentalists much colder climate correspondent kevin corke reports honolulu president successor may approve reporter president made fighting climate change one pillars presidency watershed moment joint agreement
FOXNEWS,The Five,upset people would want see al gore near top list bring lockbox know think ivanka interested climate change wanted hear
FOXNEWS,Tucker Carlson Tonight,gone like kellyanne conway woman win first presidential election race actually count got progressive believes climate change order get lauded graduate universities
FOXNEWS,The Five,feels climate change think ivanka agrees could part strange new respect evolution see candidate start moving back towards middle perhaps left like arnold swar
FOXNEWS,Americas News HQ,environment want regulations red tape keeps us going ten years disapprove anyway want speed process said would open mined climate change interviewed number
FOXNEWS,The Kelly File,deal climate change initiatives resettling refugees overwhelming feeling among members barack obama kind u president think different reception think whole point idea making america great
FOXNEWS,Special Report With Bret Baier,carbon emissions back panel charlie push shocking argument say lot climate change stuff become something religion left religion within epa energy
FOXNEWS,Special Report With Bret Baier,debate climate change pruitt acknowledged human impact climate supports robust discussion effects government address jeb bush writing laura think environmental policy
FOXNEWS,The Five,better means making dead jobs climate change greg sort hit little bit minute ago refugees germany real problem issue anyway literally hundreds
FOXNEWS,FOX  Friends,anybody worried donald trump meeting al gore understand donald trump operates listens everybody like changed mind still saying climate change bunch bunk according reince priebus
FOXNEWS,Shepard Smith Reporting,first monday afternoon another surprise long list surprises coming trump tower president elect met former vice president al gore today issue climate change former vice president gore prominent activist fight
FOXNEWS,Special Report With Bret Baier,gore week got remember met new york times said open mind climate change paris climate accord conservatives wondering whether trump gone soft environmental regulations
FOXNEWS,Tucker Carlson Tonight,gone like kellyanne conway woman win first presidential election race actually count got progressive believes climate change order get lauded graduate universities
FOXNEWS,The Kelly File,gore week got remember met new york times said open mind climate change paris climate accord conservatives wondering whether trump gone soft environmental regulations
FOXNEWS,Fox News Sunday With Chris Wallace,victory midshipmen 15 years coming much exclusive interview donald trump ask clear exactly stands climate change big cabinet pick still make secretary state
FOXNEWS,The Five,meeting move forward sense right concern russia understand hearings see get beyond think left real concern russia excuse concern climate change fossil fuels
FOXNEWS,Fox News Sunday With Chris Wallace,victory midshipmen 15 years coming much exclusive interview donald trump ask clear exactly stands climate change big cabinet pick still make secretary state
FOXNEWS,Special Report With Bret Baier,gore week got remember met new york times said open mind climate change paris climate accord conservatives wondering whether trump gone soft environmental regulations
FOXNEWS,Outnumbered,meddling u election serious worry depends ask donald trump fascinating comments climate change paris climate deal fair balanced debate environmental policy trump administration scary accident board plane
FOXNEWS,Americas Newsroom With Bill Hemmer and Martha MacCallum,crowd tonight thank rally nice meet rally likely lot attention given defense tonight yesterday climate change talk tower vice president former vice president al gore dropped
FOXNEWS,Fox News Sunday With Chris Wallace,victory midshipmen 15 years coming much exclusive interview donald trump ask clear exactly stands climate change big cabinet pick still make secretary state
FOXNEWS,Special Report With Bret Baier,climate change believes real james mattis retired three years ago fans parties law requires military men retired seven years serving civilian defense secretary needs congressional waiver secretary transportation
FOXNEWS,FOX  Friends,ivanka trump taken upon make climate change something interest husband jared kushner apparently going move washington c closer father anyway al gore went meeting wound
FOXNEWS,Special Report With Bret Baier,wants version first lady role left republican party lot issues meeting originally wants portfolio climate change portfolio brand understand deal
FOXNEWS,Hannity,way produce food live live debate settled climate change fact face pan tarn mj cannot talk act joining us reaction bill cunningham fox news
FOXNEWS,The Kelly File,climate change think president view policy making guided science policy makers listening scientists inside government outside government reporter adding white house concerns reports pie president elect team
FOXNEWS,Special Report With Bret Baier,climate change think president view policy making guided science policy makers listening scientists inside government outside government reporter adding white house concerns reports pie president elect team
FOXNEWS,Shepard Smith Reporting,odds world body variety pressing issues support iranian nuclear deal climate change budget could soon line also former u n ambassador john bolton served george w bush talked president
FOXNEWS,Special Report With Bret Baier,outside government would hope wield still make case climate change real humans contributed want see sound science seen lot science absolutely start running amuck interior secretary
FOXNEWS,Special Report With Bret Baier,portfolio climate change portfolio brand understand deal going run business two brothers come washington part administration await announcement going fix
FOXNEWS,The Five,issues perhaps people concerned climate change love choice president elect best interest country feeling someone decision making steady hand ability resources throughout world
FOXNEWS,Special Report With Bret Baier,people planet decisions like crucial president obama stop infrastructure would lock worst effects climate change something administration president perhaps jonathan think enough positive environmentalists going
FOXNEWS,Americas Newsroom With Bill Hemmer and Martha MacCallum,intention using power office investigate politically motivated areas climate change exxonmobil eric schneiderman fair question ask time president elect real transparency issues need addressed january 20th patti ann schneiderman
FOXNEWS,Fox and Friends Saturday,side business regulation obama ideological interest climate change regulatory interests focused pro business agenda shoe horning things trump says want open make competitive want make sure rexnord
FOXNEWS,Special Report With Bret Baier,presidential nominee popular vote lost election may one think former vice president al gore came trump tower today sit climate change ivanka trump possibly bulk time
FOXNEWS,Special Report With Bret Baier,republicans conservatives climate change deal believe government interve intervene al gore literally making life united states expensive carbon taxes sorts things flies around world private jet movie problems
FOXNEWS,Tucker Carlson Tonight,ignore serving interest fundraising actually tucker make judgments basis fundraising tell right appreciate fact mr tillerson acknowledged climate change real problem appreciate fact voiced support
FOXNEWS,The Five,go climate secretary state go rogue go back climate change real quick echo concerns like fact think donald trump needs conversation donald trump reached
FOXNEWS,Tucker Carlson Tonight,electricity generation real point ignore serving interest fundraising actually tucker make judgments basis fundraising tell right appreciate fact mr tillerson acknowledged climate change real problem appreciate fact
FOXNEWS,The Kelly File,skepticism number occasions called climate change hoax think big scam lot people make lot money meantime china eating lunch partake rules regulations reporter critics
FOXNEWS,Special Report With Bret Baier,skepticism number occasions called climate change hoax think big scam lot people make lot money meantime china eating lunch partake rules regulations reporter critics
FOXNEWS,Americas News HQ,forward kevin well democrats going pick really going target would guess probably epa since climate change closest thing liberal democrats religion right think probably going focus look republican
FOXNEWS,Tucker Carlson Tonight,sparking loudest backlash left saw interview tucker selection oklahoma attorney general scott pruitt head epa skeptic issue climate change says settled science join coalition
FOXNEWS,Fox and Friends Sunday,love stories like coming show imagine church sunday mass instead preaching god preacher decides talk climate change would wonderful father john react new guidelines issued catholic church first winter storm
FOXNEWS,Fox and Friends Sunday,going position climate change going try get rid paris agreement almost 180 countries going sanctions russia mean sanction russia behavior ukraine crimea nato
FOXNEWS,FOX  Friends,view essentially climate change feel much intrusion tell donald trump approach yeah would hate want employees carry policies elected hilarious story
