Station,Show,Snippet
FOXNEWS,The Real Story,people climate change skeptics look mr tillerson secretary state head exson acknowledged climate change carbon tax
FOXNEWS,Shepard Smith Reporting,global warming global climate change trump meeting real surprise enwe know happening billed meeting ivanka interest climate change
FOXNEWS,Shepard Smith Reporting,global warming donald trump long called manmade climate change hoax something created china true meeting may another indication president elect might willing change position climate change
FOXNEWS,Hannity,warming even climate deniers world today climate change real urgent america take lead world addressing right one thing argue less global warming
FOXNEWS,Hannity,right one thing argue less global warming another deny happening overwhelming evidence climate changing part blame climate change threatens
FOXNEWS,Hannity,denied global warming far settle ld either accept science 99 scientific community says global warming
FOXNEWS,The OReilly Factor,watch denied global warming far settle ld either accept science 99 scientific community says global warming
FOXNEWS,Hannity,left constantly pushing fake narrative line global warming billy
FOXNEWS,Fox and Friends Sunday,pope releasing new guidelines priests forcing promote climate change kpp climate change
FOXNEWS,Hannity,welcomeback hannity left mainstream media melt turned blind eye real fake news global warming
FOXNEWS,The Kelly File,tracks coverage fact believes x z climate change religious test office country religion climate change
FOXNEWS,Special Report With Bret Baier,unhappy life climate haiherheretic believes carbon tax supports remedy problem sees one heresy believe climate
FOXNEWS,Happening Now,december things yeahing us keep jon president elect talking climate change
FOXNEWS,Happening Now,right got called hat chicago folks truff tough president elect voicing doubts climate change
FOXNEWS,Hannity,favor merely potential leader community bring people together tell got color mind society course republicans racists global warming fear
FOXNEWS,Happening Now,jon problem hold right got malcon lisa final thought problem president obama put climate change
FOXNEWS,Tucker Carlson Tonight,mr pruitt outside mainstream okay like mr pruitt okay secretary state found dishonest statement actually completely different page rex tillerson come carbon tax
FOXNEWS,Special Report With Bret Baier,warming cut greenhouse gas emissions save planet oceans rise destruction along coastline understand like church global warming also eyes many completely subsumed
FOXNEWS,The Kelly File,warming cut greenhouse gas emissions save planet oceans rise destruction along coastline understand like church global warming also eyes many completely subsumed
FOXNEWS,Tucker Carlson Tonight,responsible approach want environment protected people thinks earth getting hotter thinks dire predictions climate change way
FOXNEWS,Special Report With Bret Baier,lane start nomination pruitt epa administrator says debate climate change far settled part several lawsuits epa regulations greenhouse gas emissions thoughts
FOXNEWS,The Kelly File,lane start nomination pruitt epa administrator says debate climate change far settled part several lawsuits epa regulations greenhouse gas emissions thoughts
FOXNEWS,Fox and Friends Saturday,metal wrote culture corruption 2009 obama administration responsible kicking people foirg pushing people dared air dissent climate change issue
FOXNEWS,Outnumbered,experience many agencies dhs umbrella democrats outraged president elect choice lead epa describe oklahoma attorney general scott pruitt ally fossil fuel industry climate change denier
FOXNEWS,Special Report With Bret Baier,feel uncomfortable fact pushing forward candidate voting favor candidate nominee would know basically would favor climate change arena
FOXNEWS,Fox and Friends Saturday,questionnaire causing liberal media freak going put headlines questionnaire sent around trump transition team energy department workers asking know climate climate change
FOXNEWS,Hannity,thedoes thread fake ne web help elect donald trump left pushing global warming climate change real urgent america take
FOXNEWS,Hannity,thedoes thread fake ne web help elect donald trump left pushing global warming climate change real urgent america take
FOXNEWS,The Journal Editorial Report,settled different saying may may know big human role explains democratic party gone rails losing many levels government made climate change
FOXNEWS,The Kelly File,think feel uncomfortable fact pushing forward candidate voting favor candidate nominee would know basically would favor climate change arena
FOXNEWS,The Kelly File,controlled epa pruitt could immense damage air children breathe water drink attorney general oklahoma working hand glove energy industry call question science climate change
FOXNEWS,The Kelly File,believes carbon tax supports remedy problem sees one heresy believe climate change contributes increase severe weather events sin
FOXNEWS,Happening Now,well respected concerns climate change supports carbon tax said choosing rex tillerson rejecting somebody like mitt romney thinks russia real threat
FOXNEWS,Fox News Sunday With Chris Wallace,betrayed well first reflecting news trying make news astonished chris week president elect trump told new york times record would relook waterboarding relook paris accords climate change
FOXNEWS,Fox News Sunday With Chris Wallace,betrayed well first reflecting news trying make news astonished chris week president elect trump told new york times record would relook waterboarding relook paris accords climate change
FOXNEWS,Special Report With Bret Baier,campaign global warming chinese hoax designed hurt manufacturing 2009 children signed letter open letter saying believed wanted real action climate change one bedrock
FOXNEWS,Hannity,next ice age coming go ice age global warming climate change got excuse left case since started make argument three decades ago plus massive wealth
FOXNEWS,Hannity,next ice age coming go ice age global warming climate change got excuse left case since started make argument three decades ago plus massive wealth
FOXNEWS,FOX  Friends,great manager state department think knows cultures think actually brilliant box choice think anti climate change supported carbon tax past meanwhile donald trump said last night well good
FOXNEWS,Special Report With Bret Baier,think fine end day someone like rex tillerson vetting question also real concerns right carbon tax seems okay idea climate change questions
FOXNEWS,Special Report With Bret Baier,think fine end day someone like rex tillerson vetting question also real concerns right carbon tax seems okay idea climate change questions
FOXNEWS,Hannity,weather snows global warming snow global warming earthquake global warming one global warming matter blame everything 1970s saying
FOXNEWS,Hannity,weather snows global warming snow global warming earthquake global warming one global warming matter blame everything 1970s saying
FOXNEWS,Red Eye With Tom Shillue,barrel would resonate varmint turned global
FOXNEWS,Fox News Sunday With Chris Wallace,calling climate change
FOXNEWS,Hannity,global warming says far settled means accepting science either accept science 99 scientific community says global warming forecast people thought world
FOXNEWS,Happening Now,kids grandkids know climate change real scott pruitt climate change denier bad pattern putting foxes charge
FOXNEWS,Special Report With Bret Baier,part several lawsuits epa regulations greenhouse gas emissions thoughts nomination going drive left absolutely crazy started
FOXNEWS,Tucker Carlson Tonight,change far settled part several lawsuits epa regulations greenhouse gas emissions thoughts nomination going drive left absolutely crazy
FOXNEWS,Fox and Friends Sunday,real providential lives people believe climate change real catholic church getting involved climate change controversy new guidelines issued priests saying promoters
FOXNEWS,Tucker Carlson Tonight,naming pruitt epa administrator let bring panel steve haze laura ingram charles lane start nomination pruitt epa administrator says debate climate
FOXNEWS,Fox and Friends Saturday,trump team demands fuel fear energy department witch hunt trump team memo climate change alarms energy department staff ever gone climate change conferences ask types questions make
FOXNEWS,Special Report With Bret Baier,fact believes x z climate change religious test office country heard climate change kind religion fact care
FOXNEWS,The OReilly Factor,california right cusp climate change forefront environmental revolution know maybe went popular vote would better climate change better environment
FOXNEWS,Special Report With Bret Baier,fact believes x z climate change religious test office country heard climate change kind religion fact care
FOXNEWS,Tucker Carlson Tonight,fact believes x z climate change religious test office country heard climate change kind religion fact care
FOXNEWS,Shepard Smith Reporting,highlighted said spent time trump ivanka alone whichized positive meeting think president elect loving parade luminaries keeping us guessing said climate
FOXNEWS,FOX  Friends,estimation democratic party identity politics greenhouse gas stuff like republicans ones talking jobs wound voting local republican instead first time ever
FOXNEWS,The OReilly Factor,revolution electoral college today washington post put heditorial blaming climate change electoral college far left going go point climate change happened well basically
FOXNEWS,Happening Now,often critics agencies asked run particular advocate climate change know concern human involvement climate change interestingly somebody comes texas big
FOXNEWS,Fox and Friends First,pruitt also suggested debate global warming far settled environmental activists already criticizing
FOXNEWS,The Five,excuse try block somebody somebody real issue say underlying issue always climate change one knocks right exxonmobil issues climate change something rex
FOXNEWS,Tucker Carlson Tonight,started think going fight hard fight anything trump administration puts forward goes heart argument planet warming cut greenhouse gas emissions save planet oceans rise
FOXNEWS,Tucker Carlson Tonight,top respected intolerance side well steve trump met al gore week got remember met new york times said open mind climate
FOXNEWS,Special Report With Bret Baier,think going fight hard fight anything trump administration puts forward goes heart argument planet warming cut greenhouse gas emissions save planet oceans rise destruction along
FOXNEWS,Hannity,cooling money global warming al gore milliona e millionaire normal americans know going normal
FOXNEWS,Hannity,cooling money global warming al gore milliona e millionaire normal americans know going normal
FOXNEWS,The Journal Editorial Report,democrats saying question russia interesting exxon endorsed carbon tax sort way truth add versaill
FOXNEWS,Hannity,remember left constantly pushing fake narrative line global warming billy cunningham monica crowley willw weigh discuss
FOXNEWS,The OReilly Factor,addressed economic concerns felt like gave voice something democratic party doubling going far left call revolution electoral college today washington post put heditorial blaming climate
FOXNEWS,Special Report With Bret Baier,global warming become new religion discuss proper reporter pruitt vindictive toward opponents said call upon
FOXNEWS,The Kelly File,gas allies maintain science global warming settled despite conflicting evidence tore pruitt environmental emergency person
FOXNEWS,Happening Now,get ugly people temperature global warming quite real fits exact round michael think assessment
FOXNEWS,Special Report With Bret Baier,global warming become new religion discuss proper reporter pruitt vindictive toward opponents said call upon
FOXNEWS,Tucker Carlson Tonight,global warming become new religion discuss proper reporter pruitt vindictive toward opponents said call upon
FOXNEWS,The Five,put hysteria global warming like like look terror think part climate
FOXNEWS,Special Report With Bret Baier,carbon tax paris climate accord trump vowed walk away ti march expressed interest business right conditions iran lot european competitors working
FOXNEWS,Happening Now,climate change think administration graveitating lukewarm point vow
FOXNEWS,Hannity,print think relationship china ok normal people understand global warming going cooling eons without human involvement earthquakes sun spots avalanches stsunamis affec
FOXNEWS,Hannity,print think relationship china ok normal people understand global warming going cooling eons without human involvement earthquakes sun spots avalanches stsunamis affec
FOXNEWS,FOX  Friends,visited ivanka wound meeting donald trump going suddenly global warming leave president elect opinion
FOXNEWS,Hannity,blind society course republicans racist global warming fear mongering early morning today show donald trump talked relationship current commander chief
FOXNEWS,Americas Election HQ,worst week afraid know often comes behind snow well snowmen guy may concerned global warming
FOXNEWS,Hannity,crazy stuff said like watch hillary clinton make solving climate crisis top national priority owpponent based idea presented would take
FOXNEWS,Fox and Friends First,met al gore climate change leonardo given copy documentary ef
FOXNEWS,Americas News HQ,daughter ivanka trump could take climate change reopening wounds bitter campaign fight
FOXNEWS,The Kelly File,demonized noting stable temperatures 150 year sgls global warming become new religion discuss proper reporter pruitt
FOXNEWS,The Kelly File,tower john thank obama administration trying reinforce scientific ideological firewall around finding global warming exists man made president outgoing interior secretary today one
FOXNEWS,The Kelly File,people priorities concerns guy says could take advantage hopefulness next obama administration takes one final shot global warming skeptics cover
FOXNEWS,Special Report With Bret Baier,tower john thank obama administration trying reinforce scientific ideological firewall around finding global warming exists man made president outgoing interior secretary today one
FOXNEWS,Outnumbered,one one thing say leonardo dicaprio believe global warming existential threat world need reduce carbon emissions may
FOXNEWS,Tucker Carlson Tonight,tillerson come carbon tax supportive paris agreement spring positions lost audio hear mr krupp unfortunately come back fred
FOXNEWS,Fox and Friends Saturday,lessons election cycle hillary clinton lost hillary clinton comes talks leonardo decaprio global warming message says son nate disconnect starting election officials
FOXNEWS,Special Report With Bret Baier,gas allies maintain science global warming settled despite conflicting evidence tore pruitt environmental emergency person climate denier
FOXNEWS,Hannity,simple thing money global cooling money global warming like watergate follow money think billions dollars transferred wealthier nation poor nations think control fossil
FOXNEWS,The Five,lies lies twitter mainstream media women make 77 cents dollar fracking harmful police shootings global warming killing polar bears cuba gives great health care
FOXNEWS,Hannity,left mainstream media melt turned blind eye real fake news global warming pressed press years true earth
FOXNEWS,Outnumbered,global warming connection actions mankind debate encouraged classrooms public forums halls congress silenced threats prosecution dissent crime meghan
FOXNEWS,The Five,say going next global warming alarmists visit trump tower president elect taps climate critic head epa mr trump details return
FOXNEWS,The Five,creates global warming think donald trump trolling al gore mean look think donald trump smart listen theory philosophy pie sky ideas entertain
FOXNEWS,Americas News HQ,year recently arranged father met former vice president al gore hear views global warming took environmentals surprise met leonardo talk abut environment
FOXNEWS,Hannity,simple thing money incooling money global warming like watergate follow money think billions dollars transferred wealthier nation poor nations think control fossil
FOXNEWS,Special Report With Bret Baier,gas allies maintain science global warming settled despite conflicting evidence tore pruitt environmental emergency person climate denier
FOXNEWS,Americas News HQ,president elect donald trump fills cabinet choices raising eyebrows pundits say picks like global warming skeptic scott pruett epa fast food exec andy putser secretary
FOXNEWS,Tucker Carlson Tonight,gas allies maintain science global warming settled despite conflicting evidence tore pruitt environmental emergency person climate denier
FOXNEWS,Fox and Friends First,productive conversation two opposite ends climate change subject ben carson housing development
FOXNEWS,Hannity,campaign attacks came former vice president crazy stuff said like watch hillary clinton make solving climate crisis top national priority opponent based ideas
FOXNEWS,Tucker Carlson Tonight,audio right point look hear mr krupp rex tillerson opposite side issues guy carbon tax bunch sides carbon issues
FOXNEWS,The Kelly File,global corporation need stabilize middle east need somebody fourth highest ranked person government go around world advance u interests reporter tillerson leadership exxon backed carbon tax paris climate
FOXNEWS,Fox and Friends Sunday,pick ceo big job like got look policy positions advocating carbon tax makes worried look lot issues need explored pick somebody never
FOXNEWS,The Journal Editorial Report,successful one democrats questioning almost russia exxon endorsed carbon tax decade certain way kind truth advertising say carbon already taxed tax
FOXNEWS,Americas Newsroom With Bill Hemmer and Martha MacCallum,could radical change energy policy hi william well martha instead focus climate change trump wants energy independence
FOXNEWS,The OReilly Factor,shoes global warming know happens gets warmer take layer find arms racial equality last time checked black president yeah still mean
FOXNEWS,FOX  Friends,moment time passed many say lot good ideas part represents democratic party stresses global warming biggest threat entire planet rather jobs
FOXNEWS,Fox and Friends First,washington post says another problem electoral college makes harder fight global warming blame george w bush woifrn al gore delaying response issue expects mr trump make
FOXNEWS,The Kelly File,throughout entire career reporter recent weeks ivanka arranged father meet former vice president al gore hear views global warming move took environmentalists surprise met twice leonardo
FOXNEWS,Special Report With Bret Baier,energy policy also want something global warming nuances position want something want kill american businesses yeah policy disagreement
FOXNEWS,Fox News Sunday With Chris Wallace,excuse losing global warming effect population george mean story cia conclusion comes time president obama calling full review intelligence agency russian involvement
FOXNEWS,The Kelly File,throughout entire career reporter recent weeks ivanka arranged father meet former vice president al gore hear views global warming move took environmentalists surprise met twice leonardo
FOXNEWS,Special Report With Bret Baier,advantage hopefulness next obama administration takes one final shot global warming skeptics heart beats one hundred thousand times day sending oxygen muscles lift even demanding weight
FOXNEWS,Special Report With Bret Baier,general kelly said afternoon would consider honor oklahoma attorney general scott pru says sold science global warming pick run epa linda mcmahon trump choice
FOXNEWS,Hannity,sanctuary city administrations may change values principles relates inclusion global warming alarmist al gore trump tower earlier week however remember
FOXNEWS,Tucker Carlson Tonight,destruction along coastline understand like church global warming also eyes many completely subsumed idea business still exist balance
FOXNEWS,The OReilly Factor,shoes global warming know happens gets warmer take layer find arms racial equality last time checked black president yeah still mean
FOXNEWS,Fox and Friends First,kissinger former vice president al gore meet evivanka trump climate change gore says length yy
FOXNEWS,The Journal Editorial Report,swift bernie sanders calling climate change denier leaving decision sad dangerous us dan henninger editorial board member mary
FOXNEWS,Tucker Carlson Tonight,krupp think working audio right point look hear mr krupp rex tillerson opposite side issues guy carbon tax bunch
FOXNEWS,The Kelly File,scientists man contributes paris climate accord wants think still energy policy also want something global warming nuances
FOXNEWS,Fox and Friends Sunday,might agree pope another bishop another priest another catholic specifics example science global warming may may yot issue issue
FOXNEWS,FOX  Friends,pro global warming speaking waiting wondering vice president joe biden made mind running 2020 keep mind even though today may look little bit gloomy may dark outside
FOXNEWS,Shepard Smith Reporting,may mean nothing gore originally scheduled meet trump oldest daughter ivanka decided take issue global warming sure going immigrant way new york post
FOXNEWS,Special Report With Bret Baier,coastline understand like church global warming also eyes many completely subsumed idea business still exist balance protecting environment business able operate
FOXNEWS,Your World With Neil Cavuto,business leaders create jobs lift people improve income think well would say time extreme economic inequality next global warming biggest problem time
FOXNEWS,Tucker Carlson Tonight,equality father made practice company throughout entire career reporter recent weeks ivanka arranged father meet former vice president al gore hear views global warming move took environmentalists
FOXNEWS,Americas News HQ,comments issue like twitter post said concept global warming created chinese make u manufacturing noncompetitive later said comments joke questioned paris climate agreement
FOXNEWS,Americas Newsroom With Bill Hemmer and Martha MacCallum,gore trump tried find common ground likely find whole lot think thing watch trump climate global warming picks energy secretary head epa likely come
FOXNEWS,Special Report With Bret Baier,democrats try turn religious test believer global warming issue believer constitution epa administer law make would fight republicans think
FOXNEWS,Special Report With Bret Baier,democrats try turn religious test believer global warming issue believer constitution epa administer law make would fight republicans think
FOXNEWS,Happening Now,fact cheap seams natural concerns climate change reporter booming natural gas industry promises revitalize struggling coal communities
FOXNEWS,Fox and Friends Sunday,fact 1 vote day supreme court denied appeal climate change permanent part catholic church
FOXNEWS,Special Report With Bret Baier,haze laura ingram charles lane start nomination pruitt epa administrator says debate climate change far settled
FOXNEWS,Special Report With Bret Baier,wanted real action climate change one bedrock beliefs things believeved r many years like torture open
FOXNEWS,The Five,schwarzenegg schwarzenegger expected terminator got kindergarten cop embraced climate change everything whole bible sucked problem
FOXNEWS,The Five,pr propagandaists remember climate change one arena scientific method testing modification theories scorned infected political ideology question
FOXNEWS,Fox and Friends Sunday,everything care everything creation promote climate change talk clamt change breaking news vatican believes taking care creation
FOXNEWS,Fox and Friends Sunday,mass hear climate change feels like political subject good 45 minutes homily today overlapping talking
FOXNEWS,Outnumbered,president obama policies despite cabinet picks tom price obama care critic fast food ceo andy puzder climate change skeptic scott pruitt oklahoma attorney
FOXNEWS,Americas News HQ,move another topic want talk ivanka trump makes make climate change one first issues despite father past
FOXNEWS,Shepard Smith Reporting,climate change biggest threat united states says nuclear proliferation someone apologize saying donald trump packing campaign promise
FOXNEWS,Special Report With Bret Baier,elected high list priorities interesting donald trump said campaign global warming chinese hoax designed hurt manufacturing 2009 children signed letter open letter saying believed
FOXNEWS,Hannity,values principles relates inclusion course global warming alarmist former vice president al gore trump tower earlier week however remember campaign attacks came former vice president
FOXNEWS,Special Report With Bret Baier,equality father made practice company throughout entire career reporter recent weeks ivanka arranged father meet former vice president al gore hear views global warming move took environmentalists surprise
FOXNEWS,Special Report With Bret Baier,homeland security according retired general kelly said afternoon would consider honor oklahoma attorney general scott pru says sold science global warming pick run epa linda mcmahon trump choice
FOXNEWS,Tucker Carlson Tonight,right global warming think key question laughter everybody thinks better kill jobs behalf paris accord liberal democrat everybody thinks working
FOXNEWS,FOX  Friends,sierra club says like putting arsonist part fires said climate change far settled science obviously left
FOXNEWS,Fox and Friends First,opposite ends climate change debate time president elect donald trump extremely interesting conversation continued leave
FOXNEWS,Special Report With Bret Baier,always said believes climate change real reporter ivanka husband jared kushner traveled washington c sunday dined family hotel
