Station,Show,Snippet
FOXNEWS,Tucker Carlson Tonight,much coming keep hearing watching television country many people dying climate change united united state leading cause death
FOXNEWS,Americas Newsroom With Bill Hemmer and Sandra Smith,category whole country county worst entire country afford sacrifice climate change beautiful easter thank sandra one pro sport team
FOXNEWS,The Five,existential threat democracy even mean greg overused term existential threat asteroid cataclysmic climate change islamic terror time stuck elevator maroon 5
FOXNEWS,Tucker Carlson Tonight,internet fact corrected everywhere even harvard teaching called climate change syrian civil war revisited global fear face aoc using
FOXNEWS,The Story With Martha MacCallum,take trek put life risk wrong message martha tagline ignored climate change pay debt allowing everyone country made
FOXNEWS,Hannity,far asylum request walk border say know climate change want come country sean think firestorm senator water
FOXNEWS,FOX  Friends,thank steve felt nation immigration crisis caused democrat acknowledge one think aoc say climate change talk coming
FOXNEWS,FOX  Friends,agree welcome surprised take brutal regime corrupt politician climate change surprised would confront policy come socialism country
FOXNEWS,The Five,something care calling change climate change talking green new deal people say guy actually serious greg embracing donald trump relentless attempt deal
FOXNEWS,Fox News  Night With Shannon Bream,also shared video left wing organization whose founder notably critic capitalism watch wildfire alberta hurricane importer rico climate change one reason many u forced
FOXNEWS,Tucker Carlson Tonight,found internet n fact corrected everywhere even harvard teaching called climate change syrian civil war revisited aoc using
FOXNEWS,Fox and Friends Sunday,sure make case yeah used party working class union sited climate change activist way worker trump resonated
FOXNEWS,Americas News HQ,greater natural disaster taking place hundred year storm occurring regular basis important need going forward adequately address climate change future generation
FOXNEWS,Americas News HQ,former texas congressman beto rourke iowa yesterday speaking crowd voter el paso native call climate change want reinstitute former president obama plan also asked issue touch equal
FOXNEWS,The Ingraham Angle,house freshman issue climate change asking skeptic saying instance talk retrofitting every building america trying make country carbon free 2030
FOXNEWS,The Ingraham Angle,government people california new york way revolutionary candidate basically carbon copy radical house freshman issue climate change asking
FOXNEWS,Town Hall America with Harris Faulkner,question climate change real weather dead 12 year like aoc said let say something harris hear little guttural voice clear
FOXNEWS,Fox and Friends First,cut back air travel due climate change another person jokingly joked croissant basic human right freed clear people going mock say
FOXNEWS,Tucker Carlson Tonight,habitat destroyed sea rise insect spread like world going end 12 year address climate change like war world war ii
FOXNEWS,Tucker Carlson Tonight,question climate change bad bad bad world war ii fact existentially bad die thehe singular crisis face crisis could worse lead
FOXNEWS,Tucker Carlson Tonight,congress would rather people campaign people funded controlling future vote people everyday american tucker believe climate change existential problem
FOXNEWS,Tucker Carlson Tonight,google com scientist understand climate change tucker membership committee allows u association scientist scientist tucker okay great checkec want thank association scientist
FOXNEWS,Fox and Friends First,29 year old america lighting rod far left idea shaking washington right alexandria ocasio cortez facing major backlash comparing impact climate change 9 11 pushing green new
FOXNEWS,FOX  Friends,next brian plus alexandria ocasio cortez comparing threat climate change event september 11th 2001 thousand american died largest terrorist attack u soil brian okay
FOXNEWS,FOX  Friends,talking threat climate change made comparison worst terror attack united state play get analysis watch okay event september 11th 2001
FOXNEWS,FOX  Friends,waiter amazing meal asked segment fox friend talking environment wanted come say climate change urgent carbon go
FOXNEWS,The Five,thing might especially address climate change smart way talking jan 4 nuclear power marie sure right around corner greg new idea come
FOXNEWS,Fox and Friends First,leaving mark social medium impersonating congresswoman alexandria ocasio cortez take listen doubt cow fart making climate change socialism actually short social medium know
FOXNEWS,Fox and Friends First,think 8 year old mock alexandria ocasio cortez impersonation twitter video mock doubt cow fart making climate change socialism actually short social medium know
FOXNEWS,Outnumbered,presidential candidate believe green new deal enough getting behind climate change policy would help fossil full exploration entirely affect 2020 presidential race joe biden expected
FOXNEWS,Tucker Carlson Tonight,climate change fever need get back 98 planet die know 3 went think used print transcript mother
FOXNEWS,Fox News  Night With Shannon Bream,taking proper regulatory act climate change causing drought hurricane tornado war unfairly driving people home incumbent u american open border
FOXNEWS,Your World With Neil Cavuto,quickly 2019 strong healthy debate people bring issue table jay ensley talk climate change think see
FOXNEWS,Tucker Carlson Tonight,another idea revealed 5 trillion plan fight climate change announcing ambitious climate plan history united state ensure
FOXNEWS,The Five,proposal greg think juan right sense could going say democrat speaking climate change talking nuclear power solar wind deluded
FOXNEWS,Americas Newsroom With Bill Hemmer and Sandra Smith,school housing initiative must also invest resiliency risk mitigation current infrastructure deal climate change leader schumer also offered preview senate floor important remember
FOXNEWS,Americas Newsroom With Bill Hemmer and Sandra Smith,seen massive wage increase record unemployment particular group versus let raise tax combat climate change think lot people get booth vote wallet pocket book sandra wow
FOXNEWS,Special Report With Bret Baier,begin delivering assistance crisis stricken country police say arrested 120 people climate change protester blocked major bridge intersection central london bringing traffic standstill group called extension
FOXNEWS,Special Report With Bret Baier,rebellion looking several week civil disobedience failure tackle cause climate change russia lower changer parliament adopted bill would expand government control internet requires internet provider
FOXNEWS,FOX  Friends,ainsley sean thank thank ainsley welcome alexandria ocasio cortez new theory causing migrant crisis say climate change lawrence jones something say join u next
FOXNEWS,Your World With Neil Cavuto,way want blame climate change everything sorry green new deal going solve wreck economy maybe immigrant want come anymore see downturn great recession
FOXNEWS,Your World With Neil Cavuto,argument mean taking seriously willing anything still climate change denier admit find way fix help side farmer hunter fisherman biggest environmentalist
FOXNEWS,The Five,immigrant flea country embrace sander aoc idea fleeing climate change actually fleeing idea belong aoc bernie come horrible capitalist society crated wealth
FOXNEWS,The Five,immigration juan think mean spirited greg exactly want jesse mean spirited say blood hand juan term climate change jesse yes juan think
FOXNEWS,Justice With Judge Jeanine,congresswoman ocasio cortez please keep pushing green new scam stand behind let stand behind climate change right stephanie jonathan harris leave next week thank attack left
FOXNEWS,The Daily Briefing With Dana Perino,healthcare consistent number one issue never seen gap like healthcare number one issue 51 climate change 17 going talk democrat going college campus court
FOXNEWS,Fox and Friends First,alexandria ocasio cortez blaming current immigration crisis climate change exactly talking charlie kirk reaction freshman congressman coming jillian steve doocy fox friend
FOXNEWS,Fox News  Night With Shannon Bream,congresswoman ocasio cortez offered leadership one day one week president trump lifetime subject conservative quick attack john kerry climate change credential fairness year
FOXNEWS,Fox News  Night With Shannon Bream,toward believe u offer gop congressman dan crenshaw number speak due climate change every immigrant come across different reason wanting come across
FOXNEWS,Americas News HQ,convince doubter yes exactly purpose committee hearing going delve history climate change know knew current situation addressing
FOXNEWS,The Story With Martha MacCallum,world nuclear weapon tell else view national security issue god nation reject trump idea climate change hoax cheer applause
FOXNEWS,Watters World,canada believe forcing people leave home climate change many issue know looking global perspective regional perspective jesse thinking
FOXNEWS,Americas News HQ,greatest security threat united state climate change moment spoke moving forward turning page going new chapter said look back would talk 20 year ago
FOXNEWS,Tucker Carlson Tonight,dr ocasio cortez say entire human race 12 year live avoid catastrophic effect climate change cut emission half 12 year 12 year
FOXNEWS,Tucker Carlson Tonight,vote people every day american tucker believe climate change existential problem planet going end planet 12 year science religion drop
FOXNEWS,The Five,memory scary one looking around greg usually glacier move unusual glasure moved rather quickly dana climate change greg blaming al gore
FOXNEWS,FOX  Friends,climate change longer something esoteric scientific fact something something right need pas green new deal health care right publicly funded
FOXNEWS,Outnumbered,katie sean need fight back policy level katie sean pregiving solution issue pollution thing like people agree climate change green new deal big government solution
FOXNEWS,Outnumbered Overtime With Harris Faulkner,climate change think eventually something meaningful think legislator florida starting conversation think starting conversation versus republican absolutely nothing going plus
FOXNEWS,Tucker Carlson Tonight,class rural people list unless secretly want retire early case really sick job go gas tax democrat united one question climate change bad
FOXNEWS,Hannity,climate change previously told u may stop kid altogether worried grandkids little confused appears like unbuilt furniture apartment congresswoman
FOXNEWS,Hannity,leader afraid fight climate change suntan lotion big deal sean dead comment take seriously like said
FOXNEWS,Fox and Friends First,family grandparent fought principle equal right united state grandchild able hide fact fought acknowledging taking bold action climate change see
FOXNEWS,Fox and Friends First,correlation racist behavior opinion climate benny say bode well country point charisma matter substance john say aoc climate change civil right two thing
FOXNEWS,FOX  Friends,flag dying fountain red calling nbc take action climate change hollywood took firefighter hour get using ladder truck 60 people arrested incredible video show water
FOXNEWS,FOX  Friends,steve mayor bill glaza new idea stop climate change new york take new york city back stone age going ban classic glass steel sky scraper steve lot
FOXNEWS,Fox and Friends First,globe waving green flag inside fountain read calling nbc take action climate change hollywood firefighter spent hour getting using ladder truck 60 people arrested remember moment jeb bush failed presidential
FOXNEWS,Tucker Carlson Tonight,ground want ban climate ground think ridiculous even earth day showed street los angeles perfect reminder climate change essentially boutique
FOXNEWS,Tucker Carlson Tonight,environmental activist spending whole day working live town new hampshire 95 recovered climate change fever need get back 98 planet die
FOXNEWS,Outnumbered,plan climate change go beyond green deal know possible could another litmus test 2020 democrat next stay u hard work leaf mark show clothes
FOXNEWS,The Five,climate change republican plan yet want scream everyone else say let rational conversation better term energy efficiency dana 115 people leaving city day
FOXNEWS,The Story With Martha MacCallum,ed hollywood listing biggest star save earth justin bieber miley cyrus area negron day thank coming next effort combat climate change youtube video already 5 million view
FOXNEWS,Shepard Smith Reporting,current democratic party want run centrist lane find support went candidate focus climate change income equality pushing idea forward heard
FOXNEWS,Fox News  Night With Shannon Bream,climate weather pattern little bit beyond left trying say taking proper regulatory action climate change causing drought
FOXNEWS,FOX  Friends,steve democrat sent letter yesterday chuck nancy calling substantial new real revenue mean tax investment make infrastructure resilient climate change neither sound like something president would board
FOXNEWS,Special Report With Bret Baier,come 5 trillion price tag paid mostly rich american corporate tax wait see climate change help ground need president work american afford
FOXNEWS,Fox News  Night With Shannon Bream,see climate change help gain ground democratic primary new front runner need president work american afford reporter today 600 person
FOXNEWS,Your World With Neil Cavuto,talked free college check say climate change said clean energy obama era progressive party think think speech careful throw
FOXNEWS,Outnumbered,climate change missing mark would dagen know administration biggest hurdle court decision would interest congress get board changing policy
FOXNEWS,Outnumbered,believing something would inevitably happen many instrument table maybe address climate change may degree new deal solution marie real answer agree made democrat
FOXNEWS,The Story With Martha MacCallum,already facing aging population seriously taking climate change create million job worker fill truth leader stoking fear divide progressive majority take power
FOXNEWS,The Story With Martha MacCallum,special kind crazy draw climate change highlighted alberta surge caravan coming alberta across border coming central south america got tell
FOXNEWS,Hannity,like pollen pet dust new memory start dusting old one feel clarity live claritin clear sean congresswoman alexandria ocasio cortez fresh set climate change hysteria week house oversight hearing
FOXNEWS,Hannity,pas something bat failed accomplished complaining horrible execution also say climate change issue leading border issue people coming nonsense
FOXNEWS,FOX  Friends,never talk causing people flee home first place would forced confront one major factor fueling global migration climate change brian exactly money communist ruling nicaragua daniel
FOXNEWS,FOX  Friends,ortega horrible condition el salvador third country decided come america maybe two third would love climate change tomi lahren heard responded alexandria ocasio cortez
FOXNEWS,FOX  Friends,immigrant noticed never talk people causing flee home first place perhaps would forced confront one major factor fueling global migration climate change brian curious fox news contributor lawrence jones
FOXNEWS,FOX  Friends,pay cartel emboldening movement get across climate change causing people get across border country government dictator suck corruption
FOXNEWS,The Five,aoc might embrace idea read juan surprised greg think agreement think republican control house senate nothing climate change nothing immigration nothing
FOXNEWS,The Story With Martha MacCallum,think seven ice age educate people reality true science martha obviously lot debate climate change want play pete bu buttigieg
FOXNEWS,The Five,would scolded would politically incorrect know industry vocal climate change hollywood one guilty idling truck every street independent film catering truck
FOXNEWS,The Daily Briefing With Dana Perino,voter reliable voter probably climate change camp voter healthcare think back 2018 reason democrat took house ran healthcare ran fact
FOXNEWS,The Daily Briefing With Dana Perino,kid going affected climate change issue voter focused dana want talk college voter issue reliable voting block top two candidate
FOXNEWS,Hannity,hand unless pas something failed horrible execution also say sean climate change issue leading border issue nonsense people paying cartel look get lot lovely
FOXNEWS,Fox News  Night With Shannon Bream,causing people flee home first place perhaps forced confront one major factor fueling migration climate change also shared video left wing leap organization whose founder notably critic capitalism watch
FOXNEWS,Outnumbered Overtime With Harris Faulkner,let talk politics climate change green new deal socialism kind coming forefront loud new voice inside political party grab onto platform get language
FOXNEWS,Justice With Judge Jeanine,ocasio cortez please keep pushing green new scam stand behind let stand behind climate change right stephanie jonathan harris leave next week thank attack left keep coming president trump
FOXNEWS,Justice With Judge Jeanine,ocasio cortez please keep pushing green new scam stand behind let stand behind climate change right stephanie jonathan harris leave next week thank attack left keep coming president trump
FOXNEWS,The Story With Martha MacCallum,combat climate change fear much kind world leaving kid term drought flooding extreme weather disturbance rising ocean level thing happen way become
FOXNEWS,The Journal Editorial Report,wanted moderate rather liberal paul mean biden get take left wing position say something climate change green new deal way
FOXNEWS,Outnumbered,discussion environment make sure climate change denier front conversation katie denier okay must denier jessica right said melissa outnumbered moment right back
FOXNEWS,The Daily Briefing With Dana Perino,midwest flooding california burning people realize climate change real say burying head sand think worse solution might try demonize democrat putting forward
FOXNEWS,Hannity,poverty jessie water good see welcome know help leader afraid yes civil right real fight fight climate change sun tan lotion big deal
FOXNEWS,Hannity,sworn uphold protect u constitution would understand context amendment u constitution maybe little much expect given congresswoman compared climate change world war ii 9 11 hurricane katrina
FOXNEWS,Hannity,see climate change see new green deal socialist policy way hillary never charged crime investigation know deep state lindsey graham
FOXNEWS,Outnumbered,camera good discussion jessica solve climate change problem ari politest group ever lisa except ari great right dagen hello love back
FOXNEWS,Hannity,democratic lieutenant governor virginia quiet saw covington high school kid would even slander 16 year old kid see climate change see new green deal socialist policy
FOXNEWS,Fox News  Night With Shannon Bream,ucla cal state played quarantine student cannot prove gotten measles vaccine restaurant california adding 1 surcharge help fight climate change supporting environmentally practice prominent restaurant owner say
FOXNEWS,Americas Newsroom With Bill Hemmer and Sandra Smith,divided bernie sander elizabeth warren primary season said candidate sandra checking box climate change healthcare immigration gun reform think need say
FOXNEWS,Americas Newsroom With Bill Hemmer and Sandra Smith,climate change healthcare economy republican push democrat former bank guy going important message party question president message talking message
FOXNEWS,FOX  Friends,focus climate change ultimately issue solvable planet start catching fire dead u good see much money could make todd said dad talking
FOXNEWS,Your World With Neil Cavuto,might good president put pace account answer position often think amount one word know hoax climate change wall immigration let flesh little bit
FOXNEWS,Outnumbered,flee home first place perhaps would forced confront one major factor flew fueling global migration climate change argument made syria well marie lot evidence department defense
FOXNEWS,Outnumbered,tell number migrant world forced flee home climate change pete laugh melissa let finish pete marie laugh grade pete marie affirmative defense get serve
FOXNEWS,Outnumbered,extreme case number people arguing like charm people progressive side committed 30 year fighting climate change social justice issue think interesting teresa point got support 2016
FOXNEWS,Your World With Neil Cavuto,ridiculous offered suggestion think people risking life putting child life risk weather think u huge threat climate change would flee getting ticket
FOXNEWS,The Five,pitbull let go guarantee thing going going end republican conservative libertarian may think climate change health care huge problem ignore peril
FOXNEWS,The Story With Martha MacCallum,around like matt bevin reporter asked stand climate change matt governor kentucky like science sure know globe covered ice quite bit almost lot ice go
FOXNEWS,The Daily Briefing With Dana Perino,2020 yes voter really focused democratic voteders youth vote look block voter need involved climate change issue going affect much family
FOXNEWS,Fox and Friends First,member reveals really happening border alexandria ocasio cortez blaming micro crisis climate change congressman dan crenshaw firing back morning crossfit gym really engaged people making everybody feel welcome
FOXNEWS,Fox News  Night With Shannon Bream,alexandria ocasio cortez could blunt saying new green deal get past take immediate drastic action fight climate change blood hand freshman congress member went twitter attack
FOXNEWS,Fox News  Night With Shannon Bream,congresswoman ocasio cortez offered leadership one day one week donald trump lifetime subject conservative quick attack john kerry climate change credential fairness year covered central american caravan found fled
FOXNEWS,Americas Newsroom With Bill Hemmer and Sandra Smith,maybe would forced confront one factor climate change conclusion draw make commentary get upted president want get chance respond let say causing
FOXNEWS,Fox and Friends Saturday,hand unless something climate change maybe somebody put together proposal green new deal see many vote got senate got zero democrat horrible execution new york amazon longer coming
FOXNEWS,FOX  Friends,climate change healthcare immigration gun reform great issue steve perfect set former president berlin saturday one thing worry sometimes among progressive united state maybe true
FOXNEWS,Outnumbered Overtime With Harris Faulkner,around another seven eight month let put room amy klobuchar side let get climate change program work harris let put aoc representative matt gaetz let side next generation
FOXNEWS,Sunday Morning Futures With Maria Bartiromo,pragmatic people certainly understand importance dealing climate change serious way want something actually pass want something actually help bringing idea let say universal
FOXNEWS,Life Liberty  Levin,climate change story really interested science want understand better trying figure true true trying understand self political
FOXNEWS,Americas News HQ,democratic congressman california house oversight committee member new democratic coalition congressman thank joining u thank understand climate change agenda committee hearing tuesday hope accomplish aiming perhaps
FOXNEWS,Cavuto Live,well try talk thing like focus climate change focus healthcare focus trump jerk argue number let talk number right couple thing
FOXNEWS,Tucker Carlson Tonight,green new deal essentially saying cost climate change admit cost associated put every day people put people fleeing home whose home hurt
FOXNEWS,Tucker Carlson Tonight,going take elected people funded politician represent people bank whether democrat republican tucker okay using climate change pretext taking basic decision life big toilet
FOXNEWS,The Daily Briefing With Dana Perino,table want seat table discussion wide range issue environment economic inequality want address climate change want see insure american see direction
FOXNEWS,Tucker Carlson Tonight,going people like alexandria ocasio cortez elected green new deal essentiallyay saying cost climate change admit cost associated put every day
FOXNEWS,FOX  Friends,really want howard schultz talk climate change specifically green new deal support support yeah really important keep low 2 degree consequence consequence devastating todd pay pay world
FOXNEWS,Americas Newsroom With Bill Hemmer and Sandra Smith,really authentic issue using conflating promote thing like climate change need bronx right right need right charter school south bronx lowest economic
FOXNEWS,Tucker Carlson Tonight,nation need come behind goal need energy young people people really want move climate change tucker mind group estimate green new deal would cost household 600000 ten year period
FOXNEWS,Fox News  Night With Shannon Bream,misstep least meeting republican halfway issue one democrat 2020 mix talk something wrote said driving lot problem illegal immigration number one climate change lot people coming
FOXNEWS,Your World With Neil Cavuto,also climate change okay biden going define similarly candidate backed green new deal know saying people midwest make living building thing making thing moving thing neil think
FOXNEWS,Fox and Friends Sunday,gun reform climate change health care formation reform somewhere spectrum far left spectrum let honest lot
FOXNEWS,The Five,number one issue politician representative government saying going speak issue voter going try something republican speaking climate change open door kind
