Station,Show,Snippet
FOXNEWS,The Five,democratess worried global warming losing sleep two dozen took part nighter senate floor hope wake congress climate change vast majority american people understand climate change real
FOXNEWS,The Five,might happened stay u democratess worried global warming losing sleep two dozen took part nighter senate floor hope wake congress climate change
FOXNEWS,FOX and Friends First,money handing 700000 theater company make musical global warming
FOXNEWS,Special Report With Bret Baier,carbon claiming support carbon tax hammered robocalls first lie mark begich told alaskan served reminder trusted keep word vote carbon tax
FOXNEWS,The OReilly Factor,american people understand climate change real doubt 98 working climate scientist believe human activity led climate change
FOXNEWS,Hannity,long time long night waste time democrat held talk thon climate change climate change
FOXNEWS,Hannity,theoretical mr president discus sound science used better understand manage real impact climate change seeing climate change real
FOXNEWS,Your World With Neil Cavuto,problem take generation maybe millenia resolve think going resolve staying late situation complaining global warming
FOXNEWS,Hannity,time magazine famous cover said next ice age coming global warming global warming saying climate change basically say ago
FOXNEWS,Hannity,time magazine famous cover said next ice age coming global warming global warming saying climate change basically say ago
FOXNEWS,Americas Newsroom,senate democrat hosting night talkathon crisis ukraine unemployment instead side decide take floor senate house dominate talk lot global warming
FOXNEWS,The OReilly Factor,secret service name polar vortex idiot bat mano idiot sleep upside think global warming enough reason think global
FOXNEWS,The OReilly Factor,secret service name polar vortex idiot bat mano idiot sleep upside think global warming enough reason think global
FOXNEWS,The Five,today last day march 2061 record low march picture new york jay laura got three inch global warming also next one superior michigan got whole slew global
FOXNEWS,Hannity,breaking news malaysian airline mystery conspiracy theory flooding internet including report passenger cell phone may active bob beckel go one one founder greenpeace global warming debate
FOXNEWS,Americas Newsroom,hopefully better soon poor guy bill imagine teammate martha scary absolutely bill lawmaker senate burning midnight oil debt ceiling crisis russia syria night talkathon global warming
FOXNEWS,The Five,exaggeration panic panic hysteric mask worse far deadlier problem mockery detail people die vitamin deficiency climate change
FOXNEWS,The OReilly Factor,global warming anymore hear climate change thing dramatic economic impact response theoretical global warming seeing epa regulation killing job seeing obama talk national energy tax
FOXNEWS,The OReilly Factor,global warming anymore hear climate change thing dramatic economic impact response theoretical global warming seeing epa regulation killing job seeing obama talk national energy tax
FOXNEWS,The OReilly Factor,63 worried 37 drug use 63 concerned 37 illegal immigration 57 american worried 42 worried climate change 49
FOXNEWS,The OReilly Factor,63 worried 37 drug use 63 concerned 37 illegal immigration 57 american worried 42 worried climate change 49
FOXNEWS,The OReilly Factor,doctor 98 said sick take medicine two told fine nothing cusp climate crisis
FOXNEWS,FOX News Reporting Surrendering America,long run exporting american natural gas europe also helping european develop shale resource reporter democrat paul bledsoe worked climate change task force
FOXNEWS,Hannity,development instead climate change agenda war fosim fuel heritage foundation greenhouse gas regulation going cost 600000 job war fossil fuel right
FOXNEWS,Hannity,say 97 expert everyone else denier evidence suggest real political agenda believe political scientific proof causing climate change
FOXNEWS,Hannity,say 97 expert everyone else denier evidence suggest real political agenda believe political scientific proof causing climate change
FOXNEWS,Hannity,development instead climate change agenda war fosim fuel heritage foundation greenhouse gas regulation going cost 600000 job war fossil fuel right would challenge putin
FOXNEWS,On the Record With Greta Van Susteren,new poll say american really care much global warming climate change care financial well fact chanting
FOXNEWS,The Five,repent know atheist guess saying atheism catching religion saying inflammatory stuff way flood god fault obviously climate change
FOXNEWS,FOX and Friends,terrorist tied attack american karzai still refusing sign security deal keep troop country past end year afghanistan elect new president april 5 dear climate change
FOXNEWS,Your World With Neil Cavuto,energy calling global warming anyone anymore climate change whatever immediate pressing problem young guy worry pressing problem worry future
FOXNEWS,Hannity,put price put price denial new poll say american really care much global warming climate change care financial well fact
FOXNEWS,Special Report With Bret Baier,student severe allergy family repeatedly reminded policy wrrg faith dad said little girl even given warning policy severe especially since sandwich zip lock bag never opened debate climate change
FOXNEWS,The OReilly Factor,reilly factor tonight take action take crisis put price put price denial new poll say american really care much global warming climate change
FOXNEWS,The OReilly Factor,reilly factor tonight take action take crisis put price put price denial new poll say american really care much global warming climate change care financial
FOXNEWS,The Five,priority despite publicity climate change number one thing strengthening economy interestingly way actually solve global warming problem concerned carbon dioxide emission grow economy money technology help u
FOXNEWS,The Five,publicity climate change number one thing strengthening economy interestingly way actually solve global warming problem concerned carbon dioxide emission grow economy money technology help u problem
FOXNEWS,Hannity,disagree global warming thing okay let tell global warming one aspect story people talk lot time
FOXNEWS,The OReilly Factor,everything blamed global warming kate let get power right majority scientist area say believe global warming folk reason even though
FOXNEWS,The OReilly Factor,global warming kate let get power right majority scientist area say believe global warming folk reason even though outnumbered
FOXNEWS,Your World With Neil Cavuto,invariably involve money confusing high definition tv division bane global warming japanese government told citizen go bed hour early fight global warming told stay
FOXNEWS,The Five,global warming antarctica iceberg floating global warming 98 scientist agree great hope whether accident terrorism hope never knew
FOXNEWS,Special Report With Bret Baier,legislation high simple say regulate greenhouse gas standard new coal fire plant using best technology available bill sponsor
FOXNEWS,Special Report With Bret Baier,senate floor talk hot issue democrat liberal base climate change real climate change caused human climate change solvable rest congress wake act pressing issue
FOXNEWS,Hannity,withne crab stuffed tail one topped shrimp hurry sea food fferently welcome back hannity apparently america top technology company room anybody question theory man made global
FOXNEWS,FOX and Friends,120 much u request government information google risen since 2009 10000 made five month span last year 700 thousand dollar much government gave theater company make musical global
FOXNEWS,The OReilly Factor,climate change say cannot idea climate going change fedex 15 year idea impact man sort climate change said council u n panel climate change said think folk reading u n policy
FOXNEWS,FOX News Reporting Surrendering America,long run exporting american natural gas europe also helping european develop shale resource reporter democrat paul bledsoe worked climate
FOXNEWS,Hannity,long time long night waste time democrat held talk thon climate change climate change theoretical mr president
FOXNEWS,Hannity,discus sound science used better understand manage real impact climate change seeing climate change real doubt
FOXNEWS,Your World With Neil Cavuto,sleeping fuss want bring attention climate change climate change worthier project work nighter result something maybe
FOXNEWS,The OReilly Factor,american people understand climate change real doubt 98 working climate scientist believe human activity led climate change went 100
FOXNEWS,FOX and Friends,afghanistan elect new president april 5 dear climate change denier buy apple stock ceo say agree company climate change initiative buy stock told shareholder
FOXNEWS,Your World With Neil Cavuto,voter think would think issue job front center medium concern immediate concern climate change whatever people view climate change pressing
FOXNEWS,FOX and Friends,yeah floor senate last night highlight impact climate change 14 hour climate change talk al gore call first date hot earth getting
FOXNEWS,Your World With Neil Cavuto,doubled fuel economy standard light vehicle car truck doubling bit 2025 second time raced fuel economy standard larger vehicle acting think climate
FOXNEWS,Your World With Neil Cavuto,marijuana way couple hundred pound else coming across border thank much chief incredible korea coming blow putin setting sight finland u n climate
FOXNEWS,The Five,kind scientific proof spending hundred billion dollar problem may exist john kerry said climate change general said climate change one
FOXNEWS,Forbes on FOX,powerful market signal dploeb l warming global warming massive hoax deal practicality deal bottom line
FOXNEWS,FOX and Friends,climate change pentagon proposes cutting military preworld war ii level cutting climate change program instead senator james inhofe oklahoma say yes join u right break number good morning sir
FOXNEWS,The Five,think reason senate lately seemingly become epicenter rallying base last week talked mumia cop killing lawyer get appointment taking climate
FOXNEWS,FOX and Friends,marky quoting dr seuss book called environmental classic one lawmaker still senate floor hour talking climate change even though plan bring climate change bill floor year
FOXNEWS,FOX News Reporting Surrendering America,resource reporter democrat paul bledsoe worked climate change task force person aligns democratic party would naturally assumed take actually turn climate change perspective economic perspective
FOXNEWS,The Five,find sound like kind spontaneous event unpredicted foreseen happened whether manmade terrorist tell global warming
FOXNEWS,Cavuto on Business,america better next government starting food fight fight global warming report hide dessert
FOXNEWS,The OReilly Factor,climate going change fedex 15 year idea impact man sort climate change said council u n panel climate change said think folk reading u n policy paper actually hear
FOXNEWS,Hannity,climate change productive bunch democratic senator come back want miss co founder greenpeace going go one one climate change debate later han itdy investigation growing number conspiracy theory
FOXNEWS,Forbes on FOX,right afraid turn movie noah global warming right right kidding also coming new movie mary
FOXNEWS,Cavuto on Business,guy say climate change hoax
FOXNEWS,FOX and Friends,40 billion animal born suffering every year cause sickness cancer greatest cause global warming take oil grain water
FOXNEWS,The Real Story With Gretchen Carlson,u sanction global warming biting chipotle staple chain might pull guacamole menu kidding brings u favorite
FOXNEWS,Hannity,let tell global warming one aspect story people talk lot time green energy reduces job ever polluted
FOXNEWS,Hannity,theory man made global warming annual shareholder meeting monday told people oppose company sustainability effort quote get stock joining great great
FOXNEWS,Forbes on FOX,2 trillion getting yanked economy exactly new study show happen epa global warming agenda planning night
FOXNEWS,The Real Story With Gretchen Carlson,could chipotle take guacamole menu finally rick company warn spiking price avocado could make cut back temporarily blaming global warming increase
FOXNEWS,Americas News Headquarters,three benefit one male announcer new glucerna advance brand doctor recommend wondering america fishy lost airplane crimea obama care global warming
FOXNEWS,Cavuto on Business,2 trillion getting yanked economy exactly new study show happen epa global warming agenda planning night
FOXNEWS,The OReilly Factor,interested appeasing radical environmentalist global warming theory watching paycheck diminish watching help lose job think tied economics people know
FOXNEWS,Americas News Headquarters,administration said number one crisis world global warming follow increase energy production america europe defund russian military think brilliant strategy exactly
FOXNEWS,The OReilly Factor,american battle global warming president obama buy approved keystone pipeline long time ago would help u economy damage opec russia hurt environment according
FOXNEWS,The OReilly Factor,4000 buck interested appeasing radical environmentalist global warming theory watching paycheck diminish watching help lose job think tied economics people know
FOXNEWS,Your World With Neil Cavuto,18 year glowing 18 every kid high school never experienced global warming serious task stay awl night
FOXNEWS,Happening Now,international body get ahold something whether human right saying united state iran china global warming arm control number environmental social
FOXNEWS,The OReilly Factor,stuff global warming guy sound like fog mirror telling planet going flop know anything know courtney love
FOXNEWS,The Five,know everybody agree 40 billion ton carbon dioxide put air every year united state seems thas point something must getting hurt quickly say sure know said democratic base care climate
FOXNEWS,Your World With Neil Cavuto,change go ahead problem coming china india anyway much global warming digging go china nighter china china mission put
FOXNEWS,Your World With Neil Cavuto,threat going prioritize ben point push bench make sense 17 half year global warming according latest satellitdata
FOXNEWS,The OReilly Factor,american battle global warming president obama buy approved keystone pipeline long time ago would help u economy damage opec russia hurt environment according credible story
FOXNEWS,Your World With Neil Cavuto,global warming motto first harm come play damage raising national debt think concocting going work night something coming solution
FOXNEWS,The OReilly Factor,warmer get concept moisture air snowfall telling point global warming thing going freeze u death climb studeaimp
FOXNEWS,The Five,directly ahead jaw dropping remark global warming co founder green peace going believe going hear plus nasa made major discovery outer space could
FOXNEWS,Hannity,miss politics governor two term miss politics many time mean certain issue coming passionate disagree global warming thing okay
FOXNEWS,Red Eye,global warming real said back said sham said right right case living space hope friend
FOXNEWS,Hannity,bob beckel go one one founder greenpeace global warming debate wab miss much continue 20134 planned 2014 probably pardon another
FOXNEWS,The OReilly Factor,warmer get concept moisture air snowfall telling point global warming thing going freeze u death climb studeaimp
FOXNEWS,The OReilly Factor,relation climate change concern line surprised fervent cause
FOXNEWS,FOX and Friends,coming next believe climate change better switch samsung apple ceo want business
FOXNEWS,FOX and Friends,mystery deepens today search change course bit tell democrat stay night draw attention global warming leaving asking focused putin fixing health care beckel lowry battle
FOXNEWS,The OReilly Factor,boring ideological believe science course going solve scientist say global warming real equal number scientist true acting like kate
FOXNEWS,The OReilly Factor,warming three massive idiot ashamed leader pick poll came said global warming concern american played
FOXNEWS,FOX and Friends,considered another weapon mass destruction perhaps even world fearsome weapon mass destruction really secretary state john kerry say global warming dangerous terrorism since 2009 government spent 120 billion combat
FOXNEWS,The Five,temperature half one degree 40 year raise one iota another 30 year period went another half degree point science global warming one liberal
FOXNEWS,The Five,guess could call liberal day founded green peace agrees sign global warming rest liberal going come around say sign guy made statement
FOXNEWS,Cavuto on Business,respect aeroone intelligent global warming denier ever come contact real phenomenon usda involved helping american better nutrition fact healthier way go agriculture trying
FOXNEWS,Your World With Neil Cavuto,ecology freak anything know think global warming like idea taking time call attention need honest discussion leaving light night long burning
FOXNEWS,The OReilly Factor,ideological trap boring ideological believe science course going solve scientist say global warming real equal number scientist true
FOXNEWS,The OReilly Factor,warming three massive idiot ashamed leader pick poll came said global warming concern american played
FOXNEWS,The Five,antarctica iceberg floating global warming 98 scientist agree great hope whether accident terrorism hope never knew god snatched panic fear
FOXNEWS,The OReilly Factor,scientist climatic scientist think global warming truth still mystery folk actually buying folk buying power buying well mean think part said
FOXNEWS,The OReilly Factor,scientist climatic scientist think global warming truth still mystery folk actually buying folk buying power buying well mean think part said
FOXNEWS,The OReilly Factor,back book segment tonight miller time let get right sage southern california join u santa barbara california night sure watching democrat took senate floor talk night global warming vast majority
FOXNEWS,Americas Newsroom,beyond people believe election issue one believe people believe particularly california drought severe around attribute global warming bob got get reaction central point
FOXNEWS,Americas Newsroom,base talking actually anything hurt vulnerable senator look major issue dealing right know feel strongly global warming file important issue reason going
FOXNEWS,Americas Newsroom,keyed global warming reality real think long term trying sell long term issue people country short term immediate issue sell sell china fact last 15 year
FOXNEWS,Americas Newsroom,global warming plateaued time pump carbon at mere lot understand one thing could natural gas anybody else martha bingo would better martha lot agreement
FOXNEWS,The Five,look answer science detail figure happening huge number scientist admit global warming pivot move right left figure hold ground
FOXNEWS,The OReilly Factor,guy go transponder ping acar know thing world immediate expert stuff stuff global warming got guy calming show sounding like fog mirror
FOXNEWS,The Five,climate crisis point return question morality ethic question survival maine bounty connecticut lobster
FOXNEWS,Your World With Neil Cavuto,without paying tax united nation covering body whatever view climate change accept reject
FOXNEWS,The OReilly Factor,climate crisis point return wow miller live near ocean well billy time anybody burn midnight oil make point much energy use kind
FOXNEWS,Your World With Neil Cavuto,night bottom line anything congress cap trade died carbon tax dead arrival happening obama said done need stinking congress executive order epa unclear
FOXNEWS,Special Report With Bret Baier,voted carbon tax opening door last thing president coattail lack latest poll wall street journal nbc poll week approval 41 see comparison 61 april 2009
FOXNEWS,Special Report With Bret Baier,see vulnerable voted carbon tax anybody taken position democratic side republican want emphasize voter know candidate may think nice guy
FOXNEWS,The OReilly Factor,back book segment tonight miller time let get right sage southern california join u santa barbara california night sure watching c span democrat took senate floor talk night global warming vast majority
FOXNEWS,Cavuto on Business,obviously climate change going foe causing work night agree senator martin congressman incredible
FOXNEWS,FOX and Friends,guacamole climate change affecting supply avocado al gore really mad last straw give guacamole give guac
FOXNEWS,Happening Now,democrat support reporter thiasuses rag question key issue whether count democrat keystone pipeline epa regulation climate change raising
FOXNEWS,The OReilly Factor,relation climate change concern line surprised fervent cause thought would
FOXNEWS,The Five,sick take medicine two told fine nothing would cusp climate crisis point return question
FOXNEWS,Hannity,environment huge health issue believe environmental climate change real think invasion need cheeseburger
FOXNEWS,Americas Newsroom,would climate change denier wake martha right rich lowery editor national review fox news contributor bob beckel former democratic campaign manager key host
FOXNEWS,FOX News Reporting Surrendering America,also helping european develop shale resource reporter democrat paul bledsoe worked climate change task force person aligns
FOXNEWS,The Five,vast majority american people understand climate change real doubt 98 working climate scientist believe human activity led
FOXNEWS,FOX News Reporting Surrendering America,also helping european develop shale resource reporter democrat paul bledsoe worked climate change task force person aligns
FOXNEWS,Hannity,believe environmental climate change real think invasion need cheeseburger poor man see
FOXNEWS,Forbes on FOX,climate change rightly right buffett talking book owns insurance company risk model get sound scary
FOXNEWS,The OReilly Factor,billy played go back watch movie inconvenient truth pan changed climate change lot people said oh come
FOXNEWS,Forbes on FOX,thing model built human being tend personally think yes climate change also know model built human being
FOXNEWS,MediaBuzz,apologize controversy surround piece ran climate change time columnist paul kruegerman calling blog something disappointment disaster silver struck back data
FOXNEWS,The OReilly Factor,billy played go back watch movie inconvenient truth pan changed climate change lot people said oh come
FOXNEWS,Americas Newsroom,commitment combat climate change much focus today situation ukraine rus russia action ukraine one country kind
FOXNEWS,The Five,doubt 98 working climate scientist believe human activity led climate change went 100 doctor 98 said
FOXNEWS,The Five,like climate change believe crimeans would rather russian ukrainian believe 96 voted like one former poll cnn immigration 98 people say possible
FOXNEWS,Your World With Neil Cavuto,climate change word going caffeine pizza doughnut food p going nighter debating
FOXNEWS,Your World With Neil Cavuto,road let pothole fix careful careful get ideasment thank much climate change nighter know fact pizza
FOXNEWS,Your World With Neil Cavuto,emission country world get started new dehli mark help whatever think climate change tomorrow world going end next year
FOXNEWS,Special Report With Bret Baier,senator planning nighter senate floor talk climate change allows reid liberal member spotlight without putting red state democrat spot vote president obama want near standard
FOXNEWS,Hannity,sunflower seed red bull coming spend last night anything pointlessly blather climate change productive bunch
FOXNEWS,Hannity,weather weather climate change warmed last 17 year know sure brings question whole hypothesis conspiracy theory flooding internet happened missing
FOXNEWS,Cavuto on Business,nothing going get better bedtime story senate floor climate change becoming aboard american put high list thing make turn twist
FOXNEWS,Cavuto on Business,interesting care people view climate change thing think pressing working night would important like 75 people living
FOXNEWS,Cavuto on Business,guy surely somebody call fatuous terribly brilliant guy surely think senate nighter climate change going affect u one way period
FOXNEWS,FOX and Friends,wow senate democrat holding night reporter perhaps tackle debt perhaps tacking happening ukraine climate change night solar energy
FOXNEWS,The Five,hurt quickly say sure know said democratic base care climate change would disagree small percentage thank glad threw
FOXNEWS,The Five,billionaire tom stier pledged 100 million lawmaker going make climate change one campaign process campaign ideology thought going forward 96 whatever
FOXNEWS,The Five,except money ignore recent data climate change ignored data gun control based gun control study ignore science e cigarette
FOXNEWS,The OReilly Factor,concerned 51 majority concerned usual money issue dominate security second theoretical situation like climate change way list fair every american support cleaner environment
FOXNEWS,FOX and Friends,denier buy apple stock apple ceo tim cook say agree company climate change initiative buy company stock said environmental initiative important company even
FOXNEWS,FOX and Friends,new textbook parent say crossing line hear one mom coming believe climate change better switch samsung apple ceo say want business
FOXNEWS,MediaBuzz,surrounding piece ran climate change time columnist paul time columnist paul krugman calling blog something disappointment disaster silver struck back data detailing criticism
FOXNEWS,FOX News Reporting Surrendering America,democratic party would naturally assumed take actually turn climate change perspective economic perspective geo political perspective developing natural gas make sense really understand environmentalist
