Station,Show,Snippet
FOXNEWS,Tucker Carlson Tonight,time sometimes go better judgment come idea anyway wind immigration policy like tear downl wall another idea revealed 5 trillion plan fight climate change announcing
FOXNEWS,The Story With Martha MacCallum,hurricane puerto rico climate change one reason many u forced leave home search safer place live keep hearing migration crisis people affected ever notice leader denying
FOXNEWS,FOX  Friends,illegal immigrant coming country due climate change excuse excuse try feed american people think going work steve ultimately keep mind year big election democrat got appear taking
FOXNEWS,Fox and Friends First,order mlb extra inning great low price get mlb tv included subscription go online learn rob alexandria ocasio cortez say climate change blame mass exodus migrant central america heading u claim left lot people confused
FOXNEWS,Fox News  Night With Shannon Bream,freshman congresswoman democratic socialist alexandria ocasio cortez climate change major factor illegal immigration crisis sign onto green new deal big part problem correspondent trace gallagher digging data good evening trace good evening shannon
FOXNEWS,The Journal Editorial Report,paul mean biden get take left wing position say something climate change green new deal way far fixing affordable care act medicare going happen
FOXNEWS,Life Liberty  Levin,dispute science climate change story really interested science want understand better trying figure true true trying understand self political
FOXNEWS,The Five,prescription medicine interesting conversation internally presidential cycle going debate everything climate change reparation medicare know end democratic platform know end capitol hill glad see
FOXNEWS,Watters World,fear resistance immigrant ever noticed never talk causing people flee home first place perhaps forced confront one major factor fueling global migration climate change aoc saying people hopping caravan
FOXNEWS,Life Liberty  Levin,example story interviewing scientist dispute science climate change right story really interested science want understand better trying figure true true
FOXNEWS,Tucker Carlson Tonight,coming keep hearing watching television country many people dying climate change united state leading cause death mean look actually pretty good data many people actually die weather related
FOXNEWS,Outnumbered Overtime With Harris Faulkner,think democrat agree climate change major issue fix effectively look economic solution well solution actual environment harris give republican credit question next summer coming something term
FOXNEWS,FOX  Friends,ainsley think talking grandkids going look back take seriously resist taking action climate change grand child going look u way might look grand grandparent might protested civil right
FOXNEWS,The Next Revolution With Steve Hilton,much talking wrong almost 70 people polled say spend ten dollar combat climate change green new deal cost trillion disconnect budget kitchen table issue care
FOXNEWS,The Next Revolution With Steve Hilton,much talking wrong almost 70 people polled say spend ten dollar combat climate change green new deal cost trillion disconnect budget kitchen table issue care
FOXNEWS,FOX  Friends,weather event midwest people losing livestock crop flooding happening river happening climate change start solving never todd thank time thank advice last night steak awesome
FOXNEWS,Outnumbered,jessica green new deal proposal hot button issue candidate revealing climate change plan elizabeth warren joining called key ground movement calling moratorium fossil fuel exploration public land bernie sander calling
FOXNEWS,The Five,dana green new deal coming city near take example new york city mayor bill de blasio unveiling new proposal would ban iconic skyscraper help fight climate change actually making green new deal live new york city
FOXNEWS,Fox News  Night With Shannon Bream,lot problem illegal immigration number one would attack climate change lot people climate refugee lot one lot refugee leaving home country trying come illegally
FOXNEWS,Fox and Friends Sunday,moderate populist already blue seat number one surrogate mid term joe biden jedediah interrupt one second supporting climate change different supporting green new deal absolutely jedediah think
FOXNEWS,The Five,taken climate change want make sure work oil gas industry fossil fuel industry brought along partner make sure make transition ten year left u scientist tell
FOXNEWS,The Five,like medicare mean going cost x like poll would liked democrat asked climate change number one issue asked going solve utilizing nuclear power support
FOXNEWS,FOX  Friends,talk gun reform immigration healthcare right climate change going far left extreme going winning going way win beat president steve kevin going give final word would agree
FOXNEWS,Fox and Friends First,time blaming immigration crisis climate change tweeting far right love drum fear resistance immigrant ever noticed never talk causing people flee home first place perhaps would forced confront one major factor fueling global
FOXNEWS,Tucker Carlson Tonight,running runway able fix problem people going die habitat destroyed sea rise insect spread like world going end 12 year address climate change like war world war ii
FOXNEWS,Fox News  Night With Shannon Bream,fear demanding nbc universal u k thousand people arrested mass climate change protest big apple become green apple new radical plan order embrace new deal mayor dave palacios said may ban iconic
FOXNEWS,Fox and Friends Sunday,aspirational think smart putting health care guaranteed job stated environment think say green new deal bold aspirational figure get climate change done running never
FOXNEWS,The Story With Martha MacCallum,box climate change healthcare gun reform immigration reform show someone commander chief going good economy actually think smart move last thing democrat nervous joe
FOXNEWS,The Five,guy climate change never change anything except get heated let argue argue fact democrat think important beto aoc clear majority super majority democrat say
FOXNEWS,The Story With Martha MacCallum,bad policy universal health care right way get green new deal right way deal climate change huge issue deal new idea solve problem believe get support
FOXNEWS,Watters World,fear resistance immigrant ever noticed never talk causing people flee home first place perhaps forced confront one major factor fueling global migration climate change aoc saying people hopping caravan honduras texas hot
FOXNEWS,Watters World,fear resistance immigrant ever noticed never talk causing people flee home first place perhaps forced confront one major factor fueling global migration climate change aoc saying people hopping caravan honduras texas hot
FOXNEWS,Fox News  Night With Shannon Bream,think black voter feel excluded conversation party think anyone talking black voter talk climate change understand talking weight impact black community lead poisoning happened flint michigan talk economy
FOXNEWS,Fox and Friends First,concerned immigration economy float 2000 election new fox news poll 20 purchased voter believe immigration nation important issue 10 say economy healthcare climate change race relation round top 5 want know issue care let u know facebook instagram twitter email
FOXNEWS,Tucker Carlson Tonight,period time need goal nation need come behind goal need energy young people people really want move climate change tucker mind group estimate green new deal would cost household 600000 ten year period time mention facn
FOXNEWS,Fox and Friends Sunday,anti trump literally candidacy absolutely losing candidacy already know party think president trump want know whose best wage u going good climate change get something passed get healthcare think long way
FOXNEWS,Fox News  Night With Shannon Bream,trace gallagher data claim good evening alexandria ocasio cortez could blunt saying new green deal get past take immediate drastic action fight climate change quote blood hand freshman congresswoman went twitter attack conservative stance immigration quoting ever noticed never talk
