Station,Show,Snippet
FOXNEWS,FOX  Friends,key making sure people turn terrorists make sure jobs make sure jobs obviously distraught climate change nothing fact radical fanatics warm enough shovels got feeling new
FOXNEWS,Special Report With Bret Baier,far left tried distort pruitt views lame attempt make anti science boogeyman scott pruitt know far unlike liberals want shut rational debate climate change pruitt acknowledged human impact climate supports robust discussion
FOXNEWS,Fox and Friends Saturday,democrats argue climate change denier approve regulations something donald trump ran really rolling back epa regulations could ben carson problem secretary housing urban development hud nominee course lot criticism
FOXNEWS,Shepard Smith Reporting,agenda camp climate change real head epa called hoax attorney general state oklahoma one whole lot people talking everything president obama relates clean power clean
FOXNEWS,Fox and Friends Sunday,clear climate change future policy future opposed wanting america respected global stage appreciate perspective morning joining us fox friends thank governor bill richardson lot pressure president elect boeing made
FOXNEWS,The Kelly File,say believe climate change think want see sound science want see take look really going equity talk regulations one thing president elect talked campaign trail really answering
