Station,Show,Snippet
MSNBC,Andrea Mitchell Reports,managers state california really effort divert attention real problem impact climate change unprecedented deadly fires goal divert
MSNBC,Andrea Mitchell Reports,scientists reached strong consensus reality threat human caused climate change political debate solutions longer good faith debate problem
MSNBC,Andrea Mitchell Reports,fact seeing damaging impacts talk much warm planet still keep within range safety prevent dangerous climate change lying island nations miami beach
MSNBC,Andrea Mitchell Reports,dealing dangerous climate change already simply matter bad willing let get world getting smaller actually smaller areas inhab humans smaller smaller
MSNBC,MSNBC Live,towns literally wiped map result extreme weather seeing climate change know unfortunately par course president would try bury
MSNBC,Deadline White House,skeptical u intelligence judiciary legal system climate change many institutions sources expertise thank god everyone still almost make one hall fame quotes
MSNBC,Deadline White House,face scientists consensus scientists claim climate change apart president united states read know fact know friends information flow
MSNBC,MSNBC Live With Katy Tur,happen broad bipartisan support look back across country history ever dealt big challenge done together worked together deal climate change di sereserves th
MSNBC,MSNBC Live With Craig Melvin,climate change warns damage environment could slice much 10 u economy finally get president trump congress act pirate girl ahoy excited squeal giggling panting
MSNBC,MSNBC Live With Craig Melvin,koch brothers effort make toxic republican go since wei seen folks like sass lindsey graham times say things need address climate change seen
MSNBC,Kasie DC,shift long president office anything monumental climate change u think one safest predictions ever make kasie know
MSNBC,PoliticsNation With Al Sharpton,infrastructure takes account creating entrepreneurial opportunities jobs sake saving nation terms climate change congress ready make move hearing lot new
MSNBC,Kasie DC,trust lying eyes trust seeing devastation change opinion climate change mr president california wildfires historic hurricanes either dire new report
MSNBC,Kasie DC,amount evidence going shift long president office anything monumental climate change u think one safest predictions ever make kasie
MSNBC,All In With Chris Hayes,bench worried long term climate change worried hate speech coming white house given license people engage racist worse racist rhetoric worse anti semitic rhetoric worse
MSNBC,MSNBC Live With Hallie Jackson,climate sure something manmade view stands direct opposition report published administration says climate change happening mostly people report also lays
MSNBC,Morning Joe,obviously president trump knows weather climate change two different things report comes administration 13 agencies getting together put flare wave red flag accident
MSNBC,MTP Daily,thank much panel go anywhere vaughn going talk climate change report white house want see next let thing
MSNBC,MTP Daily,hotter drier people lots flooding carolinas seeing unprecedented flooding everybody feeling effects climate change right terms crops producing
MSNBC,MSNBC Live With Katy Tur,might missed government dire report perils climate change trump administration tried bury releasing holiday black friday atlantic points assessment endorsed
MSNBC,The Beat With Ari Melber,win back house senate trump actually feel emboldened result move expand power doubling attacks obamacare climate change quashing investigations still going including course big question bob mueller
MSNBC,All In With Chris Hayes,working people people make eight nine bucks hour people health care people worried future planet combat climate change women demand control bodies rather
MSNBC,MTP Daily,centrist trying speak party issues like climate change immigration voted republican tax reform proposals obamacare repeals democrats trying turn liabilities enough turn
MSNBC,Morning Joe,look conditions facing firefighters bill good morning mika climate change huge part supposed rainy season november california firefighters saying almost year round
MSNBC,All In With Chris Hayes,pro immigration reform believe climate change work middle aisle may disagree things country folks working center least agreeing problems trying
MSNBC,Morning Joe,1 complete deregulation going kill us climate change need take steps hold power got mature party say get power grow power hold power move
MSNBC,All In With Chris Hayes,climate change cutting missions half seems ambitious want sense stakes entire thing look state california course california death toll looking around 44
MSNBC,Deadline White House,important office country world look chris wallace face going raking chris wallace going talking look brings climate change says oh may
MSNBC,MTP Daily,supposedly everybody wants including press area tightly coupled addressing climate change know current president denier dana rohrabacher defeated believe 97 climate scientists
MSNBC,AM Joy,got something got fast planet survive taking place climate change real despite fact people want believe let talk leadership race lot people think
MSNBC,MSNBC Live With Hallie Jackson,day raking areas raking areas fires argument climate change drier hotter contributing maybe contributes little bit big problem
MSNBC,Kasie DC,weeds raking fire raked cleaned fires argument climate change drier hotter contributing maybe contributes little
MSNBC,MSNBC Live With Katy Tur,also author madhouse effect climate change denial destroying planet driving us crazy michael sorry get studio work last minute glad agreed join us
MSNBC,MSNBC Live With Katy Tur,whether climate change actually real need make debate scientists reality according pretty much everybody michael industry real debate right heard story
MSNBC,Kasie DC,fire raked cleaned fires argument climate change drier hotter contributing maybe contributes little bit big problem
MSNBC,Kasie DC,climate change kind tackled know contributed victory 2012 adjustment party led donald trump going convince everything went great midterm elections
MSNBC,Morning Joe,let get back raking leaves anything let address issue climate change sorry would think would done must say raking leaves think saw south park episode couple years ago
MSNBC,Morning Joe,responsible happening california parts world moment believer climate change science try address president incredibly powerful position
MSNBC,MSNBC Live With Ali Velshi,problem name climate change wraps things hour ali radical going go different subject move earlier today saw bent pecan pie stuffing
MSNBC,MSNBC Live With Katy Tur,climate change higher temperatures longer droughts urban sprawl factors contributing fires getting worse worse every year ignoring blaming poor management obviously could always better
MSNBC,All In With Chris Hayes,climate change far insufficient fires scary wide ranging impact fires scary without knowledge solutions problem everything support people
MSNBC,All In With Chris Hayes,policy making need able turn solutions cannot fight climate change one disaster time also collective action problem right thing think people break
MSNBC,The Last Word With Lawrence ODonnell,deny climate change stock coal company oil company get wrong side thing billionaire president anything benefits wealthy
MSNBC,The Last Word With Lawrence ODonnell,job supposed advocate curve brother law sitting table tomorrow thanksgiving say look climate change office going fix going really
MSNBC,MTP Daily,climate change hoax manufactured chinese know something heard somebody mutt erring sitting next public bus get change seat know diabolically
MSNBC,MSNBC Live With Stephanie Ruhle,climate change blasts fed chair president saying gut tells anyone else brain ever could lost translation trump officials preparing brief lawmakers jamal khashoggi death without person heard
MSNBC,MSNBC Live With Stephanie Ruhle,states said look lot smart intelligent people like words believers climate change skeptic cite believes report came friday
MSNBC,Morning Joe,guy climate change stuff imagine going thing brings hillary clinton guess e mails makes sense important provides theoretically direct
MSNBC,Morning Joe,amounts state trump yesterday says government report climate change issued know last thursday afternoon noob know halftime detroit lions game whatever believe right got
MSNBC,MTP Daily,make sense correct funny laugh every time happens sit back get scared actually dangerous president inarticulate also talking climate change something
MSNBC,The 11th Hour With Brian Williams,would perfect time release report believe new exhaustive government report climate change paints grim picture country environmental matter economic future product years
MSNBC,AM Joy,climate change yes gets sworn nancy pelosi master normally know people complain age looks clothing unless talking woman yes glad see finally getting point
MSNBC,PoliticsNation With Al Sharpton,republicans opportunity democrat capture white house capture senate separate president mean question climate change administration came yesterday saying devastating
MSNBC,MSNBC Live,threatening human health undermining quality life report found damage climate change reduce size u economy 10 end century scientists 13 federal government agencies estimate quote annual losses
MSNBC,MSNBC Live,visited wildfires california seeing lot extreme weather scenarios whether hurricanes wildfires come frequent lot scientists experts pointed climate change reason interesting
MSNBC,First Look,many cases people hired get job done tell effective strategy president apparently convinced climate change hoax manufactured chinese
MSNBC,MSNBC Live,go back enjoy rest good friday great deals anna danny right coming trump administration releases dire report devastating effects climate change health human safety
MSNBC,MSNBC Live,environment way expect also economy scientific report warns damage climate change reduce size american economy 10 end century annual losses quote
MSNBC,MSNBC Live,document one country matter rural much like immigrants women getting equal pay climate change find correct correct look hard know president trump send
MSNBC,MSNBC Live,saw midterm elections starting wise foolish strategy trump administration pursued every front playing climate change hopefully american people wise soon
MSNBC,Deadline White House,says know climate changing different scientists say different things head scratcher true everyone understands climate science agrees climate change happening people fault president suggest notable
MSNBC,All In With Chris Hayes,powerful man america probably world shared thoughts yesterday single largest threat placing planet human kind perhaps ever history climate change quote going read one problems lot
MSNBC,Deadline White House,weeks ago oval office natural instinct science uncle professor mit even though never discussed climate change knowledge must rubbed influence
MSNBC,MSNBC Live With Craig Melvin,days president trump sit vladimir putin dig take look shocking new report climate change released thanksgiving holiday weekend release stuff really want anyone read
MSNBC,Kasie DC,clear cold northeast actually rest united states warmer usual thanksgiving john swann also interviewed president climate change weeks 60 minutes interview week two
MSNBC,Meet the Press,reference everything thinks going answer every question ask today whether saudi arabia climate change anything else donald trump number one donald trump
MSNBC,Kasie DC,said report brought us report government scientists last year report says exactly unanimous basically human beings predominant cause climate change last half century
MSNBC,Hardball With Chris Matthews,scientist hear trump administration scientists 13 agencies released report confirmed quote earth climate changing faster point history modern civilization damage climate change could cost hundreds
MSNBC,MSNBC Live With Hallie Jackson,cut friday news dump everything fly radar talk white house report impacts climate change showing major impacts anything really going change talking next
MSNBC,MSNBC Live With Hallie Jackson,climate change yeah go back like change back probably think white house responding report says largely based extreme scenario argues u leading world reducing
MSNBC,Morning Joe,climate change seems clear tried bury report released thanksgiving people follow stuff paid attention become bigger bigger political issue particularly millennials start participating
MSNBC,MSNBC Live With Katy Tur,seeing attack economy wu something problem end century see 10 economy lost due many caused climate change impact far expensive
MSNBC,Morning Joe,think voting check trump check republican agenda general talk republican agenda know governor says know wait federal government solve climate change talking leading
MSNBC,All In With Chris Hayes,view medicare system got talking raising minimum wage living wage 15 hour got talking climate change transformation energy system talking
MSNBC,All In With Chris Hayes,obviously dealing property rights people wanting rebuild homes lost obviously touchy political question yeah question going intensify climate change accelerate california whole wide spectrum problems
MSNBC,Morning Joe,climate change also huge issue finished july hottest july ever record california hottest summer mixed drier vegetation rainy season arrived november 3 4 inches behind
MSNBC,Morning Joe,working could sell thinks future tesla matters humanity says tesla cannot die many people interested climate change idea got electrify cars move transportation system away
MSNBC,The Last Word With Lawrence ODonnell,fires right need long term plan address climate change clearly contributing factor also make hard decisions future home development occurs especially high risk fire area also look
MSNBC,The Last Word With Lawrence ODonnell,raked fires argument climate change dryer hotter contributing maybe contributes little bit big problem management wow joining us tony schwartz
MSNBC,Deadline White House,raking fire raked argument fire point argument climate change drier hotter contributing maybe contributes little bit big problem
MSNBC,The Last Word With Lawrence ODonnell,raking fire raked fires argument climate change dryer hotter contributing maybe contributes little bit big problem
MSNBC,MSNBC Live With David Gura,climate change drier hotter contributing maybe contributes little bit big problem management need forest management saying negative way saying facts really learned lot
MSNBC,MTP Daily,fires result stronger due climate change fails recognize key critical issues affecting country world think get president kevin mccarthy know see hope think new guy
MSNBC,PoliticsNation With Al Sharpton,potential horrors climate change mean planet job al bring people together exactly opposite trump trying divide us got bring people together around agenda works
MSNBC,The Last Word With Lawrence ODonnell,raking fire raked fires argument climate change dryer hotter contributing maybe contributes little bit big problem management
MSNBC,Deadline White House,chris wallace going talking brings climate change says may something rake bush call tree bush serious whole pettiness man
MSNBC,Morning Joe,right lot people took good step forward last night still long way go definitely way people talking much environment yes general heading climate change protecting northern rockies
MSNBC,MSNBC Live With Craig Melvin,set table way presidential nominees something run president obama david jolly weighed yesterday solved global issues like climate change something lot
MSNBC,Kasie DC,flight northern california californi southern california three themp came back asked governor brown believe climate change big part said course asked bring president president said
MSNBC,Morning Joe,raking fire raked argument fires argument climate change drier hotter contributing maybe contributes little bit
MSNBC,Morning Joe,responsible happening california parts world moment believer climate change science try address president incredibly powerful position lead world right
MSNBC,MTP Daily,online network climate change activists bill thank much joining us trying get know week appreciate good katy read article made drop everything
MSNBC,All In With Chris Hayes,country era permanent climate disaster better start getting prepared joining co founder executive director 350 org organization pushes action fight climate change director nyu institute public
MSNBC,MSNBC Live With Stephanie Ruhle,surprised gave chance meet putin knowing much thinks relationship important presidency country also talked climate change even understand walk
MSNBC,First Look,right take look 2020 something president theology economics climate change another thing seem believe right whole thing either way wish time
MSNBC,The 11th Hour With Brian Williams,since 2015 alone says damaging weather cost u nearly 400 billion b dollars left unchecked climate change forecast cost hundreds billions dollars annual losses year 2100 equal 10
MSNBC,All In With Chris Hayes,conversation worried country worried long time young federal judges puts bench worried long term climate change worried hate speech coming white house given license
MSNBC,PoliticsNation With Al Sharpton,regarding climate change man believe evidence believe science understand real world works think open question whether ignorance kind single employ fire base
MSNBC,MSNBC Live,knows necessarily play well policies know trump administration really worked roll back series obama administration policies climate change really put lot focus non renewable energy
MSNBC,MSNBC Live,president went california visited wildfires blamed lot forest management think shows know administration president really thinks climate change think lot critics say reason
MSNBC,MSNBC Live,president left world leaders asking u going ever participate types global policies would help address issue climate change report also says area country
MSNBC,All In With Chris Hayes,long time young federal judges puts bench worried long term climate change worried hate speech coming white house given license people engage racist worse racist rhetoric worse anti semitic rhetoric
MSNBC,MSNBC Live With David Gura,california wildfires claimed lives 87 people trump administration released 1600 page report warning impacts climate change among predictions damage extreme weather could slash u economy 10 end
MSNBC,Andrea Mitchell Reports,well administration president continues deny reality climate change day claimed cold weather east coast invalidates 200 years physics chemistry tells us human caused
MSNBC,MSNBC Live,two hour appointment windows click call visit store today americans turkey leftovers waiting line black friday sales government released huge report impact climate change findings dire health
MSNBC,Deadline White House,keeps job also unfit job also think climate change talk crisis ongoing crisis national security issue
MSNBC,Deadline White House,crown prince saudi arabia anything reality cia works president assessed yeah know know crown prince wanted happen talks climate change way
MSNBC,MSNBC Live With Velshi and Ruhle,station next dire warning climate change devastate economy coming federal government president trump said guess believe break report talk one authors next george woke pain
MSNBC,MSNBC Live With Velshi and Ruhle,climate change united states military take seriously unlike president united states last report 2014 basis new regulations put place obama administration took seriously help curve mitigate effects
MSNBC,PoliticsNation With Al Sharpton,members want green deal energy commerce committee serve chomping bit really make sure move agenda new yorkers like us know climate change right
MSNBC,PoliticsNation With Al Sharpton,giving voice hear rising voice within democratic party says look future darkness gloom doom actually jobs created confronting challenges like climate change one thing
MSNBC,Hardball With Chris Matthews,stick us devastating report climate change theory deny sun deny mueller wild trump gotten days north pole falling apart laughing trump administration
MSNBC,Hardball With Chris Matthews,appointees asked general counsel look investigator investigative counsel asked look people complaining work impeded draw sound alarm happening climate change think get caught
MSNBC,Morning Joe,politically talked last time concerned millennials turn mid terms huge numbers millennials climate change environmental issues top list concerns think see get
MSNBC,MTP Daily,okay climate change administration tried bury report releasing black friday want report want attention paid climate report devastating front page newspapers across
MSNBC,Andrea Mitchell Reports,stones walking away climate deal worried next generation whether children grandchildren going live world worry climate change many important issues hearing woman right choose
MSNBC,Hardball With Chris Matthews,lost well 2000 homes 26 people lost lives really need stay vigilant especially climate change area california fire prone landscape one thing control fuels east bay regional regional park district partners pg e
MSNBC,All In With Chris Hayes,sparks sets fires reason obviously climate change california 2 degrees warmer right supposed wow northern california gotten rains traditionally expected happen october santa anas started coming bringing even
MSNBC,MSNBC Live With Katy Tur,alter ecosystem helps build fuels forest always going hopefully get climate change period still going firefighters talking smarter building terms materials talking smarter
MSNBC,All In With Chris Hayes,obviously touchy political question yeah question going intensify climate change accelerate california whole wide spectrum problems like going continue face going get worse liam dillon kendra pierce
MSNBC,PoliticsNation With Al Sharpton,far agree republican panel reality classic trump media really need focus facts one facts underlying climate change really reading enough seeing enough
MSNBC,Kasie DC,flight northern southern california three themp came back asked governor brown believe climate change big part said course asked bring president president said talk
MSNBC,All In With Chris Hayes,everything support people impacted particularly vulnerable among us look long term know responsible climate change know solutions going good us
MSNBC,All In With Chris Hayes,venture capitalist help air quality terrible right know climate change going affect vulnerable people places like titanic boat people going go first everyone
MSNBC,Morning Joe,manmade see way president said quote one problems lot people like high levels intelligence necessarily believers climate change look air water right record clean
MSNBC,Morning Joe,post political analyst msnbc nbc news philip rucker phil many places could start climate change mueller investigation fed chair jumped sat across desk president united states oval office
MSNBC,Morning Joe,president president trump blunt stands findings top scientists 13 federal agencies president added makes sense united states take drastic steps fight climate change countries like china japan done gene latest piece
MSNBC,The 11th Hour With Brian Williams,issued friday thanksgiving trump administration would perfect time release report believe new exhaustive government report climate change paints grim picture country environmental matter economic future
MSNBC,AM Joy,anything gotten used past years friday night news dump black friday found doomed friday 13 federal agencies released major report presents stark warnings consequences climate change economy
MSNBC,Andrea Mitchell Reports,change climate change denial quote interview president told one problems lot people like high levels intelligence necessarily believers go become look articles talked
MSNBC,All In With Chris Hayes,health care every man woman child view medicare system got talking raising minimum wage living wage 15 hour got talking climate change transformation energy system talking
MSNBC,All In With Chris Hayes,rebuilding well going help people homes first find dead throughout state anybody lost places live know think sobering message see last climate change deniers tell
MSNBC,MSNBC Live With Katy Tur,phone determined make people hear climate change start something governments start something time read new yorker article today thought gosh pointless life pointless decisions
MSNBC,All In With Chris Hayes,impacted particularly vulnerable among us look long term know responsible climate change know solutions going good us may made point gas mask got say
MSNBC,All In With Chris Hayes,venture capitalist help air quality terrible right know climate change going affect vulnerable people places like titanic boat people going go first everyone look sitting
MSNBC,The 11th Hour With Brian Williams,coming make report president response president response know believe want step roof house going gravity climate change real whether believe
MSNBC,The 11th Hour With Brian Williams,coming make report president response president response know believe want step roof house going gravity climate change real whether believe matter
MSNBC,The 11th Hour With Brian Williams,yeah well course tell true four year hiatus problem need acting need acting quickly danger tremendous dangers course climate change also amazing opportunities create
MSNBC,MSNBC Live,figure continue cover administration gain wrong side climate change discussion like wrong side cancer discussion get teeth cleaned discussion political partisan glad ali
MSNBC,Deadline White House,epa think goes back people live breathe air drink water terms forcing government right thing national security climate change something hippie issue
