Station,Show,Snippet
MSNBC,MSNBC Live With Stephanie Ruhle,devastation united states coming decades side side president made centerpiece policy agenda undo regulations greenhouse gases
MSNBC,MSNBC Live,extreme weather say damage health environment inf infrastructure fisheries could hit hard argue primarily manmade catastrophe caused greenhouse gases
MSNBC,The Last Word With Lawrence ODonnell,michigan toronto cold places tonight president trump tweeted cold said brutal extended cold blast could shatter records ever happened global warming get people deny climate change
MSNBC,Morning Joe,florida tonight quote brutal extended cold blast could shatter records whatever happened global warming
MSNBC,The 11th Hour With Brian Williams,florida tonight quote brutal extended cold blast could shatter records whatever happened global warming
MSNBC,Andrea Mitchell Reports,last week laid number economic effects well effects global warming next several years trump told us ready believe terms agreeing global warming
MSNBC,Kasie DC,want use hairspray meanwhile new report came days president tweeted quote brutal extended cold blast could shatter records whatever happened global warming
MSNBC,Kasie DC,want use hairspray meanwhile new report came days president tweeted quote brutal extended cold blast could shatter records whatever happened global warming
MSNBC,MSNBC Live With Stephanie Ruhle,president trump questioned denied established science human caused climate change significantly working make sure greenhouse gases released atmosphere side
MSNBC,MSNBC Live With Katy Tur,comes agriculture risks lively lood climate change poses
MSNBC,Morning Joe,economic impacts said look lot intelligence believer went tangents talking california wildfires well said global warming
MSNBC,First Look,wildfire fuelled climate creating world increasingly inhospitable humans little month since u n report warned world must take unprecedented steps avert worst effects global warming
MSNBC,MTP Daily,wildfire fuelled climate creating world increasingly inhospitable humans little month since u n report warned world must take unprecedented steps avert worst effects global warming
MSNBC,Meet the Press,released black friday order bury news white house dismissed findings largely based extreme scenario report warns significant steps taking reign global warming
MSNBC,AM Joy,fires worse donald trump asking whether viewing disaster zone changes view climate change take listen seeing devastation change opinion climate change mr president
MSNBC,Morning Joe,governor elect jerry brown saying dozens scientists including inside administration saying climate change behind things president still says well really tiny bit changed view climate change
MSNBC,First Look,extreme weather shrinking planet making less land hospitable human life bill mckibben wrote new yorker story called greenhouse gas effect also environmental activist founder 350 org online network climate
MSNBC,MTP Daily,extreme weather shrinking planet making less land hospitable human life bill mckibben wrote new yorker story called greenhouse gas effect also environmental activist founder 350 org online network climate
MSNBC,PoliticsNation With Al Sharpton,threatened government shutdown next month money provided border security even attacked findings scientists studying climate change seeming suggest cold weather challenge global
MSNBC,Kasie DC,bit big problem management president asked climate change spent day surveying damage cities chico paradise california seeing devastation change opinion climate change mr president
MSNBC,Morning Joe,political moment division extent climate change become victim partisanship side donald trump supporters go ends earth say climate change
MSNBC,Morning Joe,political moment division extent climate change become victim partisanship side trump supporters go ends earth say climate change
MSNBC,Kasie DC,new federal report sounding alarm inaction surrounding climate change predicting economy could take serious hit take preventive measures report compiled 13 federal agencies warns damage caused climate change
MSNBC,MSNBC Live With Stephanie Ruhle,report said look see climate change global warming manmade believe scientific consensus took issue findings predictions global warming would long term economic harm united
MSNBC,MSNBC Live,looming mueller probe new today starkest warning date climate change government released major report detailing impacts global warming found climate change worsening natural disasters
MSNBC,Meet the Press,simultaneously devastating u economy question variety reasons regardless one stands issue climate change
MSNBC,MSNBC Live With Stephanie Ruhle,damage like baseline imagine huge parts texas florida live anymore states inhabitable due climate change
MSNBC,MSNBC Live,gas production scientists say clear compelling evidence real emergency whether people call climate change global warming climate change clear donald trump tweeted day brutal extended
MSNBC,Morning Joe,criminal really get mean know followed issue since first earth summit climate change 1992
MSNBC,Weekends With Alex Witt,national forest fact private land real problem built cities wild land urban interface climate change
MSNBC,MSNBC Live With David Gura,first timer purpose idea terms next two years want get done new mexico campaigned lot climate change
MSNBC,All In With Chris Hayes,reality power act like also majority behind power quinnipiac polling interesting even things like climate change
MSNBC,MSNBC Live With Hallie Jackson,hurricane harvey real life previews coming disasters warns federal government report climate change immediately substantially reduce greenhouse gas emissions climate scientist katherine one report lead
MSNBC,First Look,protest outside pelosi office hill first day new memberrianitation calling democrats take action climate change
MSNBC,MSNBC Live With Velshi and Ruhle,places like miami hitting record numbers threatening 1 trillion dollars worth coastal real estate costs 2 2090 could reach 500 billion climate change
MSNBC,MSNBC Live With Katy Tur,act amy argument coming republicans heard moment ago senators lee saying costly anything used consensus climate change
MSNBC,MSNBC Live With David Gura,president desperate let climate change become talking point devastating fires think certainly degree san francisco question fires absolutely related global
MSNBC,MSNBC Live With Katy Tur,enough raking called radicals shameful cannot fix problem even name address problem even name problem name climate change
MSNBC,Morning Joe,answer explaining believe government national climate report last week report sobering alarming report administration predicting impacts climate change
MSNBC,Morning Joe,going reelection campaign looks like historic unpopularity coming morning joe shep smith fact checked president migrant caravan bob mueller climate change
MSNBC,Weekends With Alex Witt,conflict base supporters chanting lock hillary clinton interesting see white house tackle one many concerning things climate change
MSNBC,Andrea Mitchell Reports,climate science understand means united states america findings report clear matter washington c wants say shows climate change
MSNBC,All In With Chris Hayes,committed conversation like chris worried country worried long time young federal judges puts bench worried long term climate change
MSNBC,Morning Joe,raking trees little trees like trees bushes could see totally dry weeds raking fire raked argument climate change
MSNBC,MTP Daily,report new yorker article exxon things change fires west home state california important point science disagreed upon overwhelming majority scientists agree climate change
MSNBC,MSNBC Live With Stephanie Ruhle,remedy federal reserve payments first wildfires start forests much forests federal control state control world going right president making mention climate change
MSNBC,All In With Chris Hayes,combination things california always fires californians move space wild areas set cities make sparks sets fires reason obviously climate change
MSNBC,First Look,must said problem predates president trump one points article mine new yorker 30 years fossil fuel industry big oil companies known lied climate change
MSNBC,Meet the Press,climate change could slash u economy 10 end century week president tweeted east coast cold weather whatever happened global warming know man
MSNBC,MSNBC Live,concerned guess horrible effects climate change point night thanksgiving president tweeted cold weather posing question quote whatever happened global warming week ago
MSNBC,Morning Joe,know whether manmade whether effects talking see pretty clear mike president believe climate change yeah one incredibly one level revealing introduce donald trump climate
MSNBC,MTP Daily,lied climate change lie enormous consequence stuck 25 years still really completely pointless debate whether global warming real debate sides knew
MSNBC,Morning Joe,alarming report administration predicting impacts climate change economic impacts road global warming president said look lot intelligence believer explained went
MSNBC,MSNBC Live,effect global warming climate change affects us many different ways terms ferociousness storms rolling pacific seen gulf mexico real dire consequences overall
MSNBC,MTP Daily,lied climate change lie enormous consequence stuck 25 years still really completely pointless debate whether global warming real debate sides knew
MSNBC,MSNBC Live With Hallie Jackson,carbon dioxide emissions look agent pictures chicago today midwest probably thinking global warming frigid day well era climate change still going see winter want
MSNBC,MSNBC Live,going make talked scientists 20 years would say could cold specific weeks december make point generally call global warming much call climate change yes cumulative
MSNBC,The 11th Hour With Brian Williams,ability change slow believe coming drinking straws think blameless tell four years lost effort going impact overall climate change cost economic humans clearly four years going suspend efforts area yeah well course tell true four year hiatus problem need acting need acting quickly danger tremendous dangers course climate change
MSNBC,MSNBC Live,cold blast could shatter records whatever happened global warming people start believe hot global warming global warming gives us extremes sides health effects exactly point
MSNBC,MSNBC Live With Katy Tur,coincidence increase temperature driven greenhouse gases driving fires facing new fire regime 21st century ken president
MSNBC,MSNBC Live With Stephanie Ruhle,side white house releasing report saying greenhouse gases released atmosphere take 10 gdp hundreds billions dollars damage agriculture roads building
MSNBC,Weekends With Alex Witt,significant steps increase amount greenhouse gases united states currently would future emit atmosphere take example effort making roll back emission controls
MSNBC,MSNBC Live With Craig Melvin,another 249 still unaccounted new trump administration report concludes global warming helped stoke wildfires released black friday report warns without action global warming would aaction global warm could devastating effect
MSNBC,MTP Daily,also wait read another quote talking global warming fed chair saying problem fed chair says global warming one problems lot people like high levels
MSNBC,Meet the Press,burning fossil fuels emit environment number things healthiest put price carbon tax open carbon tax proposals seen far would address issues would devastate
MSNBC,The 11th Hour With Brian Williams,mines ironworks course believe report like view republicans talk climate
MSNBC,MSNBC Live With Katy Tur,back 80s george h w bush said combat greenhouse gas effect white house effect used argument republicans democrats accepted science
MSNBC,All In With Chris Hayes,action plan cut carbon emissions goal set forth government panel climate change avoid catastrophic climate change cutting missions half
MSNBC,MSNBC Live With Katy Tur,trump administration split screen climate change continue cast doubt scientific consensus climate change law hand follow
MSNBC,First Look,telling us behind lost lives burnt forest growing threat affecting us climate change affecting us climate change boy got dad slippery
MSNBC,MTP Daily,telling us behind lost lives burnt forest growing threat affecting us climate change affecting us climate change boy got dad slippery
MSNBC,MSNBC Live With Hallie Jackson,nationally people locally state local governments across country extraordinary things reducing greenhouse gas emissions investing public transit low carbon leisure
MSNBC,MSNBC Live With Katy Tur,building resilient landscapes difference come plplaining fore fires urban interfaces treated differently one final question glen address climate
MSNBC,Andrea Mitchell Reports,moms anybody seen pants nothing cleans better put dad got tide white house fire trying bury congressionally mandated climate
MSNBC,Morning Joe,evidence climate change contribu behind things president still says well really tiny bit changed view climate change really think issue
MSNBC,AM Joy,issue climate change play large role decades ago scientists predicted climate change extreme weather events seeing hotter weather drier weather
MSNBC,MSNBC Live,international community way address serious issue climate change global climate change coalition within international community includes third world countries includes europe
MSNBC,MSNBC Live With Katy Tur,claiming costly act climate change costly act already seeing damage climate change bringing projections overly
MSNBC,MTP Daily,making less land hospitable human life bill mckibben wrote new yorker story called greenhouse gas effect also environmental activist founder 350 org
MSNBC,MSNBC Live With Katy Tur,billions dollars economic losses severe frequent economic disasters massive public health costs supporters say bill would reduce greenhouse gas emissions 40 ten years 91 2050 bigger cut
MSNBC,PoliticsNation With Al Sharpton,urban fire accelerated climate change responsible president say yes deal climate change also deal forestry
MSNBC,First Look,climate change alexandria ocasio cortez newly elected members argued members creation special panel climate change new jersey congressman frank palone backed number committee members slammed
MSNBC,MSNBC Live With Katy Tur,industry attempting debunk overwhelming evidence human caused climate change really unfortunate toll taken continued denial climate change delay taking action necessary avert catastrophic
MSNBC,The 11th Hour With Brian Williams,republican congressman bob ing lis southern carolina republican stance climate change became recipient john f kennedy profile courage award climate change work congressman thank
MSNBC,MSNBC Live With Ali Velshi,democratic republican say going target certain groups based look like pray democratic republican know climate
MSNBC,All In With Chris Hayes,maybe little center right center left point carlos curbelo best buddy congress mia love good friend mine pro immigration reform believe climate
MSNBC,The 11th Hour With Brian Williams,like little bushes could see totally try weeds raking fire raked argument fire argument climate
MSNBC,Morning Joe,whatever happened global warming fact 2016 15 17 rank world three warm est record
MSNBC,First Look,many phone calls lay wreath arlington downplayed climate change brushed
MSNBC,AM Joy,climate change real point e j get sense dump came administration anti climate change felt like friday news dump thanksgiving day weekend
MSNBC,MSNBC Live,president addressed climate change touring wildfire let take listen seeing devastation change opinion climate change want great climate going forests safe
MSNBC,MSNBC Live With Craig Melvin,understand climate change real bad helped make far far worse think course republican leadership denying climate change setting putting ideology
MSNBC,Kasie DC,climate change mr president california wildfires historic hurricanes either dire new report president administration convince climate change real timing release tell everything next
MSNBC,Kasie DC,man made climate change could impact believe devastating impact cooling heating denying climate change could well go back know talking
MSNBC,Andrea Mitchell Reports,climate change intensi intensifying without policy changes cause massive challenges country health economy climate change loading dice extreme destructive weather events future already feeling
MSNBC,MSNBC Live With Hallie Jackson,manmade climate change could impact believe devastating impact still think climate change hoax look think something happening something changing change back think hoax
MSNBC,Weekends With Alex Witt,inevitably wrap court wind clock plus robert mueller written answers president two sides could still battle one big remaining issue federal government releases warning climate
MSNBC,MSNBC Live With Stephanie Ruhle,mississippi lynching real life happening 2018 hope people mississippi get vote tomorrow coming new government report details significant damage already done climate
MSNBC,MSNBC Live,yesterday clip played strong views climate change think looking way talk issue without talking terms climate change situation president yesterday suggest
MSNBC,Kasie DC,management president asked climate change spent day surveying damage cities chico paradise california seeing devastation change opinion climate change mr president strong opinion
MSNBC,MSNBC Live,untouched southwest alaska julia house democrats planning capitalize report could internal divisions within democratic party undermine strategy climate change well already seeing climate change become guess one democrat top
MSNBC,Kasie DC,man made climate change could impact believe devastating impact cooling heating denying climate change could well go back know talking well denying
MSNBC,MTP Daily,care protecting access health care making sure protect people pre existing conditions passing commonsense gun reform laws working scientists actually bring action protect environment deal impacts climate
MSNBC,Andrea Mitchell Reports,people around mbs assured nothing cia assessment intelligence evidence linking mbs killing wanted ask question os climate
MSNBC,Morning Joe,president trump yesterday asked interview climate change said believer view climate change think contributed things like wildfires state yes believer also believe cuts ways
MSNBC,First Look,also talking climate change making news report released holidays guys looking climate change much rising sea levels could costing effect dollars bad pretty bad
MSNBC,MSNBC Live With Craig Melvin,murdered president disputing government climate change report president disputing government climate change report getting hot going everything fantastic almost like really
MSNBC,Kasie DC,new federal report sounding alarm inaction surrounding climate change predicting economy could take serious hit take preventive measures report compiled 13 federal agencies warns damage caused climate change could cost u hundreds
MSNBC,Andrea Mitchell Reports,witnessed weekend yet another reckless russian kaes lace cold shoulder white house brushes administration report global warming despite findings
MSNBC,Meet the Press,much corporate much law much kind governance america much less climate standpoint doubts think doubts climate
MSNBC,Andrea Mitchell Reports,congressionally mandated climate change report going flying face many trump age agency policies rhetoric climate change reuters excerpt read going say extremely likely human
MSNBC,First Look,whatever happened global warming fact 2016 2015 2017 rank world three warmest years record climate let go bill karins
MSNBC,MSNBC Live With Hallie Jackson,century president trump big proponent fossil fuels ended war beautiful clean coal convinced global warming manmade phenomenon planet continue heating
MSNBC,First Look,activists reeinstated committee address climate crisis talking shovels snow plows early right
MSNBC,Your Business,refusing address topics worried get president trump trouble president travels california faces questions climate change devastation change opini
MSNBC,The Last Word With Lawrence ODonnell,michigan toronto cold places tonight president trump tweeted cold said brutal extended cold blast could shatter records ever happened global warming get people
MSNBC,Weekends With Alex Witt,whatever happened global warming white house issue statement report came basically reporters like said couple things one thankfully u leading world trying
MSNBC,MSNBC Live With David Gura,century report released week president responded arctic blast asking whatever happened global warming white house responded largely based extreme scenario
MSNBC,The 11th Hour With Brian Williams,florida tonight quote brutal extended cold blast could shatter records whatever happened global warming win fake news media big story today
MSNBC,Hardball With Chris Matthews,whatever happened global warming cold weather exist hot weather learn 5 years old difference weather climate back hardball round table anita susan tiffany
MSNBC,MTP Daily,unprecedented steps avert worst effects global warming effects may already apparent two days report released hurricane michael slammed florida panhandle killing 35 people state 45 people nationwide
MSNBC,The 11th Hour With Brian Williams,whatever happened global warming win fake news media big story today pushed hard gotten capitalized gasoline prices low people driving
MSNBC,Morning Joe,address climate crisis ocasio cortez also spent day slamming amazon plans open second headquarters queens joining us mayor new
MSNBC,MSNBC Live With Stephanie Ruhle,charge mueller investigation know tell us steph keep asking thank important conversation next president trump gives wide ranging interview washington post talking global warming fed chair gut
MSNBC,The 11th Hour With Brian Williams,could shatter records whatever happened global warming win fake news media big story today pushed hard gotten capitalized gasoline prices low people driving
MSNBC,Andrea Mitchell Reports,shifting electric autonomous vehicles lot play stay hot mess dangers global warming new administration climate report disputed white house going stay us
MSNBC,MSNBC Live With David Gura,number issues climate crisis begin breaking news washington post regarding potential overhaul u immigration policy post reporting
MSNBC,First Look,old especially climate change getting worse worse wavents nts arounds case
MSNBC,Morning Joe,eu march 29th report released friday climate change fourth national estimate warns expanded wildfires
MSNBC,All In With Chris Hayes,insurmountable window action think right seeing younger rising generation inspiring us right thing look images destruction may people talk carbon tax cap trade variety ways
MSNBC,Morning Joe,inspired energy activism many young activists advocates leading way climate crisis recommended house democratic colleagues reinstate select committee
MSNBC,MSNBC Live With Velshi and Ruhle,low los angeles county fire chief stated clearly climate change president might want
MSNBC,MSNBC Live With Stephanie Ruhle,holiday weekend describes dynamic crisis climate change arguing inaction could set u back decades participate longtime
MSNBC,Morning Joe,government buried holiday weekend describes dynamic crisis climate change arguing inaction could set u back
MSNBC,MSNBC Live With Katy Tur,anything conservative assessing damages risks associated climate change earth warming
MSNBC,Morning Joe,tangent talking california wildfires well explained necessarily believe global warming manmade see way let read quote people driving car see president told phil quote
MSNBC,First Look,lie enormous consequence stuck 25 years still really completely pointless debate whether global warming real debate sides knew answer beginning
MSNBC,All In With Chris Hayes,think right seeing younger rising generation inspiring us right thing look images destruction may people talk carbon tax cap trade variety ways would deal carbon pollution say well
MSNBC,MSNBC Live With Katy Tur,appropriate bring climate change think good question winds common part climatology
MSNBC,Morning Joe,stock ginning republican voters elderly voters climate change issue older voters young voters bigger
MSNBC,MSNBC Live With Stephanie Ruhle,course simply denying climate change exists particular calculation release report day thanksgiving minimize
MSNBC,MSNBC Live,yesterday president trump doubled fires management issue argument climate change dryer hotter
MSNBC,Weekends With Alex Witt,certainly jerry brown gavin newsom way front climate change president literally trapped
MSNBC,MSNBC Live With David Gura,administration accountable making sure working issues climate change course big one fires california defr
MSNBC,MSNBC Live With Katy Tur,north carolina unprecedented floods droughts heat waves face climate change dealing read bill mcci brcks
MSNBC,Morning Joe,reading sort dry reports scientists international scientists climate change watched become increasingly dire increasingly
MSNBC,First Look,plus president trump defends rejection climate change siting high intelligence back check forecast seriously
MSNBC,Weekends With Alex Witt,major climate change report released friday question begs asked mostly negative oh think interesting perspective
MSNBC,MSNBC Live With Katy Tur,michael give us idea better assessment climate change report sure hearing claims opposite reality
MSNBC,Weekends With Alex Witt,climate change real mr president important factor fires gets rains winter get heavy rental station growth
MSNBC,Morning Joe,warnings denies climate change morning joe coming right back hi kids carl broker offer 4 95 online equity trades
MSNBC,The 11th Hour With Brian Williams,wall later devastating government report warning hundreds billions dollars lost climate change president says believe
