Station,Show,Snippet
MSNBC,Morning Joe,wanted give low ratings overruled climate change romney believes world getting warmer humans contributing perry called global warming
MSNBC,Hardball With Chris Matthews,hold keys election yesterday governor rick perry asked stance climate change let listen response believe issue global warming
MSNBC,The Dylan Ratigan Show,hear unusual weather vent happening new york sort thing evidence global warming see massive storm happening think evidence bit overwhelming seeing climate change generating
MSNBC,Andrea Mitchell Reports,natural gas critical future exxonmobil recognize challenges important right june mitt romney called greenhouse gas emissions
MSNBC,Hardball With Chris Matthews,pbtsd bush traumatic stress disorder jon huntsman rivals like rick perry dismissing global warming evolution
MSNBC,MSNBC News Live,prayers going families great see thank much gop candidate sparring issue global warming
MSNBC,Martin Bashir,judicially mandated right indeed 7 10 job killer environmental regulations really small businesses suffering greenhouse gas restrictions
MSNBC,Morning Joe,things environment conflict climate change rest energy security issues tax issues think going one interesting debates dealing climate change
MSNBC,Morning Joe,come going joke let move global warming stay press releases saying global
MSNBC,Hardball Weekend,perry message perry plays texas may play peoria check tweet went yesterday quote clear believe evolution trust scientist global warming
MSNBC,Hardball With Chris Matthews,rush limbaugh presenting conspiracy theory fraud hoodwinked get lot tea party fancy story lie promote another agenda even global warming another
MSNBC,The Daily Rundown,wash manage brooks lame shake cham huge challenges ahead weather patternses clearly part climate change challenge
MSNBC,The Ed Show,absurd debate know 2500 scientists 2500 2007 came said yes humans human beings contributing climate change
MSNBC,The Last Word,president republican punching bag epa wants call shots matter many jobs draconian policies zealous actions might kill governor perry criticized stepped back global warming
MSNBC,Morning Joe,rick perry thoughtful new theory chemistry physics means group house effect known 100 years driving climate change
MSNBC,Martin Bashir,actual survivors indeed final question know remit responsibilities see hurricane many scientists yet another example climate change
MSNBC,Hardball With Chris Matthews,weak tea part fact washington getting serious deficit lot people disagree overseas markets caused weakness deal would say dictating acts global warming
MSNBC,Martin Bashir,seemingly frequent hurricanes way connected climate change well going say absolutely people work climate science tell cannot show irene directly related climate
MSNBC,The Last Word,book perry called global warming one contrived phony mess falling apart weight even mitt romney proposed plans reduce greenhouse gas emissions governor massachusetts
MSNBC,The Last Word,jobs book perry called global warming one contrived phony mess falling apart weight even mitt romney proposed plans reduce greenhouse gas emissions governor massachusetts thinks epa try anything global warming support epa much mission yes mission epa getting carbon
MSNBC,Andrea Mitchell Reports,really heard much national media going see much tv going see hometown going keep think jon huntsman tweet clear believe evolution trust scientists global warming
MSNBC,MSNBC Live,pollutants greenhouse gasses may significant contributors climate change global warming difference poll makes take wall street format romney used play middle week
MSNBC,Morning Joe,believe evolution one global warming climate change running election crazy think going anywhere rick perry think going hurt
MSNBC,MSNBC News Live,clear science simply back issue global warming yes climate change course changed thousands years glad john huntsman buys think
MSNBC,The Last Word,warming one contrived phony mess falling apart weight even mitt romney proposed plans reduce greenhouse gas emissions governor massachusetts thinks epa try anything global warming support epa much mission yes mission
MSNBC,Hardball With Chris Matthews,attract kind constituency think hope romney split conservative tea party vote allow last man standing either huntsman one appeal independents moderates hold keys election yesterday governor rick perry asked stance climate change
MSNBC,PoliticsNation,jobs talking gop wanting epa regulations talking coal ash greenhouse gases ozone farm dust mean kantor talking
MSNBC,The Last Word,stepped back global warming global warming politicized distracting issues think going change soon still scientific theory president left
MSNBC,The Last Word,stepped back global warming global warming politicized distracting issues think going change soon still scientific theory president left vacation right
MSNBC,MSNBC News Live,said believe man made global warming prompted tweet john huntsman thursday said clear believe evolution trust scientists global warming call crazy yesterday perry fired back
MSNBC,The Ed Show,government unthinkable department education using spongebob squarepants teach kids global warming government agency showed kids cartoon handed books blame man global warming tell
MSNBC,The Last Word,hear science quite sure takes science recognize example texas suffering worst ever drought rick perry pointed sort refusing carry greenhouse
MSNBC,MSNBC News Live,texas oklahoma many dry soil heats quickly vicious cycle addition heat wave enhanced fact greenhouse gases increasing atmosphere levels seen hundreds thousands years
MSNBC,MSNBC News Live,concerns rate magnitude warming trend observed last 100 years greenhouse gases continuing increase atmosphere need find ways reduce risk unwelcome changes intense heat waves
MSNBC,Morning Joe,think governor perry would noticed know maybe would led little curiosity climate change predicted climate change systematic world
MSNBC,MSNBC Live,michele bachmann people right wing republican party better keep eye rick leap recently denied truth problems facing global
MSNBC,The Last Word,texas governor rick perry also said epa job killer called president obama put moratorium regulations least six months despite independent research says environmental regulations actually create new jobs book perry called global
MSNBC,Andrea Mitchell Reports,global warming pure enough money keep ongoing
MSNBC,Way Too Early With Willie Geist,republican national field yesterday saying opponents zero substance man first sunday show interview candidate comes former ambassador china took twitter declaring belief evolution climate
MSNBC,The Ed Show,huntsman asked governor rick perry comments evolution global warming minute
MSNBC,Hardball Weekend,technology chinese india young geniuses move countries around world competing world science technology country might led somebody believe evolution climate
MSNBC,Hardball With Chris Matthews,coming forward questioning original idea man made global warming causing climate change
MSNBC,Morning Joe,really go 42 117 mars atmosphere yeah global warming leaves started change
MSNBC,Andrea Mitchell Reports,evolution social security really first time second appearance new hampshire approached opposition answer follow question science teachers folks also asking stance evolution climate
MSNBC,The Rachel Maddow Show,perry somebody believe evolution global warming thing get woman already got michele
MSNBC,Hardball With Chris Matthews,coming forward questioning original idea man made global warming causing climate change yes climate changed
MSNBC,Hardball Weekend,peoria check tweet went yesterday quote clear believe evolution trust scientists global warming call crazy
MSNBC,MSNBC News Live,greenhouse gas concentrations increased dramatically also playing role u climate assessments international assessments project going increases intensity duration frequency heat waves moving future jason look
MSNBC,The Last Word,pointed sort refusing carry greenhouse gas regulations main response drought seems designation official prayer days rain right prayer rain necessarily
MSNBC,Morning Joe,scientists global warming call crazy hours perry said campaign stop new hampshire theory texas teach folks
MSNBC,Hardball With Chris Matthews,oh goodness come got camera though let dogs thanks guys global warming well hot
MSNBC,Martin Bashir,see president obama juncture needing lean global warming issue ins austin 109 degrees great plains drought
MSNBC,MSNBC Live,first exposed myth global warming blew lid liberal conspiracy christianity presidential wannabe rick santorum educating american public
MSNBC,Hardball With Chris Matthews,like rick perry dismissing global warming evolution gop party fringe top huntsman says right wing gop find elf
MSNBC,The Last Word,called global warming science hoax guarantee epa doors locked lights turned allowed
MSNBC,Morning Joe,data dollars rolling projects seeing almost weekly daily scientists coming forward questioning original idea manmade global warming
MSNBC,MSNBC News Live,reducing greenhouse gas emissions also adapting changes way yeah someone got chat mother nature apparently jason sam thank much may invasion american soil happening right noses
MSNBC,The Last Word,process compared clear cutting strip mining reason canada greenhouse gas emissions oil gas predicted leap 1 3 next decade year energy
MSNBC,The Last Word,worst ever drought rick perry pointed sort refusing carry greenhouse gas regulations main response drought seems designation official prayer days rain right
MSNBC,Morning Joe,manmade climate change remember killer trees ronald reagan said trees causing carbon dioxide
MSNBC,Hardball With Chris Matthews,world compete science science technology chinese indian young geniuses move still countries around world competing world science technology country might led someone believe evolution believe climate
MSNBC,MSNBC News Live,huntsman response perry evolution huntsman tweeted believe evolution trusts sciences global warming quote call crazy gregory solis writes work obama
MSNBC,Morning Joe,jon huntsman saying let get real evolution exists global warming exists would peel moderate republicans majority take win
MSNBC,Jansing and Co.,evolution trust scientists global warming kaus call crazy elizabeth warren step closer challenging scott walker massachusetts expected make announcement labor day
MSNBC,Martin Bashir,claims evolution climate change become party anti climate party
MSNBC,Morning Joe,country global warming legal reform capital punishment seems like handling picture right politics eggs breakfast learned white house far making mistake
MSNBC,Hardball With Chris Matthews,clear believe evolution trust scientists global warming cal crazy odd man issues party chris know know
MSNBC,Hardball With Chris Matthews,believe issue global warming politicized think substantial number scientists manipulated data would dollars rolling
MSNBC,Hardball With Chris Matthews,projects think seeing almost weekly even daily scientists coming forward questioning original idea man made global warming causing climate
MSNBC,MSNBC News Live,global warming call crazy big splash often seen conservative candidates running office willingly embrace science smart tactic kind race
MSNBC,The Ed Show,rebound like huntsman asked governor rick perry comments evolution global warming minute republican party becomes party anti science party huge problem
MSNBC,Morning Joe,post richard cohen governor perry perry reality gap whatever global warming might might done polar bears put rick perry presidential candidacy risk republican texas governor
MSNBC,Morning Joe,going forced live like day day yep romney perry arguing global warming read fun
MSNBC,The Rachel Maddow Show,tea party like voters way field complete complete rick perry somebody believe evolution global warming thing get
MSNBC,The Rachel Maddow Show,mitt romney thurston howell iii mean jon huntsman professor believes global warming believes evolution michele bachmann could maryann sarah palin course
MSNBC,The Rachel Maddow Show,professor believes global warming believes evolution michele bachmann could maryann sarah palin course ginger wait wait wait got ginger maryann
MSNBC,Morning Joe,scientific theory proven perry speaking yesterday believe issue global warming politicized substantial number scientists manipulated
MSNBC,The Last Word,also means going talk crazy coming namely gop candidates believe evolution trust scientists global warming thinks environmental
MSNBC,Hardball With Chris Matthews,2012 also need keep think separate people saying things like governor perry believe doubt believe said global warming said evolution
MSNBC,Hardball With Chris Matthews,plus check tweet went yesterday clear believe evolution trust scientists global warming call crazy nothing remarkable except came republican presidential candidate jon
MSNBC,Hardball With Chris Matthews,thanks guys global warming hot evening encouraging write book saying good appreciate great
MSNBC,Hardball With Chris Matthews,thanks guys global warming well hot evening encouraging write book saying good appreciate great
MSNBC,Hardball Weekend,welcome mr chairman let ask comment made former utah governor jon huntsman yesterday tweeted quote clear believe evolution trust scientists global warming call crazy
MSNBC,MSNBC News Live,saying clear believe evolution trust scientists global warming call crazy minnesota congresswoman michele bachmann also barn stormed south carolina trying broaden appeal going make case
MSNBC,Morning Joe,michael steele one people people okay look think perry made secret feels issue global warming science think
MSNBC,Hardball With Chris Matthews,opinion play sides let kick hot topic global warming romney say back june world getting warmer prove believe
MSNBC,Hardball With Chris Matthews,based believe world getting warmer number two believe humans contribute okay humans least play partial role global warming yesterday let listen
MSNBC,The Ed Show,conservative radical michelle bachmann go talk global warming say nonsense got say look destroying party taking positions let intelligent
MSNBC,Morning Joe,book seems like big men washington going paul krugman piece romney perry challenge global warming check yeah book
MSNBC,Morning Joe,nobody press releases saying yet global warming whether marching future clear happening world
MSNBC,MSNBC News Live,road talked global warming evolution theory got gaps texas teach breath creationism evolution public schools
MSNBC,MSNBC News Live,rage al gore arguably world number one climate advocate case ever since inconvenient truth oscar scientific consensus causing global warming former vice president
MSNBC,MSNBC News Live,get pretty worked attempts climate deniers convince everyone else thing global warming fact gore event hosted aspen institute pay pseudo scientists
MSNBC,Hardball With Chris Matthews,even global warming another capitalism stems hatred free markets nothing science makes hard serious conversation gets anywhere people
MSNBC,The Ed Show,developments spongebob squarepants gets caught right wing war science clearly kninickelodeon pushing global warming agenda every time choose show like united states america
MSNBC,The Ed Show,nevertheless steve deucy steve deucy set facts clearly nickelodeon pushing global warming agenda big question manmade one gigantic climactic
MSNBC,The Rachel Maddow Show,actually mitt romney thurston howell iii mean jon huntsman professor believes global warming believes evolution michele bachmann could maryann sarah palin course
MSNBC,The Ed Show,cartoon origin working conjunction u government unthinkable department education using spongebob squarepants teach kids global warming government agency showed kids cartoon handed
MSNBC,Andrea Mitchell Reports,hampshire differentuate bachmann perry clear believe evolution trust scientists global warming call crazy certainly popular position probably strike
MSNBC,Hardball With Chris Matthews,patriotism message perry plays texas may play peoria plus check tweet went yesterday clear believe evolution trust scientists global warming call crazy
MSNBC,The Last Word,global warming politicized distracting issues think going change soon still scientific theory president left vacation right let rest
MSNBC,The Last Word,later show earlier today jon huntsman tweeted science clear air tweet clear believe evolution trust scientists global warming call crazy
MSNBC,The Last Word,thinks epa try anything global warming support epa much mission yes mission epa getting carbon
MSNBC,The Rachel Maddow Show,legislation calling mandatory cap global warming gases co2 emissions agree agree absolutely got good cap trade details hashed right
MSNBC,Hardball Weekend,comment made former utah governor jon huntsman yesterday tweeted quote clear believe evolution trust scientists global warming call crazy sarcastic comment odd man
MSNBC,First Look,man made global warming believe issue lit sized think substantial number scientists manipulated data dollars rolling projects
MSNBC,Hardball With Chris Matthews,play climate change wants ditch voting rights act questions constitutional basis civil rights act speaks secession
MSNBC,The Ed Show,far climate change disputed fact reality based scientific community disagrees small sample meteorological
MSNBC,The Last Word,ground get process compared clear cutting strip mining reason canada greenhouse gas emissions oil gas predicted leap 1 3 next decade year energy company trans canada
MSNBC,Hardball With Chris Matthews,rick perry doubts evolution believe global warming wants religion central politics either gop replacing real change american culture gop headed 1964 style thrashing
MSNBC,Morning Joe,right part frustration republicans rick perry lack discipline argument want hear hear talking global warming think
MSNBC,The Rachel Maddow Show,said going play makes sense mitt romney despite republican party current orthodoxy global warming made conspiracy theory mitt romney went record year defiance
MSNBC,Hardball With Chris Matthews,rick perry doubts evolution believe global warming wants religion central politics either gop replacing real change american culture gop headed 1964 style thrashing
MSNBC,The Last Word,open account today put schwab mobile work earlier today jon huntsman tweeted science clear air tweet clear believe evolution trust scientists global warming call crazy
MSNBC,Hardball With Chris Matthews,change regard global warming congress taken seriously past michael steele yes governor rendell sadly thank appreciate time
MSNBC,Hardball With Chris Matthews,opinion play sides let kick hot topic global warming romney say back june world getting warmer prove believe based believe
MSNBC,MSNBC Live,months suddenly trail pergry gallup poll 12 points romney response take low road facing match perry tea party extremism things like global warming know mostly
MSNBC,Hardball With Chris Matthews,republican field president obama even democrats jon huntsman rivals like rick perry dismissing global warming evolution gop party fringe top huntsman says extreme
MSNBC,MSNBC News Live,evolution trust scientists global warming call crazy wow made splash doug amazed really led politico play book thought people really seeing really unusual
MSNBC,Jansing and Co.,see vulnerable requests think accumulated weight kiram obviously made comments global warming ligs underscores fact probably read
MSNBC,MSNBC News Live,medical marijuana nuts says cure global warming world hunger way reality show focussing macdame ya farm hawaii might wants push nut agenda
MSNBC,The Last Word,us shoot mouth style treason evolution global warming needed watch say rick perry idiot think anybody would disagree republicans still praying help
MSNBC,The Daily Rundown,actually going television negative ad going see fight evolution global warming think think top tier everyone talking mitt romney michele bachmann
MSNBC,The Last Word,earlier today jon huntsman tweeted science clear air tweet clear believe evolution trust scientists global warming call crazy retweeted tweet gop 2012 candidate ever
MSNBC,MSNBC Live,staying offensive obama looks pretty tired took climate change pass says buy ideas
MSNBC,The Ed Show,pushing global warming agenda every time choose show like united states america built promise second section declaration independence clearly states hold truths self evident
MSNBC,News Nation,granite state one day comments global warming grabbed headlines say follow asked evolution kid know theory got gaps
MSNBC,The Last Word,trust scientists global warming thinks environmental protection agency wants kill jobs one candidates texas governor rick perry next perry fire seeming favor big donors comes big deals
MSNBC,Martin Bashir,wildfires new mexico lot unprecedented weather patterns going know word global warming president security documents urge president obama today tomorrow sometime within next say half year
MSNBC,MSNBC News Live,texas governor rick perry stumped early voting state south carolina dug heels recent controversial comments including questioning validity global warming happen believe know earth temperature moving
MSNBC,Morning Joe,sit sense back home governor california would probably different perspective environment like 15 real unemployment think say anything wants global warming people want talk jobs
MSNBC,MSNBC News Live,made better articulation romney talked last week tweet response rick perry asked global warming evolution said look texas schools teach creationism make choice
MSNBC,Hardball With Chris Matthews,world getting warmer number two okay humans least play partial role global warming yesterday let listen world getting hotter yeah know think know mostly
MSNBC,Morning Joe,global warming probably bases lot position earlier arguments science also changed argument see relevant new reality connections think governor
MSNBC,Jansing and Co.,go eternal battle republicans want go far right win nomination statements haunt general election take rick perry believe global warming believe evolution thinks ben bernanke
MSNBC,MSNBC News Live,evolution global warming john huntsman sure gop 2012 update straight ahead five chicken breasts individually wrapped use want put rest refrigerator best part takes 10 minutes
MSNBC,The Rachel Maddow Show,way field complete complete rick perry somebody believe evolution global warming thing get woman already got michele bachmann taking position let give howard
MSNBC,Hardball With Chris Matthews,getting serious deficit lot people disagree overseas markets caused weakness deal would say dictating acts global warming default significance
MSNBC,Hardball With Chris Matthews,caused weakness deal would say dictating acts global warming default significance also michele bachmann actually leader thinking would say things like founding fathers imposed slavery
MSNBC,Hardball With Chris Matthews,fraud hoodwinked get lot tea party fancy story lie promote another agenda even global warming another capitalism stems hatred free markets nothing science
MSNBC,The Dylan Ratigan Show,people seeing job gone china afford send kid college without addressing global warming creating protecting children going rich getting richer everybody else getting poorer right
MSNBC,Hardball With Chris Matthews,rick perry doubts evolution believe global warming wants religion central politics either gop replacing real change american culture gop headed 1964 style thrashing also
MSNBC,Hardball With Chris Matthews,governor john jon huntsman clear believe evolution trust scientists global warming cal crazy odd man issues party chris know know poll
MSNBC,The Ed Show,pushing global warming agenda big question manmade one gigantic climactic know phases science sides lot scientists say others say right unproven science
MSNBC,The Last Word,retweeted tweet gop 2012 candidate ever also means going talk crazy coming namely gop candidates believe evolution trust scientists global warming thinks environmental
MSNBC,The Last Word,called global warming science hoax guarantee epa doors locked lights turned allowed conservation new day new sheriff washington c
MSNBC,Martin Bashir,mean example understand michele bachmann refers gay lifestyle bondage rick perry dismisses climate change ron paul wants decriminalize many
MSNBC,Andrea Mitchell Reports,first rick perry even mitt romney questioning science climate change someone worked closely al gore many many years
MSNBC,The Ed Show,small sample meteorological society human activities major contributor climate change national research council preponderance scientific evidence points human
MSNBC,Morning Joe,take position embrace runs counter 198 climatologists said causing climate change man contribution
MSNBC,Hardball With Chris Matthews,play climate change wants ditch voting rights act questions constitutional basis civil rights act speaks secession defenders say harmless rhetorical device
MSNBC,Morning Joe,country rejecting findings science things like climate change know really get oval office resources
MSNBC,Morning Joe,think right political polarization real think climate change come city going push people
MSNBC,Hardball With Chris Matthews,separate people hoo awho things like governor perry believe doubt believe said global warming said evolution taking positions social issues maybe feel must going run gauntlet getting
MSNBC,The Ed Show,books blame man global warming tell kids actually disputed fact mean find people gretchen carlson fox friends exposing far left propaganda machine miss carlson got
MSNBC,Hardball With Chris Matthews,separate people saying things like governor perry believe doubt believe said global warming said evolution taking positions social issues maybe feel must going run gauntlet getting
