Station,Show,Snippet
MSNBC,News Nation,time michele bachmann rick perry could face could face mitt romney rick perry could play brackets trying straddle line saw bernanke comment global warming evolution things going
MSNBC,Martin Bashir,come american people say came office giving lot speeches global warming know things might make america safe presidential historian doug
MSNBC,MSNBC Live,defending federal reserve attacking sort creationism attacking creationism skepticism evolution staking position favor taking global warming actually republican voters want candidate like sure continue watch
MSNBC,Hardball With Chris Matthews,extreme weather take pick gone last six months mean change regard global warming congress taken seriously past michael steele yes governor rendell sadly
MSNBC,Hardball With Chris Matthews,world getting warmer prove believe based believe world getting warmer number two believe humans contribute okay humans least play partial role global warming yesterday let listen
MSNBC,The Daily Rundown,scientists global warming call crazy trying seize truth telling broker tim pawlenty going earlier rails got space republican primary right jon huntsman selling trying
MSNBC,MSNBC Live,attitude rick perry like facts josh know facts love fact texas create jobs jacket hot believing global warming would thank josh
MSNBC,The Dylan Ratigan Show,ceiling deal end tweeting think week actually right believes evolution believes listen scientists comes talking global warming might seem like uncontroversial positions public large may
MSNBC,The Last Word,killing organization america called global warming science hoax guarantee epa doors locked lights turned allowed conservation new day new sheriff washington c
MSNBC,The Daily Rundown,global warming calling question whether actually man made governor perry still much meeting crowds new hampshire got two events today headed fund raising continue follow
MSNBC,Morning Joe,moderate centrist reasonable breaks news says believes climate change real accepts evolution things could common assumptions instead huntsman marginal
MSNBC,Andrea Mitchell Reports,mitt romney needs stay focused one direction also new hampshire questioning science climate change great position independents others think right
MSNBC,The Ed Show,damaging serious rupert murdoch mean chairman founder news corp acknowledged humans contribute climate change even tried take news corp carbon
MSNBC,Morning Joe,98 100 climate scientists say national academy science said causing climate change man contribution think find wrong side
MSNBC,The Last Word,ground get process compared clear cutting strip mining reason canada greenhouse gas emissions oil gas predicted leap 1 3 next decade year energy company trans canada shipping oil pipeline see map
MSNBC,Morning Joe,time people turning jobs proving climate change means bigger argument remedies coming big
MSNBC,Hardball With Chris Matthews,either huntsman one appeal independents moderates hold keys election yesterday governor rick perry asked stance climate change let listen response
MSNBC,The Last Word,ravaging environment somalia climate change impact people really going better worse oil industry coal industry
MSNBC,Hardball With Chris Matthews,country national academy science example climate change scary somebody anti intellectual president come answer question party think
MSNBC,The Dylan Ratigan Show,climate change may experiencing severe weather events like going forward insurance industry cope something like change trend insurance industry literally keeps massive amounts
MSNBC,The Last Word,put americans back work afford social safety net much campaign looks like going involve fights existence climate change effectively strip women
MSNBC,Morning Joe,rapid job growth texas lot problems climate change lot problems views social issues might play well republican primary think well
MSNBC,The Ed Show,contributing climate change wrong teaching kids respect environment imagine steve doocy would want kids taught okay litter streets even even
MSNBC,News Nation,figure smart enough figure poor kid caught political fire one day rejecting climate change republican rick perry goes face face kid gives theory
MSNBC,News Nation,bachmann wants go way comes peatea party michele bachmann would dismantle department education rick perry climate change evolution
MSNBC,Martin Bashir,fema know one worst years terms natural disaster yes yes know scientists maybe dismiss climate change provoking incidents
MSNBC,Martin Bashir,dismissing notion climate change caused manmade factors ron paul saying believes drugs decriminalized right anything jobs stories chosen
MSNBC,The Ed Show,choose one dozens diverse books take home spongebob book one options far climate change disputed fact reality based scientific community disagrees
MSNBC,Hardball With Chris Matthews,far perry looking every inch winner romney one belong new political confection hates anything health care climate change room somebody backed
MSNBC,The Last Word,jon huntsman saying believe evolution climate change potential candidate first rule war know enemy want go way oh goodness yes
MSNBC,The Last Word,climate change impact people really going better worse oil industry coal industry large undisclosed huge amounts contributions
MSNBC,Jansing and Co.,troublemaker jon huntsman taking rival rick perry recently said evolution theory climate change based data manipulated scientists twitter huntsman tweeted cleveland believe
MSNBC,Morning Joe,republicans rick perry lack discipline argument want hear hear making statements global warming whether el paso safer year ago frustrates people people thinking
MSNBC,Hardball With Chris Matthews,let listen response believe issue global warming politicized think substantial number scientists manipulated data would dollars rolling projects think seeing almost weekly even daily scientists
MSNBC,The Daily Rundown,dominating fund raising yesterday rick perry surging polls romney called one guys running last night fiery town hall new hampshire voters tested global warming massachusetts health care plan government spending wish would speak
MSNBC,The Ed Show,damaging serious rupert murdoch mean chairman founder news corp acknowledged humans contribute climate change even tried take news corp carbon neutral several years back wow
MSNBC,Hardball With Chris Matthews,winner anything far perry looking every inch winner romney one belong new political confection hates anything health care climate change room
MSNBC,News Nation,speaker boehner said program costs much plus cell phones made obsolete al gore raising eyebrows losing cool climate change skeptics happening event hosted aspen institute
MSNBC,Andrea Mitchell Reports,joke natch disaster claimed quite lives ongoing time made comment invokes broader question whether believes weather patternsings disasters climate change fact manmade
MSNBC,Hardball Weekend,technology competing world science technology country might led somebody believe evolution climate change believe scientific community country scary
MSNBC,MSNBC News Live,republican nominee president jon huntsman letting comes new attack strategy last week started calling candidates evolution climate change hitting rick perry comments fed chairman ben
MSNBC,Morning Joe,distance one actually heard said stated position climate change worry michael leader party hear men could leaders
MSNBC,Andrea Mitchell Reports,quote significant contribution climate change apparently changed mind bit town hall new hampshire think world getting hotter yeah think said caused
MSNBC,The Ed Show,society human activities major contributor climate change national research council preponderance scientific evidence points human activities geological society america human activities account warming since middle 1900s
MSNBC,The Last Word,afford social safety net much campaign looks like going involve fights existence climate change effectively strip women reproductive rights whether extend marriage equality gay
MSNBC,The Daily Rundown,see comes next chris thanks jo ling expect hear comments global warming going away getaway day president fly 4 00 afternoon arrive martha vineyard hour later start ten day
MSNBC,Hardball With Chris Matthews,change believe scientific community country national academy science example climate change scary somebody anti intellectual president come answer question party
MSNBC,The Dylan Ratigan Show,visionaries say need going deal climate change modern issue global finance sovereignty individual nations actually political barrier solving big problems upside
MSNBC,Andrea Mitchell Reports,change also issue says questions whether climate change man made today also stopped couple places way pembroke speak voters expected make
MSNBC,Martin Bashir,spoke bill nye science guy last week absolutely clear hurricanes like result climate change yet noticeable president mentioned broader context think may
MSNBC,Andrea Mitchell Reports,mean may situation things differently vermont climate change well think see changes done lot years
MSNBC,Martin Bashir,able show storms like irene connected climate change floods midwest united states north america bear mind people u big government without
MSNBC,Martin Bashir,joining discuss christian parente author book chaos climate change knew geography violence put straight away well prepared east coast earthquake well quite know
MSNBC,The Ed Show,yet proven even teach kids adequate math reading science point right wing fox mouthpiece successful convincing segment population idea climate change based junk
MSNBC,The Daily Rundown,went dress rehearsal four months ago spring flooding point one governors firmly believes climate change affecting weather patterns new england use storms example
MSNBC,MSNBC News Live,rick perry campaign trail making headlines pushing creationism doubting publicly evolution climate change see jon huntsman taking shot rick perry twitter wrote clear believe
MSNBC,News Nation,articulate views like turning segments electorate need would say leave opening jon huntsman coming saying listen believe evolution climate change think
MSNBC,News Nation,tim pawlenty climate change energy surprising immigration front particularly rick perry last several years governor texas hardliner immigration reform gets republican nomination open question well
MSNBC,Andrea Mitchell Reports,senator leahy vermont experiencing problems experienced think possibility climate change much fema need get involved studying better prepared flooding even hurricane tropical
MSNBC,Way Too Early With Willie Geist,100 climate scientists said national academy sciences said causing climate change man contribution think find wrong side science therefore losing position huntsman also discussed governor perry
MSNBC,Martin Bashir,policy climate change something think absolutely bill nye always thank joining us turning virginia navy already ordered ships sea better weather storm continue team coverage
MSNBC,Hardball With Chris Matthews,cooked final question one word answer mind presence extreme weather take pick gone last six months mean change regard global warming congress taken seriously past
MSNBC,MSNBC Live,global warming two sunday take listen sure average voter going hear treasonous remark say sounds like presidential candidate sounds like someone serious issues right drawing attention picking fight perry right
MSNBC,Hardball With Chris Matthews,leeza leeza leeza love much call creepy moving seems sides go strategy mitt romney people notice problem contradict later come kind hybrid opinion play sides let kick hot topic global warming romney say back june
MSNBC,The Ed Show,population idea climate change based junk science encouraging folks ignore facts scientific evidence consider science important contribute students poor performance science got 30 seconds left oh course tell looked
MSNBC,The Last Word,rather debating real issues like fix crumbling infrastructure put americans back work afford social safety net much campaign looks like going involve fights existence climate change effectively strip women
MSNBC,MSNBC News Live,want embrace talk evolution climate change say would bad thing united states default debt makes news shocking common assumptions responsible party wants compete
MSNBC,Martin Bashir,extreme weather events going frequent certainly year one worst record absolutely right continue direction continuing right climate change new normal need less disaster
MSNBC,The Last Word,united states see results ravaging environment somalia climate change impact people really going better worse oil industry coal industry large undisclosed
MSNBC,Hardball With Chris Matthews,indian young geniuses move still countries around world competing world science technology country might led someone believe evolution believe climate change believe scientific community
MSNBC,Andrea Mitchell Reports,political spectrum economy rough people want hear anything global climate change near term think going cost jobs hard line group republican party scientists researchers sponsored oil industry driving debate
MSNBC,Hardball With Chris Matthews,republican party shifting starkly right ward wonder talking going country refuses accept role example fossil fuels play climate change sees creationism serious academic subject wants ditch voting rights act questions constitutional
MSNBC,Andrea Mitchell Reports,especially mitt romney whose campaign counting democratic leaning independents primary vote time needs careful type things said rick perry talked climate change questioned science behind new hampshire someone
MSNBC,The Ed Show,discussion issue think going work mean huntsman really hardly shown game far mean could game changer think chance chance trying outperry rick perry going conservative radical michelle bachmann go talk global warming say nonsense got say look destroying party taking positions let intelligent rational discussion things matter country country wrapped
