Station,Show,Snippet
MSNBC,MSNBC Live With Stephanie Ruhle,devastation united state coming decade side side president made centerpiece policy agenda undo regulation greenhouse gas
MSNBC,MSNBC Live,extreme weather say damage health environment inf infrastructure fishery could hit hard argue primarily manmade catastrophe caused greenhouse gas
MSNBC,The Last Word With Lawrence ODonnell,michigan toronto cold place tonight president trump tweeted cold said brutal extended cold blast could shatter record ever happened global warming get people deny climate change
MSNBC,Morning Joe,florida tonight quote brutal extended cold blast could shatter record whatever happened global warming
MSNBC,The 11th Hour With Brian Williams,florida tonight quote brutal extended cold blast could shatter record whatever happened global warming
MSNBC,Andrea Mitchell Reports,last week laid number economic effect well effect global warming next several year trump told u ready believe term agreeing global warming
MSNBC,Kasie DC,want use hairspray meanwhile new report came day president tweeted quote brutal extended cold blast could shatter record whatever happened global warming
MSNBC,Kasie DC,want use hairspray meanwhile new report came day president tweeted quote brutal extended cold blast could shatter record whatever happened global warming
MSNBC,MSNBC Live With Stephanie Ruhle,president trump questioned denied established science human caused climate change significantly working make sure greenhouse gas released atmosphere side
MSNBC,MSNBC Live With Katy Tur,come agriculture risk lively lood climate change pose
MSNBC,Morning Joe,economic impact said look lot intelligence believer went tangent talking california wildfire well said global warming
MSNBC,First Look,wildfire fuelled climate creating world increasingly inhospitable human little month since u n report warned world must take unprecedented step avert worst effect global warming
MSNBC,MTP Daily,wildfire fuelled climate creating world increasingly inhospitable human little month since u n report warned world must take unprecedented step avert worst effect global warming
MSNBC,Meet the Press,released black friday order bury news white house dismissed finding largely based extreme scenario report warns significant step taking reign global warming
MSNBC,AM Joy,fire worse donald trump asking whether viewing disaster zone change view climate change take listen seeing devastation change opinion climate change mr president
MSNBC,Morning Joe,governor elect jerry brown saying dozen scientist including inside administration saying climate change behind thing president still say well really tiny bit changed view climate change
MSNBC,First Look,extreme weather shrinking planet making le land hospitable human life bill mckibben wrote new yorker story called greenhouse gas effect also environmental activist founder 350 org online network climate
MSNBC,MTP Daily,extreme weather shrinking planet making le land hospitable human life bill mckibben wrote new yorker story called greenhouse gas effect also environmental activist founder 350 org online network climate
MSNBC,PoliticsNation With Al Sharpton,threatened government shutdown next month money provided border security even attacked finding scientist studying climate change seeming suggest cold weather challenge global
MSNBC,Kasie DC,bit big problem management president asked climate change spent day surveying damage city chico paradise california seeing devastation change opinion climate change mr president
MSNBC,Morning Joe,political moment division extent climate change become victim partisanship side donald trump supporter go end earth say climate change
MSNBC,Morning Joe,political moment division extent climate change become victim partisanship side trump supporter go end earth say climate change
MSNBC,Kasie DC,new federal report sounding alarm inaction surrounding climate change predicting economy could take serious hit take preventive measure report compiled 13 federal agency warns damage caused climate change
MSNBC,MSNBC Live With Stephanie Ruhle,report said look see climate change global warming manmade believe scientific consensus took issue finding prediction global warming would long term economic harm united
MSNBC,MSNBC Live,looming mueller probe new today starkest warning date climate change government released major report detailing impact global warming found climate change worsening natural disaster
MSNBC,Meet the Press,simultaneously devastating u economy question variety reason regardless one stand issue climate change
MSNBC,MSNBC Live With Stephanie Ruhle,damage like baseline imagine huge part texas florida live anymore state inhabitable due climate change
MSNBC,MSNBC Live,gas production scientist say clear compelling evidence real emergency whether people call climate change global warming climate change clear donald trump tweeted day brutal extended
MSNBC,Morning Joe,criminal really get mean know followed issue since first earth summit climate change 1992
MSNBC,Weekends With Alex Witt,national forest fact private land real problem built city wild land urban interface climate change
MSNBC,MSNBC Live With David Gura,first timer purpose idea term next two year want get done new mexico campaigned lot climate change
MSNBC,All In With Chris Hayes,reality power act like also majority behind power quinnipiac polling interesting even thing like climate change
MSNBC,MSNBC Live With Hallie Jackson,hurricane harvey real life preview coming disaster warns federal government report climate change immediately substantially reduce greenhouse gas emission climate scientist katherine one report lead
MSNBC,First Look,protest outside pelosi office hill first day new memberrianitation calling democrat take action climate change
MSNBC,MSNBC Live With Velshi and Ruhle,place like miami hitting record number threatening 1 trillion dollar worth coastal real estate cost 2 2090 could reach 500 billion climate change
MSNBC,MSNBC Live With Katy Tur,act amy argument coming republican heard moment ago senator lee saying costly anything used consensus climate change
MSNBC,MSNBC Live With David Gura,president desperate let climate change become talking point devastating fire think certainly degree san francisco question fire absolutely related global
MSNBC,MSNBC Live With Katy Tur,enough raking called radical shameful cannot fix problem even name address problem even name problem name climate change
MSNBC,Morning Joe,answer explaining believe government national climate report last week report sobering alarming report administration predicting impact climate change
MSNBC,Morning Joe,going reelection campaign look like historic unpopularity coming morning joe shep smith fact checked president migrant caravan bob mueller climate change
MSNBC,Weekends With Alex Witt,conflict base supporter chanting lock hillary clinton interesting see white house tackle one many concerning thing climate change
MSNBC,Andrea Mitchell Reports,climate science understand mean united state america finding report clear matter washington c want say show climate change
MSNBC,All In With Chris Hayes,committed conversation like chris worried country worried long time young federal judge put bench worried long term climate change
MSNBC,Morning Joe,raking tree little tree like tree bush could see totally dry weed raking fire raked argument climate change
MSNBC,MTP Daily,report new yorker article exxon thing change fire west home state california important point science disagreed upon overwhelming majority scientist agree climate change
MSNBC,MSNBC Live With Stephanie Ruhle,remedy federal reserve payment first wildfire start forest much forest federal control state control world going right president making mention climate change
MSNBC,All In With Chris Hayes,combination thing california always fire californian move space wild area set city make spark set fire reason obviously climate change
MSNBC,First Look,must said problem predates president trump one point article mine new yorker 30 year fossil fuel industry big oil company known lied climate change
MSNBC,Meet the Press,climate change could slash u economy 10 end century week president tweeted east coast cold weather whatever happened global warming know man
MSNBC,MSNBC Live,concerned guess horrible effect climate change point night thanksgiving president tweeted cold weather posing question quote whatever happened global warming week ago
MSNBC,Morning Joe,know whether manmade whether effect talking see pretty clear mike president believe climate change yeah one incredibly one level revealing introduce donald trump climate
MSNBC,MTP Daily,lied climate change lie enormous consequence stuck 25 year still really completely pointless debate whether global warming real debate side knew
MSNBC,Morning Joe,alarming report administration predicting impact climate change economic impact road global warming president said look lot intelligence believer explained went
MSNBC,MSNBC Live,effect global warming climate change affect u many different way term ferociousness storm rolling pacific seen gulf mexico real dire consequence overall
MSNBC,MTP Daily,lied climate change lie enormous consequence stuck 25 year still really completely pointless debate whether global warming real debate side knew
MSNBC,MSNBC Live With Hallie Jackson,carbon dioxide emission look agent picture chicago today midwest probably thinking global warming frigid day well era climate change still going see winter want
MSNBC,MSNBC Live,going make talked scientist 20 year would say could cold specific week december make point generally call global warming much call climate change yes cumulative
MSNBC,The 11th Hour With Brian Williams,ability change slow believe coming drinking straw think blameless tell four year lost effort going impact overall climate change cost economic human clearly four year going suspend effort area yeah well course tell true four year hiatus problem need acting need acting quickly danger tremendous danger course climate change
MSNBC,MSNBC Live,cold blast could shatter record whatever happened global warming people start believe hot global warming global warming give u extreme side health effect exactly point
MSNBC,MSNBC Live With Katy Tur,coincidence increase temperature driven greenhouse gas driving fire facing new fire regime 21st century ken president
MSNBC,MSNBC Live With Stephanie Ruhle,side white house releasing report saying greenhouse gas released atmosphere take 10 gdp hundred billion dollar damage agriculture road building
MSNBC,Weekends With Alex Witt,significant step increase amount greenhouse gas united state currently would future emit atmosphere take example effort making roll back emission control
MSNBC,MSNBC Live With Craig Melvin,another 249 still unaccounted new trump administration report concludes global warming helped stoke wildfire released black friday report warns without action global warming would aaction global warm could devastating effect
MSNBC,MTP Daily,also wait read another quote talking global warming fed chair saying problem fed chair say global warming one problem lot people like high level
MSNBC,Meet the Press,burning fossil fuel emit environment number thing healthiest put price carbon tax open carbon tax proposal seen far would address issue would devastate
MSNBC,The 11th Hour With Brian Williams,mine ironwork course believe report like view republican talk climate
MSNBC,MSNBC Live With Katy Tur,back 80 george h w bush said combat greenhouse gas effect white house effect used argument republican democrat accepted science
MSNBC,All In With Chris Hayes,action plan cut carbon emission goal set forth government panel climate change avoid catastrophic climate change cutting mission half
MSNBC,MSNBC Live With Katy Tur,trump administration split screen climate change continue cast doubt scientific consensus climate change law hand follow
MSNBC,First Look,telling u behind lost life burnt forest growing threat affecting u climate change affecting u climate change boy got dad slippery
MSNBC,MTP Daily,telling u behind lost life burnt forest growing threat affecting u climate change affecting u climate change boy got dad slippery
MSNBC,MSNBC Live With Hallie Jackson,nationally people locally state local government across country extraordinary thing reducing greenhouse gas emission investing public transit low carbon leisure
MSNBC,MSNBC Live With Katy Tur,building resilient landscape difference come plplaining fore fire urban interface treated differently one final question glen address climate
MSNBC,Andrea Mitchell Reports,mom anybody seen pant nothing clean better put dad got tide white house fire trying bury congressionally mandated climate
MSNBC,Morning Joe,evidence climate change contribu behind thing president still say well really tiny bit changed view climate change really think issue
MSNBC,AM Joy,issue climate change play large role decade ago scientist predicted climate change extreme weather event seeing hotter weather drier weather
MSNBC,MSNBC Live,international community way address serious issue climate change global climate change coalition within international community includes third world country includes europe
MSNBC,MSNBC Live With Katy Tur,claiming costly act climate change costly act already seeing damage climate change bringing projection overly
MSNBC,MTP Daily,making le land hospitable human life bill mckibben wrote new yorker story called greenhouse gas effect also environmental activist founder 350 org
MSNBC,MSNBC Live With Katy Tur,billion dollar economic loss severe frequent economic disaster massive public health cost supporter say bill would reduce greenhouse gas emission 40 ten year 91 2050 bigger cut
MSNBC,PoliticsNation With Al Sharpton,urban fire accelerated climate change responsible president say yes deal climate change also deal forestry
MSNBC,First Look,climate change alexandria ocasio cortez newly elected member argued member creation special panel climate change new jersey congressman frank palone backed number committee member slammed
MSNBC,MSNBC Live With Katy Tur,industry attempting debunk overwhelming evidence human caused climate change really unfortunate toll taken continued denial climate change delay taking action necessary avert catastrophic
MSNBC,The 11th Hour With Brian Williams,republican congressman bob ing li southern carolina republican stance climate change became recipient john f kennedy profile courage award climate change work congressman thank
MSNBC,MSNBC Live With Ali Velshi,democratic republican say going target certain group based look like pray democratic republican know climate
MSNBC,All In With Chris Hayes,maybe little center right center left point carlos curbelo best buddy congress mia love good friend mine pro immigration reform believe climate
MSNBC,The 11th Hour With Brian Williams,like little bush could see totally try weed raking fire raked argument fire argument climate
MSNBC,Morning Joe,whatever happened global warming fact 2016 15 17 rank world three warm est record
MSNBC,First Look,many phone call lay wreath arlington downplayed climate change brushed
MSNBC,AM Joy,climate change real point e j get sense dump came administration anti climate change felt like friday news dump thanksgiving day weekend
MSNBC,MSNBC Live,president addressed climate change touring wildfire let take listen seeing devastation change opinion climate change want great climate going forest safe
MSNBC,MSNBC Live With Craig Melvin,understand climate change real bad helped make far far worse think course republican leadership denying climate change setting putting ideology
MSNBC,Kasie DC,climate change mr president california wildfire historic hurricane either dire new report president administration convince climate change real timing release tell everything next
MSNBC,Kasie DC,man made climate change could impact believe devastating impact cooling heating denying climate change could well go back know talking
MSNBC,Andrea Mitchell Reports,climate change intensi intensifying without policy change cause massive challenge country health economy climate change loading dice extreme destructive weather event future already feeling
MSNBC,MSNBC Live With Hallie Jackson,manmade climate change could impact believe devastating impact still think climate change hoax look think something happening something changing change back think hoax
MSNBC,Weekends With Alex Witt,inevitably wrap court wind clock plus robert mueller written answer president two side could still battle one big remaining issue federal government release warning climate
MSNBC,MSNBC Live With Stephanie Ruhle,mississippi lynching real life happening 2018 hope people mississippi get vote tomorrow coming new government report detail significant damage already done climate
MSNBC,MSNBC Live,yesterday clip played strong view climate change think looking way talk issue without talking term climate change situation president yesterday suggest
MSNBC,Kasie DC,management president asked climate change spent day surveying damage city chico paradise california seeing devastation change opinion climate change mr president strong opinion
MSNBC,MSNBC Live,untouched southwest alaska julia house democrat planning capitalize report could internal division within democratic party undermine strategy climate change well already seeing climate change become guess one democrat top
MSNBC,Kasie DC,man made climate change could impact believe devastating impact cooling heating denying climate change could well go back know talking well denying
MSNBC,MTP Daily,care protecting access health care making sure protect people pre existing condition passing commonsense gun reform law working scientist actually bring action protect environment deal impact climate
MSNBC,Andrea Mitchell Reports,people around mb assured nothing cia assessment intelligence evidence linking mb killing wanted ask question o climate
MSNBC,Morning Joe,president trump yesterday asked interview climate change said believer view climate change think contributed thing like wildfire state yes believer also believe cut way
MSNBC,First Look,also talking climate change making news report released holiday guy looking climate change much rising sea level could costing effect dollar bad pretty bad
MSNBC,MSNBC Live With Craig Melvin,murdered president disputing government climate change report president disputing government climate change report getting hot going everything fantastic almost like really
MSNBC,Kasie DC,new federal report sounding alarm inaction surrounding climate change predicting economy could take serious hit take preventive measure report compiled 13 federal agency warns damage caused climate change could cost u hundred
MSNBC,Andrea Mitchell Reports,witnessed weekend yet another reckless russian kaes lace cold shoulder white house brush administration report global warming despite finding
MSNBC,Meet the Press,much corporate much law much kind governance america much le climate standpoint doubt think doubt climate
MSNBC,Andrea Mitchell Reports,congressionally mandated climate change report going flying face many trump age agency policy rhetoric climate change reuters excerpt read going say extremely likely human
MSNBC,First Look,whatever happened global warming fact 2016 2015 2017 rank world three warmest year record climate let go bill karins
MSNBC,MSNBC Live With Hallie Jackson,century president trump big proponent fossil fuel ended war beautiful clean coal convinced global warming manmade phenomenon planet continue heating
MSNBC,First Look,activist reeinstated committee address climate crisis talking shovel snow plow early right
MSNBC,Your Business,refusing address topic worried get president trump trouble president travel california face question climate change devastation change opini
MSNBC,The Last Word With Lawrence ODonnell,michigan toronto cold place tonight president trump tweeted cold said brutal extended cold blast could shatter record ever happened global warming get people
MSNBC,Weekends With Alex Witt,whatever happened global warming white house issue statement report came basically reporter like said couple thing one thankfully u leading world trying
MSNBC,MSNBC Live With David Gura,century report released week president responded arctic blast asking whatever happened global warming white house responded largely based extreme scenario
MSNBC,The 11th Hour With Brian Williams,florida tonight quote brutal extended cold blast could shatter record whatever happened global warming win fake news medium big story today
MSNBC,Hardball With Chris Matthews,whatever happened global warming cold weather exist hot weather learn 5 year old difference weather climate back hardball round table anita susan tiffany
MSNBC,MTP Daily,unprecedented step avert worst effect global warming effect may already apparent two day report released hurricane michael slammed florida panhandle killing 35 people state 45 people nationwide
MSNBC,The 11th Hour With Brian Williams,whatever happened global warming win fake news medium big story today pushed hard gotten capitalized gasoline price low people driving
MSNBC,Morning Joe,address climate crisis ocasio cortez also spent day slamming amazon plan open second headquarters queen joining u mayor new
MSNBC,MSNBC Live With Stephanie Ruhle,charge mueller investigation know tell u steph keep asking thank important conversation next president trump give wide ranging interview washington post talking global warming fed chair gut
MSNBC,The 11th Hour With Brian Williams,could shatter record whatever happened global warming win fake news medium big story today pushed hard gotten capitalized gasoline price low people driving
MSNBC,Andrea Mitchell Reports,shifting electric autonomous vehicle lot play stay hot mess danger global warming new administration climate report disputed white house going stay u
MSNBC,MSNBC Live With David Gura,number issue climate crisis begin breaking news washington post regarding potential overhaul u immigration policy post reporting
MSNBC,First Look,old especially climate change getting worse worse wavents nt arounds case
MSNBC,Morning Joe,eu march 29th report released friday climate change fourth national estimate warns expanded wildfire
MSNBC,All In With Chris Hayes,insurmountable window action think right seeing younger rising generation inspiring u right thing look image destruction may people talk carbon tax cap trade variety way
MSNBC,Morning Joe,inspired energy activism many young activist advocate leading way climate crisis recommended house democratic colleague reinstate select committee
MSNBC,MSNBC Live With Velshi and Ruhle,low los angeles county fire chief stated clearly climate change president might want
MSNBC,MSNBC Live With Stephanie Ruhle,holiday weekend describes dynamic crisis climate change arguing inaction could set u back decade participate longtime
MSNBC,Morning Joe,government buried holiday weekend describes dynamic crisis climate change arguing inaction could set u back
MSNBC,MSNBC Live With Katy Tur,anything conservative assessing damage risk associated climate change earth warming
MSNBC,Morning Joe,tangent talking california wildfire well explained necessarily believe global warming manmade see way let read quote people driving car see president told phil quote
MSNBC,First Look,lie enormous consequence stuck 25 year still really completely pointless debate whether global warming real debate side knew answer beginning
MSNBC,All In With Chris Hayes,think right seeing younger rising generation inspiring u right thing look image destruction may people talk carbon tax cap trade variety way would deal carbon pollution say well
MSNBC,MSNBC Live With Katy Tur,appropriate bring climate change think good question wind common part climatology
MSNBC,Morning Joe,stock ginning republican voter elderly voter climate change issue older voter young voter bigger
MSNBC,MSNBC Live With Stephanie Ruhle,course simply denying climate change exists particular calculation release report day thanksgiving minimize
MSNBC,MSNBC Live,yesterday president trump doubled fire management issue argument climate change dryer hotter
MSNBC,Weekends With Alex Witt,certainly jerry brown gavin newsom way front climate change president literally trapped
MSNBC,MSNBC Live With David Gura,administration accountable making sure working issue climate change course big one fire california defr
MSNBC,MSNBC Live With Katy Tur,north carolina unprecedented flood drought heat wave face climate change dealing read bill mcci brcks
MSNBC,Morning Joe,reading sort dry report scientist international scientist climate change watched become increasingly dire increasingly
MSNBC,First Look,plus president trump defends rejection climate change siting high intelligence back check forecast seriously
MSNBC,Weekends With Alex Witt,major climate change report released friday question begs asked mostly negative oh think interesting perspective
MSNBC,MSNBC Live With Katy Tur,michael give u idea better assessment climate change report sure hearing claim opposite reality
MSNBC,Weekends With Alex Witt,climate change real mr president important factor fire get rain winter get heavy rental station growth
MSNBC,Morning Joe,warning denies climate change morning joe coming right back hi kid carl broker offer 4 95 online equity trade
MSNBC,The 11th Hour With Brian Williams,wall later devastating government report warning hundred billion dollar lost climate change president say believe
MSNBC,The 11th Hour With Brian Williams,going impact overall climate change cost economic human clearly four year going suspend effort area
MSNBC,MTP Daily,crisis human ever wandered president appointed nominated epa chief denied climate change advocate coal industry
